Text,Groom
your a minor,1
that is jail time,1
im not making anything up,1
i could go to jail for just being with you without perental concent,1
soory,1
i do like you as a person   ,1
i just do not know if i can risk it to be alone with you hunny that is all,1
sorry hun your taking it wrong,1
well it isnt off yet just saying do not know if i can,1
i got to got a go getting tired,1
sorry  night hun,1
that i would get in trouble if i was with you,1
that your to young,1
i got to got a go,1
night hun,1
i do not know hunny,1
its me,1
that was me too  laugh out loud,1
i thought you said you knew it was me silly,1
i will talk,1
yes i think we can arrange something,1
im sorry   just scared,1
are you busy,1
you talking to someone else,1
he must be messed up then,1
just a couple,1
yes just friends,1
i never met them,1
,1
,1
im not busy,1
people your age,1
i like you just do not want to go to jail hun,1
do not want to go to jail hun,1
i do want to talk with you,1
you want me to leave,1
i do but your so young hun,1
well maybe we can still do that then hun,1
its no biggie,1
how you feel about me hun,1
you are not scaring me,1
its your age that does hun,1
do what right now hunny,1
but im the one that goes to jail for a long time,1
cannot you understand that hunny,1
talking is one thing,1
but me being with you is another,1
i won't tell anyone are you crazy  i do not want to go to jjail,1
but we can get caught,1
i tell you what,1
how about we have phone sex and see if we have any sparks together,1
at the idea of being with you yes,1
we can get caught you know,1
call me,1
oh i thought you had another one,1
would you take off your clothes and touch yourself to see if you feel anything for me,1
you would not be the one to go to jail though,1
im pretty tired i think im going to bed hun,1
can you delete this for me hun,1
this,1
all we talked about tonight,1
you remember,1
good girl,1
i like you,1
just do not like your age,1
you know better,1
sweet,1
did you delete yet,1
well im going to go and i want to make sure you remember,1
i won't,1
can you delete now pleeeeeeze,1
me too hun,1
delete,1
did you,1
you forgot,1
okay  night hun  laugh out loud,1
night hunny,1
night qt,1
i have been busy,1
no you did not do anything,1
i have not been online,1
ohhhh,1
do not remember that,1
i won't talk to you if you talk stupid like this,1
