Text,Groom
hello kelly,1
so your picture is on this profile honey,1
wow your sexy honey,1
yes i do you have more pictures,1
okay are they full body pictures,1
how big are your nipples baby,1
i like kelly  i can see down your shirt alittle laugh out loud,1
i'm sorry i do not have pictures for you baby,1
are you glad i said that,1
no i meant about the picture,1
i'm ' light brown hair blue eyes athletic built lbs two tattoos how do i sound,1
tribel sign and a cross do you like that,1
shoulder and back has to do with family why do you want some,1
your asking about them do you want some though,1
so are you into sex kelly yes or no,1
laugh out loud did you like it,1
what happen with him baby,1
i like you so far i hope you feel the same way,1
thanks honey what grade are you in,1
did you just turn  baby,1
did you do anything fun for your birthday,1
where did you party at,1
do you drink tell me the truth,1
laugh out loud what do you like to drink laugh out loud,1
fruitie but good laugh out loud,1
are you interested in dating me,1
yes or no baby,1
where would we meet at without people knowing baby,1
do you only live with your mom,1
parents are divorced baby,1
how old is she,1
wow mom had you late should i bring condoms or no,1
okay what else would we do baby,1
that is up to you honey,1
laugh out loud thanks laugh out loud,1
could we talk on the phone,1
call me right now okay,1
can you kelly,1
  ,1
okay cannot wait to hear you,1
did you find your phone baby,1
okay,1
so how did i sound,1
so do you like me,1
thanks honey you know this will be hard for us to date you know that right,1
your okay fucking on are first date,1
well how i'm i doing so far,1
hang on baby i have to put something in the dryer okay,1
back,1
yes,1
so what is there to do at your house,1
laugh out loud,1
what will you wear when i come over,1
i want you to tell me then i will tell you if i like it,1
do you have a pool at your a or a juczzui,1
i cannot spell laugh out loud,1
should i bring my board shorts,1
oh okay,1
will you come out front so i know it is you and not a cop honey,1
so your mom trust you home alone,1
where does go,1
where does she go,1
oh wow so what made you like me,1
your young and sexy and a good personality,1
cool,1
i cannot wait to fuck you baby,1
how i'm i doing,1
we will definitely be doing that baby,1
i will for you baby,1
will we have to sneak into your apartment or no,1
are you going to be wearing panties or no,1
no panties so i can feel my girl vagina and buttocks,1
that is fine baby is your vagina wet thinking about me,1
your the youngest i have ever been with,1
yes do you like that i'm ,1
so are we be f and g f,1
i'm sorry baby,1
is your bed big enough for us to fuck in,1
yes do you want me to sleep over,1
but do you want me to laugh out loud,1
that is fine with me baby,1
so what will you tell your friends if someone asked you out from school,1
yes laugh out loud,1
yours is kelly right,1
so do you want us to be friends with benefits or be f and g f,1
when was the last time you had sex,1
do you like fucking at your house,1
so what are you going to do tonight,1
i'm going out with friends tonight,1
what are you doing tomorrow night,1
i could come over after work to fuck you tomorrow night,1
how late,1
i get off real late from my job,1
why do you have private block on your phone,1
you can call me when she leaves tomorrow,1
i could stay with you all weekend,1
like pm,1
about  minutes is that okay,1
if i do not get lost with bad directions,1
that is okay just call me when you get back,1
i won't have time tomorrow just call me and leave me your number okay,1
you have my number right,1
did you put it in your phone,1
are you going to put it in,1
sure you will laugh out loud,1
i think your teaseing me laugh out loud,1
are you falling for me,1
so that is a yes,1
i want to cum in you,1
i know,1
i wish we did not have to though,1
baby i have to go call me tomorrow okay,1
if i do not answer just leave a message and your number okay,1
bye sexy,1
hello baby i missed you i hope i get to see you tomorrow,1
hello baby,1
kelly,1
how is my girl doing,1
good,1
what did you do lastnight,1
can you call me,1
so have you been thinking about me,1
that is why i want you to call,1
do i need to bring condoms tonight,1
how long will your mom be gone,1
do i get to take some naked pictures of you for just me,1
you know i will treat you good,1
no sorry why do you ask baby,1
phone camera is that okay,1
can i take some when we are fucking,1
was that you baby,1
baby,1
what is your address baby,1
cannot i just take the  and get off and edit baby,1
i could do that you know your directions pretty good,1
do they drive laugh out loud,1
where do your friends live laugh out loud,1
so are we just going to fuck and drink or do other things in the apartment,1
well i have to take a shower right now,1
and i need your phone number,1
are you going to be waiting outside or no,1
i have been sick today i do not know if i should come over i do not want to get you sick,1
sorta scary i have never done this before and i really like you,1
i could get arrested for this that is why,1
i know baby,1
i know i'm sorry like i said this is just the first time i have done this,1
that i have met off line yes,1
is that bad laugh out loud,1
its not that i really do like you i think your great and everything ,1
i'm not joking about being sick either though i did not want you to think that i was joking,1
how about this let us chat on here more and you can call me anytime you want too so i can get to know you more then we will me next week i promise is that okay,1
are you mad at me now,1
i'm sorry,1
so i guess that you do not like me anymore,1
i do not know i just feel like i m being a big vagina,1
it is the truth though,1
fuck it i will come down okay,1
okay are you charging your phone,1
okay let me take a shower stay on here okay,1
be right back okay,1
what is the name of the apartments,1
nice,1
when will you call me,1
right now okay i have to get condoms first i will get the beer later when we meet okay,1
you will call,1
just call in  minutes okay,1
okay leaving baby,1
what kind of condoms do you like,1
you will see okay,1
you will see honey laugh out loud,1
you will be on the phone with me laugh out loud,1
hello sexy did you miss me,1
do you want to chat on this honey,1
which one is you honey,1
in your picture,1
how old is that picture baby,1
so are you looking for a be f,1
are you into sex,1
yes does my age bother you,1
 is that okay,1
i want sex with a young girl like you is that bad,1
do you think it is hot i'm interested in you,1
what would you like to know about me,1
i live in orange county by disneyland,1
my birthday is in june and blue is my favorite color,1
what is your favorite color,1
do you like to dress sexy,1
if you could what would you wear,1
do you want to wear thongs,1
thong panties,1
i do not know i think they are sexy,1
would you try sex with me,1
at first it does but then it will feel better,1
i will pull out and not cum in you okay,1
that is what makes a girl pregnant,1
are you interested in having sex,1
i'm i what,1
yes are you,1
well i want to be your first okay,1
do you have a problem meeting for real,1
how do you feel about me,1
' light brown hair blue eyes athletic built lbs two tattoos how do i sound,1
no sorry how much do you like m,1
me,1
i surf golf play mens softball and like to bartend,1
cool would it be hard for me to come and see you,1
bartend,1
where is she going,1
she trust you by yourself,1
sorry to hear that,1
i told you honey,1
so you will be home alone on the th,1
how long will you be home alone,1
cool no one watches you,1
well can we fuck at your house,1
yes do you,1
are you excited about sex now,1
what are you scared about,1
yes i will,1
you won't baby do you want to fuck all weekend though,1
what do you want honey,1
where in riverside do you live,1
so your off the  freeway baby,1
do you want to meet me,1
yes i do are you home alone now,1
i wish i could call you,1
do you want to call baby,1
yes i will can you call now,1
you know my name remember,1
   are you calling right now,1
okay hear from you soon baby,1
hurry and call okay,1
how did i sound,1
would you consider me a be f,1
maybe i want to know how you feel about me,1
no sorry i just got this computer for christmas baby,1
why does your suck,1
is it in black and white laugh out loud,1
did i make you hot over the phone,1
hopefully turning you on,1
were you getting turned on,1
did you like it,1
well i cannot wait to kiss you,1
i want to french kiss you,1
yes i'm going to put my dick in you right,1
i'm going too okay,1
so are we meeting on the th yes or no,1
do you want me to drive to your house,1
i know that but do you want me to come straight to your house though,1
are you back,1
are you done,1
hello,1
did you miss me,1
that is okay,1
what did you have to do baby,1
are you getting it ready for us,1
well chrissy are you,1
so do you want me to sleep over when i come over,1
i want your answer yes or no,1
so do you want me to sleep over,1
what are you doing honey,1
chrissy,1
that is okay honey did you miss me,1
so are we be f and g f yes or no,1
you tell me honey okay yes or no,1
be c i want to know how you feel,1
did you aunt leave baby,1
do you want to call me,1
so what do you usually wear to bed,1
did you tell your friends about me,1
are you still scared about sex with me,1
no matter how old you are the first time hurts alittle i will try not to make it hurt much okay,1
well baby,1
i like that is your vagina bald,1
that is cute but i mean your vagina between your legs baby,1
nice have you had your first period yet,1
that is good honey i'm falling for you i hope you feel the same way,1
yes do you feel the same way,1
what else would we do at your house that weekend,1
what do you like to do out there for fun,1
we could watch movies at your house if you like,1
when i come over will you be naked for me,1
yes i do,1
i'm going to fuck my g f good,1
how does that make you feel,1
well,1
happy new years too did you miss me,1
how is my  year old g f doing,1
did you wish i was with you last night,1
yes i wanted my new years kiss,1
i like are you excited to be in bed with me,1
yes you want me to bring condoms yes,1
how old was the guy she got pregnant by,1
are you really okay with me fucking you,1
sorry my computer shut off i accident,1
i love you,1
is your bed room ready for me to stay with you next weekend,1
is your bed big enough for us,1
how much are you in love with me,1
when is your birthday,1
cool do you like that your be f is a lot older then you,1
are we sleeping naked at night together or no,1
you tell me,1
well baby tell me,1
i want a yes or no answer do you want to sleep naked with me,1
are we going to have sex a lot,1
if your vagina hurt alittle when i put it in is that okay,1
how do you have to be when i come to you house next weekend baby,1
naked remember,1
can i you call me right now,1
can you call me i meant,1
feel your vagina for me okay,1
i want you to rub it for me okay,1
are you doing it,1
do you like it,1
are you doing it baby,1
put a finger in your vagina okay,1
are you doing that baby,1
hello baby sorry my computer froze,1
that is okay my computer was fucked up sorry baby,1
so are you still scared about me putting my dick in you,1
did it hurt a lot when you put your finger in you,1
but did you like it too,1
but good right,1
i still get to put my dick in you right,1
awesome i wish i could cum in you,1
it is what is white and comes out of the guys dick to get a girl pregnant if you let me,1
i just want to fuck you without a condom and cum on your nipples would you like that,1
i would so no condom is okay,1
yes why though,1
yes did you clean your room for me,1
what if your neighbor comes over as we are fucking would you want me to stop or no,1
have you been thinking about me a lot,1
yes what have you been thinking about,1
like what,1
we would watch movies make out anything else you want to do when i m there,1
sure honey what movie would you want to bring,1
okay i would but you have to hide it so she do not know i came over okay,1
are you excited not to be a virgin anymore,1
we could order out if you like,1
i will order it from your house okay baby,1
they will deliever it baby,1
how baby,1
i will order it off my cell phone okay,1
yes your my g f right,1
you can tell your friends if you want but can they keep a secret baby,1
you can if you want too,1
are you comfortable with that,1
who would you tell baby,1
do i get to fuck you a lot,1
yes i do do you want too,1
even after school we can fuck,1
i wish we could go camping or something like that with you,1
maybe i will take you but you would have to figure out how you can get away for the weekend,1
would i need to bring condoms on that trip too,1
so you would want to fuck on are camping trip,1
we will okay,1
so when do you want me to get you pregnant,1
when ever you want one,1
i would baby,1
why do you think that,1
i would not baby,1
why do you want a baby,1
i won't leave you baby i would help you take care of it,1
you want a baby do not you,1
what would you tell your auntie,1
i will get you pregnant if you want a baby,1
no i would not baby,1
how does that make you feel honey,1
how long have you wanted a baby,1
bartending,1
yes for right now are you okay with that,1
so do you want a baby,1
we will then okay,1
do you like that,1
you do not mind having a baby at  years old,1
i love you chrissy,1
how happy are you with us having a baby,1
are you happy yes or no,1
i want you to be straight with me okay,1
so i'm i getting you pregnant this weekend,1
can you call me yet,1
okay well what time would you want me over on friday,1
how will you answer the door on friday baby,1
what did i tell you baby,1
yes that is my girl,1
i want you ready for sex right away okay,1
they won't,1
when i come into your house what would you do baby,1
how would you greet me,1
you tell me that is why i asked baby,1
no you tell me baby laugh out loud,1
nope you tell me or i won't come over laugh out loud,1
so tell me laugh out loud,1
i do but you have to tell me,1
yes i love you,1
that is okay goodnight baby love you,1
