Text,Groom
musta,1
musta no,1
how are you,1
how come you do not speak,1
i see thanks,1
bye,1
mad,1
do not be,1
why your you are sleepy,1
where from,1
hayward  you,1
vallejo,1
fairfield,1
vacaville,1
im ,1
you,1
your you are ,1
is that you on picture,1
your you are pretty,1
im old,1
nope,1
hello,1
your you are probably a virgin huh,1
okay,1
your you are not a virgin anymore,1
awwwww,1
somebody got first on you  laugh out loud,1
not me,1
no,1
i can be better,1
if im the one,1
are you shaved,1
mmm really,1
i want to taste yours  laugh out loud,1
your you are nipps,1
you have camera,1
what are you doing,1
what ds,1
i see,1
hello have to go,1
hello how big are your you are nipps just asking',1
c,1
hahahah,1
c,1
i want to eat that nipps of yours,1
yes i do,1
this morning my thing is up when i wokeup,1
its big though,1
about  long,1
i masturbate twice a day,1
this morning i cum a lot,1
no do not like my cum,1
what are you wearing,1
skimpy clothes,1
no brassiere,1
only panty,1
i wish you have camera,1
so i can see you,1
you have some more,1
how tall are you,1
im  feet,1
you will be on top of me  laugh out loud,1
wish you are here,1
so i can eat your you are nips,1
are you getting horny,1
yes,1
i am,1
my dick is up,1
im holding 'them,1
its up,1
did your you are boyfriend slide his thing in your you are pu  ,1
you like it,1
why,1
im  im going to do it to you,1
if we met i will,1
i will eat your you are pus  ,1
i will do it for you,1
i will eat your you are vagina,1
until you cum in my face,1
you like that,1
huh,1
tell me when,1
i'll meet you,1
we go to a motel,1
tell your you are mom to drop you off to a mall,1
then i will meet you,1
sounds good,1
a lot of what,1
how can i meet you,1
at your you are home,1
there's a lot of people there,1
your you are mom and dad,1
we can have sex there at your you are place,1
mom works in the morning,1
just you and mom,1
where is your you are home,1
where is that,1
what exit im going to take,1
how about sunday,1
your you are mom is away on sunday,1
in so call,1
can i come there on sunday,1
take me to the mall,1
im not a weirdo,1
im a cool guy,1
you can assure that',1
here's my phone,1
  ,1
write it down,1
let me know what time on sunday,1
yes i will,1
im off in the mornings,1
i start work  pm,1
i better go now,1
your you are name,1
why willow,1
i will see you on sunday,1
okay do not worry im not a weirdo,1
got to go now want to take a shower,1
love,1
yes its you i kiss,1
bye sweet,1
was up,1
did you went out,1
well feeling' lazy  bored,1
'coz im supposed to go to gym today but i did not,1
i know,1
sunday i will stop by at your you are place,1
is it okay,1
really why you like me,1
coz your you are cute and lovely,1
but i do not know how to get there,1
i know  north,1
so what are we going to do if i get there at your you are place,1
like what,1
i do but describe it to me,1
just want to know,1
hahahhaha i know,1
we're going to have a little sex,1
are we going to go to your you are room,1
really,1
is it big,1
can i take off your you are clothes,1
what are you going to be wearing,1
what kind of clothes you wear,1
you want me to lick your you are vagina,1
you want it,1
yes it is you will be moaning,1
do not tell it to nobody,1
even to your you are classmates,1
okay that is good,1
just be you nobody else on sunday,1
you and me,1
i will just eat your you are vagina,1
your you are nipples too,1
if you want,1
im getting horny,1
are you,1
i will lick your you are nipples to,1
is your you are nipples hard now,1
you will give me a blowjob,1
are you good at it,1
i'll spend my sunday just for you,1
mom is not coming sunday,1
does your you are mom go to so call a lot,1
this friday what will you say to her 'coz not going,1
you lived in and apartment or house,1
how big,1
we're going to take a shower both of us,1
how big is your you are room,1
if i go  north i pass novato,1
then what exit after novato,1
what is your you are address,1
i won't stood you up,1
trust me,1
tell me friday,1
coz i have to find in a mapquest,1
what are you wearing right now sweety,1
nice,1
when you go to sleep what do you wear,1
no panty,1
you want me to kiss you,1
when i get there,1
what part laugh out loud,1
lips,1
okay i will do that,1
you want it long kiss,1
i will kiss all over your you are body  laugh out loud,1
i masturbate awhile ago,1
i watch some porno movie,1
yes thinking of you,1
you want me to bring a dvd porno movie,1
so we can watch 'them there,1
you will see them sunday,1
where will i park my car,1
if i get there,1
inside your you are garage,1
i have a nice car,1
fj cruiser,1
you will see 'them,1
you want to go to the beach,1
u'll be my girlfriend from now on,1
i like your you are hair its nice,1
nice lips too,1
can i call you sweet,1
do not get any boyfriend now coz im your you are boyfriend,1
am i your you are boyfriend,1
for life  laugh out loud,1
did you have your you are lunch yet,1
me too,1
how about we go lunch right now and be back in  minutes ,1
hows that sounds,1
well can i go lunch,1
sweety,1
be right back,1
back,1
sorry,1
how can i keep in touch with you,1
do not know your you are phone,1
today,1
or i can call you,1
friday i will call you,1
what time she's leaving,1
friday,1
is she leaving friday early morning,1
how come she goes to so call quite a lot,1
does your you are dad has a house there ,1
what kind of job he has,1
like what kind,1
so you will be moving there soon in so call ,1
what does your you are mom do,1
what kind of restaurant,1
where at,1
what sz brassiere you wear',1
b is big,1
maybe your you are b,1
is it kind of loose b,1
are you going to wear that if i come sunday,1
i mean yes,1
i will come,1
yes i am,1
i am for real,1
i will show up,1
are you going to be shy on me,1
okay',1
your you are going to open the door for me,1
what do you mean open to others,1
how about you open the garage parking,1
so i can park my car there,1
coz your you are mom's car is not there,1
so people won't see any car park at the front of your you are house,1
are you sure,1
okay  then you can close the garage door so people won't see us,1
your you are neighbors are all whites,1
you want me to spend the rest of sunday there,1
okay i will,1
watch some football,1
you like sports,1
i know what you like,1
hahahahha sexxxxx,1
laugh out loud,1
right now,1
well i have to prepare going to take a shower,1
i have a meeting at pm,1
i love you willow,1
yes i am sweeeetttt,1
and so do you,1
your you are cute,1
coming sunday okay,1
we have a date,1
you like me ,1
okay bye love,1
how you doing,1
im fine thanks,1
is it cold there,1
did you think about me yesterday when i was gone,1
thanks sweety,1
yes so much even in bed,1
you we're with me in bed naked,1
you go naked in bed when i see you sunday,1
i'll be the one going to take off your you are clothes,1
mmmm,1
then you want me to lick your you are body,1
all over,1
your you are body,1
yes if you want to,1
i will kiss your you are neck  your you are nipples  your you are nipples i will lick 'them,1
what are you thinking,1
are you aroused ,1
mmmmmm yes,1
then i go down to lick your you are puss  ,1
why where do you want me to lick you,1
well cummin' sundy,1
so you got your you are address,1
i thought friday,1
only you and me on sunday,1
do not let anybody know this even your you are best friend,1
im looking at your you are pictures,1
yes all of it,1
are they recent pictures,1
when is your you are birthday,1
what are you going to wear on sunday,1
a seductive dress,1
any hint,1
no mini skirt,1
jeans and a tank top,1
tank top with no brassiere,1
do not wear brassiere,1
are you excited,1
then after this weekend whenever are mom is out of town i will come to your you are place,1
is that okay,1
okay  ,1
i kind of have a little gray on my hair,1
as long as i satisfy you,1
can we go take a shower before making love,1
i will lick your you are vagina at the shower if you want,1
standing,1
for four more days,1
excited,1
very,1
do you sometimes finger your you are vagina,1
what do you meam messy,1
oh yes,1
i like sticky,1
do you cum a lot,1
its easy,1
your you are shaved huh,1
not much hair,1
i was thnking of you last night,1
willow,1
ben,1
thanks love,1
i will just lick your you are vagina,1
no penetration,1
why you want to put my cock in your you are vagina,1
my cock is big,1
you will be moaning,1
you love me,1
eventhough im older than you,1
way older than you,1
im not a grandpa,1
same as your you are mom,1
your you are going to suck my cock,1
i will,1
your you are hair is still long,1
your you are mom is there right now,1
other room,1
are you in your you are room,1
maybe your you are mom is peeping at your you are computer,1
just be sure come friday she will be away,1
okay  hello i want to go to lunch,1
can i call you friday,1
well my phone will register there,1
of course,1
how about if i text you then just delete the text afterwards,1
what time friday,1
are you still awake like am saturday morning,1
coz that is the time i got home,1
love have to go,1
yes i will be there,1
that is for sure,1
love yes you ,1
just got off from shower,1
im totally naked,1
im holding my cock,1
im fresh,1
are you chatting with someone,1
really you sure,1
im jealous,1
nothing,1
yes i am jealous,1
coz your you are chatting with some guys,1
u'll see me,1
naked on sunday,1
both of us naked,1
are you sure i won't be in trouble on sunday,1
i do,1
you want me to say it on sunday,1
im going now,1
have to dress,1
bye love,1
how you doing sweety,1
just got back,1
went to border's,1
nothing' just read some books,1
and had some coffee,1
kind of investing,1
what are you wearin sweety,1
getting close,1
did you got your you are address now for me,1
just be sure i won't be in trouble,1
good for both of us,1
where in living room,1
with mom,1
does she look at the computer,1
want me to bring some food on sunday for you,1
sweety sorry i got booted out,1
im back,1
what kind of food you like,1
burritos,1
tacos,1
i'll bring some,1
taco bell,1
we'll eat there,1
did you think about me,1
last night,1
naked,1
naked both of us,1
mmmm nice,1
while you thinking did you finger your you are vagina,1
you want me to finger 'them for you,1
is it still tight,1
mmmm its for me,1
on saturday im going to tracy,1
i won't be online in the afternoon,1
you're welcome,1
just wondering your you are vagina is it small,1
cannot imagine it,1
only  finger im going to use,1
do you masturbate sometimes,1
you need me huh,1
mmm nice,1
im going to lick your you are nipples too,1
your you are vagina has little hair now,1
your you are boobs is gettin' big huh,1
do you play 'them sometimes,1
looking at your you are pictures,1
momscar,1
i like that clothes your you are wearin',1
going to wear that on sunday,1
i love your you are lips,1
pouty lips,1
like angelina jolie,1
we're going to go kissing on sunday,1
im a good kisser,1
mmmmm yes,1
i have to get my lunch love,1
on your you are pictures which one is very recent,1
very seductive,1
love that smile,1
what are you wearin' on that picture,1
mmmmmmmmmm nice,1
wear that on sunday okay,1
you wear lipstick,1
i mean you put on lipstick,1
no makeup,1
im looking at it,1
like that parismpressionlol,1
very nice  especially that tongue out,1
what do you do on your you are hair very silky and smooth,1
shampoo a lot,1
everyday huh,1
im going to lick your you are whole body,1
you have honey,1
i'll put honey on your you are body and lick 'them,1
and put honey on top of your you are vagina and lick 'them too,1
im going to suck 'them,1
until you cummmm,1
u'll going to be nice to me by sunday,1
well we'll see on sunday i hope you are,1
im going to eat your you are boobs,1
hahahha meaning i'll hold both of my hands on your you are boobs,1
and lick 'them  suck 'them,1
after snday  are you going to invite me again,1
you like me sweety,1
eventhough im a lot older than you,1
okay as long as we both enjoy,1
if let say someday your you are grownup will you still remember me,1
eventhough your you are far away from me,1
say if you move to so call ,1
will you drive here in no call just to see me,1
i mean say you guys move to so call ,1
i workout ths morning,1
i was dreamin of you last night,1
we're doing sex naked  dog style and you love 'them,1
what position you like most,1
i am nice,1
you know how to suck cock,1
will see sunday,1
do you like condoms,1
im clean,1
i will buy condoms,1
remember my cock is big,1
you want me to slide that in your you are vagina,1
well if you do not want to 'coz its big its okay,1
mom is there,1
i want to hear your you are voice,1
i thought you have it,1
okay love,1
i love u willow,1
i will come for sure no faker,1
at starbucks,1
going to work,1
yes call me morrow,1
i will my love,1
i love u,1
coz your you are my sweethearts,1
its friday,1
are not you glad,1
is your you are mom left,1
cool,1
call me,1
why you did not get the cell from her,1
well im still waiting for your you are address,1
what exit im going to take going  north,1
okay let me find out map quest,1
hold on,1
i got it sweety,1
well what time you want me there,1
around  am,1
how about  noon,1
so you can have your you are lunch,1
i will bring some lunch for you,1
noontime,1
what are you going to wear,1
no brassiere and no panty,1
do not wear brassiere and panty okay,1
your you are not telling this things to nobody even your you are friends,1
you will have the garage door open,1
then i will just park it there,1
where is the side door,1
so your you are house is in the left side or right side when i get there,1
on your you are house phone,1
how will you contact me,1
okay can you check it now,1
did you find it,1
thanks,1
you have it sweety,1
do not worry i'll will be there,1
i will call you,1
take a look first,1
she won't find out,1
be right back too,1
you there,1
did you call,1
call again,1
i was at the kitchen,1
you too,1
i cannot hear you,1
but you have a lovely voice,1
aww,1
you have to wear brassiere in the house,1
sunday you will going to take that clothes for me,1
hows my voice,1
i was eating hotdogs,1
come sunday you will like me,1
aww thanks,1
come sunday you will,1
until what time you want me there,1
until night,1
you want to go out sunday,1
just both of us sunday at the house,1
okay  i hope you invite me again,1
how big is your you are house,1
how many bedrooms,1
willow your you are boobs getting big,1
i will be the st one to lick that boobs sunday,1
hope you won't change on me,1
eventhough your you are  years of age,1
wish i can have you to be my wife,1
i will take care of you,1
did you think of me last night,1
what are you thinking of me,1
i did coz i promise,1
i will sweet,1
your you are going to wear a nice skimpy dress for me,1
aww that picture you had,1
that one is nice,1
you will going to wear that,1
a seductive one,1
i love your you are body sweety,1
very sexy,1
your you are taking care of your you are body,1
i want to get naked now,1
later on still early,1
can i take off my clothes for you,1
i will eat your you are vagina until you cum,1
you like that until you get wet,1
how big is your you are nipples,1
that is the nipples,1
did you ask mom when is she going back again,1
to so call ,1
going back to school huh,1
what grade are you now,1
next year u'll be in high school,1
i want to masturbate,1
okay im going to get naked in my room,1
when are you going to call me,1
let me release some orgasm,1
i'll be thinking of you,1
i think i should reserve it for you on sunday,1
im naked now,1
wish you love me too,1
okay sunday i will i won't stood you up,1
take care love,1
im recharging my phone,1
can me after you had lunch,1
call,1
tomorrow i'll be away saturday,1
go to tracy,1
go eat your you are lunch sweety,1
oh yes what kind of sandwich,1
let me get some more hotdogs be right back,1
well sweety got to prepare  going to to to work now,1
do not chat too much when im away okay,1
ditto,1
im at starbucks,1
blackberry green tea frapp,1
its goodah,1
you want me to bring that sunday,1
have to go,1
hello sweety,1
you miss me,1
im at tracy,1
thinking of you,1
call me right now,1
maybe late around pm,1
are you ready tomorow,1
me too cannot wait to see you,1
are you going to open the garage door at pm,1
got to go love,1
hello love,1
cool im still in tracy,1
your you are not going to wear brassiere and panty,1
nice your you are going to kiss me,1
ultimate kissing,1
your you are not going to be shy on me,1
going to treat me as your you are boyfriend,1
when kissing you can i take off your you are clothes,1
then i will bend down to lick your you are vagina,1
for sure,1
you will suck my cock,1
okay got to go love,1
hello love who are you chatting with,1
there's a big accident,1
altamont pass,1
a pickup truck rolls upside down,1
not right now,1
yes coz your you are my inspiration,1
im yours,1
and your you are mine,1
cannot wait,1
do you dance,1
you had your you are dinner,1
what did you had,1
a lot of food here in tracy,1
laugh i like yours to eat laugh out loud,1
i will put honey lick them,1
do you moan,1
i will your you are whole body,1
what will you do to me,1
got to go,1
im still in tracy,1
im full,1
i need to workout tomorow,1
can we do dogie style,1
yes will do everything,1
ready for me,1
can i get a souvenir,1
what sz panty you wear,1
thong,1
what sz,1
sz ,1
il be home soon,1
your you are going to wait for me,1
can you finger your you are vagina for me,1
i will finger them tomorrow,1
your you are cats will be there when were doing it,1
im going,1
see yes you ,1
just got home,1
busy,1
so sweet,1
so excited,1
looking at your you are picture,1
longfacelol,1
your you are boobs getting big huh,1
is it  now,1
b,1
i will lick your you are nipples,1
you will watch me lick your you are nipples,1
coz you will like 'them,1
imagining your you are boobs,1
mmmmmm,1
your you are vagina still tight love,1
i like that,1
so i can put my tongue in your you are vagina,1
you want me to tongue 'them,1
and suck 'them so good,1
you have tanned skin,1
can i slide my cock in your you are vagina,1
without condom,1
you can sit on top of my cock,1
your you are on top,1
you will suck my cum,1
say if im cumming  orgasm you will suck 'them for me,1
i would like you to eat my cum,1
my sperm,1
eat my sperm,1
swallow 'them,1
when is mom coming home,1
monday,1
morning or afternoon,1
did she call you yet,1
what she said,1
that is it,1
good,1
is your you are mom pretty like you,1
i think you can swallow my cock,1
you have picture of her at the house,1
show me okay,1
you like dog style,1
you want me to do 'them,1
my previous relationship girlfriend suck my cock until i cum,1
i cum in her mouth,1
she likes 'them,1
your you are my girlfriend now,1
im leaving east bay by am,1
your you are my new girlfriend,1
just between you and me,1
do not tell it to nobody please,1
yes i won't   promised,1
night love,1
sleep tight,1
muahhh,1
im on my way,1
im driving,1
yes later,1
,1
im in novato,1
quesadilla,1
are you going to open the garage,1
okay later,1
