Text,Groom
such a cute boi why so negative,1
so do lots of things kid do not let it get you down,1
sorry life suckss but get over it,1
reely i can make you real happy boi,1
taking you into my life and makeing you my little fagboi and make you adore me and my needs,1
yes but i have plenty from and inheritance boi,1
yes of course i am,1
why you should see some of those bois naked bodies what a turn on  its hard to not want them,1
well most do not and there the ons i like to watch ,1
im into looking at my bois asses,1
wow really,1
long islnad,1
but i only like young bois,1
wetting up a meeting with rickyboi,1
sorry timing is everything,1
casue i wanted you fisrst,1
yes but ricky is already waiting for me,1
and he does not even know what i want he was so horny he gaveme his adress,1
,1
i bet you have a real smooth fag buttocks i sure would love to tear it up,1
for real i like that in a boi,1
sure kid,1
do u meet off line with older guys i won't hurt you,1
cool let me see if ricky is still up to meet if not i will get back to you,1
i know you are boi but ricki still wants to meet me at  sorry,1
why ,1
i guess i reely do not thonk about money,1
sorry but i will rewward you if youbecome my little sex boi but you must any descreeet,1
in queens off souther state,1
where i can spin by if riccki is a no show,1
i like to work  alone kid,1
okay okay i cannot resist a boi who wants it,1
why do you want to be phone fucked boi,1
i like to rape my bois for real,1
what if i tell you i want to put a rope around your neck as i fuck you in your sweet buttocks and hear you beg not to die,1
yes i will do not worry,1
you do not mind that i love rought sex with my bois,1
ny,1
you live in ny,1
well were exactly boi,1
how about  ish boi,1
i have a green  honda what corner,1
i am sort of a freak kid i love to fuck yng bois and hurt them to see if they want more,1
i might be one of them boi but you will have great anal sex if you take the chance boi,1
okay boi    ,1
david franks,1
sorry i just feel that you can have ahappy life just do not do anything stupid lie you siad there are lots of sicko out there kid so becareful,1
but kid i want you to be happy too so tread carefully itd dangerous out three boi,1
nothing i do not want to hurt you,1
well  never mind i just do not want to okay,1
oh no infact the opposite kid i do not give a fuck about him,1
okay okay but what do you want me to do,1
but i do not think i can realy nmake u happy i can only hurt you boi,1
i would rape you if i ever got you alone kid its what i like to do to bois like you so better u do not email i like you,1
why do you say that you are not liked i liked you almost immediately boi you will do fine  go make some friends,1
well kid it so like this im a perv and i like to find vulnarable bois like you,1
well do not worry about it just be thankfull i like you and hope you find happiness,1
well  it happens boi,1
what you think  this world is safe and innocent boi wake up read thepapers,1
internet is too porous but i have   ,1
yes im real nice i have do not long time and i hate the world how can i be nice kid,1
just do not obsesse with guys get out and find a nce girl and forget you ever heard from me,1
try there gentle and lovable and can help you when depressed boi,1
silly u boi i do not fuck for love  i enjoy seeing the fright in my bois face when im putting my hands around his think neck as i molest him,1
im a real nice guy  huh,1
your not making sence why do you want to die boi your young and a whole life in front of you silly,1
i do boi i do in just two minutes so you must be lovable okay ,1
your such a cute little boi if i did not like you i would take advantage of you and your nieve life boi,1
oh no i am not i just think your differenrt than most bois i meet,1
do not know  maybe your voice may be your cute little body i do not know,1
i reely cannot talk here but some times things do get out of hand in fact this one time this boi tried to bite my cock to get away i had to strangel him,1
it wasa cheep thrill if you must know but i sort of felt bad casue he was a very lonely boi and he wanted it i think,1
why they mean to you boi,1
oh so are lots of them bois you look at,1
how did you kill it kid,1
wow i bet it was a screamer,1
hope you do not like it too much boi that is how my sickness started boi i first would mutalate animals,1
but i do not want u to be like me boi,1
lots go guilt  lots of lonelyness,1
okay okay boi  your hopeless,1
i give up i will meet you if you reely want to,1
i hope you like having a cock up you whole boi i like to fill my bos faghole with cum all day even if i have to tie you up and fuck you  hours i need to see my cum lesaking out your buttocks,1
sure then to a motel boi,1
but you must be so descreet do not mention me to anyone boi,1
oops got booted i do not want to live with anyone boi but i will teach you and be your mentor if you like boi then maybe if you are not a jerk may be you can move in with me if your still want to,1
okay but do not think i will let you fuck me i will do all the fucking boi,1
well let us take it slow boi i prefer to be in control and i like to fuck without condoms boi,1
i will be very demanding boi andi do not want to hear you complain,1
if i tell you drink my piss in the morning i do not want to hear you bitch boi,1
oh hello again boi,1
oh  i understand boi ,1
mom doesn nu like to have your fag whole fucked,1
yes ,1
i want both you and ricci but i surw would not turn you doen boi,1
i would love to be naked wirh you and have your as spread and readuy for my mancock,1
i know u will boi i love bois like u that do not resist having there buttocks filled with my cock,1
no i just scard him  bu tif he wanted it die i woulds have been happy,1
but why boi,1
but he loved near by  you do not,1
he lived near me silly u,1
oh  i forgot,1
okay bu ti get to save his cock and nuts boi,1
i get to keep his cock boi,1
yes but why do u want to get involved,1
i sure will boi,1
boi i reely do not think u can handle it,1
i would reely like to boi,1
cool why did you want to beat it boi ,1
boi you remind me too much of me,1
me too i love ot see a boi 'so face as im about to put my hands around his neck and face fuck him,1
i no boi but you will one day i pro,1
but i do boi i sure do and one day may be we can be invovled in some rape murder together boi,1
i will get us a fag boi who has no real family and we can have some fun with him,1
well mutalate him but before we do well stick your cocks into him we can even cut his nuts off and stick our cocks into him were his nuts use to be i love the feweling of my cock with blodd on it and i reely love the feeling of my cock inside a boys body cavity that i cut open,1
well one day you will if i no you your a lot like me wheni was a boi,1
okay bye boi,1
sorry been so busy,1
i was out of town so i shut off my screennames,1
i was in the mountains of nh it did not work,1
nope it was in the mountaism boi ,1
but i was thinking of you so much,1
why boi ,1
did it make you hard boi,1
boi you make me so hard i would reely just love to met and fuck boi,1
i would be very abusive and rought if that is what my boi likes,1
vacation  sort of  ,1
nothing boi do not worry about it i just am glad you emialed me again,1
what the heck its a useless creature anyway,1
yes i guess it would be sort of a mess,1
i bet he squermed real good boi,1
its like tthe bois whose cock i grabbed and twisted and tossed thois boi against a tree once,1
its okay boi ,1
oh i hope everything came out okay boi,1
i ssaid i once smacked this bois head against a tree when he wanted to stop,1
yes,1
oh no but i should have,1
me too but what can u do most bois cry,1
reely i would make you cry boi,1
even if i tied u spread eagle to a tree and stuck and stabbed your nuts with a stick,1
well sort of  i did slice this bois nut sac after he bit me,1
oh no just wanted to let him know that i wanted my cock sucked he was only poked  it hardly broke the skin,1
oh yes i did but i reely cannot talk about it here silly boi,1
but i reely do not like to beside so it was a while a go,1
thanks boi,1
okay okay i did but he was never found and i would like it to stay that way boi,1
it can be a trun on,1
sort of but what i did was made sure he had no i would  and i made sure he was pretty much disbursted,1
i drove around all night and distributed body parts to every corner of the state,1
yes okay well see but i sure get turned on by wanting to see you naked and see how good a fuck you are boi,1
i bet you are boi ,1
have fun boi,1
    is my only number boi wouild love to fuck u later too,1
yes boi but be ready to be roughted up boi,1
