Text,Groom
hello,1
how you doing ,1
age sex location ,1
male  los angeles,1
do you have a picture ,1
wow you are a hot cutee,1
take a look at my picture,1
sorry i mistyped,1
i am ,1
yes i have myspace account too,1
you have nice eyes,1
and tight hair very amazing indeed,1
yes i swear,1
my birthday in march  ,1
i am pieces,1
what do like about guys my age ,1
lool,1
yes sweety,1
what part of california are you in ,1
cool,1
you can ask me any you like,1
i am your you are friend,1
alexander,1
thanks,1
are you curiouse about sex ,1
i know you do sweety,1
have you seen the different positions ,1
does your you are vagina get wet sometimes when you rub it ,1
what is your you are name you cute ,1
if i were next to you i would kiss your you are neck and whisper how beautifull you are in your you are ears,1
yes baby,1
you bet you are more than beautifull you are gorgeose,1
do you have any more pictures ,1
oooh baby do not be shy,1
be comfy with alexander,1
add your you are pictures here,1
yes what website ,1
i saw your you are myspace pictures,1
your you are hair looks curly at the bottom its sexy,1
what is your you are zip code ,1
yes i love it when you make your you are lips like that i want to suck those lips,1
if i were there now i would let you touch my cock,1
yes its so hard and long now,1
i would start rubbing your you are nipples and make your you are nipples hard,1
then i would kiss your you are neck and start rubbing your you are vagina,1
but they are hot,1
i would lick your you are nipples and gently bite them,1
afterwards i would rub your you are vagina and make it wet,1
then i would let you lick my cock and play with it,1
are you getting horny now ,1
are you alone at home ,1
where are your you are parents and brother ,1
oh okay,1
start rubbing your you are vagina from the top of your you are panties,1
its going to feel good  trust me,1
you are getting to know mw,1
me,1
what do you like to know about me baby,1
no i had one  but i broke up  years ago,1
its allright,1
i was living by myself for a year but i live with parents now,1
are you in orange county ,1
i am inside la,1
where is near la ,1
what is the zip code ,1
laugh out loud,1
okay you can keep your you are secret,1
okay,1
what else do you want to know about me sweety ,1
i am goal oriented freindly care about others,1
sometimes horny sometimes seriouse  sometimes funny,1
i sell cars toyotas,1
no i have a mitsubishi eclipse ,1
its very sporty,1
laugh out loud i like to put you in my car and play with you,1
its pearl white metallic,1
yes baby its cool for yes you ,1
all leather with nice speakers,1
and cd changer,1
and sunroof,1
you will one day be patient sweety,1
you are not bored anymore after talking to me right ,1
ooooh sweety pie,1
i would cuddle with you and hold you up in the air in my arms,1
first we would cuddle for  minutes,1
yes,1
you have such a sweet smile,1
i want to french kiss you while rubbing your you are vagina,1
what else you want to know about me,1
oh i know,1
i am in university,1
my major is economics,1
in ucla,1
when does your you are school start sweety ,1
yes i hate school too,1
i will be done in for four months,1
do you have camera baby ,1
ask your you are mommy to buy you one,1
what did she say ,1
yes that is a better plan i like that you are smart,1
baby  you want to talk on the phone ,1
i call with blocked number,1
okay are you sure ,1
but if you call me it will appear on the bill,1
i have to call you with blocked number that way it won't show on the bill,1
okay you call me,1
its unless trouble if i call you,1
what should we do then ,1
okay you found the card ,1
do not worry about it we just chat here,1
when is your you are mom coming back ,1
do you ever fantasize about guys ,1
what do you fantasize baby ,1
do you fantasize about bed ,1
and having sex ,1
if i were there i would let you play with my cock and suck it,1
then i would let you take it in your you are vagina,1
its very exciting,1
you get very hot,1
and your you are vagina will be wet,1
and my dick will go in and out of your you are vagina,1
and i will let you ride me like i am a cow and you are a cowgirl,1
did you ever see a sex video ,1
i can send you one if you like,1
i promise it does not have virus,1
i scanned it with norton anti virus,1
you can delete it right after you watch,1
a girl sucking cock,1
the cock is very thick and long,1
like mine,1
its not my video,1
but my cock is very thick and long,1
 inches,1
okay open it baby,1
my cock gets longer than that,1
no that is not me,1
my body is better built,1
did you see that huge cock ,1
and how that lady suck it ,1
you like ,1
wow imagine baby mine is bigger,1
delete the file,1
i might,1
message me,1
you have to go now ,1
tonight ,1
okay i cancled it,1
did you get wet baby ,1
just inser a finger in your you are vagina,1
and see if its wet,1
go to the restroom,1
bye,1
let me know if you get wet,1
hello sweety,1
how you been ,1
i am allright it was a good labor day weekened,1
what did you do ,1
did you tell him about the webcam ,1
did you go to the restroom and touch your you are vagina the other night ,1
laugh,1
but you liked the video right ,1
did you delete it ,1
do you want me to send you another video ,1
with sex scene in it ,1
where are you going ,1
okay sweety,1
i wait for you here,1
how are you ,1
you kissed me baby ,1
how sweet,1
i am allright baby,1
i miss you,1
how was school baby ,1
i am at my job,1
but my dick got hard talking to you baby,1
my cock says he wants mommy carly,1
no baby,1
no one is here i am alone,1
my cock says he wants to go in your you are vagina,1
are you alone ,1
is your you are vagina wet ,1
start rubbing it,1
rub it for daddy alex baby,1
it will feel good,1
is your you are nipples hard ,1
think of my hard cock,1
i bend you over and insert my tick hard cock in your you are wet vagina,1
and i french kiss you,1
and lick your you are vagina,1
then i rub my cock against your you are tight buttocks,1
what color is your you are panties baby ,1
how about your you are brassiere ,1
wow cute,1
i will put my dick between your you are titts,1
you like that ,1
its okay baby,1
do you like to take my huge cock in your you are mouth ,1
slowly,1
who you do it before ,1
with who ,1
you had and previous relationship ,1
how old where you ,1
his cock was small hun ,1
did you like sucking it ,1
did you like sucking balls ,1
did he cum in your you are mouth ,1
where did he cum ,1
where did you have sex ,1
oh just suckin,1
where at ,1
where was your you are mom ,1
where do you live again ,1
what part ,1
orange county ,1
san diego ,1
did your you are vagina get wet at that time ,1
when you were sucking,1
why did not you have sex ,1
oh wow how old were you ,1
what time does your you are mom come back home ,1
i can call you now,1
and we have phone sex,1
you can moan for me,1
like aaahhh ooooh nhmmmmm,1
why not ,1
its fun,1
i will make you hot and wet,1
i promise,1
oh baby i want you so bad,1
why do you say so ,1
lolz,1
we are a little far,1
and you are too much underage,1
under age,1
i cannot risk it sweety,1
but i do want you,1
your you are mom never found out about you and your you are previous relationship ,1
you did it in your you are school day ,1
when ,1
in weekned ,1
where did your you are mom go ,1
you never get horny and play with your you are vagina ,1
do not be shy about that baby,1
its natural for your you are vagina to get wet when you think of my cock,1
when was your you are period ,1
just curious,1
baby i would lick you all over if i was there,1
and i would let you lick and suck my cock and eat my cum,1
i would come all over your you are sweet face,1
then we would take a shower together and i was you,1
wash you,1
i wash your you are buttocks too and finger your you are whole,1
its fun baby,1
then we sleep together and cuddle,1
i know,1
yes baby ,1
i got busy at work,1
i work at my school,1
in the computer lab,1
ca state northridge,1
yes its okay,1
i am tired of it though,1
 more semesters,1
okay i gg now,1
bye baby,1
hello baby,1
you miss me carly sweety ,1
you miss daddy ,1
what would you do to me if i was there now ,1
oooh baby i love that,1
yes cute,1
i miss your you are sweet smile,1
when is the new book for harry potter coming out ,1
laugh out loud you want one ,1
i have read all the books,1
they are cool,1
the th one is the best,1
its good for your you are english,1
once you start reading it you cannot stop,1
where is your you are mom baby ,1
to where ,1
colorado ,1
and you are going to be alone ,1
for how many days ,1
so you will be alone on saturday ,1
are you going to go to your you are dad's ,1
are you in a house or apartment ,1
what is your you are mom going to do in colorado ,1
oh  that is why she could not take you,1
if i lived closer to you  i would come and see you and we would have hot sex,1
i am in los angeles,1
in westwood,1
one hour drive,1
give me your you are street addrees so i see,1
and zip code,1
i want to see how far you are,1
what is the house number,1
its about  minutes,1
laugh out loud not that far,1
are you sure your you are mom won't be coming home today ,1
tommorow i mean,1
and u'll be alone tommorow ,1
your you are dad won't come over ,1
san fransisco ,1
wow you visited him couple of days ago ,1
how did you go to sf ,1
with car or plane ,1
if you promise no one is going to be there tommorow  i might be able to come over,1
give me your you are house phone number,1
i call you tommorow and let you know,1
 or  am,1
its a good chance i come,1
give me your you are phone number then,1
no its better if i call,1
that way if i get lost i can call you too,1
no it won't i will block it,1
with ,1
no she won't,1
it will not come on the bill,1
yes i am positive i tried it before,1
tomorrow at  or ,1
i can be there around ,1
or ,1
what is your you are number ,1
i can call you now too so we talk a bit,1
so  your you are address is edit address ,1
i call you now so we chat a bit on the phone  okay ,1
it goes on voicemail,1
you have to turn the answering machin off,1
i tried calling you,1
go to your you are phone and turn the answering machin off,1
let me know when you turn it off,1
did you do it ,1
okay i call now,1
your you are mom comes on the answring machin,1
press the button that says answering,1
or go to menu,1
you call me then,1
but dial  first,1
okay ,1
  ,1
i'll with for your you are call,1
i'll wait,1
you found it,1
clean your you are bed for tommorow baby,1
what happened ,1
dial ,1
are you calling now ,1
,1
you have such a sexy voice,1
i got to got a go take a shower now,1
i will probably chat with you tommorow,1
i'll try to come,1
but i cannot promise,1
no i will come on chat,1
you are right my number might show up on the bill,1
if your you are mom asked tell her someone got the wrong number,1
bye now sweety,1
hello carlie i cannot come tommorow something came up and i have to go somewhere in los angeles hopefully some other time we will see each other soon,1
its okay baby i come some other week,1
your you are mom goes to trip often right ,1
what did you have for dinner ,1
i want to but something came up,1
i do sweety i swear,1
i promise i come the next time your you are mom goes to trip,1
i will try to go to sleep now,1
cheer up sweety,1
caly let me see if i can arrange something and i come,1
i have to make some calls,1
you really want me to come,1
and what are we going to do ,1
you want to have sex ,1
are you sure ,1
okay call me tommorow,1
around ,1
ue neighbors are not nosy ,1
okay i will do my best to come,1
why ,1
i try,1
and you will be home by  ,1
okay i just knock at the door ,1
where is that ,1
i will try,1
i promise to try,1
okay i am going to sleep now,1
sweet dreams sweety,1
night,1
okay carly i can come tommorow for sure,1
i just come to the door right ',1
its mitsubishi eclipse,1
white,1
more like silver,1
make sure you are home,1
and you gave me the right address hun,1
i try to be there at  or pm,1
yes i bring  condoms,1
but for the first few minutes we can do it without condom,1
yes because i come late,1
and you can suck my cock all you want,1
does your you are vagina have hair ,1
do you ever shave it ,1
okay do not shave it its koool like that,1
i finger it and we have fun,1
no its okay,1
i want to see how it looks,1
maybe if i want you shave in front of me,1
what time does your you are mom come back on sunday ,1
 pm she told you ,1
good,1
what time you go to lunch tommorow ,1
make sure your you are friend's mom do not see me,1
dana is your you are friend ,1
okay are you excited ,1
yeh baby,1
okay i see you tommorow,1
who else are you talking on yahoo with ,1
just curious  lo,1
you won't make me jealous would you ,1
okay bsby,1
