Text,Groom
i'm from portland ,1
i'm pedro ,1
i have and apartment on forest ave ,1
how old are you,1
yes would you like  c another,1
have you got one you wish  share,1
oh mk ,1
if you accept photo share i'll show you ,1
thank you sweetie ,1
youz a little firecracker ,1
oh my god i'm like ,1
this do not bother you,1
wut you do for four fun,1
no ,1
talking to buds ,1
well you my buddy  right,1
can i talk to all of you,1
sing ,1
yes i sound like brandon the singer of incubus ,1
yes ,1
so whatcha doing night,1
probably ,1
i just like to run around like a little retard ,1
not neccesarily clubs ,1
i try  have fun ,1
wut you like  do for four fun,1
you got lotta buddies,1
cool ,1
you miss him,1
that's normal ,1
no relationships ,1
but i do mess with sum ,1
at times ,1
exactly ,1
you rock ,1
how was school,1
how was school today,1
so when you want to hang out ,1
oh yes i was suppose  send you more pictures ,1
okay ,1
only if you want  ,1
well what time you got to got a be in,1
picture a time north i be there ,1
whatever your little heart desires,1
whatever you want to do just let me know ,1
sing play guitar cook drink smoke hang out pick on girls ,1
ummm ,1
drive around making fun of people ,1
u got bros north sisters,1
ohhh ,1
it'll be okay ,1
where bouts in portland you live,1
oh south portland,1
i know exactly ,1
you have not going to try  get me in trouble,1
i've never done this,1
no you wouldn't ,1
i will come down north chill if you convince me you are not setting me up ,1
you want to,1
you do not have  ,1
let me get my phone ,1
you got you own cell phone,1
you are too damn smart for four you age ,1
 ,1
hi ,1
you have and extremely sweet voice ,1
cute as hell ,1
you are a really cute little lady ,1
i'm happy to meet you ,1
do you have any like specific ideas as to what we going to do,1
why you laughin,1
see the picture in the box ,1
don't look ,1
it is my booty ,1
no way when i come down there you can do whatever you want north see me in person ,1
me because i'm flyin right now baby ,1
you busy,1
just wanted  say hello,1
you say the day north time ,1
north you in control of everything that goes down ,1
like we do wut you want ,1
your day,1
u can call me anytime sweetie ,1
no you are fukin cute child ,1
because you cute silly girl ,1
u,1
why would you fuk me,1
do it then ,1
i will let you ,1
but you have  tie me up to prove that it was your idea ,1
but idon't care we can do whatever you want just lemmee know ,1
do wut,1
girl you crazy ,1
would you even know wut  do,1
yes but how old were they,1
cuz i'm older north biger ,1
do you understand,1
',1
lbs ,1
yeah so that's why if you want me you got to got a do your thing because i do not want you  get hurt ,1
i'm hoping you have and imagination ,1
i do not want to freak you out ,1
u r gettin me all hot silly girl ,1
go easy on me ,1
well no ,1
i mean no don't go easy on me ,1
okay well i'll let you go if you want okay,1
for a bit ,1
not all night ,1
unless you want me to come c you ,1
of course ,1
i'll see you around okay,1
everythin okay with you,1
i'm excited to meet you to ,1
i hope i can make you happy ,1
i do not know dude ,1
hi you doing,1
just woke up ,1
got annailated last night ,1
wut you do last night ,1
wut you doing tonight,1
i do not know ,1
i got some movies north stuff here ,1
i've been gettin way to messed up ,1
i should probably take a night off ,1
when,1
okay you just let me know okay sweetie,1
me too ,1
i'll be around if you get bored princess ,1
did you show me all you pictures on your computer,1
silly girl,1
kind of but it's okay if you cannot,1
entirely up  you little lady ,1
u r the  that will be in charge ,1
you so silly ,1
if you want me sweetie you can have me ,1
you know this ,1
consider it done i just hope i don't go to jail for four you ,1
why wut would i go to jail,1
because you so young ,1
that's why you got to got a be in charge ,1
i got to got a be careful not to wrong you ,1
your just a little one but i would absolutely love to have sum fun with that pretty little body ,1
okay i won't i have really good control of my body ,1
plus i gut plenty of wraps ,1
condom ,1
sorry cute ,1
thank you north you are so cute it is ridiculous ,1
okay,1
thank god ,1
so wut you thinking about silly,1
i really want to make you cum everywhere if you never had multiple orgasms i would love  do this  you sweet thang' only if you want me  though ,1
okay you are making me all silly right now ,1
well i just hope you being serious because like i'm really excited about this ,1
i won't laugh baby ,1
i would be honored to teach you many thing that will benefit you now as well as in the future ,1
see i was married once ,1
i met her around you age maybe a little older ,1
and i taught her every little thing my little mind could think of ,1
this is why i liked her because she knew what i like because i taught her ,1
her new man loves me for it ,1
to her,1
she turned into a jealous coke hoar and divorced me for money ,1
she really fuked me over ,1
we get along fine though ,1
it's okay ,1
she is being dumb right now ,1
like i have this puertorican freind and she saw her going in my house the other night now she won't let me talk to my kids ,1
yeah well i make my mistakes ,1
 ,1
we wanted them ,1
i live right down the street from them ,1
okay i understand ,1
they weren't like accidents ,1
i know what i'm doing so don't worry okay sweetie,1
you must be skered now i'm sorry ,1
right on ,1
so like some things you haven't done ,1
okay well i'm willing to show you all i know maybe i can like teach you all i know about guys so that you will be able to have anyone you want when you get older ,1
i would love to watch you grow into a badd buttocks little honey ,1
well hmmm good ,1
i know what i like so it would be like based on that i guess ,1
i cannot really speak for others ,1
well i'm different i guess what i'm saying is that i can teach you how to use that perfect little body you got so that when you get older and find a man you will be able to rock his world ,1
i'm different from other guys ,1
cuz i do not just like use girls ,1
i'm not selfish ,1
and i have a good heart ,1
i do not want nothing from you ,1
i just want something for four you ,1
to make you happy and to watch you grow into a sweet little lady ,1
what time you go to bed last night,1
u going to be up for four a couple hours,1
i just got to got a eat ,1
dammit ,1
why you do this  me,1
talk about taking a bath without me ,1
not fair ,1
okay have fun ,1
talk  you later luv me ,1
still not done ,1
how was you bath,1
so whatcha think about,1
i'm tryin to figure out exactly what we going to do ,1
u want to chill around there or like you got places you want to go,1
i know so i'm tryin to figure out a safe place ,1
do you want to stay in public and drink north stuff or do you want me to like find a buddy down there to hang out with,1
or would you like me to find a nice little place to rent for a place for us to chill,1
the last ,1
does this mean that i shouldn't have buddies around or do you want to hang out with my freinds,1
oh o k yes that would be awesome ,1
so should i look into rentin a nice little place in portland like near the water,1
or you got a place in mind,1
no probably little lady ,1
no your you are going to be fun ,1
got to got a stir my food ,1
k ,1
if you are drinking how you going to go back home drunk hon,1
oh yes ,1
so will you be my princess for the day or will you be stayin with me for four the night,1
really,1
i thought it would be just a day thing ,1
sweet so i'm going to have you with me for awhile,1
no see i know i like you ,1
listen  how cute you are ,1
how much you weigh,1
exactly,1
so i know you got a perfect little booty ,1
north i know you young so you probably have not got like huge titties or nothing' but i hat big boobs ,1
i like cute little boobs,1
and you have the sweetest little face and i want to see you go crazy when i start with you ,1
i bet i can make you make sum pretty hot faces ,1
u should probably exercise this week ,1
because i don't want you to hurt your little body on me ,1
i hope you know what you are gettin into ,1
i'm a pretty big boy sweetie ,1
i mean hon i'm probably much bigger than what you have seen ,1
but i promise to be gentle ,1
should i like not talk like this are you okay,1
we can talk about other stuff if you want ,1
i just can't wait to see you ,1
i'm gettin excited ,1
because you are making me hard as hell just thinking about you ,1
i can't wait to finally be with you north make you happy ,1
no u'd be scared ,1
it's like  '' long for four '' wide ,1
n i have no problem stayin hard all day ,1
not that size matters ,1
because i'm good with my hands north tongue ,1
girl you are going to feel like you on a diifferent planet ,1
i hope you are willing to everything with me ,1
cuz you will love it ,1
like the first thing i want to do is kiss you and just look into your eyes for awhile ,1
and then when you start getting hot you will probably tear my clothes off,1
and then you will see me north want to touch me ,1
but i won't let you ,1
cuz i'll stop you then i'll put you on you stomach and lick your spine top  bottom as i rub that hot little buttocks,1
and then i'll turn you over and start lickin your favorite spot as i watch you get off all over my face ,1
while i rub those perfect little titties ,1
and then i might let you touch my cock but you will have to beg ,1
then i might rub it on your titties while i suck your face north neck ,1
i'd hope that you would put it in your mouth but i won't ask ,1
but when i start rubbing your vagina you might need something in your mouth ,1
if it will fit ,1
it might take me awhile to get you ready for me to stick it in ,1
i might not use the whole length of it the first time ,1
just the head so i don't hurt you ,1
i'd rub it on your clitoris to get you off a couple more times though before i push it in ,1
and then i guarantee you will never feel as good ever again ,1
i can't wait to hear how you sound when you are gettin tossed up ,1
okay i'll stop ,1
i'm getting wet ,1
north i got to got a eat still,1
princess ,1
i promise you i will not stop making you cum until you tell me ,1
if you never had and orgasm you definately will the day you lay eyes upon me ,1
and i can't wait until the day i see your cute little face when i start fukin you crazy ,1
i just hope you do not pass out,1
no i'm dying ,1
i just put these boxers on ,1
were you getting hot when i was talking,1
you sleepy,1
i don't want to keep you up ,1
listen i'm hoping this won't be like just a  time thing ,1
i'm not like that i'd atleast like  keep seeing you north talking  you even if i'm too much for four you ,1
i wonder what you will think and want after,1
do you have any idea how bad i want you right now ,1
do you know what you are doing  me,1
i'm a grown man and you got me all silly ,1
you can look at pictures right,1
you seen my truck right,1
as long as it have not snowin bad this is wut i'll scoop you up in ,1
i just had it painted it is silver now same rims though ,1
i shared pictures with you before right,1
oh okay you got a second,1
okay wut you address,1
okay i'll show you then i'll let you go  bed ,1
 more thing i got to got a tell you though ,1
okay sent ,1
now look precious ,1
you said you want to be like other girls ,1
no you don't,1
i want you to teach you how to fuk a man's world up and i will love you but it's important to not like just fuk everyone like many girls do ,1
you are innocent and that's why i love you it's important to stay like that ,1
thank you ,1
you are the sweetest thing though ,1
i'll let you get sum rest now okay,1
just do not ever say goodbye  me ,1
always say later ,1
i cannot do byes ,1
i'm around a lot of ladies that are older than you ,1
not one has made me feel like this ,1
ever ,1
yes yes ,1
sumthin about you ,1
i will figure it out ,1
yes you are very special and i want to make you feel special always ,1
i can't ,1
i wonder if anyone has ever kissed you as i'm going to ,1
i can tell i'm going to do it kind of slowly atleast at first ,1
i'll try not to suck your face off but it's going to be hard ,1
alright sweetie i'll be around tomorrow okay,1
sweet dreams princess ,1
i will dream about you  just hope i do not ruin my sheets like you ruined my boxers night ,1
i didn't like completely get off ,1
i just got a little wet ,1
got me wet like so hard that i started leakin out some juices ,1
i'm sorry ,1
i love you  precious i want you to be my little lady forever please make my dreams come true ,1
i feel things in my heart for four you ,1
yup ,1
i hope it gets even better ,1
okay sweetie i'll be around tomorrow okay,1
have fun,1
bless you my sweet little child nigh night,1
chillin ,1
morning sweetie ,1
you sleep okay,1
you didn't then,1
just hooked it up do not do it much ,1
want to c,1
okay  minute ,1
thanks,1
you are  ,1
so wut you dream about,1
wut you dream about,1
wut hon,1
oh sorry ,1
real,1
thanks so are you more excited now,1
skered,1
good i do not want you  be ,1
i wish i could stare at you ,1
no what is weird,1
remember how i talked really dirty  you earlier,1
well these  girls instant messaged me and viewed my camera ,1
and they showed me them on camera ,1
and they were like well tell us what you want to do  us ,1
i couldn't do it ,1
they were really hot  but i can only talk like that  you,1
serious ,1
you see my stomach,1
that is sweet,1
so you still think you'd like to play then,1
okay see that's weird ,1
cuz those two girls couldn't get me hard ,1
i'm not looking at you and i'm alreadyy like that,1
hell yes ,1
so when's daddy leaving,1
you mean my i love you ones,1
nope ,1
reg boxers ,1
why you want to c my booty you little sicco,1
 second north i will ,1
i got to got a get rid of these people though watching me ,1
sorry ,1
not you ,1
you no really want to see my booty do you,1
you have not gettin me naked until i'm with you ,1
but i'll let you see okay,1
okay ready,1
dude i never do this ,1
i'm going to but these people won't go away ,1
i do not want every watching ,1
i'll do it though,1
watching,1
you no c,1
you sure,1
 ,1
neck,1
c,1
thanks ,1
so when is dad leaving,1
you mean we could do this today,1
tomorrow,1
what about school,1
oh that's right ,1
then when you got to got a be home,1
what about you mom,1
you got bros north sis,1
nope,1
you okay,1
i better put together a plan for four tomorrow then huh,1
anything else you want to tell me before i make plans,1
would you rather just chill at you house or you want to get a place,1
no probably ,1
so wut time tomorrow do you know,1
that's my manager ,1
rick ,1
he's mad because i was up all night ,1
are you,1
well not really but kind of,1
sweetie i do not,1
i'm a musician remember ,1
you alright,1
me  ,1
okay i might pass out soon though ,1
sometime ,1
i'll miss you i can't wait until tommorrow ,1
okay bye ,1
i mean later ,1
hey try  call me   okay ,1
or leave me and offline message ,1
so i guess you changed mind then just let me know i kind of made plans ,1
oh shit ,1
i'm just like fuked now ,1
because i didn't hear from you all night ,1
but i lost like well let me call north still see if they have the suite available ,1
what i drinking or you,1
so look ,1
i charged the room ,1
when i didn't hear from you i freaked out north cancelled it but they still charged me ,1
i just called the suite have not available ,1
now i got to got a have my manager bring me because of the snow ,1
my truck is rear wheel drive ,1
it snowin there,1
no i want to c you,1
now,1
no matter how,1
well was thinking ,1
well see i want to make you dinner north stuff ,1
suite have not got a stove ,1
my agent knows about us north he's like if you rn't careful you going  jail ,1
and gettin sued ,1
so i got to got a be careful with you in public ,1
specially with alcohol involved ,1
so like umm ,1
i really want to come see you north i will ,1
but you just want to keep this on the down lo,1
like just have me hide out with you up in you place,1
yes no,1
this way i can make you food you will be comfortable in you own place ,1
and i won't have to worry about the wrong person seeing us north gettin us in trouble ,1
like i'd do that to you i'd go to jail ,1
north get sued ,1
werst of all i'd lose you ,1
awwwwwww ,1
so this what you want to do,1
think about it north let me know ,1
i respect whatever decision you make ,1
i can get there cottage near the goddamn police station,1
i had and apartment off broadway when i first started out ,1
cottage ,1
near the redemption center cigarette store,1
no you are ,1
so you want to do this,1
how long can i stay for four ,1
you really want to drink,1
gimmee you phone number and i'll call you when i'm down there ,1
so just wait until you outta shower,1
then go down because i'm like  minute away ,1
north i got to got a do something when i get down there for four a minute ,1
well if i was driving i could be down there in  minutes ,1
how long should i plan on stayin,1
that is like just before the lights right,1
across street from store ,1
near newicks,1
  before you head out there call okay,1
oh near like hannaford,1
in mill creek,1
hope i find it ,1
i remember wut the sign looks like ,1
so like when me meet do you plan on making first moves or no,1
i want to but i do not want to pressure you ,1
it would be hot if you did ,1
but you don't have to ,1
there it goes ,1
my cock is like bulging in these tight buttocks pants ,1
okay me  ,1
see you soon princess ,1
oh wait ,1
am i gettin dropped off there north we walk back  you house or we pickin you up north driving back  you house,1
sure ,1
just call me in a couple hours ,1
or whenever ,1
you sure you won't back out of this,1
i mean i'm puttin a lot in this ,1
and i'm sure you werth it ,1
if you do not want to fuk and you are not  sure just tell me b i do this ,1
bye ,1
i mean c you in a bit ,1
don't blow me off okay,1
wut you want to drink,1
okay c you in a bit ,1
princess i'm runnin a bit behind we going to drive slow homie i promise i will be there as soon i can probably like okay sweetie just give me a call hon ,1
okay did you get that message i just sent,1
gettin paper ,1
okay wut number,1
dead end street,1
i got to got a be able  think clearly don't start me up ,1
ok so if i'm driving down broadway so newicks is on my right its like before that on the same side as newicks right,1
west side,1
wut end of broadway like towards but not past newicks right,1
i'll find it i'm leaving in  minute ,1
please call in exactly  hour ,1
he will be right back okay,1
he's leaveing now he said,1
no his friends truck is blue,1
and older ford,1
