Text,Groom
you are up late,1
oh okay,1
what you doing,1
so you kicked jay so behind,1
on profile,1
no boy friend now,1
really,1
where about are you in tx,1
above plano or below,1
i see,1
so you looking,1
oy friend,1
what you want to do with him,1
i am much older,1
,1
you like older ones,1
nice,1
,1
that was tease,1
how old is dada,1
okay,1
east of dallas,1
not far from you,1
so what year are you in school,1
tell me did you do it with jay,1
you know the stuff,1
sex,1
oh yes virgin,1
you there,1
oh,1
wish you were older,1
iwould ask you out,1
you like to be with me,1
well make sure we can have sex,1
you want it now,1
would you like it with me,1
no sorry,1
i don't know,1
oh i see,1
are you wet now,1
my hard drive crashed,1
its okay i ll get some,1
yes you have more,1
you are cute,1
can i see them,1
thank you,1
hello,1
sending it,1
sure,1
mikejardi yahoo com,1
sending now or later,1
oh good,1
its okay,1
be right back,1
you are so cute,1
wish you were my neighbor,1
to see you,1
yes,1
how old are the pictures,1
do you have a cell,1
no its okay,1
i may be in dallas next week,1
you go to mall,1
in plano,1
i could come around there,1
you go alone,1
your mom works during the day,1
oh so you alone,1
i could sneak in laugh out loud,1
really you want me to,1
yes i do,1
sleep with you,1
well having sex too,1
you want me to,1
oh we use condom,1
i know,1
which nights she is out,1
when you know about next weekend east mail me,1
sorry next week,1
not weekend,1
what time she goes,1
usually,1
and are you in apartment or house,1
you think neighbors won t shirt see if i come,1
and,1
what do you mean,1
you come there,1
you walk,1
and then we go where,1
then you can go back home yourself,1
you want to do it in the car,1
you can sit on it,1
my dick,1
what is your adress,1
want to find the gas station from yahoo map,1
what is the zip code there,1
if you give me the house it is easier to find on yahoo map,1
not now of course,1
too late,1
do you weant me to call you on home phone when i get there,1
then you come,1
i ll block the number do not t shirt wory,1
its long distance mom will finds out,1
and wife here get up,1
then i am in trouble,1
just east mail me,1
i would be able to come during the day is that okay too,1
okay baby,1
love to pop your cherry,1
you ll like it too,1
wish you had a camera,1
oh yes you get to cum,1
you do not t shirt have camera do you,1
oh yes you ll love it,1
do you play with yourself,1
i know but touch your vagina right now see if its wet,1
touch it,1
is it wet,1
i understand,1
small one,1
then would you let me touch you,1
you sure you want to sit on it,1
have touch any dick before,1
do you like to,1
if you were my neighbor i would come and let you now,1
i am hard,1
may be you like to suck it first,1
then i may cum inside your mouth,1
say it agai,1
again,1
what should i call you crissy,1
like it,1
ywe,1
are you sleepy,1
you want me to put you in bed,1
wish i could,1
sweet dream crissy,1
night,1
hello baby hold for a minute okay have to reboot,1
brb,1
sorry,1
how are you,1
do not t shirt want trouble on this side you know,1
but you can im if you see me here,1
okay may be i could be around there may be  or ,1
no day,1
tesday,1
tuesday,1
where did you go,1
yahoo sucks,1
what was your zip,1
give me your phone so i call when get there,1
may be around noon,1
well you said she is going for day anyhow,1
you want me to come to house,1
well would only around noon but she is home,1
well how long you can stay out,1
but how can i reach you when i get there,1
well how could wait for so long,1
in the heath,1
is there shopping center close,1
but they see you get to my car,1
tell me what you east wearing,1
so come around   and wait until ,1
hope there is no big traffic,1
do not t shirt put any panty on,1
you shave,1
grey car,1
like sport utility vehicle,1
ford,1
what time you have to go be ack,1
you sure she won t shirt be looking,1
what you want to do when you see me,1
what you like i mean,1
you like to sit on it,1
dick,1
with condom,1
or you only want to suck,1
is there any place near we could go stay in car,1
like park or something,1
well want to kiss you,1
what size breast,1
i ll suck them for you,1
has any one sucked it for you,1
you will like it,1
have played with any dick,1
never,1
well how many you have seen,1
truth,1
how come now you want it,1
why,1
you have not seen me,1
are you sure you want it,1
it will be hot laugh out loud,1
i will,1
when was your period,1
when did you start having it,1
does your mom has boy friend,1
she sleeping,1
you alone,1
wish could be there,1
have you played with yourself before,1
yes but do not t shirt want you to get to the car there,1
i ll go next block,1
well when you see it come out and start walking,1
no,1
what time,1
do not t shirt have one,1
not good idea baby,1
every one sleeipng,1
u llse me tuesday baby,1
look nice,1
i am not too tall and not fat,1
grey,1
and black,1
do not t shirt have one blue one yes,1
gona go to bed now,1
me too,1
