Text,Groom
hello,1
how you doing,1
fine thanks,1
age sex location please,1
 m renton here,1
th grade,1
laugh out loud  how did you get in here,1
was not here any age limit  laugh out loud,1
so hows classes,1
nice picture,1
i love animals as pets,1
do you have more pictures,1
yes,1
we can do photo sharing,1
more,1
i like watching pictures,1
where did you go,1
to take a picture   laugh out loud,1
so what are your you are hobbies,1
i thought you were going to say bar  laugh out loud,1
i love pets,1
right now  no coz i am new to this place,1
but back home i have many,1
except for a dog and a goat,1
i have  rabbits,1
 cats,1
they multiply a lot,1
all they think about is multiplying,1
 parrot  doves  fish cannot count then   tutle,1
yes they all are back home in india,1
and am a student here  so living a single life,1
so looks like you like pets too,1
are you busy,1
more pictures,1
okay  so hows life at school,1
have a boyfriend,1
how come  american women strat dating at very young age,1
one of my friends told that too,1
so you like elder guys  laugh out loud,1
am elder and single too  laugh out loud but,1
do not you think you are too young to ask for a date  laugh out loud  jes kidding,1
so you have not dated anybody before,1
just for fun  guys of your you are age,1
how was it,1
why do you call it bad,1
what kind of guys do you like,1
are you american,1
indian,1
asian indian,1
am and indian too,1
dad or mom,1
sorry to hear that,1
been long time,1
mom is american,1
did she marry again,1
any siblings,1
what happen to your you are dad  if you do not mind,1
bad  anyd ways no body can stop fate,1
am sam,1
hi kendra,1
i have not hear that name before,1
so you should be knowing indian cultures and all,1
do you have a family picture,1
k where does your you are mom work,1
so whom do you live with,1
usaully american females get married soon,1
your you are mom decided to stay single,1
do you have any pets at home,1
do not you have school tomorrow,1
i am looking for a nice gal to date kendra,1
i would have asked you out,1
laugh out loud  i have a feeling you are too young,1
i dint mean that,1
are you looking for a guy,1
yes  yes  i can understand,1
are you still a virgin or that dumb guy had you  laugh out loud,1
what do you feel,1
is it just okay to lose it when you are young,1
coz in india females hold on to it for long time,1
but you cannot blive guys,1
they can be playing aroung,1
am going to ask you out some day kendra,1
wats your you are ideal date about,1
movies  food  share differents aspects of life know each other,1
and ofcourse fun,1
sure kendra,1
nice meeting you,1
dinner so early  am preparing right now is and early dinner right ,1
hope you had a great day kendra ,1
hi,1
busy,1
are you there,1
looks like you are very busy,1
so hows was your you are day,1
what time did you get up today,1
so  hours of sleep,1
had a long day at school,1
me too,1
so kendra when can i take you out   laugh out loud,1
the choice is for the female always  nothing bad  do not want to go to jail  laugh out loud,1
its all up to you,1
how was your you are last date,1
how about your you are mom,1
is she going to be mad,1
about you going for a date at ,1
so you want to do it with out her knowing,1
hide n date is very difficult  laugh out loud,1
tell me about your you are ideal date kendra,1
i am on for anything,1
and i am sure you cannot stay out for long time,1
from home,1
if you were over  i would have come up with better ideas,1
and now where did you for,1
okay  we can go out for a movie lunch and find some place to sit north talk,1
okay  you tell me  kendra  you want to make it really rocking,1
we can arrange a party and it will be fun,1
but again your you are age  laugh out loud,1
the dates have been really good but its all about having fun,1
tell me what you want to do  tell me something which is not lame,1
am on for anything,1
a date with out a kiss is like a day with out light  laugh out loud,1
i love to smooch if i have the right partner,1
have you do not it before  i am sure you have,1
so do you really want to try something more,1
some thing more pleasurable   on a date only if you are willing,1
being together nad xploring each other kendra  oh my  as if you do not know anything  come on kendra,1
you already looked worried,1
i dint say that  i like cute people,1
i mean cute and sweet gals,1
but do you know dating a minor can lead me to jail  laugh out loud,1
ofcourse  if some body comes to know that i am dating you they will make out that i am having you for sex and i can be jailed,1
laugh out loud  that will work  but kendra always think well  its not easy when its first time  laugh out loud,1
but if you are looking for more fun then you are new right,1
come on kendra  more fun means doing thingsthat you have not done before,1
but what if you take me to jail  laugh out loud,1
just kidding,1
just trying to make it easy for yes you ,1
are you interested in trying out new things,1
exploring each other and having more pleasure,1
like losing virginty  oh my am sorry to say all this to you,1
if you are interested and if we get along well do you want to try it out,1
to be frank  am just worried about your you are age dear  ,1
i have been with  female but she was  then,1
well we can try kendra  i do not mind,1
do you know its going to be painful in the begining,1
you have never flet like having it before,1
then  its like  i am forcing you,1
do you know you will bleed  laugh out loud,1
do you have a camera,1
thru yahoo,1
won't your you are mom hear,1
okay  call me at    in  minute,1
what number are you going to call from,1
nope  you think i am dumb  laugh out loud,1
are you sure you want to call  ,1
you know what  call me when your you are mom is not at home,1
i do not want you to get into trouble,1
okay  call me in  minute,1
be right back in  minute,1
am back,1
call me,1
okay  what time,1
you too kendra  like a sweet gl,1
gal ,1
thank you very much what is dat,1
thank you  ym,1
so is your you are mom very strict,1
we should meet for sure,1
when are you free,1
okay  weekends,1
and where can v meet,1
laugh out loud  as i told am ready for anything dear,1
do you really want to try out what we discussed before,1
i do not mind as long as it is a secret between us,1
looks like you really ready for it,1
kendra  i do not know where we can meet,1
coming to my home will be really far,1
yes i do,1
yes i can  ,1
but your you are mom  do not want to get you into trouble,1
but to have fun where else can v go,1
we just cannot go anywhere and have fun,1
laugh out loud,1
take it easy,1
you can come to my home,1
but its far to reach back,1
sure we can  ,1
this saturday,1
okay  sure we will plan up,1
and what do you want to do on saturday,1
  just want to meet me,1
even though i am   i do not look   laugh out loud,1
so kendra you excited,1
it is fun kendra,1
i have not been with any gals lately coz i have beem very busy  laugh out loud,1
and i have been with only  gal,1
and we did eveyrhting,1
kendra  its up to you dear  i do not want to hurt you,1
guys will try to hurt gals  i am not saying i do not like sex and all but i cannot take a female getting hurt,1
is it paining now  laugh out loud,1
blive me its the first pain then you would enjoy it,1
how come you have never felt like having it kendra,1
and you like me  laugh out loud,1
well i am not like a  year old american guy though  he  he,1
 year old and looks like  year old  laugh out loud,1
am very young too,1
your you are choice of a guy,1
hieght weight,1
laugh out loud  just asking dumb q's,1
okay  kendra,1
you have my number,1
do call me,1
i will be back only by  after my clinics,1
i will come online,1
do call when you get itme,1
take care,1
love yes you  good night,1
i dint know you were online sweety,1
what time are you going to bed,1
yes  what do you mean by still,1
we will surely meet up,1
saturday,1
up to you,1
morning would be great,1
what if your you are mom comes to know,1
laugh out loud  yes,1
am going to tell her that i have a minor friend,1
laugh out loud  no dear,1
do you really want to do all those we talked,1
are you really ready for it,1
well i like it  but just wondering if you will be able to take it  laugh out loud,1
do you know how it is going to be,1
if it does  i will stop laugh out loud,1
but there's always a first time,1
let us see  if it hurts we will wait for some more time,1
do you know what it is all about,1
what do you know dear,1
you won't  laugh out loud,1
if you do  i will be in jail  laugh out loud,1
use protection,1
do not discuss anything with anyone,1
we can be good friends and share all our things,1
do you have lots of freinds,1
okay  let us be good friends then,1
so kendra  what do you know about sex,1
just wondering what a  year old knows  laugh out loud,1
you do not talk with your you are friends,1
none of your you are friends have had it before,1
in the begining it does,1
it can even bleed a bit,1
do you get periods at time,1
are you scared when you hear it bleeds,1
kendra  if you need more time  we can wait,1
i just do not want you to leave a decision to me,1
take it easy  okay,1
okay  ,1
so hows your you are day,1
i had to do  hours of clinical work,1
kendra  busy with some work,1
hows minnie,1
you will get her soon,1
where's mom,1
what time does she work,1
 to,1
on saturdays too,1
where is the barn,1
will she let you go by urslef,1
but other paople are going to see us too  laugh out loud,1
people ,1
and now  where are you sweety   dreaming chatting,1
okay  i will be,1
i will catch up with yes you morrow,1
bye  ,1
good nute,1
night ,1
hi kendra  how was your you are day,1
 more days and we are going to meet  laugh out loud,1
hows it going,1
did you get my offline message,1
i had send offline messages yesterday,1
where did you go yesterday,1
for,1
okay  what did you buy for me,1
so all set to meet me on saturday,1
what do you want me to bring for you,1
tell me something you want,1
laugh out loud  i will,1
but your you are mom is going to ask where you got it from right,1
but how long will you hide it,1
wellwhat will you tell her once she sees it,1
so you are going to say that you are going to barn,1
nobody else will see us there,1
how is that,1
whose barn is that,1
okay  is your you are mom working on saturday,1
how long can you stay out side,1
what if she comes to the barn and checks,1
its not that easy as you think kendra,1
parents will,1
okay  so wattime can v meet,1
okay  do you have your you are personal computer,1
then how can you use your you are camera,1
kendra  you shuld be careful,1
u know how much trouble i can get into,1
for being with a minor  laugh out loud,1
sad that you are a minor,1
 more years to go  laugh out loud,1
we will just meet up and talk,1
let me see how matured you look,1
anything you say krenda,1
i am ready for anything,1
but we need privaxy for other stuff,1
where somewhere else,1
i could take you to my home  but ti is far,1
wats your you are address,1
let me see how far your you are place is,1
but if you can give me your you are address i can know the place,1
i am not going to maeet you at your you are house dear,1
just to see how far you are,1
okay ,1
wats the famous store near your you are house,1
okay,1
oh my  ,1
  miles  ,1
poulsbo shuldnt be that far,1
let me check again,1
it is   miles dear   hours to drive to go and come  oh my kendra    why did you go that far,1
naaaa  kendra,1
there's nothing like that,1
but  miles we will have to plan up on a different day,1
a day when i can come and spend more time with you,1
but this saturday i have to be back by for four for my clinicals,1
church  mom is coming from india  laugh out loud,1
not yet palnned,1
most probably  months,1
it would have been great if i could bring you to my home or we could meet at your you are home,1
total privacy,1
its  okay,1
so if we are going to do all those naughty things where are v going to meet,1
but not a place where we get total privacy,1
so you said one of your you are friends have had sex right,1
did she like it,1
and then she liked it,1
ask her how a guy uses his tongue  laugh out loud,1
she will have a great experiance to tell yes you ,1
be right back in  minute,1
i and sorry we culdnt meet,1
so how did your you are weekend go,1
had a great weekend,1
it was wonderful,1
had a date with and american gal   laugh out loud,1
she was very hot,1
yes i do kendra  but we cannot meet often coz you are very far,1
and i dint want to date this female ,1
but got drunk,1
and did it,1
i learnt a lesson,1
never drink,1
it goes out of control,1
we stayed home all saturday,1
had sex  times  ,1
am still tired,1
are all american gals like this,1
she got drunk and then she just dint know what she was doing,1
do you know american gals suck cocks  laugh out loud,1
will you when you get a chance,1
am i going over the limit kendra,1
sorry if i am,1
she said it was tasty,1
do not know what was tasty there,1
have you seen any porn movies,1
how come,1
yes they do fall from the sky  laugh out loud,1
want to see,1
yes right now,1
where's your you are mom,1
will she come to know if you play something on the computer,1
okay  then i am not going to send it to you,1
but there are ways to see it free,1
link to what i am guessing is and adult porn site but i did not click it to find out ,1
do not get caught dear,1
i always like you  you are very sweet,1
you dint call me after that,1
nothing like that kendra,1
u are very sweet,1
we can be friends for now,1
and we will meet for sure,1
are you watching something,1
so your you are mom has not dated anybpdy since  years,1
so she brings her boyfriends home,1
but she has,1
once you are with a guy it is very difficult to live with out ,1
if you see those videos you will know what sex is all about,1
you are still very young though,1
i want to meet you very badly,1
today,1
just talk,1
we are friends,1
i will come and hide in your you are room  laugh out loud,1
the other way,1
the other way wat do you mean,1
kendra,1
which way,1
sexual way,1
i like you kendra,1
and when i get you  i am going to kiss and lick you from top to bottom  laugh out loud,1
do you think i am just going to do that  laugh out loud,1
first talk,1
but i need total privacy,1
so we can share everything,1
ofourse,1
once we are together we are going to do everything,1
you have small nipples right  ,1
would you like to get them sucked,1
its agood feeling for the female,1
when guys nibble on their nipples,1
you like to kiss right,1
how may times have you kissed before,1
did he do something else,1
like touching year nipples,1
did you guys do a lip kiss,1
how did you feel,1
did you guys use your you are tongue,1
call me when you get time,1
and am ready to meet any time,1
if you are ready to hide me under your you are bed  i am ready to come tomite  laugh out loud,1
does your you are mom sleep near your you are room,1
nope  we can do everything,1
but silently,1
am free morrow,1
college is off,1
but what can v do at the mall  just talking and shopping,1
and where can v go,1
to your you are home,1
but you dint want to give me your you are address,1
okay  what did she say,1
are you going wuth her,1
so you cannot stay back home,1
them,1
why did you ask her when you knew i was about to come,1
them lives alone,1
so dat means we cannot meet tomorrow,1
if you had stayed back home  we could meet and have fun,1
yes i have off,1
mc donalds,1
and from there to,1
but she is going to be back,1
are you going to have the home keys,1
just tell her you are going to be at home,1
what if she calls them,1
does she have em's number,1
okay  so your you are mom is suposed to pick up from ems home in thevevning right,1
am sure your you are mom will call em's mom,1
ofcourse dear,1
okay  i would love to meet you,1
so the plan is your you are mom will drop you at em's house,1
and how will you get out from there,1
so i can come pick you up from there,1
and then go home,1
and where can i park the car,1
in front of your you are house,1
is there many houses in your you are locality,1
why are you asking me again and again dear,1
kendra  am cool  i hust do not want you to get into trouble,1
okay  cool  i do not want you to get into trouble dats it,1
tell me your you are time dear,1
some how try to find what time she is going to be back,1
sleep in,1
sleep where,1
tomorrow,1
so she is going to come alte,1
late ,1
then we can have loads of fun,1
okay  how far is the mcds from your you are home,1
okay  cool  do you know the street name,1
okay  cool,1
let me find the address,1
l  i have a navigation map so that is not tough,1
its the mcds in port orchard right,1
edited address ,1
is dat the add,1
another edited address ,1
okay  dear,1
if that is the add  i am going to be there at ,1
at pm,1
do not make me drive all the way  laugh out loud,1
 hour i guess,1
let me check,1
 minute,1
not bad,1
be ready to kiss  laugh out loud,1
until what time should i wait,1
okay  cool i will be there outide wiating for you sharp at two,1
what are you going to wear,1
cool ,1
so if you have any changes call me and let me know,1
can you call me today want to hear your you are voice,1
okay  do try  ,1
love yes you kendra,1
am going to take you to heaven morrow  laugh out loud,1
laugh out loud  just take everything easy,1
i am just worried about you dear,1
so call me  okay,1
me too  x,1
not going to bed,1
dats ma latest picture,1
so you just need a camera,1
but make sure you do not get into any trouble with your you are mom,1
send me some more pictures of yours kendra,1
send me the one's you have,1
cannot find it   laugh out loud,1
come on kendra  please,1
okay  then i will see you in real tomorrow,1
so we are going to have total fun tomorrow,1
so you do not want to,1
laugh out loud  same for me too  so we will do it,1
so kendra  you chat a lot,1
so nobody has asked you for a date,1
so you should be really excited,1
so kendra  are you looking for a long term and we will just meet up once in a while,1
let us see  ,1
but i want to marry and indian gal  laugh out loud,1
if there is any kind of delay  give me a call,1
am going to bed,1
bye,1
