Text,Groom
hello what is up,1
chillin about to go out,1
yes  got to got a take a break frm the work week someday,1
to a bar ,1
yes,1
so what you doing tonight,1
so age  llocation,1
oh really i did not see it sorry,1
  your you are a youngin,1
m ga,1
'i got  years on you,1
be right back,1
so what do you do for fun,1
cool  what kind of music do you like,1
wow your you are a cute  i wish i was  ,1
i would be all over you like white on rice  jk,1
so what part of ga are you in,1
where the hell is that,1
so you drink smoke or go to church,1
your you are as goody goody  that is cool,1
well im about to head out you mind if i friend you,1
well i did not add you cus you blockadded me,1
i put your you are under hotties in my list hope you do not mind,1
so you got a boyfriend,1
wh why not are the guys where you at retarted,1
awww im sorry,1
damn i wish i was your you are puppy  he is in a damn good spot  j okay,1
wow that was a joke,1
let me stop before i get in trouble,1
you might go tell on me,1
daddy this guy is being a jerk,1
im just trin to make you laugh  ,1
in like min  okay,1
you there,1
so what kind of music do you like,1
to make a drink  and bs with the buddies,1
so you do not dance,1
so how old is your you are previous relationship boyfriend,1
what like line dance,1
wow that sucks to be boring at ,1
what you shake dat little booty i bet its a nice one why yes you bullshittin,1
im talking to myself,1
telling myself to stop bullshitting i bet you got a nice buttocks,1
sorry if that is rude,1
damn i wish i was   i would take you out on a date and have you laughin all night long,1
that is one thing im good at,1
makeing folks laugh,1
why cannot you be older,1
damn this drink is getting me fucked up,1
so im   j okay,1
 with a full beard,1
so what kind of guys do you like,1
not old ones  laugh,1
im a grandfather now,1
you do not think  is old,1
bet your you are daddy does,1
if you were like hello daddy this is my boyfriend he is  or  or  or   he would flip,1
you would not tell him,1
what just sneak outta the house,1
im too bad for you  ,1
lieing is bad,1
i do not lie any more,1
i do not have too,1
im a big dude i tell the truth if some one do not like it i do not care  they going to hit me,1
hit they die,1
not literaly,1
strong and cocky  i do construction work you got to got a be tough for that,1
the only thing i hate about it is my hands are not soft,1
you a little bit  how much you weigh,1
damn i can pick you up with one hand  standing on one foot,1
you want to bet,1
i bench ,1
weighing   not all mucle though,1
i guiess,1
but im still to bad for four  yes you ,1
but good girls like bad boys,1
laugh j okay,1
any piercings,1
do not have enough tounge exsperiance to get a tounge piercing yet  ,1
sorry that was a joke,1
im a smartass i do not think before i speak,1
that was rude im sorry,1
your you are  you shouldnt have tounge exsperiance yet,1
wow i got to got a stop,1
why you say that,1
why do you think that,1
no im talking about all the things i keep saying they are rude,1
you say whatever like you got exsperiance,1
uh oh,1
we got and undercover bad girl,1
no hell no,1
im just playing with yes you ,1
no  your you are exsperiamenting,1
trust me girl i do not point fingers  im not perfect,1
you cool with me,1
now if were like i have had sex with  sum od guys then i would have s,1
cool,1
you still a virgin,1
when did you lose it,1
okay,1
are you of asian desent,1
even better,1
you like white guys,1
laitna girls like really sexy men though,1
im to extreamly sexy,1
you can check out my yahoo space,1
mypace i mena,1
i do not know how to tel you where to go or whatever,1
dj i think,1
search by name,1
im going to check yours out through your you are profile and then friend you  cool,1
wow that picture on the far right is really sexy ,1
check it out ,1
you can add me,1
your you are fuckin geourgous,1
you got a really pretty face,1
thank you,1
but your you are beautiful,1
fine as hell  i wish you hand a picture from the behind viiew,1
check out my pictures  you will have a good laugh i promise,1
so you got a cell phone,1
would you say your you are more mature than most girls your you are age,1
 month away,1
so you think im cute,1
is that cus im older or you really think im cute,1
well thank you,1
damn inow i want to take your you are little cute buttocks out to see a movie or sum shit,1
did i scare you away,1
hello,1
did you get a good laugh,1
so if i gave you my number would you call,1
   dj,1
call when ever its my cell ,1
yes what is yours,1
you lie,1
pift,1
i belive you,1
you can call whenever that is my cell,1
if you want,1
let me go make a drink and you can call in like  if you want,1
 minutes,1
cool im going to get off here  so do what you do,1
did you friend me on myspace,1
cool talk to you in a bit,1
later,1
hello cute,1
about ta leave,1
oh i will,1
you have a really cute voice,1
stop your you are makeing me blush,1
if you want to call me agine  it be cool,1
call me when he falls asleep or  marrow,1
when you get that cell phone get verizon,1
then we can text and bullshit all day,1
damn your you are finw,1
what is up shawty,1
what is up stranger,1
chillin,1
you stayin outta trouble,1
here,1
where you been,1
i do what you talking about,1
i have not been on here much i hit you up when i get on,1
you have not called me  ,1
why you can call me up any time are you not allowed to use the phone,1
why not,1
do they listen to your you are conversations,1
ight baby,1
becareful how you use that papi,1
no do not be sorry,1
that papi shit is sexy,1
damn i want to talk to your you are little sweet soundin self,1
still think im cute,1
laugh no,1
i just worked and bullshited with my homies you,1
damn bet you look fine in be suit,1
you guess  shut up you know it,1
if we ever get to chill im going to have you laughin  you cool as hell,1
i just want to give you a big old hug,1
just pick yes you up and squeeze you tight,1
maybe a soft kiss on your you are neck,1
only if you hugged me back,1
no im for real,1
as long as your you are not trin to get me in trouble  ,1
well then hell yes i want to meet up  take you on a picnic or something just get to know each other,1
im not secure enough with my looks to be doing the whole jaccuzi thing  besides what about them,1
i would not get in a juccuzzi the first time i met you unless you promised not to care  but what about your you are rents,1
where is the juccuzzi at your you are house,1
if we chill your you are rents will probly be home,1
what happens if they showed up  that would be a risky move,1
im not scared i just do not have the whole six pack thing,1
i will pick you up we go chill somewhere,1
go chill at a park and bullshit or go watch a movie,1
can you give directions to your you are house,1
do not dress too sexy,1
cus your you are fine and i might not want to stop holdin you,1
truthfully i probly won't want to let you go with whatever you wearin,1
where can we go that would be cool to chill,1
i do not want a perent showing up  i could end up in jail in that situation,1
how does that work ,1
well im saying they come home at some point they are not just gone all weekend,1
that is risky  i would be nerves the whole time i was there,1
why,1
were they ,1
really  if your you are positive its safe,1
thy never came home early before,1
are you going to be a tease,1
me too,1
so what you think you going to wear,1
or not  j okay,1
it would wouldn't it,1
it be hard to stop staring,1
skirts are sexy,1
you wear undies with them right,1
good,1
well you can go to school without them,1
i do not think they would mind  jk,1
i know im playing,1
but i doit for you dj  kidding,1
oh my gosh stop,1
nono,1
your you are  your you are jusrt makeing me me uh uh you know,1
so do you trim down there,1
i figure if i like a girl to she probly would like me too,1
hello im going to go est  you still going to be on in about min,1
we will talk in few sexy baby,1
food have not ready yet,1
may i ask a quetion not trin to be rude or insinuate any thing  just outta curiosity,1
how many guys have you been with,1
that is real cool,1
you do not me asking that did you,1
so what size brassiere are you,1
that is the sexiest size,1
do not laugh im being honest,1
you listen to rap music,1
i like that stuff,1
im going to kiss your you are neck,1
yes kissing is fub,1
i like to cuddle too,1
rubbing a girls soft skin makes me feel so good,1
see now if you wore a skirt with no panties i might start rubbing unmentionables,1
maybe we got to got a see how everything pans out  we cannot jump the gun,1
im not saying i won't but wait and see i want to respect you  i think you a cool girl,1
i try and respect girls  you know,1
stuff what stuff,1
if we both comefortable something might happen  but i want to make sure we on da same page back to that respect thing,1
i will bring some of those but i do not want you think i need all that to like you or chill with you,1
no do not,1
it could happenu never know,1
exspecially since we both are flirts,1
things can escalate quickly,1
i just want to make sure your you are as cool as you seam  i do not want to get in trouble,1
i think your you are cool as hell age really have not nothing to me but the government does not seam to agree with me,1
me neither,1
so why do you like me so much if you do not mind me asking,1
and your you are so sweet,1
i want to hold you so bad,1
so do you ever masturbate,1
i bet your you are really tight  huh,1
how many times,1
wow,1
was the guy really really big,1
yes cus im like   ,1
no i would rathe talk to you,1
would you let me eat you out if it got to that point,1
and im really good at it,1
would you return the favor,1
i would not finish in your you are mouth inless you wanted me too,1
did you swallow it,1
did that bother you,1
so you would do that agine,1
your you are gettin me there agine,1
what your you are not there,1
a kirt with a thong and a tight tanktop that would make me ohhohh ohho ohhh,1
or a skirt with no panties and a brassiere if you really wanted to tease me,1
i coould just imagine you in that a bending over to tease me  i would start licking before you could stand up,1
kssing your you are thighs and back,1
shorts and a t shirt shirt,1
a hat,1
ao you ever done anal,1
it probly would,1
i have never tried it  kind of always wanted too,1
a lot of ky,1
do i make you uncomfortable,1
how can i bee sure your you are not a officer of the law pretnding to be ,1
true and you sounded so sexy,1
im willing to take my chances,1
yes it be cool if when you got a liscence we could start dating and stuff  if you would like too,1
you could drive up to atlanta and spend the night with me and stuff,1
we could just lay in bed and hold each other all night  flirt and play fight,1
me tickling you,1
it would be,1
friday or saturday night,1
what time and what time would i have to leave,1
yes i work,1
probly gettin off early friday though,1
what is the earliest i can come and when do i have to go,1
really,1
what is the earliest i can come,1
 to midnight that is a long time,1
you got me worried,1
i might fall in love with you,1
is that good,1
i would stay the whole time are you crazy why would i leave,1
im not going to want to let you go,1
i hold you you stadle me and i just squeeze you and kiss you all night,1
you think your you are going to flirt with me,1
how far do you think it will go,1
you think you going to kiss me before i kiss you,1
how long you think we are going to chill before we start making out,1
no hell no i like aggresive women,1
except in the bed room i like to be in charge then,1
what do you like in the bedroom just normal what ever happens happens,1
or does it turn you on to be told what to do and stuff,1
oh i lead,1
you moan,1
what positions have you tried,1
you know how to ride,1
you like doggy,1
you do delet all these ims when your you are done right i would hate for four  your you are mom to get nosey,1
oh,1
well if we ever have sex  i will introduce it to you,1
but i switch positions a lot  so your you are bound to learn a few new tricks,1
i wish you could call me tonight,1
i want to talk to you  hear your you are sweet voice,1
when do they go to sleep,1
call me  i want to talk to you,1
so do you have any other pictures of you on this thing,1
yes on your you are myspace page,1
so if i brought a camra would you pose for me  clothed of course,1
we can get you down to a brassiere  right,1
unless you wanted to go further on down the line,1
so you really want me to come hang out this weekend,1
i cannot wait to hug you,1
so why did you have a  year old at your you are house,1
where did you meet him,1
where you attracted to him,1
well i won't be a jerk,1
but you do know im not mister sex six pack big muscular chest kind of guy right,1
hello baby you there,1
cool that is all i want to here,1
i sense some skinny dipping this friday,1
jk,1
skinny dipping would quiclky turn in to a whole bucnch of something else,1
you got stop that   you little tease,1
my dick is so hard right now,1
cus of me imagineing your you are geourgous buttocks naked,1
so do you shave or just trim,1
fuck this shit im going to walk in your you are house pck up squeze you and grab your you are beautiful face a plant a huge kiss right on your you are lips,1
no no no fuck that im going to pick you up wrap your you are legs around me lay down on the couch and just start kissing your you are lips then your you are neck and so on,1
you want me to do that,1
and while im kissing you your you are going to feel my dick pushing all up on you,1
well i got to got a go  but im exspectiing a call frm you tongiht,1
bye baby,1
anytime,1
try and make it between  and  though,1
okay bye baby,1
hello baby do not give up on me that easily  i left my phone in the car this mourning and got all your you are messages but the phone number cut out  so i took the phone in to the job with me after  waiting for you to call and you never did  i want to come but i also want to get your you are number so i can call you if i get lost  if you get on call me back  im until  after traffic  call me,1
yo your you are and hour  minutes away  you going to have to call me before i leave  i need to have your you are number  ,1
so hurry up get back on the internet  or just call me grrrrr,1
