User,Text,Groom
charlie_e44,really that is this weekend,True
bethaneyizbored,no tahts next weekend,False
charlie_e44,you sure your not the copes lol,True
charlie_e44,hahhha,True
bethaneyizbored,omg dont scare me agin lol,False
charlie_e44,hahahahah,True
bethaneyizbored,ur mean lol,False
charlie_e44,but i want you so much,True
charlie_e44,i am so horrny right now,True
charlie_e44,wish you were here riding it,True
bethaneyizbored,me 2,False
charlie_e44,so tell me the way you think it would be when you think about sex,True
bethaneyizbored,i think bout it difrent ways cuz i dont know,False
charlie_e44,it is ok tell me,True
bethaneyizbored,sometimes i think it be all romntic with candles n stuff,False
charlie_e44,that is cool,True
bethaneyizbored,somtimes i think it will be comfortble with us talkin n holdin each otehr,False
charlie_e44,ya,True
bethaneyizbored,somtimes i think it gets a bit difrent,False
bethaneyizbored,lol,False
bethaneyizbored,waht do u,False
charlie_e44,if you dont mind,True
bethaneyizbored,like u mite kiss me kinda hard n tell me waht 2 do,False
bethaneyizbored,tahts all im sayin tho,False
bethaneyizbored,lol,False
bethaneyizbored,it will b easer 2 talk once we meet,False
charlie_e44,no i tell you every thing now you tell me i love it very hot,True
bethaneyizbored,no cuz tehn it gets kinda hard 2 imagine cuz i dont rely know,False
bethaneyizbored,i just hafta think bout teh movees n kinda think bout us doin those things,False
charlie_e44,i think you like it rough,True
charlie_e44,and want it that way all the time,True
charlie_e44,is that right,True
bethaneyizbored,yeah i think cuz i havent done it,False
charlie_e44,so if i want to put it in your butt i just do it right,True
bethaneyizbored,ouch,False
bethaneyizbored,yeah but ouch lol,False
charlie_e44,that is the way you want it,True
charlie_e44,you dont care if it hurts a little,True
bethaneyizbored,i dont care,False
charlie_e44,well tell the truth be honast,True
bethaneyizbored,i am bein honest,False
charlie_e44,you really want me to take you dont you,True
bethaneyizbored,i dont care if it hurts a lil cuz i know its gonna hurt teh first time anyway,False
charlie_e44,you really want me to take you dont you and fuck you like i want to,True
bethaneyizbored,yeah i do,False
charlie_e44,well i just want to make shure what you want i am a little dom any way,True
charlie_e44,i like it like that,True
bethaneyizbored,yeah u tell me taht b4,False
charlie_e44,tell you what to do and how to do it,True
bethaneyizbored,yeah,False
charlie_e44,that is the way you want a man to be with you all the time isnt it,True
bethaneyizbored,yes,False
charlie_e44,mmmm good we are going to get along good,True
charlie_e44,do you want daddy to spank you too,True
bethaneyizbored,yeah,False
charlie_e44,do you want to be spanked hard,True
bethaneyizbored,how,False
charlie_e44,i dont know just asking,True
charlie_e44,i like to have my dick sucked and watch you eat the cum,True
bethaneyizbored,i wusnt sure how hard wuz hard lol,False
bethaneyizbored,i will do taht,False
charlie_e44,will you do it a lot becase i like that a lot,True
bethaneyizbored,yeah,False
charlie_e44,it is salty you know,True
charlie_e44,think you can handel that,True
bethaneyizbored,yeah,False
charlie_e44,ok when i get you in the motel and pull your pantes off and start making you suck my hard dick that is what you want,True
bethaneyizbored,yeah,False
charlie_e44,ya you like salty,True
bethaneyizbored,yeah,False
charlie_e44,cool,True
charlie_e44,thought you were tierd,True
charlie_e44,did i wake yopu up,True
bethaneyizbored,yes,False
bethaneyizbored,lol,False
charlie_e44,you meet any other guy sence we have not been talking and when you get on in the afer none,True
bethaneyizbored,no,False
charlie_e44,figgerd a good looking girl like you meet a bunch of guys,True
bethaneyizbored,not rely cuz mom wont lemme date,False
charlie_e44,and how long you been wanting to fuck,True
bethaneyizbored,i dunno,False
bethaneyizbored,maybe a lil over a,False
charlie_e44,really what started it if you dont mind,True
bethaneyizbored,probly too many romance books lol,False
bethaneyizbored,i like 2 read,False
charlie_e44,god daddy need your mouth he needs to cum so bad,True
bethaneyizbored,i wish i wuz there 4 u,False
charlie_e44,mm me too i would push you down on my hard dick till it went aall the way in your mouth,True
charlie_e44,and make you suck it till i cum in your mouth,True
charlie_e44,then i would make you suck it hard and take your sweet little tight pussy,True
charlie_e44,fuck you deep and hard,True
charlie_e44,that the way you want it,True
charlie_e44,is that what you been thinking of,True
bethaneyizbored,yeah,False
charlie_e44,mmmmmmmmm i am going to make you mie,True
charlie_e44,mine,True
bethaneyizbored,i like taht,False
charlie_e44,i like my balls sucked and licked too,True
charlie_e44,you lick and suck my balls and jurk me off at the same time,True
charlie_e44,do you like to be on your knees,True
bethaneyizbored,im not sure how 2 do,False
bethaneyizbored,yeah i gues,False
bethaneyizbored,i dont spend lots time on my knees so i dunno lol,False
charlie_e44,what do you want to call me,True
charlie_e44,daddy or master,True
bethaneyizbored,either one,False
charlie_e44,what do you like the most,True
bethaneyizbored,daddy,False
bethaneyizbored,no lol,False
charlie_e44,kool i like daddy,True
bethaneyizbored,i just had 2 think,False
charlie_e44,so what kind of sexy pantes do you have,True
bethaneyizbored,i dont have lotsa sexy pantees lol,False
bethaneyizbored,i do have some thongs,False
charlie_e44,do you wear makeup,True
bethaneyizbored,yeah,False
charlie_e44,m thongs are nice what do thay look like,True
charlie_e44,you wear make up,True
bethaneyizbored,i got black red n white ones,False
bethaneyizbored,yeah i wear make up,False
charlie_e44,and lipstick,True
charlie_e44,god you are going to look good,True
bethaneyizbored,i dont wear lotsa lipstick just lip gloss,False
charlie_e44,mmmmmmmmmmm i like lipstick,True
charlie_e44,it is so sexy,True
charlie_e44,lip gloss is kool bring ait with you so i can make you put it on every time you suck my dick,True
bethaneyizbored,ok,False
charlie_e44,so why are you not going with your mom next weekend,True
bethaneyizbored,shes takin her bf cuz theres gonna be drinkin n she dont want me ther,False
charlie_e44,and what thongs do you think look the sexyest on you,True
bethaneyizbored,black lol,False
charlie_e44,ya she wants you to be at the motel with me,True
charlie_e44,mmmmmmmm i like black,True
bethaneyizbored,lol,False
charlie_e44,i like lip gloss on when you suck my dick,True
charlie_e44,and we can take a bath togeather,True
bethaneyizbored,okay,False
charlie_e44,i am so hornny,True
charlie_e44,i really am,True
charlie_e44,i need you,True
charlie_e44,she is leaving friday,True
charlie_e44,what time,True
bethaneyizbored,in teh mornin,False
bethaneyizbored,cuz tehy have dinner taht nite n teh weddin teh next nite,False
charlie_e44,so what if i get there lare friday night,True
bethaneyizbored,okay,False
charlie_e44,what then,True
bethaneyizbored,we can still meet at kfc,False
charlie_e44,i dont want you walking at night not late at night,True
bethaneyizbored,how,False
charlie_e44,it would be nice if i could call ya you could say it was the wrong number lol,True
bethaneyizbored,im 2 scared lol,False
charlie_e44,i dont know depends what time i get off,True
charlie_e44,you dont want to have your nuber i understand hun,True
bethaneyizbored,like,False
charlie_e44,mmmmmmmmmm i dont know i got to see how long it is going to take me to get there,True
charlie_e44,i think it will take like 4 houers,True
bethaneyizbored,ok,False
charlie_e44,well how long did it take you to get from birmingham,True
bethaneyizbored,i dont rember,False
charlie_e44,do you get your peried yet,True
bethaneyizbored,i think 3,False
bethaneyizbored,yes,False
charlie_e44,when is it going to be lol,True
bethaneyizbored,it jus stop,False
charlie_e44,so it will be ok then,True
bethaneyizbored,yeah,False
charlie_e44,so all it is we got to meet so w know each other,True
bethaneyizbored,yeah,False
charlie_e44,so it well be cool as shit after the first time,True
bethaneyizbored,yeah,False
charlie_e44,i think the second time will be better,True
charlie_e44,all i know is i want you bad,True
charlie_e44,i want to fuck you and hear you call me daddy,True
charlie_e44,y do you think you will like calling me daddy,True
bethaneyizbored,becuz u will take care of me,False
bethaneyizbored,ur always so nice 2 me,False
charlie_e44,mmmm all i want to do i want you from now on fore ever,True
bethaneyizbored,me 2,False
charlie_e44,you nice to me,True
charlie_e44,sorry i got upset with you when your arm was broken but i missed you so much,True
bethaneyizbored,its okay,False
bethaneyizbored,i missed u 2,False
charlie_e44,well it is good you figerd it all out,True
charlie_e44,you now hun i like to fuck a lot i am going to keep you bizzy all weekend,True
bethaneyizbored,lol,False
bethaneyizbored,taht sounds good 2 me,False
charlie_e44,i hope you can take it the first time s that weekend,True
charlie_e44,breake you in good next time it will feel so good,True
charlie_e44,streach your sweet little pussy out so you can injoy it,True
charlie_e44,i think you like the pain thing the first time dont you i think you like pain and are not shure till you fuck,True
bethaneyizbored,yeah,False
charlie_e44,you think about pain and you like it dont you,True
bethaneyizbored,yeah i do,False
charlie_e44,ya yo aremy sole mate,True
charlie_e44,yo are every thing i want,True
bethaneyizbored,u are waht i want 2,False
charlie_e44,god wish i could see you now,True
bethaneyizbored,i culd sneak out but it wuld take u 2 long 2 drive lol,False
charlie_e44,you know what it is going to be bad if i do move there i will want you to sneek out in the middele of the night to fuck you,True
bethaneyizbored,omg ur so funny,False
bethaneyizbored,i just say teh same thing kinda,False
bethaneyizbored,lol,False
charlie_e44,ya and when i see you i am going to want to fuck you a long time,True
charlie_e44,not no shourt shit,True
charlie_e44,i have been wanting you for to long for a fast fuck,True
charlie_e44,well i think i will be moving to ozark really may take me a year or so but i will come see you till i move,True
charlie_e44,you know what we could do all the motels have internet i could take my puter and set it up and see if you are up when i get there,True
bethaneyizbored,wow taht wuld work,False
bethaneyizbored,tahts smart,False
charlie_e44,ya i could bring my webcam and we could make a vid of your first time,True
charlie_e44,would you like that,True
bethaneyizbored,u wuldnt show it 2 any1,False
charlie_e44,hell no it would be for me and you only,True
bethaneyizbored,ok,False
charlie_e44,would you like to see yourself fuck,True
charlie_e44,wellyes or no,True
bethaneyizbored,yeah taht wuld be kinda kewl,False
charlie_e44,ok we can talk about it,True
bethaneyizbored,ok,False
charlie_e44,do it latter after you get good at every thing it would be hot as hell then,True
bethaneyizbored,lol,False
charlie_e44,you going to be on tomorow,True
charlie_e44,night,True
bethaneyizbored,yeah,False
charlie_e44,i got to go i wish i could stay up all night and talk to you,True
charlie_e44,i miss you so much,True
bethaneyizbored,me 2,False
charlie_e44,god daddy needs that hot little mouth of your sucking his hard dick,True
charlie_e44,you are going to do that a lot,True
charlie_e44,so you like my dick did you like the way it looked,True
bethaneyizbored,yeah,False
charlie_e44,good i got to go hun miss you see you latter night,True
bethaneyizbored,miss u 2,False
charlie_e44,bye,True
bethaneyizbored,bye,False
charlie_e44,try to get on as soon as you can so we can talk,True
bethaneyizbored,ok,False
charlie_e44,sweet dreems,True
bethaneyizbored,u 2 nite,False
charlie_e44,hope i dont fall asleep becase i am bord,True
bethaneyizbored,hey im sowwy,False
bethaneyizbored,my comp was messin up n i culdnt log in,False
bethaneyizbored,ill b online 2morow,False
bethaneyizbored,i miss u,False
charlie_e44,i went to sleep i am soory i worked like 14 houers sorry,True
charlie_e44,i will try to stay up i just got home now too,True
charlie_e44,fun i miss you to sexy,True
bethaneyizbored,nope i wuz here last nite,False
charlie_e44,lol,True
bethaneyizbored,u were online but wehn i finish checkin my email u were gone,False
charlie_e44,sexy,True
charlie_e44,god i miss you,True
bethaneyizbored,i miss u 2,False
charlie_e44,how long you goinmg to be on,True
bethaneyizbored,4 a while,False
charlie_e44,got to do something,True
bethaneyizbored,ill be here,False
charlie_e44,got to work on the car,True
charlie_e44,take about 20 min,True
charlie_e44,ok brb,True
charlie_e44,dont go,True
bethaneyizbored,ill be here,False
charlie_e44,ok back,True
charlie_e44,lol hi ya sug,True
charlie_e44,so what are you wearing,True
charlie_e44,nothing i hope,True
bethaneyizbored,lol,False
bethaneyizbored,im wearin sweats n a tshirt cuz moms got teh ac goin full blast lol,False
charlie_e44,mmmmmm so you need to be wormed up,True
charlie_e44,think i could rub your butt and worm it up,True
charlie_e44,mmmmm ya bet you got a nice butt,True
charlie_e44,been thinking of you a lot,True
bethaneyizbored,i dunno lol,False
charlie_e44,sorry i have been working like 13 14 houers a day i have been wiped out,True
charlie_e44,you do to know if you got a nice butt,True
bethaneyizbored,nobody ever said lol,False
charlie_e44,bet you got a smoking butt,True
charlie_e44,needs my thung all over it,True
charlie_e44,hahahahaya,True
charlie_e44,i will tell ya,True
charlie_e44,you got on early tonight,True
charlie_e44,did you miss me,True
bethaneyizbored,yeah mom went 2 bed erly,False
bethaneyizbored,lots,False
charlie_e44,i miss you tooo sexy,True
charlie_e44,hay found some wild vids the other night when i was bord,True
charlie_e44,my damn truck broke today,True
bethaneyizbored,taht sux,False
charlie_e44,and i lost like 140 bucks,True
charlie_e44,that i could have made,True
bethaneyizbored,oh no taht sux,False
charlie_e44,ya this week i have been makeing 250 to 330 a day,True
bethaneyizbored,wow,False
bethaneyizbored,tahts a lot,False
charlie_e44,ya good for me,True
charlie_e44,i did make that all the time but it has been slow,True
charlie_e44,i like this it may be to wild for you,True
charlie_e44,she has a nice ass,True
charlie_e44,love the out fit she has on,True
bethaneyizbored,yeah me 2,False
charlie_e44,bet you would look good in it,True
charlie_e44,nice ass,True
charlie_e44,daddy spanking her good,True
bethaneyizbored,why is ther a bag over her,False
charlie_e44,ya it is paper,True
bethaneyizbored,oh ok,False
charlie_e44,like i sade it may be to wild for you,True
bethaneyizbored,i think its kewl,False
charlie_e44,but there is nothing she can do but take it,True
charlie_e44,you like this,True
charlie_e44,kwel,True
bethaneyizbored,yeah,False
charlie_e44,bet you got a nice ass like that from running,True
charlie_e44,ya i like this it is the way i lke to take a girl not to rough,True
charlie_e44,althow you mite like it harder then that i dont know,True
bethaneyizbored,i dunno either lol,False
charlie_e44,wish you were sucking me like that,True
charlie_e44,but that was not to bad right,True
bethaneyizbored,my comps slow so its stil got anotehr minute,False
bethaneyizbored,no its not bad,False
charlie_e44,hahahaha,True
charlie_e44,i think you would like that,True
bethaneyizbored,yeah,False
charlie_e44,kwel that what you think about,True
bethaneyizbored,yeah,False
bethaneyizbored,kk finished,False
charlie_e44,nice you are mad for me you know that,True
charlie_e44,i fucking want you all the time,True
bethaneyizbored,i cant wait til next weekend,False
charlie_e44,it may be a good thing i live so far from you becase i would be wanting you all the time evry night,True
bethaneyizbored,lol,False
bethaneyizbored,u r so bad lol,False
charlie_e44,i am not lieing,True
charlie_e44,y am i bad becase i want you,True
bethaneyizbored,cuz u say teh wildest things lol,False
bethaneyizbored,i like it tho,False
charlie_e44,damn i want you to take a dick like that,True
bethaneyizbored,with a bag over my lol,False
charlie_e44,no the next vid the way she sucks it,True
bethaneyizbored,yeah but shes got somethin on her head 2,False
charlie_e44,and i mite put a bag over your head so you dont know what is going to happen next,True
bethaneyizbored,lol,False
charlie_e44,no she dont you are watching the wrong one,True
charlie_e44,ya she dose her shirt,True
bethaneyizbored,o okay,False
charlie_e44,slaped that pussy,True
charlie_e44,you going to be daddys little cum slut,True
bethaneyizbored,yeah,False
charlie_e44,love the way she was riding that hard dick,True
bethaneyizbored,yeah,False
bethaneyizbored,finsih,False
charlie_e44,god i want your littlr tight ass now tonight,True
bethaneyizbored,sowwy u gotta wait a few more days,False
charlie_e44,y,True
bethaneyizbored,cuz my moms here 2nite lol,False
charlie_e44,hahahhaah,True
charlie_e44,it is hard to beleve she leves you there all alone,True
bethaneyizbored,im not a baby,False
charlie_e44,i know that but you are still young,True
charlie_e44,how old are you now,True
bethaneyizbored,13,False
bethaneyizbored,ill be 14 in july tho,False
charlie_e44,and you are going into 9 th grade3,True
bethaneyizbored,yeah,False
charlie_e44,started early your younger then the reast of the kids,True
bethaneyizbored,yeah,False
bethaneyizbored,im teh yungest in my class,False
charlie_e44,can i slap yoour pussy,True
charlie_e44,you like that dont you the idea of it,True
charlie_e44,i cannot wate to see you,True
bethaneyizbored,yes,False
bethaneyizbored,me 2,False
charlie_e44,i an going to pull your top and pants off as soon as i can,True
charlie_e44,and look at that sexy body,True
charlie_e44,i am going to push your head down on my hard dick,True
charlie_e44,damn now i have a hard on think of it,True
bethaneyizbored,lol,False
charlie_e44,funny huh,True
charlie_e44,what till after i get you liking it i am going to say things to you to drive you nuts pay back is hell,True
bethaneyizbored,yeah u say teh wildest stuff,False
charlie_e44,so why do you like it so much,True
bethaneyizbored,like,False
charlie_e44,did you like the second vid,True
bethaneyizbored,yeah,False
charlie_e44,like the wild things i say,True
bethaneyizbored,im stil watchin this one,False
charlie_e44,i know you are,True
bethaneyizbored,cuz nobodys said stuf like taht 2 me b4,False
charlie_e44,and you are a little want to be slut,True
bethaneyizbored,yes,False
charlie_e44,fuck i want you,True
charlie_e44,my fucking puter needs to be rebooted,True
charlie_e44,i hate this thing,True
charlie_e44,got to bueld a new one,True
bethaneyizbored,mine sux 2,False
charlie_e44,i am going to make a good one that dont fuck up,True
bethaneyizbored,kewl,False
charlie_e44,it is easy,True
charlie_e44,i can show you how,True
bethaneyizbored,taht wuld be awesom,False
charlie_e44,ya thay are easy as hell to do,True
charlie_e44,just got to know some things about bios and putting drivers,True
bethaneyizbored,ummm ok,False
bethaneyizbored,lol,False
charlie_e44,you are awsome,True
charlie_e44,i cannot wate to kiss you all over,True
bethaneyizbored,me 2,False
charlie_e44,ill you play with your self for daddy,True
charlie_e44,i like to watch that,True
charlie_e44,makes me really hard,True
charlie_e44,i know i am bad,True
bethaneyizbored,yeah but i dont rely know how,False
charlie_e44,you need a web cam,True
charlie_e44,you know what feels good,True
charlie_e44,i know you do it,True
bethaneyizbored,im not alowed 2 have 1,False
bethaneyizbored,finish,False
charlie_e44,ya and your not alowed to have sex,True
charlie_e44,lol that is not stoping you,True
bethaneyizbored,well tahts tru lol,False
charlie_e44,hahahaha,True
charlie_e44,you dont say much,True
charlie_e44,why do you get on so late,True
bethaneyizbored,ive been lol,False
bethaneyizbored,cuz i wait until mom goes 2 bed or at least 2 her room,False
bethaneyizbored,im always scare seh gonna catch me lol,False
charlie_e44,y what ar you doing,True
bethaneyizbored,ummm seh wuldnt like waht im watchin lol,False
charlie_e44,mm you got to learn to do that,True
bethaneyizbored,n i dont want her catchin me chattin,False
bethaneyizbored,yeah,False
charlie_e44,that feels good when the whole thing gose in your mouth like that,True
charlie_e44,mmmmmm you shuer you want this,True
charlie_e44,sure,True
bethaneyizbored,yes,False
bethaneyizbored,finish,False
charlie_e44,ok just checking,True
charlie_e44,let me find one,True
bethaneyizbored,ok,False
charlie_e44,i just want you and want to do all the things you want,True
charlie_e44,mmmmmm spank that ass,True
bethaneyizbored,wahts that,False
charlie_e44,ya it is,True
charlie_e44,you like that,True
charlie_e44,always be honast,True
bethaneyizbored,i just saw teh stick pulling her dress around,False
charlie_e44,sqweazy your nippels,True
charlie_e44,like that,True
charlie_e44,your not saying anything,True
bethaneyizbored,sowwy i wuz watchin,False
charlie_e44,you ike it,True
bethaneyizbored,i gues i cant watch n talk lol,False
bethaneyizbored,yeah,False
charlie_e44,wy not becase you are rubbing yourself,True
charlie_e44,well are you,True
bethaneyizbored,a lil,False
charlie_e44,mmmmmm like to see that,True
charlie_e44,god i wish i was deep in you right now,True
bethaneyizbored,tahts a,False
charlie_e44,daddy has a big hard on,True
charlie_e44,that is a dildo,True
charlie_e44,fake dick,True
bethaneyizbored,oh it looked like a candle cuz it looked like it was lit,False
charlie_e44,you are going to need one of them,True
bethaneyizbored,im probly not sposed 2 have 1 of those either lol,False
bethaneyizbored,its not somethin i can ask santa for lol,False
charlie_e44,hahahahaha ya and your not sopose to be fucking dont think that will stop you,True
charlie_e44,it is something you can ask daddy for,True
charlie_e44,can i pull on your nippels,True
bethaneyizbored,yeah,False
charlie_e44,and slape them,True
bethaneyizbored,yes,False
charlie_e44,am i making you hurnny,True
charlie_e44,hornny,True
bethaneyizbored,yeah a lil lol,False
charlie_e44,that is a candile,True
charlie_e44,hot wax on her ass,True
bethaneyizbored,why a,False
bethaneyizbored,oh ok,False
charlie_e44,hell i dont know never did that,True
bethaneyizbored,haha okay,False
charlie_e44,i need a coller and hand chuffes for you,True
charlie_e44,and a lish,True
charlie_e44,leash,True
charlie_e44,ya you like that,True
bethaneyizbored,yeah i think so,False
bethaneyizbored,ive never had taht,False
charlie_e44,mmmmmmmmmmmm sounds like fun,True
charlie_e44,girl you been thinking of some wild things,True
bethaneyizbored,lol uve been showin me some wild things,False
charlie_e44,only becase you like it,True
charlie_e44,my fucking browser will not work,True
charlie_e44,i got to reboot,True
bethaneyizbored,ok,False
charlie_e44,so what do you want to talk about now,True
bethaneyizbored,anything,False
bethaneyizbored,tell me waht u been doin this week,False
charlie_e44,or am i just a sex toy for you,True
bethaneyizbored,otehr than chattin with me lol,False
charlie_e44,sleeping,True
charlie_e44,working and sleeping and talking to you,True
charlie_e44,what you been doing,True
bethaneyizbored,lol,False
bethaneyizbored,bein lazy,False
charlie_e44,some not much,True
charlie_e44,ya like what you been doing,True
bethaneyizbored,readin watchin movees,False
bethaneyizbored,nothin special,False
charlie_e44,who you been chatting and talking to,True
charlie_e44,ya,True
bethaneyizbored,chattin with u,False
bethaneyizbored,only u,False
bethaneyizbored,talkin 2 friens n stuff on teh fone,False
charlie_e44,lol jk,True
charlie_e44,ya which frends,True
bethaneyizbored,krissy n bri mostly,False
charlie_e44,who are thay,True
bethaneyizbored,who have u been chattin lol,False
charlie_e44,i want to know sorry i am nosy,True
bethaneyizbored,bri is some1 ive known 4ever,False
bethaneyizbored,krissy is some1 i met here,False
charlie_e44,kool when did you meet her,True
bethaneyizbored,a few months ago,False
charlie_e44,bri lives in hover right,True
bethaneyizbored,yeah,False
charlie_e44,you never told me you had a new freand,True
bethaneyizbored,she n i didnt talk much until school wuz almost finish,False
bethaneyizbored,we study 2gether for english,False
charlie_e44,ben keeping things from me have you,True
charlie_e44,lol i am fucking with you,True
charlie_e44,hahahahah,True
charlie_e44,i love it,True
bethaneyizbored,lol,False
bethaneyizbored,i dont want u gettin mad at me cuz i forget things,False
charlie_e44,i would not get mad at you silly,True
charlie_e44,like you way to much,True
charlie_e44,y would i get mad at you,True
bethaneyizbored,i dunnno,False
bethaneyizbored,i just always worry bout disapointin people i like,False
charlie_e44,i got upset with you when you went space on me,True
charlie_e44,spaceo and didnt talk to me,True
bethaneyizbored,im sowwy,False
charlie_e44,and gave me no good reason,True
charlie_e44,i know it is a lot to put on you,True
bethaneyizbored,i wont do it agin,False
charlie_e44,i dont mean to put a lot of shit on you at all,True
charlie_e44,i know like i said i was worred about things too you,True
charlie_e44,know,True
charlie_e44,hard to beleve i found some one like you,True
bethaneyizbored,yeah,False
bethaneyizbored,yeah u said taht b4,False
bethaneyizbored,i gotta tell u a secret lol,False
charlie_e44,your like every thing i have always wanted,True
charlie_e44,ok go ahead,True
bethaneyizbored,4 a while i thout u were someone i knew n wuz just messin with me,False
bethaneyizbored,i didnt think u were real lol,False
charlie_e44,really what changed your mind,True
charlie_e44,well i wil tell you something,True
bethaneyizbored,wehn u showed me pictures n teh movees i knew u were real cuz none of my friens look at stuff like taht,False
bethaneyizbored,okay,False
