User,Text,Groom
charlie_e44,hi,True
charlie_e44,oipps sorry wrong person,True
bethaneyizbored,okie dokie,False
charlie_e44,lol cool,True
charlie_e44,just bord rite,True
bethaneyizbored,yep,False
charlie_e44,ya really bad,True
charlie_e44,notting to do at all,True
bethaneyizbored,same here,False
bethaneyizbored,we just moved so online is all i got 4 now,False
charlie_e44,ya,True
charlie_e44,so what do you do for fun on here,True
bethaneyizbored,nothin jus chat,False
bethaneyizbored,whatelse is lol,False
charlie_e44,ya i am divorced and all the kids are gron so i am bord,True
bethaneyizbored,its just a computer,False
bethaneyizbored,that sux,False
charlie_e44,hahahaha,True
charlie_e44,ya it dose,True
bethaneyizbored,13 f dothan btw,False
charlie_e44,ya i am a lot older,True
bethaneyizbored,thats okay,False
bethaneyizbored,how old r,False
charlie_e44,47 old,True
bethaneyizbored,wow,False
charlie_e44,see i told you,True
bethaneyizbored,sorry i gues thats rude 2 say that lol,False
bethaneyizbored,where do u,False
charlie_e44,jasper close to birmingham,True
charlie_e44,so where did you move from,True
bethaneyizbored,actuly i moved from bham,False
bethaneyizbored,lol,False
charlie_e44,hahahahah rerally,True
bethaneyizbored,yeah hoover,False
charlie_e44,really,True
charlie_e44,new key bord sorry,True
bethaneyizbored,no prob,False
charlie_e44,well you lived in a nice place,True
charlie_e44,how is it there,True
bethaneyizbored,yeah,False
bethaneyizbored,its okay,False
bethaneyizbored,i just dont know anybody,False
bethaneyizbored,so its kinda lame,False
charlie_e44,have you started school,True
charlie_e44,you will meet ppl there,True
bethaneyizbored,yeah im inschool but i dont know any1 realy yet,False
charlie_e44,how long you been there,True
bethaneyizbored,three weeks,False
bethaneyizbored,moms job moved her,False
charlie_e44,y did you move,True
charlie_e44,ya i see,True
charlie_e44,so what dose she do,True
bethaneyizbored,she works 4 a company selling drugs 2 doctors,False
charlie_e44,ya good job,True
bethaneyizbored,she goes 2 doctor offices n takes them pens n notepads n stuff 2 buy medicine,False
charlie_e44,ya she dose good,True
charlie_e44,so has she meeting ppl,True
charlie_e44,or is her and your dad togeatther,True
bethaneyizbored,no they divorced,False
bethaneyizbored,he lives in atlanta,False
bethaneyizbored,shes datin a guy named pat who also livesin dothan,False
bethaneyizbored,i think thats why we moved,False
charlie_e44,ya it may be,True
charlie_e44,where is she tonight,True
charlie_e44,you got any sisters or brothers,True
bethaneyizbored,on the phone lol,False
bethaneyizbored,nope im an only child,False
charlie_e44,to pat right,True
charlie_e44,so your spoild i bet,True
charlie_e44,lol,True
bethaneyizbored,yeah 2 pat,False
bethaneyizbored,kinda spoiled,False
charlie_e44,ya i bet you are,True
charlie_e44,so do you sportsin school,True
charlie_e44,play,True
bethaneyizbored,no cuz we just moved,False
charlie_e44,did you,True
bethaneyizbored,i wanted 2 do track cuz i like 2 run but mom say maybe next year,False
charlie_e44,you need to do things so you can meet ppl,True
bethaneyizbored,yeah,False
charlie_e44,my girls were cherleaders,True
charlie_e44,but this is a small town,True
bethaneyizbored,i think i wuld be 2 shy 2 be a cheerleader lol,False
charlie_e44,i hope your mom dont flip out becase you are talking to me,True
charlie_e44,nnnnnnnaaaaa,True
bethaneyizbored,ummmm i wont be tellin her lol,False
bethaneyizbored,she wuld ground me,False
charlie_e44,hahahaha,True
charlie_e44,she will flip out lol,True
charlie_e44,i bet you would make a good cheerleader,True
charlie_e44,well where is your computer at in your room,True
bethaneyizbored,on my desk,False
charlie_e44,ya in your room,True
charlie_e44,so she cannot see it,True
bethaneyizbored,nope she cant see it,False
charlie_e44,you talk to older ppl,True
bethaneyizbored,not lots,False
charlie_e44,ididnt think so,True
bethaneyizbored,somtimes tehy im me n we chat n then they go away lol,False
bethaneyizbored,why didnt u think,False
charlie_e44,not to many ppl talk to younger ppl,True
bethaneyizbored,so why r u talkin 2 lol,False
charlie_e44,i dont know,True
charlie_e44,noone else would talk to me lol,True
charlie_e44,hahahaah,True
bethaneyizbored,omg lol,False
bethaneyizbored,ur so funny,False
charlie_e44,ya rite,True
charlie_e44,hahaha,True
charlie_e44,i am a crazzy old man,True
charlie_e44,so what do you look like,True
charlie_e44,i am 6 ft 190 br hair and eyes,True
bethaneyizbored,im 98 pounds n brown hair,False
bethaneyizbored,i gotta pic somewhere on here if u wanna see,False
bethaneyizbored,lol,False
charlie_e44,bet you look really good,True
bethaneyizbored,i think i look funny,False
charlie_e44,so you meet any boys yet,True
charlie_e44,it dont sound like you look funny,True
charlie_e44,sounds like you are a good looking girl,True
bethaneyizbored,i found my pics u wanna,False
charlie_e44,so what do you talk about on here,True
bethaneyizbored,anything rely,False
bethaneyizbored,im usuly bored lol,False
bethaneyizbored,lol,False
charlie_e44,hahaha ya i know what you mean,True
charlie_e44,dont talk to many girls your age,True
charlie_e44,i talk to older women about other things,True
bethaneyizbored,lol,False
bethaneyizbored,waht kinda,False
charlie_e44,hahaha you want to get me in trubull,True
bethaneyizbored,no i dont wanna get u in,False
charlie_e44,y what do you talk to older guys about,True
bethaneyizbored,i dont talk 2 them much,False
bethaneyizbored,usuly they ask if my mom is datin lol,False
charlie_e44,like sex and things that is what older women talk about,True
charlie_e44,hahahahah ya,True
bethaneyizbored,ohhhh ok lol,False
bethaneyizbored,i dont know much bout it,False
bethaneyizbored,i guess thats why older guys dont talk 2 me bout it lol,False
charlie_e44,hahahaha ya i didnt figger you did,True
charlie_e44,not much what do you know,True
bethaneyizbored,well i know waht they teach in health class lol,False
charlie_e44,what have you been doing,True
charlie_e44,that is not much,True
charlie_e44,hahahaha,True
bethaneyizbored,i know dont laugh lol,False
charlie_e44,i wont it is ok sorry,True
charlie_e44,y is it something you want to do,True
bethaneyizbored,yeah kinda curous bout it,False
charlie_e44,ya i bet you are,True
bethaneyizbored,one of my friends has a bf n she talks bout stuff n i dont know about it,False
charlie_e44,lol i will show you,True
charlie_e44,sorry,True
charlie_e44,lol,True
bethaneyizbored,lol i wuz just typing okay,False
bethaneyizbored,lol,False
charlie_e44,you want me to,True
charlie_e44,be fun,True
charlie_e44,hahahaha i am so bad,True
bethaneyizbored,lol,False
bethaneyizbored,it wuld make my life not so borin lol,False
charlie_e44,to bad you moved,True
bethaneyizbored,yeah,False
bethaneyizbored,i hate it here,False
charlie_e44,i would like to show you,True
charlie_e44,i am not good looking,True
charlie_e44,ya reallyu,True
bethaneyizbored,i dont think im good lookin either,False
bethaneyizbored,n yeah i wuld,False
charlie_e44,i bet you are,True
bethaneyizbored,well unless u were like a killer r somethin lol,False
charlie_e44,ya i would if you wanted to,True
charlie_e44,nokiller,True
charlie_e44,not at all,True
charlie_e44,well to be honast i did mean to message you but i didnt want you to freek out you know,True
bethaneyizbored,i think thats sweet,False
charlie_e44,i have never been with a young girl i thought about it,True
bethaneyizbored,whats the yungest u been,False
charlie_e44,i have never been with one,True
charlie_e44,just think about it that is all,True
bethaneyizbored,so u dont mind that im,False
charlie_e44,no that would be ok ifyou dont mind me being 47,True
charlie_e44,lol,True
bethaneyizbored,i think age is just a number,False
charlie_e44,cool,True
bethaneyizbored,it depens on if a guy is nice n stuff,False
charlie_e44,ya i knowwhat you mean,True
charlie_e44,well you can add me if you want to,True
charlie_e44,so what do you think about doing like sex ways,True
bethaneyizbored,kewl thanx,False
charlie_e44,any time hun,True
bethaneyizbored,well i dunno cuz i never did it before,False
charlie_e44,ya,True
charlie_e44,well it would be fun doing it,True
charlie_e44,it would take some time like to play and rub,True
bethaneyizbored,that souns kewl,False
charlie_e44,think you would like to get rubbed all over,True
charlie_e44,mm ya lick you all over too,True
charlie_e44,i have alwaysthought about a girl your age,True
charlie_e44,ya,True
charlie_e44,you got a pic,True
bethaneyizbored,yeah,False
charlie_e44,i think thay are sexy i dont know y,True
bethaneyizbored,thats kewl,False
charlie_e44,i like the way a younger girl looks,True
charlie_e44,you look good to me,True
bethaneyizbored,u got any,False
charlie_e44,really you do,True
charlie_e44,i look bad i am looing my hair,True
bethaneyizbored,i think its rely sweet of u 2 say taht cuz i dont think ilook that great,False
bethaneyizbored,its okay cuz ur nice,False
charlie_e44,lol your to nice,True
charlie_e44,i like the way you look all small,True
charlie_e44,beet you gota good looking body,True
bethaneyizbored,u like girls who r,False
charlie_e44,ya i do i like the way you are,True
bethaneyizbored,r u gonna showme any pics or lol,False
charlie_e44,so i have some bad pics you like to see them,True
bethaneyizbored,lol,False
bethaneyizbored,sure,False
charlie_e44,let me find them,True
charlie_e44,i hope your mom cannot5 see your puter when she walkes in your room,True
bethaneyizbored,nope,False
bethaneyizbored,it faces teh other way n shes stil on the phone lol,False
charlie_e44,that is me i need a shave in that one,True
bethaneyizbored,its small lol,False
charlie_e44,is it,True
bethaneyizbored,u look nice not like some murdrer lol,False
charlie_e44,right click on it to make it large,True
bethaneyizbored,didnt work,False
charlie_e44,ya i see that,True
bethaneyizbored,i kinda suck at computers somtimes lol,False
charlie_e44,opps,True
bethaneyizbored,is that,False
charlie_e44,youi like that,True
charlie_e44,ya you like it,True
bethaneyizbored,yeah cuz i havent seen stuff like taht before,False
charlie_e44,dont let mom se,True
charlie_e44,we get in trrrrrrr,True
bethaneyizbored,omg no i wont let her see,False
bethaneyizbored,i wuld b grounded 4evah,False
charlie_e44,lol,True
charlie_e44,i would let you play with it,True
charlie_e44,can you see me in that one,True
charlie_e44,i look bad,True
charlie_e44,thanx,True
charlie_e44,so would you like to play with thaty,True
bethaneyizbored,yeah but i never done taht before so i dont rely know how,False
bethaneyizbored,i think thats rely kewl looking,False
charlie_e44,ya i keep it shaved i dont like hair on it,True
charlie_e44,like to try that,True
bethaneyizbored,try whats in this,False
charlie_e44,ya,True
bethaneyizbored,yeah but i dont know how cuz i never done taht,False
bethaneyizbored,it looks kewl,False
charlie_e44,like to see you naked bet you look good,True
bethaneyizbored,i dont have any pics like taht,False
charlie_e44,ya i know,True
charlie_e44,i was just saying,True
bethaneyizbored,can girls my age even do pics like lol,False
bethaneyizbored,i thout u had 2 be grown up 2 be a model,False
charlie_e44,we could take them with a cam,True
charlie_e44,what can you do that,True
bethaneyizbored,i dont havea cam,False
charlie_e44,it is ok,True
bethaneyizbored,i dont even have a digital cam cuz i broke moms,False
charlie_e44,how did you get the ones you have,True
bethaneyizbored,my friends took them n scan them 4 me n email em to me,False
charlie_e44,ya who was your frend,True
bethaneyizbored,is taht,False
charlie_e44,no,True
bethaneyizbored,my friend krista from back home,False
bethaneyizbored,o ok,False
charlie_e44,i have never been with a young girl,True
charlie_e44,a pic someone gave me,True
bethaneyizbored,o is she she looked older,False
charlie_e44,ya,True
bethaneyizbored,how old is,False
charlie_e44,i dont know,True
bethaneyizbored,ok,False
charlie_e44,m ya like to know what you think about it,True
bethaneyizbored,i think its rely interestin cuz i havent seen pics like this before,False
charlie_e44,it would be fun to spend some time togeather after we get to know each other,True
charlie_e44,if you wanted to,True
bethaneyizbored,yeah i think so 2,False
bethaneyizbored,yeah i do,False
charlie_e44,i like to see up skirts and things like that,True
bethaneyizbored,tahts kewl,False
bethaneyizbored,i think lotsa guys do lol,False
charlie_e44,you know when a guy looks up it and you let him but act like your notletting him,True
bethaneyizbored,lol,False
charlie_e44,ya i think so to,True
charlie_e44,ya it would be,True
charlie_e44,so what kind of pantes do you where,True
charlie_e44,wear,True
bethaneyizbored,jus regular kind but i got some thongs 4 my skirts so i dont get panty lines,False
charlie_e44,mmmmmmm nice i bet you got a nice butt,True
bethaneyizbored,i gues lol,False
charlie_e44,so would you like to try what she is doing,True
charlie_e44,be nice if you had a webcam you could show me what it looked like,True
bethaneyizbored,yeah but wuld it fit in my i mean what if my mouth is 2 small r somethin,False
bethaneyizbored,im sowwy if that sound dum,False
bethaneyizbored,yeah i dont have one but i rely want one,False
charlie_e44,no it is not to small it looks bigger then it is right there,True
bethaneyizbored,o okay good,False
charlie_e44,see,True
charlie_e44,lol,True
charlie_e44,didnt mean to say that,True
charlie_e44,i know you dont know,True
bethaneyizbored,yeah she looks like shes just a lil bit older than me,False
bethaneyizbored,n she can do it,False
charlie_e44,ya be nice to go to a motel and spend the day and just thouch and feel each other,True
charlie_e44,ya i would like to be with you,True
charlie_e44,i think you are good looking,True
bethaneyizbored,ur teh first person 2 tell me that,False
charlie_e44,this girl is small,True
bethaneyizbored,yeah is seh my,False
charlie_e44,really and you are really nice too,True
charlie_e44,i would say yes i think so,True
bethaneyizbored,i think ur nice 2,False
bethaneyizbored,kewl,False
charlie_e44,thanx,True
charlie_e44,dont take me wrong i would just like to be with a girl your age to see y i think thay are so sexy,True
bethaneyizbored,thats kewl,False
bethaneyizbored,im kinda curous bout it,False
charlie_e44,and i have never meet a girl like you,True
charlie_e44,we would only try what you wanted to,True
charlie_e44,we would not even have to have sex just thouch each other,True
bethaneyizbored,taht souns so romantic,False
charlie_e44,mmmmmm ya it dose4e,True
bethaneyizbored,yeah,False
charlie_e44,what time you got to go to bed,True
charlie_e44,or can you stay up tonight,True
charlie_e44,cool,True
charlie_e44,see her i think she looks good,True
charlie_e44,like the up skirt shoot too,True
bethaneyizbored,yeah,False
charlie_e44,sorry i am bad,True
bethaneyizbored,shes not wearin pantees is,False
bethaneyizbored,lol its ok,False
charlie_e44,no pritty hot,True
bethaneyizbored,do u know,False
bethaneyizbored,i wish my hair were blond,False
charlie_e44,no i never put ppl i know on this never,True
charlie_e44,i tthink you look good just the way you are,True
charlie_e44,like to be kissing you and taking your shiryt off rite now,True
charlie_e44,and kissing youir nippels and stumic,True
charlie_e44,and then take off your pants slowly and kiss you all over,True
bethaneyizbored,i bet that wuld feel good,False
charlie_e44,down your leggs and then take your pantes off and kiss you all over your butt and roll you over spred your leggs and kiss your pussy,True
charlie_e44,and make it all wet,True
charlie_e44,kiss that little lump on it and lick it,True
charlie_e44,that is your clit,True
charlie_e44,is that doing any thing for you,True
charlie_e44,do you ever rub your self down there,True
charlie_e44,i do,True
charlie_e44,i play with myself,True
bethaneyizbored,yeah sometimes but it feels kinda silly so i stop,False
bethaneyizbored,i wanna real bf,False
charlie_e44,ya i want a young girl frend like you,True
charlie_e44,i would do all that to you and make you feel good,True
charlie_e44,i would too,True
charlie_e44,wish you were here with me doing that,True
charlie_e44,if you wanted to,True
bethaneyizbored,yeah i wuld want 2 if u wuld show me how,False
bethaneyizbored,lol my mom wuld kill me if i wore that,False
charlie_e44,i would show you a lot of things,True
charlie_e44,any thing you want,True
charlie_e44,and i acnnot get a girl praggnet any more,True
charlie_e44,i got that fixed so no spirm comes out,True
bethaneyizbored,tahts good cuz mom wuld def freak if i got preg,False
charlie_e44,i still cum but it has no spirm,True
bethaneyizbored,o ok,False
charlie_e44,ya it is good,True
charlie_e44,so i can cum in you,True
bethaneyizbored,thats a cute outfit tho,False
charlie_e44,ya i would like to take it off you,True
bethaneyizbored,lol,False
charlie_e44,i think you would look so sexy in that,True
bethaneyizbored,whats that on,False
charlie_e44,cum,True
bethaneyizbored,o okay,False
bethaneyizbored,sowwy if i have dumb questons,False
charlie_e44,like to have it all over your butt,True
bethaneyizbored,lol shes a cheerleader,False
bethaneyizbored,i suddenly saw it wuz a cheer skirt,False
charlie_e44,no it is ok you dont have a dumb queston,True
bethaneyizbored,lol,False
charlie_e44,ya rite,True
charlie_e44,sexy as hell,True
charlie_e44,lol,True
bethaneyizbored,lol,False
charlie_e44,i am bad,True
bethaneyizbored,i dont mind,False
charlie_e44,i like that out fit,True
charlie_e44,letts her butt out,True
bethaneyizbored,yeah shes pretty 2,False
charlie_e44,you are too,True
bethaneyizbored,she looks yunger tahn me,False
charlie_e44,stop saying you are not,True
charlie_e44,i have a hard dick thinking of you,True
bethaneyizbored,im glad u think im pretty,False
charlie_e44,ya like to see you naked be really sexy,True
charlie_e44,so you got hair down there,True
bethaneyizbored,sowwy no cameras,False
bethaneyizbored,not rely,False
bethaneyizbored,mom says im kinda a late bloomer,False
charlie_e44,cool i like it shaved or with no hair,True
bethaneyizbored,o ok good,False
charlie_e44,bet you would look good in that,True
bethaneyizbored,lol theres not enough of taht 2 lolol,False
charlie_e44,ya it is better to lick when there is no hair,True
bethaneyizbored,o ok,False
charlie_e44,lie to be doing tthat to you rite now,True
charlie_e44,bet you tast good,True
charlie_e44,i really want to get to know you,True
bethaneyizbored,i wanna get 2 know u 2,False
charlie_e44,cool i like that,True
charlie_e44,be nice to be sucking on your pussy,True
charlie_e44,lipes,True
bethaneyizbored,i wuld like taht,False
bethaneyizbored,brb gotta pee lol,False
charlie_e44,i like the way she looks,True
charlie_e44,lol ok,True
bethaneyizbored,back,False
charlie_e44,cool just looking at you really nice,True
bethaneyizbored,yeah thats a cute outfit 2,False
charlie_e44,ya it is,True
charlie_e44,so what do you think is sexy,True
charlie_e44,she is like you,True
bethaneyizbored,i think nice people r sexy cuz they will treat u nice,False
bethaneyizbored,this last,False
charlie_e44,ya thay will,True
charlie_e44,ya she is young,True
charlie_e44,dont you think she is,True
charlie_e44,i maybe wrong,True
bethaneyizbored,how old is,False
charlie_e44,she may be older,True
charlie_e44,i am not shour,True
bethaneyizbored,teh girls with teh white outfit is young lol,False
charlie_e44,ya she is that what your body looks like,True
bethaneyizbored,kewl,False
charlie_e44,love this outfit,True
charlie_e44,so sexy her butt sticking out,True
bethaneyizbored,yeah thats kewl,False
charlie_e44,you would be hot in that,True
charlie_e44,well you are anyway,True
bethaneyizbored,thanks,False
bethaneyizbored,i wish i had cute clothes like taht lol,False
charlie_e44,lick you rite on your butt,True
charlie_e44,we could let you get some you could go shoping,True
charlie_e44,like to see you in something like that,True
bethaneyizbored,wow taht wuld b kewl,False
charlie_e44,ya we can or you can,True
charlie_e44,let you have some nony,True
charlie_e44,money,True
charlie_e44,hard on getting in the way,True
bethaneyizbored,lol,False
charlie_e44,do you stay up on the computer that much,True
bethaneyizbored,not a lot,False
bethaneyizbored,this weekend yeah cuz i wuz bored,False
charlie_e44,i like this too,True
charlie_e44,you were off this week,True
charlie_e44,would you do that for me,True
bethaneyizbored,yeah,False
charlie_e44,opps,True
charlie_e44,x off by misstake,True
charlie_e44,is it coming back up,True
charlie_e44,ya what are you doing,True
charlie_e44,you rubbing that wet pussy,True
bethaneyizbored,photoshare is up but theres isnt anythin in it,False
bethaneyizbored,not,False
bethaneyizbored,lol,False
charlie_e44,ya i have to add more pics to it,True
bethaneyizbored,o ok,False
charlie_e44,darn like to know you are rubbing it like to see you do that,True
charlie_e44,would you like to seee me play with my hard on,True
bethaneyizbored,yeah taht wuld b kewl,False
charlie_e44,mm ya it would be nice to see you do it too,True
charlie_e44,i lke that too she is older but it is sexy,True
charlie_e44,her bobs are to big i like small ones,True
bethaneyizbored,lol i wuz gonna ask if u thout i wuld look like that,False
charlie_e44,ya you would look good any way,True
charlie_e44,with nothing on you would look good,True
charlie_e44,sorry i was looking for a pic,True
charlie_e44,ya i am not going anywhere,True
charlie_e44,so what do youy like to do for fun,True
bethaneyizbored,i like 2 be outdoors lots,False
bethaneyizbored,i like 2 run n swim,False
bethaneyizbored,i love 2 read n go shopping,False
charlie_e44,i love too swim,True
bethaneyizbored,i like talkin2 my friends,False
charlie_e44,i like them pantes,True
charlie_e44,you have any like that,True
charlie_e44,like to have you like that and with your leggs spred and me licking you,True
bethaneyizbored,nuh uh,False
bethaneyizbored,mom wuld die if i had see thru stuff lol,False
charlie_e44,mmmm it would look so good seeing that sweet thing,True
charlie_e44,is that what your bod looks like,True
bethaneyizbored,yeah,False
charlie_e44,you are hot,True
charlie_e44,mmmmmmmmm,True
charlie_e44,love to be with you,True
bethaneyizbored,i wuld like taht 2,False
charlie_e44,like to have a pic of you like that with your leggs spred mmmmmmm,True
bethaneyizbored,i wish i culd,False
charlie_e44,i could take one of you like that,True
bethaneyizbored,you wuldnt show any1 wuld,False
charlie_e44,hell no never would you and me are the only ones that would know about it,True
bethaneyizbored,okay kewl,False
bethaneyizbored,mom wuld absolutely freek,False
charlie_e44,ya no shit she would,True
charlie_e44,like the up skirt thing,True
bethaneyizbored,yeah,False
charlie_e44,i like that out fit,True
bethaneyizbored,yeah i like it 2,False
bethaneyizbored,lots,False
charlie_e44,you will look like that,True
charlie_e44,even better,True
charlie_e44,ya i do think you will,True
bethaneyizbored,lol ur funny,False
charlie_e44,hahahahaah,True
bethaneyizbored,ur 2 nice 4 me to ever leave behind,False
charlie_e44,really nice you nice,True
charlie_e44,i am old lol,True
bethaneyizbored,ur nice n thats all that matters 2 me,False
charlie_e44,good,True
charlie_e44,so do you know ppl have sex up the butt too,True
bethaneyizbored,no way,False
charlie_e44,ya reall some girls really lioke it,True
charlie_e44,a lot,True
charlie_e44,like,True
bethaneyizbored,kewl,False
charlie_e44,ya y did you think of doing that,True
bethaneyizbored,no i nver thout of it b4,False
charlie_e44,ok i was woundering,True
charlie_e44,i like that not to sex but nice,True
bethaneyizbored,yeah,False
charlie_e44,see that is what you are going to look like,True
charlie_e44,you well be sexy,True
charlie_e44,so are you,True
bethaneyizbored,thanx,False
charlie_e44,you would lok good in that,True
charlie_e44,like to see you at the beach,True
bethaneyizbored,i wish,False
bethaneyizbored,i love teh beach,False
charlie_e44,ya me too i lived on the beach in fl before,True
charlie_e44,well up the street from the beach,True
bethaneyizbored,why did u,False
bethaneyizbored,i wulda stayed lol,False
charlie_e44,job,True
bethaneyizbored,where u,False
charlie_e44,i think i am going to move agin,True
charlie_e44,i did work for grayhound,True
charlie_e44,the bus line,True
bethaneyizbored,o okay,False
bethaneyizbored,wehn are u gonna,False
charlie_e44,i dont know,True
charlie_e44,like to move next door you could come over lol,True
charlie_e44,that looks good,True
charlie_e44,i like girls with dark hair,True
charlie_e44,ya and how ofton would you come over,True
bethaneyizbored,as often as u,False
charlie_e44,that would be all the time,True
charlie_e44,hahahah realy,True
bethaneyizbored,lol okay,False
charlie_e44,ya rite what would mom say,True
bethaneyizbored,i wuld sneak out lol,False
bethaneyizbored,or wait until shes gone one weekend lol,False
charlie_e44,hahahaha ya,True
charlie_e44,or when she is at work,True
bethaneyizbored,yeah,False
charlie_e44,she stays gone all weekend,True
bethaneyizbored,sometimes if she n pat wanna go someplace,False
charlie_e44,she dont come home,True
bethaneyizbored,well she come back sunday nite cuz she gotta work teh next day,False
bethaneyizbored,she says she need time 2 be herself n be with her bf,False
charlie_e44,damn so we could go to the motel,True
bethaneyizbored,its ok cuz im used 2 bein by myself,False
bethaneyizbored,well yeah,False
charlie_e44,cool,True
charlie_e44,y do you need to be by your self,True
bethaneyizbored,i dont hafta be by myself lol,False
charlie_e44,tell her you need a web cam to talk to your frends,True
bethaneyizbored,but i dont got a sitter r anything lol,False
charlie_e44,we could have some fun,True
bethaneyizbored,i told her taht n she say no way,False
charlie_e44,lol no way y did you want one,True
charlie_e44,dose she call you,True
bethaneyizbored,so i culd keep up with my lol,False
bethaneyizbored,sometimes but not lots,False
