User,Text,Groom
bethaneyizbored,yeah if u want 2,False
bethaneyizbored,n wont show nobody lol,False
bethaneyizbored,but i dont gotta cam,False
charlie_e44,would you like to watch your self,True
charlie_e44,i will get one,True
bethaneyizbored,i dunno master cuz i havent thout bout it,False
charlie_e44,i would never show anyone,True
bethaneyizbored,kewl,False
charlie_e44,oo ic slut well you wwill do what i want you to you cum eatter,True
bethaneyizbored,yes master,False
charlie_e44,god she has a nice ass tell me if your looks like that,True
bethaneyizbored,i gues so,False
bethaneyizbored,i havent looked at it lots lol,False
charlie_e44,lol,True
charlie_e44,it just looks nice and smooth,True
bethaneyizbored,k finish taht one,False
charlie_e44,god i want you to wear this mmmmmmmmmmmmm,True
charlie_e44,ya suck that dick bitch,True
bethaneyizbored,yes master i will do taht,False
charlie_e44,m ya you will you are going to make master happy,True
bethaneyizbored,i hope so,False
charlie_e44,you will if you do what you are told to do,True
bethaneyizbored,i will master,False
bethaneyizbored,taht movee just finish,False
charlie_e44,i am so hard i want you now,True
charlie_e44,mmmmmmmmmmmmmmmmmmm like the way she sucks it,True
charlie_e44,mmmmmmmm love that,True
bethaneyizbored,yeah,False
charlie_e44,mmmmmmm rub it bitch rub it for me,True
bethaneyizbored,yes master,False
charlie_e44,m lick my balls,True
bethaneyizbored,i will do watev u want,False
charlie_e44,put them in your mouth,True
charlie_e44,i want to know what all you think you will get into like to hear what you thought ppl would think was crazzy,True
bethaneyizbored,i just kinda want 2 be told waht 2 do,False
bethaneyizbored,i wuld want teh guy 2 decide stuff,False
charlie_e44,mm i will tell you a lot of things to do,True
bethaneyizbored,i want 2 make u happy,False
bethaneyizbored,that ones finish,False
charlie_e44,like to hear what you thought of thow i know you thought of things,True
charlie_e44,cool you will make me happy,True
charlie_e44,i just hope yopu dont get tierd of me,True
charlie_e44,like the way she sucks,True
charlie_e44,mmmmmmmmmmmmm,True
bethaneyizbored,i wont get tired of u,False
charlie_e44,i am so hard,True
bethaneyizbored,yeah seh can put almost all of it in her mouth,False
charlie_e44,ya i will be old,True
charlie_e44,you will want someone young,True
bethaneyizbored,i want someone who knows waht they r doin lol,False
charlie_e44,ya and you will after a while,True
bethaneyizbored,i wuld still need u,False
bethaneyizbored,cuz u know so much n i like u,False
charlie_e44,i am going to make you my bitch a little slave cunt,True
bethaneyizbored,yes master,False
charlie_e44,i am going to use your little pussy,True
charlie_e44,and you are going to learn to take it in the ass nomatter how long it takes,True
bethaneyizbored,yes master,False
charlie_e44,will you want to rite i will,True
bethaneyizbored,yeah,False
charlie_e44,take it eazy on you in the beging,True
charlie_e44,but after that it is all mine to use,True
charlie_e44,is this the way you want me to be with you reale,True
bethaneyizbored,yeah i kinda like it,False
charlie_e44,weell yes or no reale stop doing that tell what you feel,True
bethaneyizbored,yeah,False
charlie_e44,it is about time,True
charlie_e44,i love to be the dome,True
charlie_e44,i have wanted a slave,True
bethaneyizbored,taht movee finish,False
bethaneyizbored,i will do taht,False
bethaneyizbored,but i dont know how,False
charlie_e44,huh what do you mean,True
bethaneyizbored,i dont know how 2 be a slave,False
charlie_e44,is that the way you want to be all the time,True
charlie_e44,you dont have to know you do what you are told,True
bethaneyizbored,o okay,False
bethaneyizbored,all teh time but i have school n stuf,False
charlie_e44,reale that is the way you want me to do you all the time,True
charlie_e44,if you want to or not,True
bethaneyizbored,yes,False
charlie_e44,mmmmmm god i want you,True
charlie_e44,you moving in when you are 18 i will pay for your school,True
bethaneyizbored,kewl,False
charlie_e44,hell ya what for you,True
charlie_e44,i reale want you i do,True
bethaneyizbored,me 2,False
charlie_e44,wish you coulkd move in now,True
bethaneyizbored,yeah me 2,False
charlie_e44,yeh,True
charlie_e44,you will meet someone your a little hotty,True
charlie_e44,i think you are to sexy,True
bethaneyizbored,taht one finish,False
charlie_e44,wish you could come up it summer,True
bethaneyizbored,waht u,False
charlie_e44,come here and stay some,True
charlie_e44,it would be nice,True
bethaneyizbored,yeah it wuld,False
charlie_e44,it would be fun,True
charlie_e44,we could sleep togeather every night and fuck all the time,True
bethaneyizbored,yeah i think so 2,False
charlie_e44,i would fuc k you so much,True
bethaneyizbored,yeah,False
charlie_e44,and you could wash me and do every thing i tell you to you slave,True
bethaneyizbored,yes master,False
charlie_e44,mmmmm little bitch,True
charlie_e44,i am going to fuck the hell out of you,True
charlie_e44,and make you suck me and do all the things i want,True
bethaneyizbored,yes master,False
bethaneyizbored,like teh girl in teh,False
charlie_e44,i cannot wate to see you eat my cum slut,True
bethaneyizbored,yes master,False
charlie_e44,see how much you like it,True
charlie_e44,what do you want to be called,True
bethaneyizbored,watever u want 2 call me master cuz i like what u want,False
charlie_e44,or you can call me daddy if you want to,True
bethaneyizbored,ok,False
charlie_e44,mm your so fucking hot,True
charlie_e44,you likke the daddy thing,True
charlie_e44,is that what you have thought about,True
bethaneyizbored,yeah,False
charlie_e44,see that is cool to,True
charlie_e44,so tell me what you have thought of,True
bethaneyizbored,i want some1 to take care of me,False
bethaneyizbored,taht movee finish daddy,False
charlie_e44,m i want to take care of you as long as you do as i say,True
bethaneyizbored,i will daddy,False
charlie_e44,well i will be in good shape by the time you move in,True
charlie_e44,5 years rite well 4,True
bethaneyizbored,yeah im almost 14,False
charlie_e44,mmmmmmm and a hotty,True
charlie_e44,mm like this girls body,True
bethaneyizbored,yeah,False
charlie_e44,m like the way she sucks dick too,True
bethaneyizbored,waht do u like about,False
charlie_e44,ya cunt take it all,True
charlie_e44,that she is small and little boobs and bet she has a nice pussy and ass,True
charlie_e44,i like a nice ass,True
charlie_e44,i want you to suck me like that take all that cock bitch,True
charlie_e44,make a teare come out of your eye,True
charlie_e44,mmmmmmmmmmmmmmmm hell ya slut,True
bethaneyizbored,yes master i will,False
charlie_e44,i bet you wish you could hear me telling you that,True
charlie_e44,you have got to open your throgt to do that,True
bethaneyizbored,ok,False
charlie_e44,you can practice by putting your fingger down your throte,True
charlie_e44,and moveing it around,True
bethaneyizbored,ok i will do taht,False
charlie_e44,mmmmm ya that way you will be ready,True
charlie_e44,god i am so hard thinking of you,True
charlie_e44,think you would like me to pull your hair,True
charlie_e44,love her tits,True
charlie_e44,mmmmmmmm lick them balls,True
bethaneyizbored,yeah i wuld like taht,False
charlie_e44,god i bet that feels so good,True
charlie_e44,see how she is opening her throte,True
charlie_e44,god i want to do that to you,True
bethaneyizbored,yeah i saw,False
bethaneyizbored,it jus finish,False
charlie_e44,i need you,True
bethaneyizbored,me 2,False
charlie_e44,m bet she sucks good too,True
charlie_e44,hell ya suck it bitch,True
bethaneyizbored,did we jus watch this,False
charlie_e44,you like the way i talk,True
bethaneyizbored,yeah,False
charlie_e44,i dont know sorry,True
bethaneyizbored,o ok,False
charlie_e44,did we i was trhinking of you doing it,True
bethaneyizbored,lol yeah,False
bethaneyizbored,we can watch again if u want master,False
bethaneyizbored,ok,False
charlie_e44,heree go to this,True
bethaneyizbored,okay,False
charlie_e44,so you want daddy to spank you,True
bethaneyizbored,yes daddy,False
charlie_e44,m and slap his cock all over your face like a slut,True
charlie_e44,mmmmmmmmm make her suck it,True
bethaneyizbored,yes daddy if u like taht,False
bethaneyizbored,i want 2 make u happy,False
charlie_e44,would you think you would like it,True
bethaneyizbored,yes,False
charlie_e44,reale,True
bethaneyizbored,it looks excitin,False
charlie_e44,the spanking and the control turns you on,True
bethaneyizbored,yeah but i dont know why lol,False
charlie_e44,m i want to do that to you,True
charlie_e44,ya and you play with your self like a cunt,True
charlie_e44,ya see it going down her throte,True
bethaneyizbored,yeah,False
charlie_e44,m i love it,True
charlie_e44,you want me to be rough like that with you,True
bethaneyizbored,he dont look like hes bein taht rough,False
charlie_e44,so you feel like you been used,True
charlie_e44,no not at all you want it rougher then that,True
bethaneyizbored,i dont know waht that wuld look like,False
bethaneyizbored,it just dont look like hes taht rough rite now cept wehn she looks like shes chokin lol,False
charlie_e44,cum all in your mouth like that use it,True
bethaneyizbored,yeah,False
charlie_e44,you want to get chocked,True
bethaneyizbored,i dont know waht that wuld be like so i dunno,False
bethaneyizbored,it wuldnt kill me r nothin,False
charlie_e44,no i would never hurt you like i always say try it and see what you like too,True
charlie_e44,i want to make you cum all over the bed not make you hate it,True
bethaneyizbored,yeah,False
bethaneyizbored,i want taht 2,False
charlie_e44,like i said the pussy is going to hurt sorry but got to use it so we can fuck a lot after that,True
bethaneyizbored,its okay cuz i know it gonna hurt at first,False
charlie_e44,m ya sorry,True
bethaneyizbored,its ok,False
charlie_e44,like to tie you to the bed and use you,True
bethaneyizbored,taht ones finish,False
charlie_e44,ya reale you want to try that you think about that,True
bethaneyizbored,ill think bout it,False
charlie_e44,lol cool dont matter i will make you do it bitch,True
bethaneyizbored,yes daddy,False
charlie_e44,bet you would like to hear me calling you all the names,True
charlie_e44,damn i want to jump in my car and come down there,True
bethaneyizbored,i wish u wuld lol,False
charlie_e44,your mom is home,True
bethaneyizbored,yeah,False
charlie_e44,god i want my cock in your mouth,True
bethaneyizbored,yeah,False
charlie_e44,so what you going to tell her be back sunday bye ging to fuck see ya,True
bethaneyizbored,lol,False
bethaneyizbored,i dont think taht wuld work,False
charlie_e44,hahahaha y not,True
bethaneyizbored,she wuld freek,False
charlie_e44,tell her she can watch,True
charlie_e44,lol,True
bethaneyizbored,i think shes gonna b gone on teh 19 20 but i dont rember,False
bethaneyizbored,lol,False
charlie_e44,i hate this cunts tits,True
bethaneyizbored,i dont think moms watch taht kinda stuff,False
bethaneyizbored,wahts wrong with her,False
charlie_e44,to big and fake,True
bethaneyizbored,o ok lol,False
charlie_e44,and ugly,True
bethaneyizbored,lol,False
charlie_e44,ya hard to know if i am working om saterday or what,True
charlie_e44,all i do is think of you all the time that is y i get on when i get home,True
charlie_e44,so i dont miss you,True
bethaneyizbored,ill try 2 b online more cuz i like chattin with u,False
bethaneyizbored,ur so sweet,False
charlie_e44,god i want you,True
bethaneyizbored,nobody has told me taht im sexy b4,False
charlie_e44,if mom is up we dont have to watch vids,True
bethaneyizbored,yeah shes not up now but shes up durin teh day,False
charlie_e44,so which side of dothen you live on,True
charlie_e44,she has a ugly pussy too,True
bethaneyizbored,well actuly im in ozark,False
bethaneyizbored,i tell people dothan cuz its close n bigger tahn where i live,False
charlie_e44,reale where at,True
bethaneyizbored,just incaes,False
charlie_e44,how far off 231,True
bethaneyizbored,ozark,False
bethaneyizbored,i dunno cuz we moved here not 2 long ago,False
bethaneyizbored,mom likes 2 move lots,False
charlie_e44,i know where ozark is i go throw there when i go to fl in my truck,True
bethaneyizbored,i hate it,False
bethaneyizbored,o kewl,False
charlie_e44,tell her to move up here,True
bethaneyizbored,lol,False
bethaneyizbored,i wish,False
bethaneyizbored,taht wuld b kewl,False
charlie_e44,get you to hang out with my dau so you can come over all the time get her to pick you up anyway,True
bethaneyizbored,she wuldnt,False
charlie_e44,no told you that,True
charlie_e44,you dont belive me,True
bethaneyizbored,yeah i know i just want 2 make sure,False
bethaneyizbored,i bellleeve u,False
charlie_e44,ya it is cool,True
bethaneyizbored,dont b mad,False
charlie_e44,i would never get mad at you,True
charlie_e44,i was not mad just sade it wrong i guess,True
charlie_e44,this girl is ugly,True
bethaneyizbored,i beleeve u but i just wanna make sure she not tell people,False
bethaneyizbored,her boobs look weird lol,False
charlie_e44,ya thay are fake,True
charlie_e44,thay reale suck,True
bethaneyizbored,o ok,False
charlie_e44,and she wont tell anyone,True
bethaneyizbored,ok,False
charlie_e44,i need you here close to me,True
bethaneyizbored,i wish i wuz,False
charlie_e44,m me too we would be fucking,True
bethaneyizbored,yeah,False
charlie_e44,i wopuld be licking your pussy and getting it all wet,True
charlie_e44,y little slut,True
charlie_e44,i want you on your knees for me,True
bethaneyizbored,yes daddy,False
charlie_e44,mmmmmmmmmm ya suck it bitch i like that,True
charlie_e44,mmm slap it on her mouth,True
charlie_e44,push it deep,True
charlie_e44,take it all bitch,True
charlie_e44,you like daddy the best dont you,True
bethaneyizbored,yes i like daddy teh best,False
charlie_e44,god i want you on my cock like that,True
charlie_e44,he is making her do it,True
bethaneyizbored,yeah,False
charlie_e44,like that dont you bitch,True
bethaneyizbored,yes daddy,False
charlie_e44,when you get in my car i am telling you to take your pantes off and show me that pussy and ass,True
bethaneyizbored,i will,False
charlie_e44,like a good little girl,True
charlie_e44,m i like the glasses,True
charlie_e44,mmmmmm god damn she can take it all mmmmm,True
bethaneyizbored,yeah,False
charlie_e44,love the glasses you know,True
bethaneyizbored,im glad,False
charlie_e44,ya i think thay are sexy,True
charlie_e44,push her head down on it,True
bethaneyizbored,i gotta go 2 bed soon cuz im gettin tired,False
charlie_e44,that sucks,True
bethaneyizbored,im watchin this one but im gettin sleepy lol,False
charlie_e44,you need to come take care of this hard dcock,True
bethaneyizbored,im not there,False
charlie_e44,you think you got a good idea how to suck cock now,True
bethaneyizbored,yeah,False
charlie_e44,kool,True
charlie_e44,dont forgit to practis the figger down the trote thing,True
bethaneyizbored,i wont forget daddy,False
charlie_e44,so you dont know what road you live on,True
bethaneyizbored,yeah lol,False
charlie_e44,your a good girl to daddy,True
bethaneyizbored,but i dont wanna say cuz if u came here i culd get n trouble,False
bethaneyizbored,i wanna be a good girl 4 u daddy,False
charlie_e44,i hope you do,True
charlie_e44,i would not come there till you told me to anyway,True
bethaneyizbored,kewl,False
charlie_e44,still not suer about me huh,True
bethaneyizbored,we culd meet somewhere 2 if u want,False
bethaneyizbored,i do but i wanna wait uuntil we know wehn,False
charlie_e44,know,True
bethaneyizbored,wehn u r gonna come over,False
charlie_e44,ok i was just woundering,True
charlie_e44,so where we going to meet at,True
bethaneyizbored,theres a hotel near here but i 4get teh name of it,False
charlie_e44,dont want you walking to far,True
bethaneyizbored,its not taht far,False
bethaneyizbored,i wuld hafta figur it out n see if its 2 far,False
charlie_e44,reale how far is it that would be cool you can walk there,True
bethaneyizbored,i like 2 run n stuf,False
bethaneyizbored,n its not cold anymore,False
bethaneyizbored,i gotta look it up,False
bethaneyizbored,my moms gonna be gone teh weekend of teh 18 i think,False
bethaneyizbored,i gotta check,False
charlie_e44,ok cool then i could tell you what room i was in and you could come over,True
bethaneyizbored,yeah,False
charlie_e44,that better to you,True
bethaneyizbored,yeah,False
bethaneyizbored,taht one finish,False
charlie_e44,so you wont be scard rite,True
bethaneyizbored,i wont be scard,False
charlie_e44,this is still scary to you isnt it,True
bethaneyizbored,only cuz i havent done it b4,False
bethaneyizbored,im not scare of u,False
charlie_e44,kool,True
bethaneyizbored,im not scare of things we talk bout r watch,False
charlie_e44,well you dont want to tell me where you live,True
bethaneyizbored,just kinda nervos cuz its my first time,False
charlie_e44,ya ok cool,True
bethaneyizbored,im gonna go 2 bed,False
charlie_e44,can i cum,True
bethaneyizbored,u gonna b online,False
charlie_e44,yaqa as soon as i get up,True
bethaneyizbored,kewl,False
charlie_e44,i will turn it on,True
bethaneyizbored,ok,False
charlie_e44,i reale do want you,True
bethaneyizbored,u make me happy cuz nobody ever say taht 2 me b4,False
charlie_e44,like to be with you if we like each other i woulfd wate for you,True
bethaneyizbored,i wuld like taht2,False
charlie_e44,ya me too night hun hat do me a faver see if,True
charlie_e44,you can get some more pics of you standing,True
bethaneyizbored,kk i will look,False
charlie_e44,you can scane them at walmart,True
bethaneyizbored,lol,False
charlie_e44,see ya tomoro night,True
bethaneyizbored,nite,False
charlie_e44,i have some,True
bethaneyizbored,kewl,False
charlie_e44,i can take more you get some and i will too,True
bethaneyizbored,kk,False
charlie_e44,bye hate to let you go,True
charlie_e44,want to hold you all night,True
bethaneyizbored,yeah but i gonna fall sleep on my comp,False
bethaneyizbored,lol,False
bethaneyizbored,yeah taht wuld be sooooo nice,False
charlie_e44,i will put something in your mouth and wake you up,True
bethaneyizbored,lol,False
charlie_e44,lol night bye,True
bethaneyizbored,nite daddy,False
charlie_e44,night hunny,True
charlie_e44,hi baby,True
charlie_e44,what you been doing,True
charlie_e44,your frends on,True
bethaneyizbored,ive been outside wehn it wasnt raining lol,False
charlie_e44,i thought you were doing something,True
charlie_e44,what you been doing out there,True
bethaneyizbored,i went running 4 a bit,False
charlie_e44,y is that,True
bethaneyizbored,tehn i help mom clean up inside,False
bethaneyizbored,i like 2 run,False
bethaneyizbored,its fun,False
charlie_e44,is it,True
charlie_e44,i ran a lot in the army,True
bethaneyizbored,did u like,False
charlie_e44,ya i should have stayed in there,True
bethaneyizbored,why did u,False
charlie_e44,i always get into shit lol,True
charlie_e44,i was in 6 years,True
bethaneyizbored,lol,False
bethaneyizbored,did u get n lol,False
charlie_e44,so what you and your frend talking about,True
bethaneyizbored,just gossip bout who like who,False
charlie_e44,well who dose she like,True
bethaneyizbored,she likes this guy name brad but he likes some1 else so she always gets sad,False
charlie_e44,and who did you tell her you like,True
charlie_e44,that sucks,True
bethaneyizbored,i told her nobody cuz i didnt wanna tell anyone bout u,False
bethaneyizbored,i wuz afraid tehy mite tell some1,False
charlie_e44,hahahaha y not,True
bethaneyizbored,what if tehy told their folks taht i wuz chattin i wuld b in trouble,False
charlie_e44,you dont like me,True
charlie_e44,hahahahahah fucking with you,True
bethaneyizbored,i do like,False
bethaneyizbored,lol,False
charlie_e44,i know that,True
charlie_e44,i think you do any way,True
charlie_e44,tell her sshe needs to find a older guy,True
bethaneyizbored,lol,False
charlie_e44,how old is she,True
charlie_e44,reale,True
bethaneyizbored,shes 13,False
charlie_e44,what did she say,True
bethaneyizbored,shes still cryin,False
bethaneyizbored,shes tryin 2 write a poem about it,False
charlie_e44,she needs a older guy,True
charlie_e44,that would be good to her,True
bethaneyizbored,yeah she needs some1 nice,False
charlie_e44,ya she dose,True
bethaneyizbored,so i wanna hear about ur trouble in teh army lol,False
bethaneyizbored,were u lol,False
charlie_e44,ya i was always bad smoking pot and taking druges all the time,True
charlie_e44,and i never did what i was told,True
bethaneyizbored,did u get,False
charlie_e44,all the time hahahah,True
bethaneyizbored,lol,False
charlie_e44,hahahah so bad,True
charlie_e44,tell your frend she needs a guy around 45 and see what she says lol,True
charlie_e44,hahahahah,True
bethaneyizbored,no way seh wuld tell some1 lol,False
charlie_e44,tell them what,True
charlie_e44,you can always say you were kiding lol,True
bethaneyizbored,her mom checks her comp sometimes so i aint sayin nothin like taht lol,False
charlie_e44,chickin,True
charlie_e44,hahahahaaha,True
bethaneyizbored,so waht all did u do,False
charlie_e44,i need a good girl to come and take care of this for me,True
charlie_e44,nothing i was wating for you,True
charlie_e44,ya rite i am a sweety lol,True
bethaneyizbored,u,False
bethaneyizbored,i mean,False
bethaneyizbored,i think so,False
charlie_e44,hahahaah,True
charlie_e44,ok,True
charlie_e44,i beleve you,True
charlie_e44,damn you need to come take care of this,True
bethaneyizbored,take care of,False
charlie_e44,mmmmmmmmmmmmmm you dont know,True
bethaneyizbored,lol,False
charlie_e44,you need to be on your knees,True
bethaneyizbored,i wuld feel silly doin taht now lol,False
charlie_e44,y is that,True
bethaneyizbored,lol cuz i wuld be on my knees in front of teh comp lol,False
charlie_e44,i mean here on your knees silly,True
charlie_e44,hahahah,True
charlie_e44,what are you wearing,True
charlie_e44,now,True
bethaneyizbored,omg lol im such a dummy lolol,False
bethaneyizbored,im wearin a nightie,False
charlie_e44,you got pantes on,True
bethaneyizbored,yeah,False
charlie_e44,take them off,True
charlie_e44,you didnt know i ment you need to be here on your knees,True
charlie_e44,becase i told you to,True
bethaneyizbored,okay,False
charlie_e44,thats my girl,True
charlie_e44,hahahaaha i want to think of you being there with no pantes on that is hot,True
bethaneyizbored,lol ur bad,False
charlie_e44,ya i am,True
charlie_e44,you love it so what dose that make you,True
bethaneyizbored,i dunno,False
charlie_e44,i know you like that i told you to take them off,True
charlie_e44,dont you,True
bethaneyizbored,yes,False
charlie_e44,see your aa little slut,True
charlie_e44,i love it,True
charlie_e44,your so bad,True
bethaneyizbored,i never thout of myself as bad lol,False
charlie_e44,do you think someone is going to find out you have no pantes on,True
bethaneyizbored,i dont think so,False
charlie_e44,you are ready to fool around you are going to like it i bet,True
charlie_e44,wish i could see up your nighty,True
charlie_e44,so is your frend still crying,True
bethaneyizbored,shes writin a poem bout lovin him,False
charlie_e44,hahahhahaha,True
bethaneyizbored,shes not chattin rite now,False
charlie_e44,she has it bad,True
bethaneyizbored,she say shes gonna read it 2 me wehn she finishes,False
charlie_e44,were you like that too,True
bethaneyizbored,lol yeah if i get sad over a guy i get rely sad,False
bethaneyizbored,but i dontwrite poems r nothin cuz i dont know how lol,False
charlie_e44,ya so you never had a bf,True
bethaneyizbored,yeah i had a bf a coupla times,False
bethaneyizbored,we never did much tho,False
charlie_e44,so how far did you go with them,True
charlie_e44,did thay feel you up,True
bethaneyizbored,i kissed jake n taht wuz it,False
charlie_e44,did you want him to do more,True
bethaneyizbored,daniel n i kissed a lot but tehy never touch me,False
bethaneyizbored,yeah,False
charlie_e44,ya but did you want them to,True
charlie_e44,you are such a slut,True
charlie_e44,lol,True
bethaneyizbored,yeah i want tehm 2,False
bethaneyizbored,lol,False
charlie_e44,hahahahah,True
charlie_e44,well to bad for them your my little bitch now,True
bethaneyizbored,i wanna be yours,False
charlie_e44,thought you were mine,True
bethaneyizbored,i am,False
charlie_e44,i am going to make you mine and take it all,True
charlie_e44,just the way you like,True
charlie_e44,to bad her mom checks her puter we could let her see some vids,True
charlie_e44,lol i am bad,True
bethaneyizbored,yeah u r bad,False
bethaneyizbored,her mom checks n i dont wanna get my comp taken away,False
charlie_e44,be fun to see what she says lol,True
bethaneyizbored,nope,False
charlie_e44,how is your puter going to get taken,True
bethaneyizbored,cuz she wuld call my mom n tell her,False
charlie_e44,thay are frends,True
bethaneyizbored,well tehy arent like best friens but all moms talk 2 other moms,False
charlie_e44,huh in whos world,True
bethaneyizbored,well it sure seems so in mine lol,False
charlie_e44,hahahahah that sucks,True
bethaneyizbored,if i get n trouble at school tehn mom knowes bout it,False
charlie_e44,so how you going to get out for a long time then,True
bethaneyizbored,yeah it sux,False
bethaneyizbored,cuz she goes outta town with her bf somtimes,False
bethaneyizbored,im not sposed 2 tell,False
charlie_e44,is he marred,True
bethaneyizbored,no,False
bethaneyizbored,but seh dont want people knowin im here alone but seh dont wanna pay a sitter r somethin,False
charlie_e44,then y are thay not together every weekend,True
bethaneyizbored,i dunno,False
bethaneyizbored,tehy like 2 go places without me i gues,False
charlie_e44,bet he is marred,True
bethaneyizbored,maybe i dunno,False
bethaneyizbored,i didnt ask lol,False
charlie_e44,bet he is,True
charlie_e44,that is y thay talk on the phone and shit,True
bethaneyizbored,o okay,False
bethaneyizbored,i dont know,False
charlie_e44,hahaahha,True
charlie_e44,your mom is wild too,True
charlie_e44,bet she likes to be spanked,True
charlie_e44,hahahahahahahh,True
