User,Text,Groom
charlotte,russe i hide it so my aunt wuldnt find it,False
charlotte,russe now i caint find it lol,False
daddy_needs_slave,geez,True
charlotte,russe srry,False
charlotte,russe,False
daddy_needs_slave,u want it,True
charlotte,russe ya,False
charlotte,russe i wont loose it agin lol,False
daddy_needs_slave,785 577 0837,True
charlotte,russe k got it lol,False
charlotte,russe i put it undr my mattres so i dont loose it,False
charlotte,russe lol,False
daddy_needs_slave,what else is under your matress,True
charlotte,russe nuttin cept my diary,False
daddy_needs_slave,how bad u want to see me this weekend,True
charlotte,russe itd be relly kewl,False
daddy_needs_slave,for how,True
charlotte,russe i dont care my aunt aint gonna be bck til somtime mon morn,False
daddy_needs_slave,how long u wanna be,True
charlotte,russe lol dont mattr to me how long u wanna stay,False
daddy_needs_slave,u going to be naked whole time i am,True
charlotte,russe i can mite get kinda cold tho lol,False
daddy_needs_slave,what if i want u naked the whole time,True
charlotte,russe i could do that lol,False
daddy_needs_slave,at least topless,True
charlotte,russe k,False
daddy_needs_slave,those lil nipples will be hard the whole,True
charlotte,russe lol,False
daddy_needs_slave,u have any hair down,True
charlotte,russe vry lil,False
daddy_needs_slave,can u shave it,True
charlotte,russe u want me to,False
daddy_needs_slave,yes,True
charlotte,russe k i will,False
daddy_needs_slave,i dont like any hair,True
charlotte,russe k,False
charlotte,russe but i aint gonna do that less u r comin,False
daddy_needs_slave,u call me tomorrow night and i will,True
charlotte,russe k kewl,False
charlotte,russe lik what time u want me to call,False
daddy_needs_slave,and where do u want me to,True
charlotte,russe lol wherevr,False
daddy_needs_slave,on your,True
charlotte,russe sur aint nevr had that befor,False
daddy_needs_slave,wont cum in you,True
charlotte,russe k,False
charlotte,russe i dont want no babies so thats kewl,False
daddy_needs_slave,call a lil after 5,True
charlotte,russe k,False
daddy_needs_slave,and if i dont hear from u i am not going to come,True
charlotte,russe k i wil call,False
charlotte,russe u not jus teasin rite,False
daddy_needs_slave,no,True
daddy_needs_slave,are,True
charlotte,russe k,False
charlotte,russe nooooo,False
charlotte,russe i wanna see ya,False
daddy_needs_slave,u want to get,True
charlotte,russe ya i wanna do all the stuf we talkd bout,False
daddy_needs_slave,cant invite any of your friends over then,True
charlotte,russe k i wont lol,False
daddy_needs_slave,unless one of them wants sex too,True
charlotte,russe nooo i aint tellin em nuttin,False
daddy_needs_slave,brb phone with brother,True
charlotte,russe k,False
daddy_needs_slave,ok back,True
charlotte,russe k wb,False
daddy_needs_slave,my brother is in the navy in australia,True
charlotte,russe wow thats kewl,False
daddy_needs_slave,and he is in washington dc right now,True
charlotte,russe kewl,False
daddy_needs_slave,yeah he is way up there in command,True
charlotte,russe thats awsome,False
daddy_needs_slave,almost an admiral,True
charlotte,russe wow,False
daddy_needs_slave,has lots of,True
charlotte,russe kewl lol,False
daddy_needs_slave,how late u gonna stay up when aunt is,True
charlotte,russe til i get relly sleepy lol,False
daddy_needs_slave,well what if i came down tomorrow night,True
charlotte,russe thatd be kewl,False
daddy_needs_slave,would u like that,True
charlotte,russe ya itd be fun,False
daddy_needs_slave,and how u gonna answer the,True
charlotte,russe in my skirt an cami less its freezin lol,False
daddy_needs_slave,what if it is,True
charlotte,russe idk mite not wear a skirt lol,False
charlotte,russe if thats ok but only if its lik freezin,False
charlotte,russe i can change aftr u get here,False
daddy_needs_slave,like when i get,True
charlotte,russe ya,False
daddy_needs_slave,no bra,True
charlotte,russe that way i dont freez openin the door,False
charlotte,russe right,False
daddy_needs_slave,u gonna be nippin,True
charlotte,russe lol ya,False
daddy_needs_slave,what kind of panties do u wear,True
charlotte,russe i gots bikini an i got 3 new thongs 2day,False
daddy_needs_slave,what color thong,True
charlotte,russe i got 2 black ones an a red one,False
daddy_needs_slave,wear the black one,True
charlotte,russe k,False
daddy_needs_slave,what size boobs again,True
charlotte,russe 30 b,False
daddy_needs_slave,nice and perky,True
charlotte,russe ya,False
daddy_needs_slave,oh and i will tell dont like a lot of light,True
charlotte,russe kewl,False
daddy_needs_slave,low dim lights,True
charlotte,russe k thats kewl,False
daddy_needs_slave,u have a big,True
charlotte,russe its a full bed,False
daddy_needs_slave,bif enough for,True
daddy_needs_slave,big,True
charlotte,russe i think so ya,False
charlotte,russe nevr had 2 in it befor lol,False
daddy_needs_slave,u wanna sleep tight to,True
charlotte,russe wel ya next to ya,False
daddy_needs_slave,fall asleep in my arms naked,True
charlotte,russe thatll be fun,False
daddy_needs_slave,with your cute lil butt up against me,True
charlotte,russe lol k,False
daddy_needs_slave,do u,True
charlotte,russe noooo do u lol,False
daddy_needs_slave,i might,True
daddy_needs_slave,use to not to,True
daddy_needs_slave,untill i had my nose and cheek bones crushed,True
charlotte,russe k if u do i jus put pillo ovr my head lol,False
charlotte,russe ouch howd u do that,False
daddy_needs_slave,i help a race team,True
daddy_needs_slave,and was changing a tire on the back and the driver started the car and it was in gear and the impact wrench me,True
charlotte,russe omg,False
daddy_needs_slave,my nose was almost over by my ear,True
charlotte,russe omg but ur ok now rite,False
daddy_needs_slave,yeah,True
daddy_needs_slave,just snore now and,True
charlotte,russe lol,False
charlotte,russe when u get hurt,False
daddy_needs_slave,took 4 surgeries to get me back,True
charlotte,russe geeze,False
daddy_needs_slave,2 summers ago,True
charlotte,russe wow glad ur ok now,False
daddy_needs_slave,and went to the hospital and got stitched up and went right back to the race track,True
charlotte,russe geeze i wulda stayd away from races,False
daddy_needs_slave,couldnt do anything else with my nose or cheeks until all the swelling went away which was about 2 weeks later,True
daddy_needs_slave,i never missed a race and only 4 days of work for the surgeries,True
charlotte,russe geeze u must be relly strong to take all that pain,False
daddy_needs_slave,or,True
charlotte,russe nah u aint dum,False
daddy_needs_slave,ahhh u like me,True
charlotte,russe ya i do is that bad,False
daddy_needs_slave,no,True
charlotte,russe kewl,False
daddy_needs_slave,to bad u werent older so i could bring you home with me,True
charlotte,russe wow thatd be kewl,False
daddy_needs_slave,yes it would,True
daddy_needs_slave,would love someone like u to live with me,True
charlotte,russe awww id luv it to then i wuldnt hafta liv wit my aunt nemore,False
daddy_needs_slave,yeah,True
daddy_needs_slave,would u be my lil sex slave,True
charlotte,russe hmm do what u want me 2 uhhhh duh ya lol,False
daddy_needs_slave,would u like that,True
charlotte,russe ya lol,False
daddy_needs_slave,i would treat u right though,True
charlotte,russe thats kewl,False
daddy_needs_slave,i am not abusive,True
daddy_needs_slave,dont beleive in that shit,True
charlotte,russe k,False
charlotte,russe thats good cuz i aint into gettin hit,False
daddy_needs_slave,a guy should never ever hit a girl,True
charlotte,russe,False
daddy_needs_slave,just spank her lil,True
charlotte,russe lol long as its lil spanks its kewl,False
daddy_needs_slave,for pleasure,True
charlotte,russe k,False
daddy_needs_slave,u like to,True
charlotte,russe ya who dont lol,False
daddy_needs_slave,good,True
daddy_needs_slave,like to use your,True
charlotte,russe ya lol,False
daddy_needs_slave,i am going to get you lo like girls too,True
daddy_needs_slave,to,True
charlotte,russe lol idk we gotta see bout that,False
daddy_needs_slave,oh that is so hot,True
charlotte,russe k,False
daddy_needs_slave,u said do what i want you to,True
charlotte,russe ya i wil,False
daddy_needs_slave,can i bring my camera,True
charlotte,russe ya if u wanna,False
daddy_needs_slave,will u be camera,True
charlotte,russe no long as u aint gonna shar the pics wit ne one,False
daddy_needs_slave,i would never do that,True
charlotte,russe k kewl then,False
daddy_needs_slave,i want some of u on your hands and knees,True
charlotte,russe k,False
daddy_needs_slave,u know i like that,True
charlotte,russe ya u said u lik it that way,False
daddy_needs_slave,can u cook,True
charlotte,russe ya my aunt taught me,False
daddy_needs_slave,good so u gonna feed me when i am there,True
charlotte,russe lol ya,False
daddy_needs_slave,and then u are the dessert,True
charlotte,russe lol thatll be fun,False
daddy_needs_slave,got any whip,True
charlotte,russe umm idk i can look,False
charlotte,russe i got lotsa choc bars,False
daddy_needs_slave,lol,True
charlotte,russe what kinda choc u talkin bout lol,False
daddy_needs_slave,syrup,True
charlotte,russe o u meen the ice cream kind lol ya i got that,False
daddy_needs_slave,yeah,True
daddy_needs_slave,u like,True
charlotte,russe i luv choc,False
daddy_needs_slave,u can put it on my cock,True
charlotte,russe wont that be lik relly messy lol,False
daddy_needs_slave,u get to lick it off,True
charlotte,russe oo kewl,False
daddy_needs_slave,u like choc that,True
charlotte,russe ya its lik my fav food,False
charlotte,russe it should be its own food group lol,False
daddy_needs_slave,well u can put it on my cock the,True
daddy_needs_slave,then,True
charlotte,russe kewl,False
daddy_needs_slave,will be fun,True
charlotte,russe ya its gonna be hella kewl,False
daddy_needs_slave,u ready to go atw,True
charlotte,russe ya lol,False
daddy_needs_slave,have u been thinking about it,True
charlotte,russe ya,False
daddy_needs_slave,u excited,True
charlotte,russe ya relly excitd jus hope u aint jus playin,False
daddy_needs_slave,hope u aint,True
charlotte,russe i aint,False
daddy_needs_slave,good,True
charlotte,russe i relly caint wait to get to see ya in person,False
daddy_needs_slave,u ready to,True
charlotte,russe ya,False
daddy_needs_slave,sweet,True
charlotte,russe ur sweet too lol,False
daddy_needs_slave,ok well i will be waiting for your call,True
charlotte,russe k i will call bout 5 tomm,False
daddy_needs_slave,if i dont answer keep trying back,True
charlotte,russe k,False
charlotte,russe y u not gonna answr,False
daddy_needs_slave,might still be working,True
daddy_needs_slave,i dont know,True
daddy_needs_slave,but hope to be off by 5,True
charlotte,russe k,False
daddy_needs_slave,well i think i am going to go to bed,True
charlotte,russe awww ok,False
daddy_needs_slave,tired,True
charlotte,russe k,False
charlotte,russe,False
daddy_needs_slave,will be waiting on your call,True
charlotte,russe k,False
charlotte,russe luv ya,False
daddy_needs_slave,hi sexy hope u call me really want to come see u,True
daddy_needs_slave,hey u,True
daddy_needs_slave,out of school,True
daddy_needs_slave,are u going to talk to me,True
charlotte,russe hiya srry,False
daddy_needs_slave,how are u,True
charlotte,russe im k,False
daddy_needs_slave,your aunt gone yet,True
charlotte,russe ya,False
daddy_needs_slave,i am not going to make it tonight,True
daddy_needs_slave,have to work for a couple hours in the morning and then can leave,True
charlotte,russe awww y not,False
charlotte,russe ohhh ok,False
daddy_needs_slave,sorry,True
charlotte,russe umm im not gonna be here til lik 2 that ok,False
charlotte,russe tomm lik round 2,False
daddy_needs_slave,what are you going to be,True
daddy_needs_slave,u going to see some other,True
charlotte,russe im goin to a gfs hous tonite,False
daddy_needs_slave,well what if i came tonight,True
charlotte,russe i wulda been home lol,False
daddy_needs_slave,what time u gonna go there,True
charlotte,russe im gonna leav here bout 5 i think,False
daddy_needs_slave,ummmmm when u gonna call,True
charlotte,russe ill stil call ya lol ill call befor i go,False
daddy_needs_slave,can u call me now,True
daddy_needs_slave,in about 5 minutes,True
charlotte,russe ya i gotta find the dang phon reel quik,False
daddy_needs_slave,tell me whn u have it,True
charlotte,russe k,False
daddy_needs_slave,my phone is in my truck so i have to go out and get it,True
daddy_needs_slave,i need to get off here and go back to work anyways,True
charlotte,russe oh so i jus call ya round 5 lik we said,False
daddy_needs_slave,no,True
daddy_needs_slave,in about 5 minutes,True
daddy_needs_slave,i have about a 20 minute drive back to my job,True
daddy_needs_slave,did u find the phone,True
charlotte,russe lookin brb,False
daddy_needs_slave,damn how can u lose the phone,True
daddy_needs_slave,here is my number again 785 577 need to get back to work so call me when u get the better hear from you if u want to see me tomorrow,True
daddy_needs_slave,i will be waiting for your call,True
charlotte,russe ok,False
daddy_needs_slave,u find,True
charlotte,russe ya one sec wil call,False
daddy_needs_slave,ok hurry babe,True
charlotte,russe k i gotta sign off,False
daddy_needs_slave,ok want you to call me so i can come tomorrow,True
charlotte,russe k signin off,False
daddy_needs_slave,i am leaving here now too so hurry and call,True
daddy_needs_slave,hurry babe,True
daddy_needs_slave,785 577 0837,True
daddy_needs_slave,waiting,True
daddy_needs_slave,hurry up,True
daddy_needs_slave,u havent signed off yet,True
daddy_needs_slave,ok guess if you dont call you dont want me to come tomorrow,True
daddy_needs_slave,got to go now so call me,True
charlotte,russe srry my phon battry died lol im chargin it,False
daddy_needs_slave,hey u hung up on me,True
charlotte,russe srry my battry died,False
daddy_needs_slave,u gonna call me back,True
charlotte,russe ill try aftr the phon charges,False
charlotte,russe lol k i wil,False
daddy_needs_slave,didnt you like talking to,True
charlotte,russe ya u sounded cute,False
daddy_needs_slave,and so did u,True
charlotte,russe awww ty,False
daddy_needs_slave,u sounded sweet and sexy,True
charlotte,russe so u gonna visit sense i calld ya lik u said,False
daddy_needs_slave,when u call me back,True
charlotte,russe awww thats cheatin lol,False
daddy_needs_slave,no it didnt even talk 5 minutes,True
charlotte,russe ya srry i jus hafta use my callin card membr an i gotta watch my mins 2,False
daddy_needs_slave,i will take ya to buy another one,True
charlotte,russe kewl,False
daddy_needs_slave,so dont worry about that,True
charlotte,russe k,False
daddy_needs_slave,i dont even know where you live though,True
charlotte,russe ya i kno cuz u aint said u r gonna yet,False
daddy_needs_slave,when u call me back,True
charlotte,russe idk aftr my phon charges,False
daddy_needs_slave,how long does that been almost 2 hrs,True
charlotte,russe srry it hasnt chargd all nite lol,False
daddy_needs_slave,well they dont take much more than 2 hrs,True
charlotte,russe lol,False
daddy_needs_slave,doesnt sound like you are to interested,True
charlotte,russe ya u jus cheatin tho,False
daddy_needs_slave,how,True
charlotte,russe cuz last nite u said ud come ovr if i calld now u want me 2 call agin,False
daddy_needs_slave,well wedidnt even talk 5,True
charlotte,russe i kno but my phon died but lest i calld ya,False
daddy_needs_slave,and i do want to come over but want to talk a lil more than 5 minutes on the phone,True
charlotte,russe k lik how long u wanna talk cuz i aint got alot of mins on my card,False
daddy_needs_slave,10 minutes or i want you to save a lil for when i am on my way tomorrow so u can call me and see where i am at,True
charlotte,russe i only got lik 8 mins left on it aftr callin ya,False
charlotte,russe i use it to call my frends in mo,False
daddy_needs_slave,well that sucks,True
daddy_needs_slave,always somethin,True
charlotte,russe wel geeze im srry,False
daddy_needs_slave,here is a calling card i if there is any minutes left on it,True
daddy_needs_slave,u have to call 1 800 487 7646 first,True
daddy_needs_slave,then the pin number is 1237 5852 0621,True
daddy_needs_slave,did u get that,True
charlotte,russe ya tryin to see if my phon wil work yet,False
charlotte,russe im gonna go to the stor an get a new card caint get urs to work,False
daddy_needs_slave,when,True
charlotte,russe im gonna go now so i can call ya agin k,False
charlotte,russe cuz i relly wanna see u,False
daddy_needs_slave,ok u get one then when i come there i will get you another one,True
charlotte,russe k kewl but u not gonna say u stil wanna talk befor u come r ya lol,False
daddy_needs_slave,are u gonna call me back after u,True
charlotte,russe ya,False
daddy_needs_slave,well then ya,True
daddy_needs_slave,i really want to see u too,True
daddy_needs_slave,but want to talk a lil more than 5 minutes,True
charlotte,russe k i jus dont wanna get a new card then u say u stil not comin,False
daddy_needs_slave,i will come,True
charlotte,russe k,False
daddy_needs_slave,u just call me,True
charlotte,russe k i wil gotta go get a card tho,False
daddy_needs_slave,and why do u really really want to see,True
charlotte,russe duh so we can do all the stuf we talkd bout,False
daddy_needs_slave,u ready to go all the way,True
charlotte,russe ya,False
daddy_needs_slave,u feelin,True
charlotte,russe kinda ya,False
daddy_needs_slave,hope its more than kinda when i get there,True
charlotte,russe it wil be when ur here lol,False
charlotte,russe k im gonna go get a card k,False
daddy_needs_slave,ok then when u call me back u can give me your addy,True
charlotte,russe k,False
charlotte,russe bck in a bit,False
charlotte,russe hiya im bck lol,False
daddy_needs_slave,ok,True
charlotte,russe k lemme go to the bthrm then i call lol,False
daddy_needs_slave,ok call cause i am going to get off here and go run some errands,True
charlotte,russe k,False
charlotte,russe gimme a min,False
daddy_needs_slave,talkto you in a few,True
daddy_needs_slave,ok,True
charlotte,russe im me when u bck k,False
charlotte,russe u bck yet,False
charlotte,russe so y u not answrin me,False
daddy_needs_slave,i am back,True
daddy_needs_slave,u,True
charlotte,russe ya,False
daddy_needs_slave,u hung up again,True
charlotte,russe srry ran outta mins agin lol could only get a small card,False
daddy_needs_slave,didnt it tell u that u were about out of,True
charlotte,russe no it was bein a pain,False
charlotte,russe lol,False
daddy_needs_slave,didnt u see i called u back,True
charlotte,russe no didnt notice,False
charlotte,russe im srry relly,False
daddy_needs_slave,well i left a message on your answering machine,True
charlotte,russe oh kewl lol,False
daddy_needs_slave,so u better erase it before aunt gets home,True
charlotte,russe i wil thnx,False
daddy_needs_slave,no problem,True
charlotte,russe so u find out how long its gonna take u to get here tomm,False
daddy_needs_slave,going to here in a few,True
charlotte,russe kewl,False
daddy_needs_slave,u want me to hurry and get there dont u,True
charlotte,russe ya duh im gettin excitd to get to see u now aftr talkin earlir,False
daddy_needs_slave,duh,True
daddy_needs_slave,lol,True
charlotte,russe lol,False
charlotte,russe y u aint excotd,False
charlotte,russe excitd lol,False
daddy_needs_slave,yeah,True
charlotte,russe lol,False
daddy_needs_slave,how come u are invisible,True
charlotte,russe oh dang srry lol,False
charlotte,russe i aint invis lol,False
daddy_needs_slave,u hidin from,True
charlotte,russe says im onlin,False
charlotte,russe no lol,False
daddy_needs_slave,shows u offline on my end,True
charlotte,russe dang yahell,False
daddy_needs_slave,its cool,True
daddy_needs_slave,i know u are here,True
charlotte,russe u was showin offlin earlir when we chattd lol,False
charlotte,russe ya im here,False
daddy_needs_slave,wish u were here,True
charlotte,russe wish u was here alredy lol,False
daddy_needs_slave,u horny,True
charlotte,russe ya a lil,False
daddy_needs_slave,cool,True
charlotte,russe u aint playin rite u stil gonna come,False
daddy_needs_slave,not playin,True
charlotte,russe thats what i askd lol,False
daddy_needs_slave,what do u mean,True
charlotte,russe i meen u aint teasin ur gonna come see me rite,False
daddy_needs_slave,yes,True
daddy_needs_slave,i am eating,True
charlotte,russe yummy lol,False
daddy_needs_slave,why u so worried i am not going to come,True
charlotte,russe idk u jus dont seem as excitd as me lol,False
daddy_needs_slave,has there been some other guy that said he was going to come see u and never,True
charlotte,russe noooo i dont jus chat wit evryone lol,False
daddy_needs_slave,have u ever been interested in someone that u wanted to meet them,True
charlotte,russe not onlin lik this nooo,False
daddy_needs_slave,so i am the,True
charlotte,russe ya geeze what u think i chat wit evryone,False
daddy_needs_slave,idk,True
daddy_needs_slave,geez,True
charlotte,russe no i got u sayin idk lol,False
charlotte,russe now i meen,False
daddy_needs_slave,maybe,True
charlotte,russe,False
daddy_needs_slave,oh bite me,True
charlotte,russe caint u aint here yet lol,False
daddy_needs_slave,and u would if i,True
charlotte,russe not hard lol,False
daddy_needs_slave,ok,True
daddy_needs_slave,how long u been chatin online,True
charlotte,russe idk lik 2 yrs off an on,False
charlotte,russe y,False
daddy_needs_slave,just askin,True
charlotte,russe i jus usully chat wit my frends from school,False
daddy_needs_slave,u have,True
daddy_needs_slave,lol,True
charlotte,russe ya duh what u think im wierd an aint got ne frends,False
charlotte,russe,False
daddy_needs_slave,i was joking,True
daddy_needs_slave,duh,True
charlotte,russe i kno lol,False
daddy_needs_slave,shush,True
daddy_needs_slave,lol,True
charlotte,russe u gonna see how far it is,False
daddy_needs_slave,after done with icecream,True
charlotte,russe lol yummy,False
daddy_needs_slave,icecream with strawberries and choc,True
charlotte,russe yummmmy i luv choc,False
daddy_needs_slave,most girls do,True
daddy_needs_slave,like shopping,True
charlotte,russe lol ya,False
daddy_needs_slave,so when is your aunt going to let u move out,True
charlotte,russe idk nevr askd her lol,False
daddy_needs_slave,so u can live with me,True
charlotte,russe thatd be kewl,False
daddy_needs_slave,u think u would,True
charlotte,russe i think so but wil see aftr i see ya lol,False
daddy_needs_slave,whats that mean,True
charlotte,russe well see if u stil lik me by time im 18 lol thats a long way off stil,False
daddy_needs_slave,i thought u meant u might not like what u see when i get there and not let me in,True
charlotte,russe noooooooo,False
daddy_needs_slave,how many people u talking to,True
charlotte,russe 0 sides u,False
charlotte,russe lol,False
daddy_needs_slave,well u are slow to respond,True
charlotte,russe srry lol,False
charlotte,russe was checkin my mail,False
daddy_needs_slave,whats your email,True
charlotte,russe charlotte,False
charlotte,russe u gonna mail me lol,False
daddy_needs_slave,maybe,True
charlotte,russe kewl lol,False
daddy_needs_slave,how long have u had this name,True
daddy_needs_slave,cause u havent been 14 all that long,True
charlotte,russe umm not vry long sense lik nov i think cuz i made a new one so my aunt wuldnt see what one i am on,False
daddy_needs_slave,oh so u have more than,True
charlotte,russe no not nemore no,False
daddy_needs_slave,but she knows u chat right,True
charlotte,russe ya she knos,False
charlotte,russe she dont relly care bout it,False
daddy_needs_slave,has she seen your friends,True
charlotte,russe noooo,False
charlotte,russe geeze i dont wanna die lol,False
daddy_needs_slave,lol,True
charlotte,russe lol,False
daddy_needs_slave,ok so if u have no more minutes on your calling card how u going to see where i am at tomorrow,True
charlotte,russe i stil got the one i usd to cal ya the first time its got 8 mins on it,False
daddy_needs_slave,well i have your number too if u answer the darn phone,True
charlotte,russe lol srry bout that,False
daddy_needs_slave,yeah yeah,True
charlotte,russe,False
daddy_needs_slave,u can use that tongue tomorrow,True
charlotte,russe kewl,False
daddy_needs_slave,if u know how,True
charlotte,russe ya ya tole ya i done that befor lol,False
daddy_needs_slave,u said u just sucked it though,True
charlotte,russe wel ya but its not that much diff is it,False
daddy_needs_slave,put some choc on it,True
charlotte,russe lol yummy,False
daddy_needs_slave,how long has it been since u gave a bj,True
charlotte,russe lik 4 months now i think,False
daddy_needs_slave,to long,True
charlotte,russe ya lol,False
daddy_needs_slave,u ready,True
charlotte,russe ya i am,False
daddy_needs_slave,u dont have to shave if u dont want,True
daddy_needs_slave,u can wait till i get there,True
charlotte,russe it dont mattr aint much there lol,False
daddy_needs_slave,ok i wanna see,True
charlotte,russe wanna see what me shave,False
daddy_needs_slave,yeah,True
charlotte,russe k,False
charlotte,russe ill wait then,False
daddy_needs_slave,will u do that for me,True
charlotte,russe ya tole ya i wuld,False
daddy_needs_slave,ok checking directions now,True
charlotte,russe k,False
daddy_needs_slave,355 miles,True
charlotte,russe dang,False
charlotte,russe is that lik a long way,False
daddy_needs_slave,about 5 hrs,True
charlotte,russe wow,False
charlotte,russe so if u leav bout 11 lik u said u be here round 4,False
daddy_needs_slave,probably around noon,True
charlotte,russe what leav there round noon,False
daddy_needs_slave,yeah,True
charlotte,russe so u be here round 5 then lol,False
daddy_needs_slave,yeah,True
charlotte,russe kewl,False
charlotte,russe i can make us somthin to eat for dinnr then,False
daddy_needs_slave,hope its worth the drive,True
charlotte,russe,False
daddy_needs_slave,u think i will want to eat when i get there and see u in a lil skirt and sexy,True
charlotte,russe no but aftr maybe lol,False
daddy_needs_slave,do u use lotion after a shower,True
