User,Text,Groom
daddy_needs_slave,damn u are pretty hot for 14,True
charlotte,russe aww ty,False
daddy_needs_slave,welcome,True
charlotte,russe asl,False
daddy_needs_slave,i am,True
charlotte,russe y u lol,False
daddy_needs_slave,cause that is old to you,True
charlotte,russe nah 80 is old,False
daddy_needs_slave,ur right,True
charlotte,russe jus cuz im 14 dont meen i think u old,False
charlotte,russe lol,False
daddy_needs_slave,cool,True
charlotte,russe so what ya doin,False
daddy_needs_slave,old enough to be your dad,True
daddy_needs_slave,lol,True
daddy_needs_slave,and doing nothing,True
charlotte,russe ucaint be my dad cuz ud be dead,False
daddy_needs_slave,oh sorry,True
charlotte,russe its k,False
daddy_needs_slave,i can play your,True
charlotte,russe aww thatd be kewl irelly mis my dad,False
daddy_needs_slave,oh i bet,True
charlotte,russe mom too tho,False
charlotte,russe i liv wit my aunt now,False
daddy_needs_slave,u like,True
charlotte,russe not relly but shes alli got left,False
charlotte,russe aww ty,False
daddy_needs_slave,welcome,True
charlotte,russe u got kids,False
daddy_needs_slave,no,True
charlotte,russe ohjus thoght ur sn meent u had kids,False
daddy_needs_slave,no,True
charlotte,russe thats kewl,False
charlotte,russe i dont want kids nithr,False
charlotte,russe lol,False
daddy_needs_slave,look at my profile and u will see what it means,True
charlotte,russe k goin to look,False
daddy_needs_slave,only a couple ways not to have kids,True
daddy_needs_slave,keep legs closed or good,True
charlotte,russe ur funny,False
daddy_needs_slave,well its true,True
charlotte,russe ya i gues so lol,False
charlotte,russe whos the chick on ur prof lol,False
daddy_needs_slave,some of the times condoms or the pil dont work,True
daddy_needs_slave,she is an ex of mine,True
charlotte,russe omg they dont work,False
daddy_needs_slave,what,True
charlotte,russe i thoght thats y they made em,False
daddy_needs_slave,why have u tried,True
charlotte,russe no but gots frends that hav,False
daddy_needs_slave,have heard of condoms that break and have heard girls getting prego when they were on the pill,True
charlotte,russe geeze that must suck bad,False
daddy_needs_slave,i bet it,True
charlotte,russe ya omg i wuld jus die,False
daddy_needs_slave,oh bull,True
daddy_needs_slave,u will change your mind one of theses days,True
charlotte,russe noway no babies forme,False
daddy_needs_slave,then keep legs,True
charlotte,russe lol,False
daddy_needs_slave,thats no fun either,True
daddy_needs_slave,lol,True
charlotte,russe lol,False
charlotte,russe so i gues u not marrid by lookin at ur prof lol,False
daddy_needs_slave,nope,True
charlotte,russe didnt think so lol,False
charlotte,russe brb,False
charlotte,russe k srry bck,False
charlotte,russe hadda let my kitty in,False
daddy_needs_slave,that was fast,True
charlotte,russe he jus wantd in my room,False
charlotte,russe lol,False
daddy_needs_slave,oh,True
daddy_needs_slave,i want a kitty in my room not a 4 legged,True
charlotte,russe what othr kind is there,False
daddy_needs_slave,think,True
daddy_needs_slave,whats another name for cat,True
charlotte,russe omg u meen lik what ur prof was talkin bout,False
charlotte,russe srry kinda slow somtimes lol,False
daddy_needs_slave,pussy kat,True
daddy_needs_slave,hehe,True
charlotte,russe lol,False
daddy_needs_slave,ok i know i am bad,True
charlotte,russe lol nah ur kewl,False
daddy_needs_slave,ty,True
charlotte,russe yw,False
daddy_needs_slave,good at being bad though,True
charlotte,russe lol thats ok to aint it,False
daddy_needs_slave,hell yeah,True
charlotte,russe kewl,False
daddy_needs_slave,but where the bad girls at,True
charlotte,russe huh what u meen,False
daddy_needs_slave,bad or naughty,True
charlotte,russe who me,False
daddy_needs_slave,no i was asking where the bad naughty girls at,True
charlotte,russe lol i dont get it srry,False
charlotte,russe lol srry,False
charlotte,russe i aint no angel lol,False
charlotte,russe i get in trubble somtimes,False
daddy_needs_slave,for doing what,True
charlotte,russe not doin what my aunt says an skippin skool somtimes,False
daddy_needs_slave,what do u do when u skip school,True
charlotte,russe go hang wit othr frends somtimes i jus come home tho an chat onlin,False
daddy_needs_slave,u need a,True
daddy_needs_slave,hehe,True
charlotte,russe hell no im too old to get spankd,False
daddy_needs_slave,no way,True
daddy_needs_slave,i like to give spankins,True
daddy_needs_slave,pleasure spankins that is,True
daddy_needs_slave,hehe,True
charlotte,russe ouch,False
charlotte,russe oh lik luv taps,False
daddy_needs_slave,nice lil pleasure spanks,True
charlotte,russe thats kewl i gues,False
daddy_needs_slave,yeah,True
charlotte,russe kewl,False
daddy_needs_slave,gues u have never done anything with a boy have you,True
charlotte,russe ya,False
charlotte,russe i usd to hang wit my ex til he startd bein a jerk,False
daddy_needs_slave,and what did u do with him,True
charlotte,russe all kindsa stuf,False
daddy_needs_slave,well i mean sexual,True
charlotte,russe oh wel umm i did a bj befor,False
daddy_needs_slave,on,True
charlotte,russe ya,False
charlotte,russe is that bad,False
daddy_needs_slave,did u like,True
charlotte,russe ya it was kewl,False
daddy_needs_slave,no its not bad,True
daddy_needs_slave,what did he do to you,True
charlotte,russe nuttin relly we jus kissd,False
daddy_needs_slave,did u want him to do anything,True
charlotte,russe idk not relly he was bein a jerk aftr,False
daddy_needs_slave,cause he got what he wanted,True
charlotte,russe i gues so we did that cupple times but that was all,False
daddy_needs_slave,and he was the one that wanted,True
charlotte,russe ya,False
daddy_needs_slave,see it was all about him,True
charlotte,russe ya thats y i said he was bein a jerk,False
daddy_needs_slave,thats boys for ya,True
charlotte,russe ya thats y we brok up,False
daddy_needs_slave,all boys are like that,True
daddy_needs_slave,men pleasure their girls,True
charlotte,russe that sux,False
charlotte,russe bout boys i meen,False
charlotte,russe lol,False
daddy_needs_slave,yeah boys only want the girls to pleasure them,True
charlotte,russe ya,False
daddy_needs_slave,and thats not right,True
charlotte,russe ya i kinda thoght it was meen,False
daddy_needs_slave,it is,True
charlotte,russe but oh wel its ovr now,False
daddy_needs_slave,did he like it,True
charlotte,russe ya said he did,False
charlotte,russe idk jus did what he said to,False
daddy_needs_slave,where did he cum,True
charlotte,russe moth,False
charlotte,russe mouth lol,False
daddy_needs_slave,did u like that,True
charlotte,russe ya it was kinda kewl,False
daddy_needs_slave,did u spit it out or swallow it,True
charlotte,russe he tole me to swallo,False
daddy_needs_slave,how old was he,True
charlotte,russe 17,False
daddy_needs_slave,and u never wanted to do anything else,True
charlotte,russe idk nevr thoght bout it aftr we brok up,False
daddy_needs_slave,what about when u were with him,True
charlotte,russe we nevr went atw but it wulda been kewl,False
daddy_needs_slave,what would you have like to done,True
charlotte,russe idk nevr did nuttin else so dont relly kno what there is,False
daddy_needs_slave,but i know you have talked about it with your friends,True
charlotte,russe ya cupple frends went atw befor,False
daddy_needs_slave,what is,True
charlotte,russe all the way lol,False
daddy_needs_slave,oh ok,True
charlotte,russe srry i jus hate spellin evrythin lol,False
daddy_needs_slave,its cool,True
charlotte,russe k,False
daddy_needs_slave,and there is more things then just going all the way,True
charlotte,russe relly thoght that was all ther was,False
daddy_needs_slave,no,True
charlotte,russe kewl,False
daddy_needs_slave,kissing a girl all over her hot body,True
charlotte,russe wow,False
daddy_needs_slave,licking and sucking and playing with her nipples,True
charlotte,russe kewl,False
daddy_needs_slave,rubbing fingering and licking her sweet lil pussy,True
charlotte,russe omg relly,False
daddy_needs_slave,oh yeah,True
daddy_needs_slave,thats called 4play,True
charlotte,russe kewl he tole me guys dont lik doin that stuf tho,False
daddy_needs_slave,sometimes so much more fun then just going all the way,True
charlotte,russe kewl,False
daddy_needs_slave,guys dont like doing what,True
charlotte,russe that stuf u was sayin to a girl,False
daddy_needs_slave,cause he is a boy,True
daddy_needs_slave,only want to get pleased instead of pleasing the girl,True
charlotte,russe oh,False
charlotte,russe lol,False
daddy_needs_slave,real men please the girl,True
charlotte,russe thats kewl,False
daddy_needs_slave,i would much rather please the girl and get her off,True
charlotte,russe wow kewl,False
daddy_needs_slave,i love playing with a hot girls body,True
charlotte,russe lol,False
daddy_needs_slave,well i do,True
charlotte,russe kewl,False
daddy_needs_slave,now what are u,True
charlotte,russe that my ex was a relly big jerk,False
charlotte,russe lol,False
daddy_needs_slave,how long were u with him,True
charlotte,russe 3 monhs,False
charlotte,russe months lol,False
daddy_needs_slave,how long were u dating when he wanted his first bj,True
charlotte,russe idk bout a month i think,False
daddy_needs_slave,were u nervous about it,True
charlotte,russe ya but he relly wantd to so i did,False
daddy_needs_slave,he was always the one that wanted it,True
charlotte,russe kinda i did to tho it was kewl,False
daddy_needs_slave,sweet,True
charlotte,russe lol,False
daddy_needs_slave,well u are a hottie thats for sure,True
charlotte,russe awww ty ur sweet,False
daddy_needs_slave,and he never even played with your boobs,True
charlotte,russe ya he lik touchd em but that was bout it,False
daddy_needs_slave,did u like,True
charlotte,russe ya that was kewl,False
daddy_needs_slave,did your nipples get hard,True
charlotte,russe ya a lil,False
daddy_needs_slave,damn i wouldnt have stopped,True
charlotte,russe wow relly thats kewl,False
daddy_needs_slave,cause u have a nice lil body too,True
charlotte,russe omg u think so ty,False
daddy_needs_slave,hell yes,True
daddy_needs_slave,i bet all the guys want you,True
charlotte,russe wow kewl,False
charlotte,russe lol boys i go to skool wit r so dum,False
daddy_needs_slave,lol,True
daddy_needs_slave,but i bet some want you,True
charlotte,russe idk if so they dont say,False
daddy_needs_slave,oh,True
charlotte,russe what lol,False
daddy_needs_slave,they dont flirt with,True
charlotte,russe somtimes but thats all they do,False
daddy_needs_slave,do u flirt with the boys,True
charlotte,russe nah they r jus stupid,False
daddy_needs_slave,lol,True
charlotte,russe im charlotte btw,False
daddy_needs_slave,and i am paul,True
charlotte,russe ntmu paul,False
charlotte,russe awww ty,False
daddy_needs_slave,anytime,True
charlotte,russe so u got ne pics,False
daddy_needs_slave,not yet,True
charlotte,russe aww k,False
daddy_needs_slave,had to redo my computer so dont have them on here yet,True
charlotte,russe k,False
daddy_needs_slave,but i am 160 pounds brn hair and blu eyes,True
charlotte,russe wow u soun hot,False
daddy_needs_slave,ty,True
charlotte,russe yw,False
daddy_needs_slave,where in ok are,True
charlotte,russe south okla,False
charlotte,russe u,False
daddy_needs_slave,south kansas,True
charlotte,russe omg lol,False
daddy_needs_slave,almost on the oklahoma border,True
charlotte,russe what ya doin in a okla room lol,False
charlotte,russe oh lol,False
daddy_needs_slave,i like to travel,True
charlotte,russe lol kewl,False
daddy_needs_slave,what are you doing in an oklahoma for,True
charlotte,russe jus chattin lol,False
daddy_needs_slave,and flirtin,True
charlotte,russe nah not relly,False
daddy_needs_slave,u can flirt with,True
charlotte,russe awww,False
daddy_needs_slave,do you have a lot of older guys that message,True
charlotte,russe somtimes jus to yell at me,False
daddy_needs_slave,lol,True
daddy_needs_slave,what do the others want,True
charlotte,russe most jus to tell me to get outta chat,False
charlotte,russe lol,False
charlotte,russe lik im breakin som kinda rule or somthin,False
daddy_needs_slave,oh i bet there are some that want more than that,True
charlotte,russe thers been a few that r lik relly gross i jus iggy em lol,False
daddy_needs_slave,and u havent iggied me yet,True
daddy_needs_slave,lol,True
charlotte,russe u aint been gross lol,False
daddy_needs_slave,well i dont like gross,True
charlotte,russe thats kewl me neithr,False
daddy_needs_slave,i just like to please,True
charlotte,russe kewl,False
daddy_needs_slave,in many ways,True
charlotte,russe lol,False
daddy_needs_slave,i like to take a girl shooping,True
daddy_needs_slave,and differnt places,True
charlotte,russe i luv shoppin,False
daddy_needs_slave,what girl,True
charlotte,russe dont lik shoppin wit my aunt much tho,False
daddy_needs_slave,why dont u like it with her,True
charlotte,russe she dont got good tast,False
daddy_needs_slave,she dont like u in skimpy,True
charlotte,russe no she jus thinks i outta be covrd head to toe lol,False
daddy_needs_slave,lol,True
daddy_needs_slave,is she,True
charlotte,russe somthings ya but othrs no,False
daddy_needs_slave,hehe,True
charlotte,russe kewl lol,False
daddy_needs_slave,spring or summer would be a little better when it was warmer out,True
charlotte,russe thats tru,False
daddy_needs_slave,get some sexy lil shorts,True
charlotte,russe i luv shorts,False
daddy_needs_slave,and a sexy lil top,True
charlotte,russe i lik cami s,False
daddy_needs_slave,dont know what those,True
charlotte,russe lol a lil top wit spaghtti straps,False
daddy_needs_slave,nice,True
charlotte,russe ya they r my fav,False
daddy_needs_slave,and some sexy lil panties,True
charlotte,russe lol ya,False
daddy_needs_slave,what size boobs,True
charlotte,russe 30 b,False
charlotte,russe is that bad,False
daddy_needs_slave,i like,True
charlotte,russe kewl,False
daddy_needs_slave,i like,True
charlotte,russe k,False
daddy_needs_slave,and i bet a nice lil butt too,True
charlotte,russe i think so lol,False
daddy_needs_slave,nice,True
charlotte,russe ty,False
daddy_needs_slave,anytime,True
charlotte,russe wanna add me i need to take my showr,False
daddy_needs_slave,need your back,True
charlotte,russe lol,False
daddy_needs_slave,thats not an answer,True
charlotte,russe if u wanna,False
charlotte,russe gonna be kinda hrd sense u not here,False
charlotte,russe lol,False
daddy_needs_slave,yeah but would u want me to,True
charlotte,russe if u wantd ya,False
daddy_needs_slave,was asking if u wanted,True
charlotte,russe lol i said ya,False
daddy_needs_slave,just dont drop the lol,True
charlotte,russe lol,False
daddy_needs_slave,things happen then,True
charlotte,russe what does,False
daddy_needs_slave,if u bent over to get it,True
charlotte,russe oh lol,False
charlotte,russe can i add u,False
daddy_needs_slave,do u want to,True
charlotte,russe yes,False
daddy_needs_slave,u must like me,True
daddy_needs_slave,lol,True
charlotte,russe ya i do,False
charlotte,russe is that bad,False
daddy_needs_slave,cool,True
daddy_needs_slave,depends if u wanna get bad,True
daddy_needs_slave,hehe,True
charlotte,russe lol,False
charlotte,russe u gonna let me add u cuz i gotta get in the showr,False
daddy_needs_slave,yes u can,True
charlotte,russe k ty,False
daddy_needs_slave,i need to get going too,True
daddy_needs_slave,are you on here,True
charlotte,russe ya most days,False
daddy_needs_slave,well i am usally on at night,True
charlotte,russe wel aftr skool,False
charlotte,russe lol,False
daddy_needs_slave,well after work for me which is after 6,True
charlotte,russe kewl,False
charlotte,russe we can chat mor then,False
daddy_needs_slave,if u want,True
charlotte,russe ya if u do too lol,False
daddy_needs_slave,well duh,True
daddy_needs_slave,lol,True
charlotte,russe kewl,False
charlotte,russe k i be bck latr then,False
daddy_needs_slave,k dont know if i will be tonight,True
charlotte,russe aww k,False
daddy_needs_slave,if it says idle by my name and u message me and i dont answer means i am not here,True
daddy_needs_slave,i wont ignore you,True
charlotte,russe k kewl,False
daddy_needs_slave,but sometimes i leave my computer on,True
charlotte,russe im alwasys on if im showin on too,False
charlotte,russe k,False
daddy_needs_slave,well have fun in the shower and think of me,True
charlotte,russe k dont forget me eithr,False
daddy_needs_slave,can i ask u a,True
charlotte,russe ya,False
daddy_needs_slave,do you shave down there,True
charlotte,russe i aint got much ther to shave,False
daddy_needs_slave,shaved is nice,True
charlotte,russe oh lol,False
daddy_needs_slave,yeah,True
charlotte,russe wel i jus got a lil,False
daddy_needs_slave,ok,True
charlotte,russe latr,False
daddy_needs_slave,bye sexy,True
daddy_needs_slave,ok back for a few,True
charlotte,russe what ya doin,False
daddy_needs_slave,nothin,True
daddy_needs_slave,what about u,True
charlotte,russe nuttin relly,False
charlotte,russe jus been studyin,False
daddy_needs_slave,fun fun,True
charlotte,russe not relly lol,False
daddy_needs_slave,are u pretty good in,True
charlotte,russe ya bs,False
daddy_needs_slave,want me to teach you a few,True
daddy_needs_slave,hehe,True
charlotte,russe lik what,False
daddy_needs_slave,what do u want to,True
charlotte,russe idk i got teachrs alredy,False
daddy_needs_slave,i mean things u cant be taught in school,True
charlotte,russe hmm,False
charlotte,russe what u wanna teach me,False
daddy_needs_slave,what its like for you to have multiple orgasms,True
charlotte,russe kewl aint nevr done that befor,False
daddy_needs_slave,do you get,True
daddy_needs_slave,do u get,True
charlotte,russe idk i think bout it somtimes,False
daddy_needs_slave,what do u think about,True
charlotte,russe lik jus guys u kno,False
charlotte,russe lol,False
daddy_needs_slave,oh tell me,True
daddy_needs_slave,guys and what,True
charlotte,russe lik y guys r jus jerks an wanna do some stuf but not othrs,False
daddy_needs_slave,what other stuff u,True
charlotte,russe i jus meen lik not only doin bj,False
daddy_needs_slave,u want,True
charlotte,russe wel ya somtime but idk kno evrythin lol,False
daddy_needs_slave,well tell me what you do know and what you would like to dont say idk,True
daddy_needs_slave,i know you talk about it with your girls,True
charlotte,russe lol we talk bout lotsa stuf som of my gfs hav gone atw,False
daddy_needs_slave,well what do you want to do or try,True
charlotte,russe lik i said idk what all ther is sides atw,False
daddy_needs_slave,you and your girls have never talked about other things,True
charlotte,russe i thoght that was all ther was,False
charlotte,russe not relly jus bout doin bjs an goin atw,False
daddy_needs_slave,did they like going atw,True
charlotte,russe they said it hurts the first time but then its k,False
daddy_needs_slave,and none have had been eaten,True
charlotte,russe idk they nevr said nethin bout that,False
daddy_needs_slave,oh u would like,True
charlotte,russe kewl,False
daddy_needs_slave,ever touch,True
charlotte,russe i tird that one time jus felt relly dum,False
daddy_needs_slave,did it feel good,True
charlotte,russe not relly jus dum,False
daddy_needs_slave,there is nothing wrong with it,True
charlotte,russe gues it aint my thing,False
daddy_needs_slave,guess i could teach you,True
charlotte,russe relly u kno how to do that,False
daddy_needs_slave,i could show u how,True
charlotte,russe how u gonna do that,False
daddy_needs_slave,by showing you how to do it,True
charlotte,russe thatd be kewl,False
daddy_needs_slave,would u let,True
charlotte,russe ya if u wantd to show me itd be kewl,False
daddy_needs_slave,how did you do it before,True
charlotte,russe i jus lik rubbd a lil,False
daddy_needs_slave,what did you rub,True
charlotte,russe the top jus a lil,False
daddy_needs_slave,top of what,True
charlotte,russe duh,False
daddy_needs_slave,did you spread it any,True
charlotte,russe eww no,False
daddy_needs_slave,its not ewwww,True
daddy_needs_slave,do you know where your clit,True
charlotte,russe no whats that,False
daddy_needs_slave,its like a little button on top right on the inside,True
daddy_needs_slave,thats what gets a girl off,True
charlotte,russe oh,False
daddy_needs_slave,do u ever get a lil wet down there,True
charlotte,russe ya somtimes,False
daddy_needs_slave,then you are horny,True
charlotte,russe oh thats what that is,False
daddy_needs_slave,and before a guy goes atw he should get a girl really wet,True
charlotte,russe oh,False
daddy_needs_slave,and does that by 4play,True
charlotte,russe kewl,False
daddy_needs_slave,so see i could teach you a lot,True
charlotte,russe ya sous lik it,False
charlotte,russe stil dont see how u gonna do that on here tho,False
daddy_needs_slave,yeah would be hard on here,True
charlotte,russe ya,False
daddy_needs_slave,but would you like to learn,True
charlotte,russe idk i jus aint relly into do that stuf to meself,False
daddy_needs_slave,i mean learn what its like for a guy to do it,True
charlotte,russe wel ya,False
daddy_needs_slave,u want to learn,True
charlotte,russe ya,False
daddy_needs_slave,so how we gonna do that,True
charlotte,russe idk how we can on here,False
daddy_needs_slave,kinda hard on here,True
charlotte,russe ya lol,False
daddy_needs_slave,guess u will have to invite me down there,True
charlotte,russe omg u relly wanna do that,False
daddy_needs_slave,u going to invite,True
charlotte,russe wel if u wanna come here u could,False
daddy_needs_slave,and tell me what you would like to do and learn,True
daddy_needs_slave,tell me all babe,True
charlotte,russe what we been talkin bout,False
daddy_needs_slave,oh come on tell want to hear it from you,True
daddy_needs_slave,dont be shy,True
charlotte,russe srry im jus kinda shy bout it,False
daddy_needs_slave,dont be shy just tell me,True
charlotte,russe how to hav orgasm,False
daddy_needs_slave,what else,True
charlotte,russe idk geeze,False
charlotte,russe tole ya i aint nevr done much,False
daddy_needs_slave,ever heard of,True
charlotte,russe whats that,False
daddy_needs_slave,when a guy lays on his back and the girl gets on top of him and spreads on his face and he licks her as she is giving him a bj,True
charlotte,russe omg didnt kno u could do that,False
daddy_needs_slave,its great,True
charlotte,russe kewl,False
daddy_needs_slave,and what would u like to do to me,True
charlotte,russe ur the guy so whatevr u tole me to,False
daddy_needs_slave,did u play with his dick or just suck it,True
charlotte,russe jus suckd,False
daddy_needs_slave,so he was already,True
charlotte,russe no but he got that way,False
daddy_needs_slave,so u got him hard by sucking on it,True
charlotte,russe ya,False
charlotte,russe y is that not good,False
daddy_needs_slave,yeah,True
daddy_needs_slave,but will teach u how to play with it,True
charlotte,russe kewl,False
charlotte,russe hey u gonna be on tomm cuz i gotta go to bed,False
daddy_needs_slave,yeah,True
charlotte,russe kewl latr then,False
daddy_needs_slave,can u get out at night on a,True
charlotte,russe my aunt goes outta town on weeknds somtimes,False
daddy_needs_slave,u home alone,True
charlotte,russe ya most times,False
daddy_needs_slave,u the only kid,True
charlotte,russe ya jus me an my aunt,False
daddy_needs_slave,so wanna make plans,True
charlotte,russe sur gotta go to bed now tho,False
daddy_needs_slave,ok nite and sweet dreams,True
charlotte,russe nite nite,False
daddy_needs_slave,gonna give me a kiss before u,True
charlotte,russe,False
daddy_needs_slave,ty sexy,True
charlotte,russe yw nite,False
daddy_needs_slave,wanna be my lil,True
charlotte,russe ya kewl,False
charlotte,russe hey u said if it showd u on ud chat wit me,False
daddy_needs_slave,hi there,True
charlotte,russe lol hiya,False
daddy_needs_slave,sorry was putting some food in microwave,True
charlotte,russe oh srry,False
daddy_needs_slave,i am hungry,True
charlotte,russe lol me too i need to fine som food,False
daddy_needs_slave,so whats up,True
charlotte,russe nuttin jus bord an done my homework alredy,False
daddy_needs_slave,its friday,True
daddy_needs_slave,school isnt till monday,True
charlotte,russe ya but wantd to get it outta the way so i gots the weeknd to chat,False
daddy_needs_slave,not hanging with the girls this,True
charlotte,russe nah my aunts raggin,False
daddy_needs_slave,that sucks,True
charlotte,russe ya but shes gonna be gone nex weeknd so i gues bettr this week then nex lol,False
daddy_needs_slave,lol,True
daddy_needs_slave,where does she go,True
charlotte,russe shes goin to cali,False
daddy_needs_slave,oh,True
daddy_needs_slave,so look out charlotte will be on the loose,True
charlotte,russe lol ya,False
daddy_needs_slave,u stay at home when she is,True
charlotte,russe ya,False
charlotte,russe less shes gonna be gone lik a week,False
daddy_needs_slave,does she call and check on you all the time,True
charlotte,russe but this time she only bein gone til lik sun nite,False
charlotte,russe she usuly calls once a day,False
daddy_needs_slave,ic,True
daddy_needs_slave,so u pretty much do what you want,True
charlotte,russe ya long as i dont tear up the hous,False
charlotte,russe lol,False
daddy_needs_slave,do you have friends over,True
charlotte,russe ya somtimes i do,False
daddy_needs_slave,cool,True
charlotte,russe ya i lik it when shes gone lol,False
daddy_needs_slave,so she pretty much trusts you,True
charlotte,russe ya she knos i wont burn the hous down,False
daddy_needs_slave,well thats good,True
charlotte,russe ya lol,False
daddy_needs_slave,so did u think of anything fun today,True
charlotte,russe ya thoght bout gettin the heck outta skool an gettin home to chat,False
daddy_needs_slave,who all do u chat with,True
charlotte,russe,False
daddy_needs_slave,if i am slow its cause i am eating,True
charlotte,russe thats ok i think im gonna see what i can fine to eat too,False
charlotte,russe brb,False
charlotte,russe k srry bck,False
daddy_needs_slave,welcum back,True
charlotte,russe ty,False
daddy_needs_slave,anytime,True
charlotte,russe awww ur jus so sweet,False
