User,Text,Groom
daddy_needs_slave,i am not going to get mad,True
charlotte,russe good lol,False
daddy_needs_slave,so u want to,True
charlotte,russe ya it souns kewl,False
daddy_needs_slave,u will like,True
charlotte,russe k,False
daddy_needs_slave,so when you get horny at night you will know what to do,True
charlotte,russe kewl,False
daddy_needs_slave,and u want to learn to play with a,True
charlotte,russe ya u said u wuld show me that,False
daddy_needs_slave,will teach you anything u want to know,True
charlotte,russe kewl,False
charlotte,russe i gotta go aunts yellin its bedtime,False
charlotte,russe ill be on tomm an wil let ya kno when she leavs,False
daddy_needs_slave,u have a bedtime on,True
charlotte,russe ya when shes bitchy,False
daddy_needs_slave,damn,True
charlotte,russe k i chat tomm k,False
charlotte,russe,False
daddy_needs_slave,u always forget,True
charlotte,russe nite,False
daddy_needs_slave,bad girl,True
charlotte,russe srry lol i wil try an membr,False
daddy_needs_slave,bye,True
charlotte,russe nite,False
charlotte,russe im here wher u at,False
daddy_needs_slave,whats up,True
daddy_needs_slave,never got what you window went blank,True
charlotte,russe said heya what ya doin lol,False
daddy_needs_slave,just got home,True
charlotte,russe dang u musta hadda work lots today,False
daddy_needs_slave,dont work on sunday,True
charlotte,russe oh,False
daddy_needs_slave,was with a friend all day then went to parents for dinner tonight,True
charlotte,russe kewl hav fun,False
daddy_needs_slave,yeah,True
daddy_needs_slave,what did u do today,True
charlotte,russe went wit my aunt,False
daddy_needs_slave,fun fun,True
charlotte,russe ya lotsa,False
daddy_needs_slave,haha,True
charlotte,russe u eat nething good,False
daddy_needs_slave,ate way to much,True
daddy_needs_slave,lol,True
charlotte,russe lol,False
daddy_needs_slave,belly is full,True
charlotte,russe lol time to curl up an sleep then huh,False
daddy_needs_slave,pretty soon,True
charlotte,russe lol,False
charlotte,russe i do that when i get full to,False
daddy_needs_slave,waiting for work clothes to get out of the dryer,True
charlotte,russe kewl they get out by themselvs lol,False
daddy_needs_slave,i wish,True
daddy_needs_slave,lol,True
charlotte,russe haha,False
daddy_needs_slave,or i need a girl to get them out for,True
charlotte,russe hmm thats y they got dry cleanrs,False
daddy_needs_slave,fuck that,True
daddy_needs_slave,i can do my own laundry,True
charlotte,russe lol,False
daddy_needs_slave,have been doing it for years,True
charlotte,russe kewl,False
daddy_needs_slave,damn the weekends go by way to fast,True
charlotte,russe ya they do gotta go bck to skool tomm,False
charlotte,russe sux,False
daddy_needs_slave,trade ya,True
daddy_needs_slave,i have to go to work,True
charlotte,russe hell ya lest then id hav mony,False
charlotte,russe lol,False
daddy_needs_slave,u just need to find a guy with,True
charlotte,russe u got mony lol,False
charlotte,russe mor then me,False
charlotte,russe,False
charlotte,russe lol,False
daddy_needs_slave,oh so u want to be with,True
charlotte,russe thoght we done figurd that out,False
charlotte,russe lol,False
daddy_needs_slave,will your aunt let me have you,True
charlotte,russe she aint gotta kno nuttin,False
daddy_needs_slave,how long u want me for,True
charlotte,russe umm til we get tird of ech othr lol,False
daddy_needs_slave,lol,True
daddy_needs_slave,you just want my truck,True
charlotte,russe wel thats a plus lol,False
charlotte,russe but caint drive it so no worries,False
daddy_needs_slave,so u can ride,True
charlotte,russe ya thats fun but not as much as drivin wuld be lol,False
daddy_needs_slave,want me to teach you that too,True
charlotte,russe,False
daddy_needs_slave,are you high,True
daddy_needs_slave,lol,True
charlotte,russe lol no i dont do that,False
charlotte,russe geeze its freakin cold,False
daddy_needs_slave,u,True
charlotte,russe brb gonna get some hot coco,False
charlotte,russe dang aunt,False
charlotte,russe i gotta get to bed srry,False
daddy_needs_slave,ok,True
daddy_needs_slave,nite nite,True
charlotte,russe hey u not chattin,False
daddy_needs_slave,hey just got home,True
charlotte,russe hey lol,False
charlotte,russe u work to much,False
daddy_needs_slave,yes i do,True
charlotte,russe that sux,False
daddy_needs_slave,got to make money some how,True
charlotte,russe ya thats tru i gues,False
daddy_needs_slave,so what have you been up to,True
charlotte,russe nm jus waitin for my aunt to leav tomm,False
charlotte,russe its gonna be hella kewl,False
daddy_needs_slave,why is that,True
charlotte,russe cuz i lik it when shes gone lol,False
daddy_needs_slave,so you can do what u want,True
charlotte,russe wel ya an i can stay up late as i want lol,False
daddy_needs_slave,and sleep in as long as u want,True
charlotte,russe ya but aint no fun sleepin the hole time lol,False
daddy_needs_slave,what else u gonna do,True
charlotte,russe idk gonna watch a cupple movies maybe an gonna be chattin some not sure what else yet,False
daddy_needs_slave,have friends,True
charlotte,russe ya prolly that 2,False
daddy_needs_slave,and get in trouble,True
charlotte,russe caint get in trubble aunts not gonna be here lol,False
daddy_needs_slave,lol,True
charlotte,russe so u stil workin all weeknd,False
daddy_needs_slave,idk,True
charlotte,russe lol,False
daddy_needs_slave,supose to be colder than hell,True
charlotte,russe ya cold sux,False
daddy_needs_slave,u gonna warm me,True
charlotte,russe,False
daddy_needs_slave,u dont,True
charlotte,russe wel idk how im gonna do that u aint here lol,False
daddy_needs_slave,well i mean if i was silly,True
charlotte,russe oh then how u want me 2,False
daddy_needs_slave,i am asking how u would do it,True
charlotte,russe lol i could hug ya relly big,False
daddy_needs_slave,and that would do,True
charlotte,russe idk it mite,False
charlotte,russe what lol,False
daddy_needs_slave,dont think a hug would do it,True
charlotte,russe hmmm what u want me to do then,False
daddy_needs_slave,rub your sexy body all over me,True
charlotte,russe k wuld that warm ya up,False
daddy_needs_slave,yes,True
charlotte,russe kewl,False
daddy_needs_slave,your naked sexy body,True
charlotte,russe awww ty ur relly sweet,False
daddy_needs_slave,and so are u,True
charlotte,russe lol,False
daddy_needs_slave,so if i come see u and tell u i am cold u will know what to,True
charlotte,russe ya i wil now lol,False
daddy_needs_slave,and what are u going to do,True
charlotte,russe u jus said lol rub up aginst u,False
daddy_needs_slave,u going to be naked,True
charlotte,russe ya u said that wuld warm u up,False
daddy_needs_slave,well when i ask you what u are going to do the answer i am looking for is like i will first take my top off and rub all over you and then pull my shorts off and get totally naked and rub all over,True
daddy_needs_slave,and get you hot,True
charlotte,russe k lol,False
daddy_needs_slave,i dont like when u do what you just,True
charlotte,russe y,False
charlotte,russe i jus kinda shy bout talkin bout it,False
daddy_needs_slave,well dont be shy,True
daddy_needs_slave,i want to know,True
charlotte,russe wel it dont mattr neway cuz u jus talkin bout it on here,False
daddy_needs_slave,do,True
charlotte,russe u jus chattin bout it on here its not lik u relly here,False
daddy_needs_slave,but what if i was,True
charlotte,russe if u was itd be diff on here jus is dum talkin bout it,False
daddy_needs_slave,will u be shy in,True
charlotte,russe no cuz its diff,False
daddy_needs_slave,so what are u doing now,True
charlotte,russe nuttin jus sittin here listenin to cds lol,False
daddy_needs_slave,what kind of music do u like,True
charlotte,russe i lik country best,False
charlotte,russe u,False
daddy_needs_slave,doesnt matter,True
charlotte,russe huh whats wrong now,False
daddy_needs_slave,noyhin,True
daddy_needs_slave,nothin,True
daddy_needs_slave,brb need to reboot,True
charlotte,russe k,False
daddy_needs_slave,ok back,True
charlotte,russe wb,False
daddy_needs_slave,what time does your aunt leave tomorrow,True
charlotte,russe she leavin at 2,False
daddy_needs_slave,u gonna call me tomorrow evening then,True
charlotte,russe ya i wil if u want me 2 u gotta give me ur numbr tho lol,False
daddy_needs_slave,i thought i gave it to u,True
charlotte,russe ya i caint find it now tho lol,False
charlotte,russe i hide it so my aunt wuldnt find it,False
charlotte,russe now i caint find it lol,False
daddy_needs_slave,geez,True
charlotte,russe srry,False
charlotte,russe,False
daddy_needs_slave,u want it,True
charlotte,russe ya,False
charlotte,russe i wont loose it agin lol,False
daddy_needs_slave,785 577 0837,True
charlotte,russe k got it lol,False
charlotte,russe i put it undr my mattres so i dont loose it,False
charlotte,russe lol,False
daddy_needs_slave,what else is under your matress,True
charlotte,russe nuttin cept my diary,False
daddy_needs_slave,how bad u want to see me this weekend,True
charlotte,russe itd be relly kewl,False
daddy_needs_slave,for how,True
charlotte,russe i dont care my aunt aint gonna be bck til somtime mon morn,False
daddy_needs_slave,how long u wanna be,True
charlotte,russe lol dont mattr to me how long u wanna stay,False
daddy_needs_slave,u going to be naked whole time i am,True
charlotte,russe i can mite get kinda cold tho lol,False
daddy_needs_slave,what if i want u naked the whole time,True
charlotte,russe i could do that lol,False
daddy_needs_slave,at least topless,True
charlotte,russe k,False
daddy_needs_slave,those lil nipples will be hard the whole,True
charlotte,russe lol,False
daddy_needs_slave,u have any hair down,True
charlotte,russe vry lil,False
daddy_needs_slave,can u shave it,True
charlotte,russe u want me to,False
daddy_needs_slave,yes,True
charlotte,russe k i will,False
daddy_needs_slave,i dont like any hair,True
charlotte,russe k,False
charlotte,russe but i aint gonna do that less u r comin,False
daddy_needs_slave,u call me tomorrow night and i will,True
charlotte,russe k kewl,False
charlotte,russe lik what time u want me to call,False
daddy_needs_slave,and where do u want me to,True
charlotte,russe lol wherevr,False
daddy_needs_slave,on your,True
charlotte,russe sur aint nevr had that befor,False
daddy_needs_slave,wont cum in you,True
charlotte,russe k,False
charlotte,russe i dont want no babies so thats kewl,False
daddy_needs_slave,call a lil after 5,True
charlotte,russe k,False
daddy_needs_slave,and if i dont hear from u i am not going to come,True
charlotte,russe k i wil call,False
charlotte,russe u not jus teasin rite,False
daddy_needs_slave,no,True
daddy_needs_slave,are,True
charlotte,russe k,False
charlotte,russe nooooo,False
charlotte,russe i wanna see ya,False
daddy_needs_slave,u want to get,True
charlotte,russe ya i wanna do all the stuf we talkd bout,False
daddy_needs_slave,cant invite any of your friends over then,True
charlotte,russe k i wont lol,False
daddy_needs_slave,unless one of them wants sex too,True
charlotte,russe nooo i aint tellin em nuttin,False
daddy_needs_slave,brb phone with brother,True
charlotte,russe k,False
daddy_needs_slave,ok back,True
charlotte,russe k wb,False
daddy_needs_slave,my brother is in the navy in australia,True
charlotte,russe wow thats kewl,False
daddy_needs_slave,and he is in washington dc right now,True
charlotte,russe kewl,False
daddy_needs_slave,yeah he is way up there in command,True
charlotte,russe thats awsome,False
daddy_needs_slave,almost an admiral,True
charlotte,russe wow,False
daddy_needs_slave,has lots of,True
charlotte,russe kewl lol,False
daddy_needs_slave,how late u gonna stay up when aunt is,True
charlotte,russe til i get relly sleepy lol,False
daddy_needs_slave,well what if i came down tomorrow night,True
charlotte,russe thatd be kewl,False
daddy_needs_slave,would u like that,True
charlotte,russe ya itd be fun,False
daddy_needs_slave,and how u gonna answer the,True
charlotte,russe in my skirt an cami less its freezin lol,False
daddy_needs_slave,what if it is,True
charlotte,russe idk mite not wear a skirt lol,False
charlotte,russe if thats ok but only if its lik freezin,False
charlotte,russe i can change aftr u get here,False
daddy_needs_slave,like when i get,True
charlotte,russe ya,False
daddy_needs_slave,no bra,True
charlotte,russe that way i dont freez openin the door,False
charlotte,russe right,False
daddy_needs_slave,u gonna be nippin,True
charlotte,russe lol ya,False
daddy_needs_slave,what kind of panties do u wear,True
charlotte,russe i gots bikini an i got 3 new thongs 2day,False
daddy_needs_slave,what color thong,True
charlotte,russe i got 2 black ones an a red one,False
daddy_needs_slave,wear the black one,True
charlotte,russe k,False
daddy_needs_slave,what size boobs again,True
charlotte,russe 30 b,False
daddy_needs_slave,nice and perky,True
charlotte,russe ya,False
daddy_needs_slave,oh and i will tell dont like a lot of light,True
charlotte,russe kewl,False
daddy_needs_slave,low dim lights,True
charlotte,russe k thats kewl,False
daddy_needs_slave,u have a big,True
charlotte,russe its a full bed,False
daddy_needs_slave,bif enough for,True
daddy_needs_slave,big,True
charlotte,russe i think so ya,False
charlotte,russe nevr had 2 in it befor lol,False
daddy_needs_slave,u wanna sleep tight to,True
charlotte,russe wel ya next to ya,False
daddy_needs_slave,fall asleep in my arms naked,True
charlotte,russe thatll be fun,False
daddy_needs_slave,with your cute lil butt up against me,True
charlotte,russe lol k,False
daddy_needs_slave,do u,True
charlotte,russe noooo do u lol,False
daddy_needs_slave,i might,True
daddy_needs_slave,use to not to,True
daddy_needs_slave,untill i had my nose and cheek bones crushed,True
charlotte,russe k if u do i jus put pillo ovr my head lol,False
charlotte,russe ouch howd u do that,False
daddy_needs_slave,i help a race team,True
daddy_needs_slave,and was changing a tire on the back and the driver started the car and it was in gear and the impact wrench me,True
charlotte,russe omg,False
daddy_needs_slave,my nose was almost over by my ear,True
charlotte,russe omg but ur ok now rite,False
daddy_needs_slave,yeah,True
daddy_needs_slave,just snore now and,True
charlotte,russe lol,False
charlotte,russe when u get hurt,False
daddy_needs_slave,took 4 surgeries to get me back,True
charlotte,russe geeze,False
daddy_needs_slave,2 summers ago,True
charlotte,russe wow glad ur ok now,False
daddy_needs_slave,and went to the hospital and got stitched up and went right back to the race track,True
charlotte,russe geeze i wulda stayd away from races,False
daddy_needs_slave,couldnt do anything else with my nose or cheeks until all the swelling went away which was about 2 weeks later,True
daddy_needs_slave,i never missed a race and only 4 days of work for the surgeries,True
charlotte,russe geeze u must be relly strong to take all that pain,False
daddy_needs_slave,or,True
charlotte,russe nah u aint dum,False
daddy_needs_slave,ahhh u like me,True
charlotte,russe ya i do is that bad,False
daddy_needs_slave,no,True
charlotte,russe kewl,False
daddy_needs_slave,to bad u werent older so i could bring you home with me,True
charlotte,russe wow thatd be kewl,False
daddy_needs_slave,yes it would,True
daddy_needs_slave,would love someone like u to live with me,True
charlotte,russe awww id luv it to then i wuldnt hafta liv wit my aunt nemore,False
daddy_needs_slave,yeah,True
daddy_needs_slave,would u be my lil sex slave,True
charlotte,russe hmm do what u want me 2 uhhhh duh ya lol,False
daddy_needs_slave,would u like that,True
charlotte,russe ya lol,False
daddy_needs_slave,i would treat u right though,True
charlotte,russe thats kewl,False
daddy_needs_slave,i am not abusive,True
daddy_needs_slave,dont beleive in that shit,True
charlotte,russe k,False
charlotte,russe thats good cuz i aint into gettin hit,False
daddy_needs_slave,a guy should never ever hit a girl,True
charlotte,russe,False
daddy_needs_slave,just spank her lil,True
charlotte,russe lol long as its lil spanks its kewl,False
daddy_needs_slave,for pleasure,True
charlotte,russe k,False
daddy_needs_slave,u like to,True
charlotte,russe ya who dont lol,False
daddy_needs_slave,good,True
daddy_needs_slave,like to use your,True
charlotte,russe ya lol,False
daddy_needs_slave,i am going to get you lo like girls too,True
daddy_needs_slave,to,True
charlotte,russe lol idk we gotta see bout that,False
daddy_needs_slave,oh that is so hot,True
charlotte,russe k,False
daddy_needs_slave,u said do what i want you to,True
charlotte,russe ya i wil,False
daddy_needs_slave,can i bring my camera,True
charlotte,russe ya if u wanna,False
daddy_needs_slave,will u be camera,True
charlotte,russe no long as u aint gonna shar the pics wit ne one,False
daddy_needs_slave,i would never do that,True
charlotte,russe k kewl then,False
daddy_needs_slave,i want some of u on your hands and knees,True
charlotte,russe k,False
daddy_needs_slave,u know i like that,True
charlotte,russe ya u said u lik it that way,False
daddy_needs_slave,can u cook,True
charlotte,russe ya my aunt taught me,False
daddy_needs_slave,good so u gonna feed me when i am there,True
charlotte,russe lol ya,False
daddy_needs_slave,and then u are the dessert,True
charlotte,russe lol thatll be fun,False
daddy_needs_slave,got any whip,True
charlotte,russe umm idk i can look,False
charlotte,russe i got lotsa choc bars,False
daddy_needs_slave,lol,True
charlotte,russe what kinda choc u talkin bout lol,False
daddy_needs_slave,syrup,True
charlotte,russe o u meen the ice cream kind lol ya i got that,False
daddy_needs_slave,yeah,True
daddy_needs_slave,u like,True
charlotte,russe i luv choc,False
daddy_needs_slave,u can put it on my cock,True
charlotte,russe wont that be lik relly messy lol,False
daddy_needs_slave,u get to lick it off,True
charlotte,russe oo kewl,False
daddy_needs_slave,u like choc that,True
charlotte,russe ya its lik my fav food,False
charlotte,russe it should be its own food group lol,False
daddy_needs_slave,well u can put it on my cock the,True
daddy_needs_slave,then,True
charlotte,russe kewl,False
daddy_needs_slave,will be fun,True
charlotte,russe ya its gonna be hella kewl,False
daddy_needs_slave,u ready to go atw,True
charlotte,russe ya lol,False
daddy_needs_slave,have u been thinking about it,True
charlotte,russe ya,False
daddy_needs_slave,u excited,True
charlotte,russe ya relly excitd jus hope u aint jus playin,False
daddy_needs_slave,hope u aint,True
charlotte,russe i aint,False
daddy_needs_slave,good,True
charlotte,russe i relly caint wait to get to see ya in person,False
daddy_needs_slave,u ready to,True
charlotte,russe ya,False
daddy_needs_slave,sweet,True
charlotte,russe ur sweet too lol,False
daddy_needs_slave,ok well i will be waiting for your call,True
charlotte,russe k i will call bout 5 tomm,False
daddy_needs_slave,if i dont answer keep trying back,True
charlotte,russe k,False
charlotte,russe y u not gonna answr,False
daddy_needs_slave,might still be working,True
daddy_needs_slave,i dont know,True
daddy_needs_slave,but hope to be off by 5,True
charlotte,russe k,False
daddy_needs_slave,well i think i am going to go to bed,True
charlotte,russe awww ok,False
daddy_needs_slave,tired,True
charlotte,russe k,False
charlotte,russe,False
daddy_needs_slave,will be waiting on your call,True
charlotte,russe k,False
charlotte,russe luv ya,False
daddy_needs_slave,hi sexy hope u call me really want to come see u,True
daddy_needs_slave,hey u,True
daddy_needs_slave,out of school,True
daddy_needs_slave,are u going to talk to me,True
charlotte,russe hiya srry,False
daddy_needs_slave,how are u,True
charlotte,russe im k,False
daddy_needs_slave,your aunt gone yet,True
charlotte,russe ya,False
daddy_needs_slave,i am not going to make it tonight,True
daddy_needs_slave,have to work for a couple hours in the morning and then can leave,True
charlotte,russe awww y not,False
charlotte,russe ohhh ok,False
daddy_needs_slave,sorry,True
charlotte,russe umm im not gonna be here til lik 2 that ok,False
charlotte,russe tomm lik round 2,False
daddy_needs_slave,what are you going to be,True
daddy_needs_slave,u going to see some other,True
charlotte,russe im goin to a gfs hous tonite,False
daddy_needs_slave,well what if i came tonight,True
charlotte,russe i wulda been home lol,False
daddy_needs_slave,what time u gonna go there,True
charlotte,russe im gonna leav here bout 5 i think,False
daddy_needs_slave,ummmmm when u gonna call,True
charlotte,russe ill stil call ya lol ill call befor i go,False
daddy_needs_slave,can u call me now,True
daddy_needs_slave,in about 5 minutes,True
charlotte,russe ya i gotta find the dang phon reel quik,False
daddy_needs_slave,tell me whn u have it,True
charlotte,russe k,False
daddy_needs_slave,my phone is in my truck so i have to go out and get it,True
daddy_needs_slave,i need to get off here and go back to work anyways,True
charlotte,russe oh so i jus call ya round 5 lik we said,False
daddy_needs_slave,no,True
daddy_needs_slave,in about 5 minutes,True
daddy_needs_slave,i have about a 20 minute drive back to my job,True
daddy_needs_slave,did u find the phone,True
charlotte,russe lookin brb,False
daddy_needs_slave,damn how can u lose the phone,True
daddy_needs_slave,here is my number again 785 577 need to get back to work so call me when u get the better hear from you if u want to see me tomorrow,True
daddy_needs_slave,i will be waiting for your call,True
charlotte,russe ok,False
daddy_needs_slave,u find,True
charlotte,russe ya one sec wil call,False
daddy_needs_slave,ok hurry babe,True
charlotte,russe k i gotta sign off,False
daddy_needs_slave,ok want you to call me so i can come tomorrow,True
charlotte,russe k signin off,False
daddy_needs_slave,i am leaving here now too so hurry and call,True
daddy_needs_slave,hurry babe,True
daddy_needs_slave,785 577 0837,True
daddy_needs_slave,waiting,True
daddy_needs_slave,hurry up,True
daddy_needs_slave,u havent signed off yet,True
daddy_needs_slave,ok guess if you dont call you dont want me to come tomorrow,True
daddy_needs_slave,got to go now so call me,True
charlotte,russe srry my phon battry died lol im chargin it,False
daddy_needs_slave,hey u hung up on me,True
charlotte,russe srry my battry died,False
daddy_needs_slave,u gonna call me back,True
charlotte,russe ill try aftr the phon charges,False
charlotte,russe lol k i wil,False
daddy_needs_slave,didnt you like talking to,True
charlotte,russe ya u sounded cute,False
daddy_needs_slave,and so did u,True
charlotte,russe awww ty,False
daddy_needs_slave,u sounded sweet and sexy,True
charlotte,russe so u gonna visit sense i calld ya lik u said,False
daddy_needs_slave,when u call me back,True
charlotte,russe awww thats cheatin lol,False
daddy_needs_slave,no it didnt even talk 5 minutes,True
charlotte,russe ya srry i jus hafta use my callin card membr an i gotta watch my mins 2,False
daddy_needs_slave,i will take ya to buy another one,True
charlotte,russe kewl,False
daddy_needs_slave,so dont worry about that,True
charlotte,russe k,False
daddy_needs_slave,i dont even know where you live though,True
charlotte,russe ya i kno cuz u aint said u r gonna yet,False
daddy_needs_slave,when u call me back,True
charlotte,russe idk aftr my phon charges,False
daddy_needs_slave,how long does that been almost 2 hrs,True
charlotte,russe srry it hasnt chargd all nite lol,False
daddy_needs_slave,well they dont take much more than 2 hrs,True
charlotte,russe lol,False
daddy_needs_slave,doesnt sound like you are to interested,True
charlotte,russe ya u jus cheatin tho,False
daddy_needs_slave,how,True
charlotte,russe cuz last nite u said ud come ovr if i calld now u want me 2 call agin,False
daddy_needs_slave,well wedidnt even talk 5,True
charlotte,russe i kno but my phon died but lest i calld ya,False
daddy_needs_slave,and i do want to come over but want to talk a lil more than 5 minutes on the phone,True
charlotte,russe k lik how long u wanna talk cuz i aint got alot of mins on my card,False
daddy_needs_slave,10 minutes or i want you to save a lil for when i am on my way tomorrow so u can call me and see where i am at,True
charlotte,russe i only got lik 8 mins left on it aftr callin ya,False
charlotte,russe i use it to call my frends in mo,False
daddy_needs_slave,well that sucks,True
daddy_needs_slave,always somethin,True
charlotte,russe wel geeze im srry,False
daddy_needs_slave,here is a calling card i if there is any minutes left on it,True
daddy_needs_slave,u have to call 1 800 487 7646 first,True
daddy_needs_slave,then the pin number is 1237 5852 0621,True
daddy_needs_slave,did u get that,True
charlotte,russe ya tryin to see if my phon wil work yet,False
charlotte,russe im gonna go to the stor an get a new card caint get urs to work,False
daddy_needs_slave,when,True
charlotte,russe im gonna go now so i can call ya agin k,False
charlotte,russe cuz i relly wanna see u,False
daddy_needs_slave,ok u get one then when i come there i will get you another one,True
charlotte,russe k kewl but u not gonna say u stil wanna talk befor u come r ya lol,False
daddy_needs_slave,are u gonna call me back after u,True
charlotte,russe ya,False
daddy_needs_slave,well then ya,True
daddy_needs_slave,i really want to see u too,True
daddy_needs_slave,but want to talk a lil more than 5 minutes,True
charlotte,russe k i jus dont wanna get a new card then u say u stil not comin,False
daddy_needs_slave,i will come,True
charlotte,russe k,False
daddy_needs_slave,u just call me,True
charlotte,russe k i wil gotta go get a card tho,False
daddy_needs_slave,and why do u really really want to see,True
charlotte,russe duh so we can do all the stuf we talkd bout,False
daddy_needs_slave,u ready to go all the way,True
charlotte,russe ya,False
daddy_needs_slave,u feelin,True
charlotte,russe kinda ya,False
daddy_needs_slave,hope its more than kinda when i get there,True
charlotte,russe it wil be when ur here lol,False
charlotte,russe k im gonna go get a card k,False
daddy_needs_slave,ok then when u call me back u can give me your addy,True
charlotte,russe k,False
