User,Text,Groom
daddy_needs_slave,will,True
daddy_needs_slave,i lick,True
charlotte,russe lol,False
daddy_needs_slave,haha,True
charlotte,russe ya if u aint stil playin lol,False
daddy_needs_slave,playin with myself right now,True
daddy_needs_slave,haha,True
charlotte,russe lol ya rite,False
daddy_needs_slave,dont u wish u were doing it,True
charlotte,russe doin what,False
daddy_needs_slave,playin with me,True
charlotte,russe oh ya lol,False
daddy_needs_slave,duh,True
charlotte,russe,False
daddy_needs_slave,well i think i am going to bed,True
charlotte,russe k,False
charlotte,russe miss me lol,False
daddy_needs_slave,do u get offline messages,True
charlotte,russe u meen can i,False
charlotte,russe ya i can if u send em lol,False
daddy_needs_slave,i have,True
charlotte,russe oh idk if i got em or not dont membr,False
daddy_needs_slave,sent a couple today before u got on,True
charlotte,russe oh ya bout askin if i was bck yet or not,False
daddy_needs_slave,i dont remember,True
charlotte,russe lol me neithr,False
charlotte,russe i got lik one from ya tho,False
charlotte,russe y,False
daddy_needs_slave,cause if u arent on in the morning how do u know when i am leaving,True
charlotte,russe ya thats tru u can leav me an offlin when u redy to leav,False
charlotte,russe then i see em when i come on,False
daddy_needs_slave,and u better answer the phone tomorrow,True
charlotte,russe k wil try im goin wit misty an her mom to hav bredfast in lawton,False
daddy_needs_slave,what time,True
charlotte,russe shes gonna be here at 10,False
daddy_needs_slave,well i wont call till the afternoon,True
charlotte,russe k when ur on the road,False
daddy_needs_slave,yeah,True
daddy_needs_slave,or u better call me,True
charlotte,russe k,False
daddy_needs_slave,if i dont hear from you by 2 i am going to turn around and come home,True
charlotte,russe k i wil call ya i promis,False
charlotte,russe jus lik i did 2day k,False
charlotte,russe i tole ya i wuld,False
daddy_needs_slave,or if i call i dont want to get the answering machine,True
charlotte,russe well i caint help that if im onlin ull get that an if im not home it does it,False
daddy_needs_slave,well u know i will be calling so if you want to see me that bad u will be waiting for a what i mean,True
charlotte,russe geeze ur actin wierd agin lol i said if i aint got a call from ya then ill call ya,False
daddy_needs_slave,not acting weird,True
daddy_needs_slave,when someone says they are going to call me i make sure my phone is free so they can get ahold of me,True
charlotte,russe geeze u aint gotta gimme a lectur lol i said k,False
daddy_needs_slave,and said it wont be untill about 2,True
charlotte,russe k,False
daddy_needs_slave,i will leave u an offline if u arent on when i leave,True
charlotte,russe ok kewl,False
daddy_needs_slave,ok well i am going to bed,True
charlotte,russe k nite,False
charlotte,russe,False
daddy_needs_slave,ty,True
charlotte,russe yw,False
daddy_needs_slave,sweet dreams,True
charlotte,russe u 2,False
charlotte,russe nite,False
daddy_needs_slave,cant wait to see you,True
charlotte,russe me neithr caint wait to see u,False
charlotte,russe,False
charlotte,russe thoght u was goin to bed lol,False
daddy_needs_slave,hey u need to get aholdof me when u get on here,True
daddy_needs_slave,call,True
charlotte,russe so u didnt call me neithr,False
daddy_needs_slave,i did 2 times,True
daddy_needs_slave,actually 3,True
charlotte,russe ya whatevr,False
daddy_needs_slave,u did,True
daddy_needs_slave,i,True
daddy_needs_slave,didnt leave a message,True
daddy_needs_slave,called once about 1 when i left,True
daddy_needs_slave,and then a couple times around 2,True
charlotte,russe u wasnt gonna come here neway so whatevr,False
daddy_needs_slave,i was to the oklahoma line,True
charlotte,russe k whatevr i stayd wit my gf,False
daddy_needs_slave,how come your number is lawton number when u live in walters,True
charlotte,russe cuz its my aunts cell,False
daddy_needs_slave,ok another know i asked you if you had a mall or in,True
charlotte,russe ya,False
daddy_needs_slave,and you said you didnt know,True
charlotte,russe i said didnt kno if they was relly inside of waltrs duh,False
daddy_needs_slave,how could you not know when the town is that small and only people in it,True
charlotte,russe dude i dont drive i dont kno wher city limits r,False
daddy_needs_slave,oh wait a u say it was your aunts,True
charlotte,russe ya its her ole one y,False
daddy_needs_slave,then why did you have to get offline to,True
charlotte,russe whatevr look i aint fightin wit ya lik we did last nite k,False
daddy_needs_slave,not fighting,True
daddy_needs_slave,just asking questions cause it seems weird,True
charlotte,russe ya wel u seem wierd 2 wit all the shit u doin so jus forget it,False
daddy_needs_slave,no i am just checking things out before i drove that far,True
daddy_needs_slave,is your house in the middle of the block or on a,True
charlotte,russe i aint on the cornr dude nevr said that,False
daddy_needs_slave,shows it on the corner,True
daddy_needs_slave,mapquest has a new thing where it gives real pics from above where the location is,True
daddy_needs_slave,shows all the houses and everything,True
charlotte,russe whatevr look said i aint fightin,False
daddy_needs_slave,how close to the railroad tracks do you live,True
daddy_needs_slave,or tell me what street is right next to you,True
daddy_needs_slave,and seriously i was at the oklahoma line when i turned around,True
daddy_needs_slave,and 300 bucks in my pocket,True
charlotte,russe ya k u gotta take boundary to heather dr but it dont mattr now cuz u jus a playr neway so byw,False
charlotte,russe bye,False
daddy_needs_slave,sorry i am not a player,True
daddy_needs_slave,you never called or answered like you said u were,True
daddy_needs_slave,and i said i was going to turn around if i never heard from you,True
charlotte,russe tole ya i was at my gfs hous,False
daddy_needs_slave,see i would have been there by 5 and u wouldnt been home,True
daddy_needs_slave,how nice would that have been,True
charlotte,russe i was only wit my frend cuz knew u werent comin an i wasnt wastin my hole weeknd,False
daddy_needs_slave,i was comin,True
daddy_needs_slave,told u i was,True
daddy_needs_slave,i keep my word on things,True
charlotte,russe ya wel u said lots of stuf no u dont u said aftr i calld ya the first time u wuld come but u made me call ya a sec time an i did then u pulld all that crap bout havin a frend im me,False
daddy_needs_slave,yeah cause only talked for 5,True
daddy_needs_slave,wtf,True
charlotte,russe whatevr i aint messin wit ya so jus forget it,False
daddy_needs_slave,because things u tell me now dont add up,True
daddy_needs_slave,you know you can find a lot of info on the net,True
charlotte,russe ya so what,False
daddy_needs_slave,tell me the name of the school u go to then,True
daddy_needs_slave,and dont take 5 minutes to look it up,True
charlotte,russe walters middle school,False
charlotte,russe duh dumass,False
charlotte,russe what no othr stupid questins now,False
daddy_needs_slave,u neve said if there are railroad tracks close to u,True
charlotte,russe so tole ya i aint messin wit ya ur a playr an i aint into that,False
daddy_needs_slave,i am not a player,True
daddy_needs_slave,u want me to get in truck and come that way,True
daddy_needs_slave,again,True
charlotte,russe hell no u aint comin an i kno it,False
daddy_needs_slave,wow are u getting mad,True
charlotte,russe been mad sense u playd me by havin that othr name im me,False
daddy_needs_slave,told you i was sorry,True
charlotte,russe ya i kno u did but u stil actin lik u dont beleve me an i aint doin nuttin wit somone that dont,False
daddy_needs_slave,and you dont think i would have been more mad if i drove all the way there and you weent home,True
charlotte,russe wulda been here if i thoght u was comin,False
daddy_needs_slave,i told you i was coming and i did,True
daddy_needs_slave,i left at 1,True
daddy_needs_slave,got to the oklahoma line and never heard from you so turned around,True
charlotte,russe wel then u wuldnt hav been here at 5 neway so there,False
daddy_needs_slave,yes i would have,True
charlotte,russe how u said it was 5 hr drive,False
daddy_needs_slave,thats what mapquest said and thats diving 60 miles an hour,True
charlotte,russe so 1 clock plus 5 hrs aint 5 clock then,False
daddy_needs_slave,u can drive 78 on interstate,True
daddy_needs_slave,so driving 18 miles an hour faster can save ove an hour,True
charlotte,russe wel i dont kno nething bout that,False
daddy_needs_slave,mapquest gives the driving time at 60 miles and hour,True
charlotte,russe k stil dont hav no idea bout all that cuz i caint driv yet,False
daddy_needs_slave,so driving 78 can make up alot of time,True
charlotte,russe k whatevr,False
daddy_needs_slave,well think about it,True
daddy_needs_slave,60 miles per hour u can drive 60 miles in one hour,True
daddy_needs_slave,78 you can drive 78 miles in one 18 more miles in one hour,True
daddy_needs_slave,so in 5 hrs you are saving almost 100 miles,True
daddy_needs_slave,thats an hour and a half,True
daddy_needs_slave,in time,True
charlotte,russe ya ok whatevr,False
daddy_needs_slave,told you i really wanted to see you,True
charlotte,russe if u did u wulda came evn sense i didnt call agin dang i calld ya 2 times,False
daddy_needs_slave,ok tell me this,True
daddy_needs_slave,if you were druving 5 hrs to see somebody and you never heard from them like they told you they would what would you think,True
charlotte,russe id think she was buzy dude,False
daddy_needs_slave,i am saying if u were going to drive that far to come see me and never heard from me what would you think,True
charlotte,russe id think u was buzy at the time u were suposd to call an id stil be ther lik i said i wuld,False
daddy_needs_slave,and then you got here and i wasnt home,True
charlotte,russe look i said i aint fightin wit ya k u didnt come an thats that,False
daddy_needs_slave,and no u wouldnt would have been mad if u drove this far and never got ahold of think i was playin ya like u said i am now,True
charlotte,russe wel u r so im jus gonna go cuz aint no dang reson to be fightin,False
daddy_needs_slave,i am not,True
daddy_needs_slave,i asked you if you want me to get in my truck now and come that way,True
charlotte,russe it wuldnt mattr if i said ya cuz u stil wuldnt till i calld an evn then u wuldnt,False
daddy_needs_slave,yes i will,True
charlotte,russe u wil what,False
daddy_needs_slave,come that way,True
charlotte,russe ya what if i call ya agin,False
daddy_needs_slave,well i would like while i am on my way so u know where i am,True
daddy_needs_slave,u said u would do that,True
charlotte,russe see i knew it,False
daddy_needs_slave,u said you would do that,True
charlotte,russe evry time i call ya u wanna keep talkin an i tole ya i only gots 8 mins,False
daddy_needs_slave,thats why i said i would call you,True
charlotte,russe whatevr,False
daddy_needs_slave,what kind of cell phone is it if you have to get a phone card for it,True
charlotte,russe prepaid phon duh,False
daddy_needs_slave,well i dont know anything about them,True
daddy_needs_slave,and i told you i would get you a new one or give you money for one,True
charlotte,russe evn when i get calls it takes my mins,False
daddy_needs_slave,told you i would get you a new one or give you money for one,True
charlotte,russe that aint gonna do me no good til aftr u r here so it stil dont gimme mins to keep callin u or havin u call me,False
daddy_needs_slave,well only want you to call me to see where i am,True
daddy_needs_slave,wont talk long,True
charlotte,russe u jus want me keep wastin my mins,False
daddy_needs_slave,no,True
daddy_needs_slave,dont u want to know how close i,True
charlotte,russe ya but u aint clos lol,False
daddy_needs_slave,not yet,True
daddy_needs_slave,how close u want me,True
charlotte,russe sides u watchin ur game membr,False
daddy_needs_slave,i got digital cable today so can record it automatically,True
charlotte,russe lol kewl,False
charlotte,russe but what bout supr bowl tomm,False
daddy_needs_slave,it has built in recording,True
daddy_needs_slave,i can be home for it,True
daddy_needs_slave,or leave after it,True
charlotte,russe see thatd suck u not come here til late an then leav early to watch the game,False
daddy_needs_slave,said i can stay if u wanted me to,True
daddy_needs_slave,would u let me take a nap tomorrow afternoon so i can drive home at night,True
charlotte,russe wel duh tole ya u could stay long as u gone befor my aunt comes home,False
daddy_needs_slave,wel duh,True
charlotte,russe,False
daddy_needs_slave,i am so gonna spank your butt,True
charlotte,russe,False
daddy_needs_slave,but can be,True
daddy_needs_slave,u want me,True
charlotte,russe i wantd ya here last nite lol,False
daddy_needs_slave,told u i couldnt worked this morning,True
charlotte,russe i kno but noww,False
daddy_needs_slave,so u want me or not,True
charlotte,russe ya u kno that,False
daddy_needs_slave,u gonna fall asleep before i get,True
charlotte,russe not if u hurry lol,False
daddy_needs_slave,what if u,True
daddy_needs_slave,then i will be really mad,True
charlotte,russe i wont jus come on lol,False
charlotte,russe what kinda truc u got agin i forget,False
daddy_needs_slave,and thats waht you wanted was my truck,True
charlotte,russe no jus wanna make sur i dont run out to the wrong one lol,False
charlotte,russe no but ther is othr cars on this road lol,False
daddy_needs_slave,black fod,True
daddy_needs_slave,ford,True
charlotte,russe so u comin or u jus playin,False
daddy_needs_slave,i will cum,True
charlotte,russe wel hurry up so i dont fall alseep,False
daddy_needs_slave,you so better not fall asleep,True
charlotte,russe lol i wont,False
daddy_needs_slave,how late did u stay up last night,True
charlotte,russe i leav porch lite on too,False
charlotte,russe i didnt go bed til lik 2 but kinda feel sleep at my putr for abit lol,False
daddy_needs_slave,and yes i did go to bed when i said,True
daddy_needs_slave,lots of times i leave computer on,True
charlotte,russe k,False
charlotte,russe sooo we gonna jus keep chattin here or u leavin lol,False
charlotte,russe u gonna get here or jus keep chattin lol,False
daddy_needs_slave,should i bring a razor cause i need to,True
charlotte,russe wel if u wanna shav here u gotta bring one cuz u aint usin mine lol,False
daddy_needs_slave,i wont use yours,True
charlotte,russe k,False
daddy_needs_slave,u will be using,True
charlotte,russe ya if u evr get here,False
charlotte,russe lol,False
daddy_needs_slave,cause i am sure u wont like wiskers on me,True
charlotte,russe prolly not lol,False
daddy_needs_slave,ok i need to shower so should i wait till i get,True
charlotte,russe u can here lol,False
daddy_needs_slave,with,True
charlotte,russe ya thats kewl,False
daddy_needs_slave,ok one more thing,True
charlotte,russe what lol,False
daddy_needs_slave,since it will be dark out now u going to do what i asked,True
charlotte,russe lol ya i will,False
daddy_needs_slave,where do i park,True
charlotte,russe now hurry up lol out front is k,False
daddy_needs_slave,and u promise u wont fall asleep,True
charlotte,russe i said i wont but if u dont hurry up i mite lol,False
daddy_needs_slave,i will be so mad if u do,True
charlotte,russe i wont geeze,False
daddy_needs_slave,ok i need to set my clothes get gas and on my way,True
charlotte,russe k bout 30 mins then,False
charlotte,russe so i kno bout when to start lookin out for ya,False
charlotte,russe lol,False
daddy_needs_slave,yeah,True
charlotte,russe k u bettr not be playin agin,False
charlotte,russe lol,False
daddy_needs_slave,but u coing to call in about 2 hrs to see where i am,True
charlotte,russe dang agin k i wil call ya but only gonna ask wher u r an then i hangin up lol,False
daddy_needs_slave,like u always,True
charlotte,russe k now gooo,False
charlotte,russe lol,False
daddy_needs_slave,ok u better call in 2 hrs or i will just go to the casino and spend my money,True
charlotte,russe k lik i said come on lol,False
daddy_needs_slave,cum,True
daddy_needs_slave,haha,True
charlotte,russe,False
daddy_needs_slave,and u dont have to shower till i get there,True
charlotte,russe k but if u dont leav u aint gonna get here lol,False
daddy_needs_slave,i am,True
daddy_needs_slave,oh gotta get my camera too,True
charlotte,russe k,False
daddy_needs_slave,stay there i will message u when i leave the house,True
charlotte,russe k hurry lol,False
daddy_needs_slave,u,True
charlotte,russe lol,False
daddy_needs_slave,thats not an answer,True
charlotte,russe lol ya duh,False
daddy_needs_slave,oh not just a lil,True
daddy_needs_slave,lol,True
charlotte,russe lol,False
charlotte,russe byeeeeeee lol,False
daddy_needs_slave,ok i am leaving the house,True
daddy_needs_slave,have to get gas on will be on the road,True
charlotte,russe k u bettr not be teasin lol,False
daddy_needs_slave,i am not,True
daddy_needs_slave,and u better not be either,True
charlotte,russe k kewl,False
charlotte,russe i aint,False
charlotte,russe jus go,False
charlotte,russe lol,False
daddy_needs_slave,will be expecting a call at 10,True
charlotte,russe k,False
charlotte,russe see ya when u get here,False
daddy_needs_slave,and then seeing them nice lil tits when u come out to my truck,True
charlotte,russe k,False
charlotte,russe lol,False
daddy_needs_slave,k talk to you about 10,True
charlotte,russe k,False
daddy_needs_slave,bye,True
charlotte,russe bye,False
charlotte,russe,False
daddy_needs_slave,will be waiting for that real one soon,True
daddy_needs_slave,bye,True
charlotte,russe damn u are pretty hot for 14,False
charlotte,russe aww ty,False
daddy_needs_slave,welcome,True
charlotte,russe asl,False
daddy_needs_slave,i am,True
charlotte,russe y u lol,False
daddy_needs_slave,cause that is old to you,True
charlotte,russe nah 80 is old,False
daddy_needs_slave,ur right,True
charlotte,russe jus cuz im 14 dont meen i think u old,False
charlotte,russe lol,False
daddy_needs_slave,cool,True
charlotte,russe so what ya doin,False
daddy_needs_slave,old enough to be your dad,True
daddy_needs_slave,lol,True
daddy_needs_slave,and doing nothing,True
charlotte,russe u caint be my dad cuz ud be dead,False
daddy_needs_slave,oh sorry,True
charlotte,russe its k,False
daddy_needs_slave,i can play your,True
charlotte,russe aww thatd be kewl i relly mis my dad,False
daddy_needs_slave,oh i bet,True
charlotte,russe mom too tho,False
charlotte,russe i liv wit my aunt now,False
daddy_needs_slave,u like,True
charlotte,russe not relly but shes all i got left,False
charlotte,russe aww ty,False
daddy_needs_slave,welcome,True
charlotte,russe u got kids,False
daddy_needs_slave,no,True
charlotte,russe oh jus thoght ur sn meent u had kids,False
daddy_needs_slave,no,True
charlotte,russe thats kewl,False
charlotte,russe i dont want kids nithr,False
charlotte,russe lol,False
daddy_needs_slave,look at my profile and u will see what it means,True
charlotte,russe k goin to look,False
daddy_needs_slave,only a couple ways not to have kids,True
daddy_needs_slave,keep legs closed or good,True
charlotte,russe lol ur funny,False
daddy_needs_slave,well its true,True
charlotte,russe ya i gues so lol,False
charlotte,russe whos the chick on ur prof lol,False
daddy_needs_slave,some of the times condoms or the pil dont work,True
daddy_needs_slave,she is an ex of mine,True
charlotte,russe omg they dont work,False
daddy_needs_slave,what,True
charlotte,russe i thoght thats y they made em,False
daddy_needs_slave,why have u tried,True
charlotte,russe no but gots frends that hav,False
daddy_needs_slave,have heard of condoms that break and have heard girls getting prego when they were on the pill,True
charlotte,russe geeze that must suck bad,False
daddy_needs_slave,i bet it,True
charlotte,russe ya omg i wuld jus die,False
daddy_needs_slave,oh bull,True
daddy_needs_slave,u will change your mind one of theses days,True
charlotte,russe noway no babies for me,False
daddy_needs_slave,then keep legs,True
charlotte,russe lol,False
daddy_needs_slave,thats no fun either,True
daddy_needs_slave,lol,True
charlotte,russe lol,False
charlotte,russe so i gues u not marrid by lookin at ur prof lol,False
daddy_needs_slave,nope,True
charlotte,russe didnt think so lol,False
charlotte,russe brb,False
charlotte,russe k srry bck,False
charlotte,russe hadda let my kitty in,False
daddy_needs_slave,that was fast,True
charlotte,russe he jus wantd in my room,False
charlotte,russe lol,False
daddy_needs_slave,oh,True
daddy_needs_slave,i want a kitty in my room not a 4 legged,True
charlotte,russe what othr kind is there,False
daddy_needs_slave,think,True
daddy_needs_slave,whats another name for cat,True
charlotte,russe omg u meen lik what ur prof was talkin bout,False
charlotte,russe srry kinda slow somtimes lol,False
daddy_needs_slave,pussy kat,True
daddy_needs_slave,hehe,True
charlotte,russe lol,False
daddy_needs_slave,ok i know i am bad,True
charlotte,russe lol nah ur kewl,False
daddy_needs_slave,ty,True
charlotte,russe yw,False
daddy_needs_slave,good at being bad though,True
charlotte,russe lol thats ok to aint it,False
daddy_needs_slave,hell yeah,True
charlotte,russe kewl,False
daddy_needs_slave,but where the bad girls at,True
charlotte,russe huh what u meen,False
daddy_needs_slave,bad or naughty,True
charlotte,russe who me,False
daddy_needs_slave,no i was asking where the bad naughty girls at,True
charlotte,russe lol i dont get it srry,False
charlotte,russe lol srry,False
charlotte,russe i aint no angel lol,False
charlotte,russe i get in trubble somtimes,False
daddy_needs_slave,for doing what,True
charlotte,russe not doin what my aunt says an skippin skool somtimes,False
daddy_needs_slave,what do u do when u skip school,True
charlotte,russe go hang wit othr frends somtimes i jus come home tho an chat onlin,False
daddy_needs_slave,u need a,True
daddy_needs_slave,hehe,True
charlotte,russe hell no im too old to get spankd,False
daddy_needs_slave,no way,True
daddy_needs_slave,i like to give spankins,True
daddy_needs_slave,pleasure spankins that is,True
daddy_needs_slave,hehe,True
charlotte,russe ouch,False
charlotte,russe oh lik luv taps,False
daddy_needs_slave,nice lil pleasure spanks,True
charlotte,russe thats kewl i gues,False
daddy_needs_slave,yeah,True
charlotte,russe kewl,False
daddy_needs_slave,gues u have never done anything with a boy have you,True
charlotte,russe ya,False
charlotte,russe i usd to hang wit my ex til he startd bein a jerk,False
daddy_needs_slave,and what did u do with him,True
charlotte,russe all kindsa stuf,False
daddy_needs_slave,well i mean sexual,True
charlotte,russe oh wel umm i did a bj befor,False
daddy_needs_slave,on,True
charlotte,russe ya,False
charlotte,russe is that bad,False
daddy_needs_slave,did u like,True
charlotte,russe ya it was kewl,False
daddy_needs_slave,no its not bad,True
daddy_needs_slave,what did he do to you,True
charlotte,russe nuttin relly we jus kissd,False
daddy_needs_slave,did u want him to do anything,True
charlotte,russe idk not relly he was bein a jerk aftr,False
daddy_needs_slave,cause he got what he wanted,True
charlotte,russe i gues so we did that cupple times but that was all,False
daddy_needs_slave,and he was the one that wanted,True
charlotte,russe ya,False
daddy_needs_slave,see it was all about him,True
charlotte,russe ya thats y i said he was bein a jerk,False
daddy_needs_slave,thats boys for ya,True
charlotte,russe ya thats y we brok up,False
daddy_needs_slave,all boys are like that,True
daddy_needs_slave,men pleasure their girls,True
charlotte,russe that sux,False
charlotte,russe bout boys i meen,False
charlotte,russe lol,False
daddy_needs_slave,yeah boys only want the girls to pleasure them,True
charlotte,russe ya,False
daddy_needs_slave,and thats not right,True
charlotte,russe ya i kinda thoght it was meen,False
daddy_needs_slave,it is,True
charlotte,russe but oh wel its ovr now,False
daddy_needs_slave,did he like it,True
charlotte,russe ya said he did,False
charlotte,russe idk jus did what he said to,False
daddy_needs_slave,where did he cum,True
charlotte,russe moth,False
charlotte,russe mouth lol,False
daddy_needs_slave,did u like that,True
charlotte,russe ya it was kinda kewl,False
daddy_needs_slave,did u spit it out or swallow it,True
charlotte,russe he tole me to swallo,False
daddy_needs_slave,how old was he,True
charlotte,russe 17,False
daddy_needs_slave,and u never wanted to do anything else,True
charlotte,russe idk nevr thoght bout it aftr we brok up,False
daddy_needs_slave,what about when u were with him,True
charlotte,russe we nevr went atw but it wulda been kewl,False
daddy_needs_slave,what would you have like to done,True
charlotte,russe idk nevr did nuttin else so dont relly kno what there is,False
daddy_needs_slave,but i know you have talked about it with your friends,True
charlotte,russe ya cupple frends went atw befor,False
daddy_needs_slave,what is,True
charlotte,russe all the way lol,False
daddy_needs_slave,oh ok,True
charlotte,russe srry i jus hate spellin evrythin lol,False
daddy_needs_slave,its cool,True
charlotte,russe k,False
daddy_needs_slave,and there is more things then just going all the way,True
charlotte,russe relly thoght that was all ther was,False
daddy_needs_slave,no,True
charlotte,russe kewl,False
daddy_needs_slave,kissing a girl all over her hot body,True
charlotte,russe wow,False
daddy_needs_slave,licking and sucking and playing with her nipples,True
charlotte,russe kewl,False
daddy_needs_slave,rubbing fingering and licking her sweet lil pussy,True
charlotte,russe omg relly,False
daddy_needs_slave,oh yeah,True
daddy_needs_slave,thats called 4play,True
charlotte,russe kewl he tole me guys dont lik doin that stuf tho,False
daddy_needs_slave,sometimes so much more fun then just going all the way,True
charlotte,russe kewl,False
daddy_needs_slave,guys dont like doing what,True
charlotte,russe that stuf u was sayin to a girl,False
daddy_needs_slave,cause he is a boy,True
