User,Text,Groom
kinkyjeff694u,hi diva very lovely pic u r very beautiful,True
14_yr_old_girl,awww ty,False
kinkyjeff694u,you are so very welcome,True
14_yr_old_girl,14 f okla,False
14_yr_old_girl,u,False
14_yr_old_girl,kewl,False
14_yr_old_girl,so what ya doin,False
kinkyjeff694u,not much just chillin and you,True
14_yr_old_girl,nm jus bein bord lol,False
kinkyjeff694u,aww sweetie i hot lil sexy thing like u being bored,True
14_yr_old_girl,lol ty,False
kinkyjeff694u,you are so very welcome,True
14_yr_old_girl,u r nice,False
14_yr_old_girl,is that u over,False
kinkyjeff694u,yes it is sweetie,True
14_yr_old_girl,kewl,False
kinkyjeff694u,ty u sweetie,True
kinkyjeff694u,what do u like to do for fun,True
14_yr_old_girl,shop hang wit frends campin,False
14_yr_old_girl,jus normal stuff,False
14_yr_old_girl,lol,False
14_yr_old_girl,u,False
kinkyjeff694u,camping fishing hanging out with friends parting dancing,True
14_yr_old_girl,kewl,False
14_yr_old_girl,i dont lik fishin ewwwwwwww lol,False
kinkyjeff694u,well thats ok sweetie,True
14_yr_old_girl,lol kewl,False
kinkyjeff694u,yeah sweetie,True
kinkyjeff694u,i also like movies and cuddlin too,True
14_yr_old_girl,thats kewl too,False
kinkyjeff694u,yeah it is too,True
14_yr_old_girl,ur quiet lol,False
kinkyjeff694u,sorry sweetie,True
14_yr_old_girl,its k,False
kinkyjeff694u,so do u like older guys,True
14_yr_old_girl,i gues so its jus a numbr to me,False
14_yr_old_girl,i lik chattin to whoevr,False
kinkyjeff694u,cool and yea me too,True
14_yr_old_girl,kewl,False
14_yr_old_girl,so u lik kiss groop huh,False
kinkyjeff694u,yes i do they rock,True
14_yr_old_girl,lol ya,False
kinkyjeff694u,ohh ya what kind of music do u like,True
14_yr_old_girl,contry mostly,False
kinkyjeff694u,cool,True
14_yr_old_girl,ya i luv carrie underwood,False
kinkyjeff694u,yeah she hot,True
14_yr_old_girl,lol,False
kinkyjeff694u,and she sings good too,True
14_yr_old_girl,ya she does lol,False
kinkyjeff694u,yes,True
14_yr_old_girl,u stil got long hair,False
kinkyjeff694u,yes i do baby,True
14_yr_old_girl,thats kewl,False
14_yr_old_girl,looks good,False
kinkyjeff694u,aww ty u sweetie,True
14_yr_old_girl,lol yw,False
14_yr_old_girl,so tell me bout u,False
kinkyjeff694u,well first of all im disable im a paraplegic but i very outgoing and indepent im very open and honest and warm and caring and friendly and i love to pamper and please,True
14_yr_old_girl,aww kewl,False
14_yr_old_girl,u sound very nice,False
kinkyjeff694u,aww thank u sweetie,True
14_yr_old_girl,yw,False
kinkyjeff694u,and i like younger girls too,True
14_yr_old_girl,kewl gues u lik me then lol,False
kinkyjeff694u,yes i do sweetie you are very beautiful and sexy,True
14_yr_old_girl,wow u relly think so,False
kinkyjeff694u,ohh yes i do very much so,True
14_yr_old_girl,ty soo much,False
kinkyjeff694u,mmmmm you are so very welcome and my pleasure baby,True
14_yr_old_girl,u chat much,False
kinkyjeff694u,yes i do baby,True
14_yr_old_girl,kewl me too,False
kinkyjeff694u,kwel baby,True
kinkyjeff694u,so tell me more about u to baby,True
14_yr_old_girl,hmm well im my mom an dad died cupple yrs ago so i liv wit my aunt i am on here lots cuz aint got much else to do lol,False
14_yr_old_girl,i got a black kitty cat named salem too lol,False
kinkyjeff694u,very lovely baby and im sorry to hear about ur mom and dad too and i have a lil yorkie name lil bit too,True
14_yr_old_girl,kewl,False
kinkyjeff694u,yeah baby,True
14_yr_old_girl,so what do u do,False
kinkyjeff694u,i work on computers for people from my home and i chat on here and sometimes even meet them too in real,True
14_yr_old_girl,thats kewl,False
14_yr_old_girl,i luv my puter lol,False
kinkyjeff694u,cool baby,True
14_yr_old_girl,i tole my aunt i wishd i had a puter long time ago lol,False
kinkyjeff694u,cool sweetie,True
14_yr_old_girl,so umm can i ask u somethin,False
kinkyjeff694u,yes u can baby anything,True
14_yr_old_girl,ur in a wheelchair rite,False
14_yr_old_girl,looks lik it in pic,False
kinkyjeff694u,yes i am baby,True
14_yr_old_girl,so how do u drive,False
kinkyjeff694u,i have hand controls in my car,True
14_yr_old_girl,oh kewl nevr herd of that before,False
14_yr_old_girl,srry was jus bein nosey,False
kinkyjeff694u,aww ur just fine baby,True
14_yr_old_girl,k didnt wanna seem lik i was wierd for askin lol,False
kinkyjeff694u,im glad when people ask me question baby it lets me know that their interested in me,True
14_yr_old_girl,ya ur kewl i lik that,False
kinkyjeff694u,ya ur kewl and very sweet to baby,True
14_yr_old_girl,ty,False
14_yr_old_girl,i gotta take a shower u wanna add me so we can chat agin,False
kinkyjeff694u,mmmmm wish i could join u baby,True
14_yr_old_girl,lol thatd be kewl,False
kinkyjeff694u,mmmm ohh yes it would be to baby,True
14_yr_old_girl,u gonna be on in bout an hour,False
kinkyjeff694u,yes i will be baby,True
14_yr_old_girl,k i be bck bout then,False
14_yr_old_girl,im btw,False
kinkyjeff694u,mmmmm ok baby i cant wait,True
kinkyjeff694u,hi im jeff,True
14_yr_old_girl,ntmu,False
14_yr_old_girl,back soon,False
kinkyjeff694u,hi how was ur shower baby,True
14_yr_old_girl,it was warm lol,False
kinkyjeff694u,mmmmmm very nice then,True
14_yr_old_girl,ya i luv showrs,False
kinkyjeff694u,me too baby wish i could wash ur hair,True
14_yr_old_girl,thatd be kewl,False
14_yr_old_girl,what part of okla u in,False
14_yr_old_girl,im in south,False
kinkyjeff694u,im in chickasha,True
14_yr_old_girl,idk where that is lol,False
kinkyjeff694u,im south of okc,True
14_yr_old_girl,oh kewl,False
kinkyjeff694u,yeah baby,True
kinkyjeff694u,baby can i ask u a personal question,True
14_yr_old_girl,ya,False
kinkyjeff694u,are u shaven or nicely trimmed,True
14_yr_old_girl,not relly not much there relly,False
kinkyjeff694u,mmmmm very sexy,True
14_yr_old_girl,k,False
kinkyjeff694u,mmmm i would love to taste u down there baby,True
14_yr_old_girl,relly,False
kinkyjeff694u,mmmm ohh yes baby and ur lovely breast too,True
14_yr_old_girl,kewl nevr had that before,False
kinkyjeff694u,mmmm well i would love to show u how it feels baby,True
14_yr_old_girl,thatd be kewl,False
kinkyjeff694u,mmmm ohh yes it would be to baby,True
14_yr_old_girl,kewl,False
kinkyjeff694u,i can still have sex too but i cant cum from my penis,True
14_yr_old_girl,relly how come,False
kinkyjeff694u,from having no feeling in it and after awhile i stop making sperm but i still have the same sensation though,True
14_yr_old_girl,ohh how long u been lik that,False
kinkyjeff694u,ive been in a wheelchair since i was 19,True
14_yr_old_girl,wow,False
14_yr_old_girl,what happend if i can ask,False
kinkyjeff694u,i had a cliff diving accident i dove 40ft into 4ft of water not known that the tide had gone out,True
14_yr_old_girl,omg srry,False
kinkyjeff694u,thank u baby,True
14_yr_old_girl,so lik u have no feelins anywher,False
kinkyjeff694u,i have no feeling from the nipple line down,True
14_yr_old_girl,omg that sux,False
kinkyjeff694u,yes thats true baby,True
14_yr_old_girl,srry im probly buggin ya wit all that,False
14_yr_old_girl,i jus nevr kne neone that was hurt lik that,False
kinkyjeff694u,ohh you are just fine baby,True
14_yr_old_girl,k,False
kinkyjeff694u,and for sex u just have to be ontop of me thts all too,True
14_yr_old_girl,how u do that wit no feelin,False
kinkyjeff694u,i can still get hard baby,True
14_yr_old_girl,ohh lol ok,False
kinkyjeff694u,mmm yes baby,True
14_yr_old_girl,u evr play 20 questons before,False
kinkyjeff694u,yes i have,True
14_yr_old_girl,kinda feel lik thats what im doin lol,False
kinkyjeff694u,but im glad ur asking though baby,True
14_yr_old_girl,k,False
14_yr_old_girl,so i asked lots ur turn lol,False
kinkyjeff694u,have u had sex yet baby,True
14_yr_old_girl,not atw no,False
14_yr_old_girl,u got ne bros or sis,False
kinkyjeff694u,yes i have a younger sis baby,True
14_yr_old_girl,kewl,False
14_yr_old_girl,ur turn lol,False
kinkyjeff694u,what all have u done with a boy or girl,True
14_yr_old_girl,no girls jus my ex an kissin an stuff lik that but nevr went all the way,False
kinkyjeff694u,very lovely baby,True
14_yr_old_girl,whats the yungest u have been wit,False
kinkyjeff694u,12 baby with her mom,True
14_yr_old_girl,ur turn lol,False
kinkyjeff694u,what are ur turn ons and turn off from a guy,True
14_yr_old_girl,umm guy has gotta be reel no fake stuf an he has gotta be lots of fun,False
14_yr_old_girl,u said 12 with her mom what did that meen,False
kinkyjeff694u,i was with her and her mom at the same time we all played with each other,True
14_yr_old_girl,o lol k,False
14_yr_old_girl,ur turn agin,False
kinkyjeff694u,yes baby,True
kinkyjeff694u,how would u like ur first time all the way to be,True
14_yr_old_girl,wit someone that wont laff at me for not knoin what im doin,False
kinkyjeff694u,well i wouldnt laff at u at all baby but make u feel very comfortable,True
14_yr_old_girl,thatd be kewl,False
14_yr_old_girl,my turn,False
14_yr_old_girl,u stil see the 12 yo an her mom,False
kinkyjeff694u,no baby,True
14_yr_old_girl,k ur up lol,False
kinkyjeff694u,have u ever touched or played with urself,True
14_yr_old_girl,i tried that one time but i gues i didnt do it rite or somethin i jus felt relly wierd,False
kinkyjeff694u,mmmm well i would love to teach u anything u would want to try or learn baby,True
14_yr_old_girl,thatd be kewl,False
14_yr_old_girl,umm thinkin lol,False
14_yr_old_girl,u got gf or wife,False
kinkyjeff694u,no baby,True
14_yr_old_girl,wow,False
kinkyjeff694u,im single and looking,True
14_yr_old_girl,kewl,False
14_yr_old_girl,ur turn,False
kinkyjeff694u,do u have a,True
14_yr_old_girl,not ne more no,False
kinkyjeff694u,kewl,True
14_yr_old_girl,lol ya he was a jerk,False
14_yr_old_girl,u alwasys livd in chickawhatever lol,False
kinkyjeff694u,well glad that u got rid of him then,True
14_yr_old_girl,me to lol,False
kinkyjeff694u,yes since 1985 i lived in north carolina before that,True
14_yr_old_girl,kewl thats a long time,False
kinkyjeff694u,yes baby,True
kinkyjeff694u,whats ur biggest fantasy,True
14_yr_old_girl,idk nevr relly thought bout that before,False
14_yr_old_girl,whats the mayrhofen in ur name meen,False
kinkyjeff694u,thats my last name baby,True
14_yr_old_girl,short spellin,False
14_yr_old_girl,or rite way,False
kinkyjeff694u,u spelled it right baby,True
14_yr_old_girl,kewl,False
kinkyjeff694u,yes baby ur the first one that ever just spelled it right the first time,True
14_yr_old_girl,i jus looked over,False
14_yr_old_girl,lol,False
kinkyjeff694u,cool,True
14_yr_old_girl,ya,False
14_yr_old_girl,whens ur bday,False
kinkyjeff694u,may 13 and urs,True
14_yr_old_girl,oct 31,False
kinkyjeff694u,cool a halloween baby,True
14_yr_old_girl,ya lol,False
kinkyjeff694u,im a friday the 13 baby,True
14_yr_old_girl,kewl,False
kinkyjeff694u,yeah,True
14_yr_old_girl,ur turn,False
kinkyjeff694u,what are u wearing now,True
14_yr_old_girl,t an shorts,False
kinkyjeff694u,mmmm very sexy baby,True
14_yr_old_girl,awww ty,False
kinkyjeff694u,mmmm yvw,True
kinkyjeff694u,what kind of panties are u wearing,True
14_yr_old_girl,bikini,False
kinkyjeff694u,mmmmm very sexy,True
14_yr_old_girl,ty agin,False
14_yr_old_girl,lol,False
14_yr_old_girl,hmm thinkin agin,False
kinkyjeff694u,i love girls in sexy panties and bras,True
14_yr_old_girl,kewl,False
14_yr_old_girl,u been wit mor girls my age or oldr,False
kinkyjeff694u,both about the same equals to the same amount,True
14_yr_old_girl,lol kewl,False
kinkyjeff694u,whats ur fav color,True
14_yr_old_girl,blue,False
14_yr_old_girl,urs,False
kinkyjeff694u,blue,True
14_yr_old_girl,kewl we match lol,False
kinkyjeff694u,mmmm yes we do in more ways then one,True
14_yr_old_girl,how else we match,False
kinkyjeff694u,we both are attractive to each other,True
14_yr_old_girl,ya thats kewl,False
kinkyjeff694u,yes it is too baby,True
14_yr_old_girl,lol ya,False
kinkyjeff694u,i think that u are just so sweet and beautiful and sexy baby,True
14_yr_old_girl,omg that is so kewl,False
kinkyjeff694u,well its the truth though baby,True
14_yr_old_girl,awww ty,False
kinkyjeff694u,ur so very welcome baby and my pleasure,True
14_yr_old_girl,u kno ur cute too,False
14_yr_old_girl,luv the hair,False
kinkyjeff694u,mmmm ty u baby long enough for u t hold on to,True
14_yr_old_girl,ya it is lol,False
14_yr_old_girl,yw too,False
14_yr_old_girl,u be on tomorow,False
kinkyjeff694u,yes i will be baby,True
14_yr_old_girl,kewl,False
14_yr_old_girl,i chat wit u mor then cuz my aunt said i gotta go to bed for school,False
kinkyjeff694u,mmmmm ok baby very sweet dreams and ill be thinking about u,True
14_yr_old_girl,k i chat u tomorow u sleep good too k,False
kinkyjeff694u,ohh i will baby,True
14_yr_old_girl,k nite for now,False
kinkyjeff694u,nite for now baby,True
kinkyjeff694u,hi baby how are u this evening,True
14_yr_old_girl,hey u here,False
14_yr_old_girl,aww u not gonna talk to me,False
kinkyjeff694u,hi baby,True
14_yr_old_girl,hey wher were u,False
kinkyjeff694u,letting my dog outside,True
14_yr_old_girl,ooo ok lol,False
14_yr_old_girl,thoght u were mad at me for sumthin,False
14_yr_old_girl,lol,False
kinkyjeff694u,ohh no baby not at all,True
14_yr_old_girl,k kewl,False
kinkyjeff694u,mm ohh yes baby,True
14_yr_old_girl,what ya been up to,False
kinkyjeff694u,not to much tring to stay wrm andu baby,True
14_yr_old_girl,nm our powr was out lol,False
kinkyjeff694u,ohh wow then baby,True
14_yr_old_girl,ya it suckd,False
14_yr_old_girl,lol,False
kinkyjeff694u,ya i bet to baby,True
kinkyjeff694u,ive missed you though baby,True
14_yr_old_girl,i missd u too,False
kinkyjeff694u,mmmm that makes me feel so special babvy,True
14_yr_old_girl,kewl,False
14_yr_old_girl,hey whats that by ur name the linkie,False
kinkyjeff694u,my name baby,True
14_yr_old_girl,lol i kno it has ur name lol,False
14_yr_old_girl,by ur name lol,False
kinkyjeff694u,are u talking about jeff mayrhofen,True
14_yr_old_girl,no i kno u said that was ur name was talkin bout the lil link by ur name,False
kinkyjeff694u,view my cam,True
14_yr_old_girl,oh k lol,False
14_yr_old_girl,didnt kno u had a cam lol,False
kinkyjeff694u,yes i do baby,True
14_yr_old_girl,kewl,False
kinkyjeff694u,mmmmm ohh yes baby,True
kinkyjeff694u,baby do u want to see my new pics that i took of me,True
14_yr_old_girl,ya if u wanna share em wit me,False
kinkyjeff694u,mmmmm ohh yes i do my sweet love,True
14_yr_old_girl,kewl,False
kinkyjeff694u,are u alone baby some of them are nude,True
14_yr_old_girl,ya my aunt is sleepin,False
kinkyjeff694u,so what do u think baby,True
14_yr_old_girl,they r loadin slow,False
kinkyjeff694u,ohh ok baby,True
14_yr_old_girl,wow thos all u,False
kinkyjeff694u,yes they are baby,True
14_yr_old_girl,kelw,False
14_yr_old_girl,kewl lol,False
kinkyjeff694u,im glad that u like them baby,True
14_yr_old_girl,ya ther kewl,False
kinkyjeff694u,not a bad size cock huh and thick,True
14_yr_old_girl,idk i gues so not sure how big its suposd to be,False
kinkyjeff694u,well when im laying down its about 6,True
14_yr_old_girl,i gues its k,False
kinkyjeff694u,kwel,True
14_yr_old_girl,lol i do that too mix up my lettrs,False
kinkyjeff694u,yea,True
kinkyjeff694u,so what are u wearing now baby,True
14_yr_old_girl,sweats an t,False
kinkyjeff694u,very sexy,True
14_yr_old_girl,awww ty,False
kinkyjeff694u,yvw baby,True
kinkyjeff694u,i bet that ur wearing some sexy panties too,True
14_yr_old_girl,i gues so lol,False
kinkyjeff694u,mmmm what do they look like baby,True
14_yr_old_girl,they r bikini wit pink bow on em,False
kinkyjeff694u,mmmmm very sexy and yummy i cant wait to see them on u,True
14_yr_old_girl,that souns kewl,False
kinkyjeff694u,mmmm ohh yes and softly caress them whiel ur wearing them,True
14_yr_old_girl,kewl,False
kinkyjeff694u,mmmm ohh yes and taste ur sweet hot juices thru them as ur wearing them,True
14_yr_old_girl,souns kewl,False
kinkyjeff694u,and suck and nibble on ur sweet sexy tities as well to baby,True
14_yr_old_girl,relly thats kewl,False
kinkyjeff694u,mmmm ohh yes really baby and kiss ur tender lips passionately,True
14_yr_old_girl,kewl,False
kinkyjeff694u,mmm ohh yes baby do anything u want,True
14_yr_old_girl,relly thatd be kewl,False
kinkyjeff694u,ohh yes really baby,True
kinkyjeff694u,what would be something u would want to do,True
14_yr_old_girl,idk i aint done much,False
kinkyjeff694u,cool baby well we will take it slowly baby,True
14_yr_old_girl,kewl,False
kinkyjeff694u,pamper u with a nice bath and rub some lotion on u afterwards with a gently massage,True
14_yr_old_girl,that souns fun,False
kinkyjeff694u,mmmm ohh yes it does baby too,True
14_yr_old_girl,u go to sleep lol,False
kinkyjeff694u,no im still here baby,True
14_yr_old_girl,k u got quiet lol,False
kinkyjeff694u,im sorry baby,True
kinkyjeff694u,phone,True
14_yr_old_girl,k,False
kinkyjeff694u,and then me burshing ur hair,True
14_yr_old_girl,kewl,False
kinkyjeff694u,mmmmmm ohh yes baby,True
kinkyjeff694u,just pamper u liek the princess that u are baby,True
14_yr_old_girl,kewl thatd be fun,False
kinkyjeff694u,mmmmm ohh yes it would be baby,True
14_yr_old_girl,what kinda car u got that has hand controls,False
kinkyjeff694u,cadillac eldorado black,True
14_yr_old_girl,kewl,False
kinkyjeff694u,mmmm ohh yes,True
kinkyjeff694u,u will like it,True
14_yr_old_girl,kewl,False
14_yr_old_girl,u gonna let me drive lol,False
kinkyjeff694u,yes i will baby,True
14_yr_old_girl,o wow kewl,False
kinkyjeff694u,mmmm ohh yes baby,True
kinkyjeff694u,just to have u beside me,True
14_yr_old_girl,thatd be fun,False
kinkyjeff694u,yes u wearing one of ur lil short skirts too,True
14_yr_old_girl,i could do that but its kinda cold rite now lol,False
kinkyjeff694u,well yes i know that now baby im talking when it gets warmer,True
14_yr_old_girl,o ic lol,False
kinkyjeff694u,yes baby thts way we could open up the moon roof too,True
14_yr_old_girl,kewl its got a moon roof,False
kinkyjeff694u,mmmm ohh yes it does,True
14_yr_old_girl,ya,False
kinkyjeff694u,ohh yeah and a louf stereo too,True
14_yr_old_girl,kewl,False
kinkyjeff694u,ohh yes,True
14_yr_old_girl,did u go drivin an slippin round on the ice,False
14_yr_old_girl,lol,False
kinkyjeff694u,no baby i didnt,True
14_yr_old_girl,lol thats good cuz it was bad,False
14_yr_old_girl,my aunt said we needed to go to the store an we keepd slidin round,False
kinkyjeff694u,ohh wow baby,True
14_yr_old_girl,ya we went lik 2 blocks an came bck home lol,False
kinkyjeff694u,yeah i bet too,True
14_yr_old_girl,ya glad it got this ice ovr befor next weeknd tho,False
kinkyjeff694u,ohh yeah how come,True
14_yr_old_girl,cuz aunt has gotta go to cali this nextweeknd,False
kinkyjeff694u,ohh ok baby,True
14_yr_old_girl,lol i lik it when she goes cuz then i get home by meself,False
kinkyjeff694u,cool baby,True
14_yr_old_girl,ya i get to act lik i liv by meself lol its fun,False
kinkyjeff694u,cool baby i might have to come up if the roads are good,True
14_yr_old_girl,thatd be kewl,False
kinkyjeff694u,mmmm ohh yes it would be too,True
14_yr_old_girl,ya itd be fun,False
kinkyjeff694u,ill even let u invite one of ur too,True
14_yr_old_girl,lol nah i dont wanna get in trubble,False
kinkyjeff694u,yeah true baby,True
14_yr_old_girl,ya i aint sayin nuttin i mite get in trubble an that wuldnt be kewl,False
kinkyjeff694u,yes true baby and me too and we wouldnt want that,True
14_yr_old_girl,heck no i aint dum,False
kinkyjeff694u,me either,True
kinkyjeff694u,watch u model ur sexy lil outfits for me too,True
14_yr_old_girl,lol kewl i can do that,False
kinkyjeff694u,mmmmm very lovely baby,True
kinkyjeff694u,and ur sexy lil nightys and panites too,True
14_yr_old_girl,lol i bettr make sur the heats on reel good then lol,False
kinkyjeff694u,mmmmm ohh yes thats true baby,True
14_yr_old_girl,lol,False
kinkyjeff694u,lol,True
14_yr_old_girl,u look cold ovr lol no shirt on,False
kinkyjeff694u,no i got the heat,True
14_yr_old_girl,k good or ud get sick lol,False
kinkyjeff694u,yes thats true baby,True
14_yr_old_girl,im gonna hafta get to bed case we got school,False
kinkyjeff694u,ok baby,True
14_yr_old_girl,u gonna be here tomm,False
kinkyjeff694u,yes i will be baby,True
14_yr_old_girl,k if we aint got no school then i be on round 2 or so k,False
kinkyjeff694u,i give u my cell phone number to if u like,True
kinkyjeff694u,ok baby,True
14_yr_old_girl,ya kewl then i can call ya tomm if u want me too,False
kinkyjeff694u,ohh yes i sure would baby,True
14_yr_old_girl,kewl,False
14_yr_old_girl,k kewl got it,False
kinkyjeff694u,kwel baby,True
14_yr_old_girl,wil call tomm but only aftr i see ya on here k,False
kinkyjeff694u,ok baby i cant wait,True
14_yr_old_girl,me to k chat tomm then nite for now,False
kinkyjeff694u,nite for now baby sweet dreams kisses,True
14_yr_old_girl,nite nite,False
kinkyjeff694u,nite nite my darling love,True
14_yr_old_girl,u ther,False
kinkyjeff694u,yes i am baby,True
14_yr_old_girl,kewl,False
14_yr_old_girl,whatcha doin,False
kinkyjeff694u,not much baby and you,True
14_yr_old_girl,nm just checkin email,False
kinkyjeff694u,kwel baby,True
kinkyjeff694u,i missed u today baby,True
14_yr_old_girl,i srry was sleepin lol,False
kinkyjeff694u,mmmmm wish i was there cuddlin with u then,True
14_yr_old_girl,awww kewl,False
kinkyjeff694u,mmmmm ohhh yes and holding u next to me closely,True
14_yr_old_girl,thatd be good,False
kinkyjeff694u,mmmmm ohh yes and softly caressin you,True
14_yr_old_girl,kewl,False
kinkyjeff694u,kissing u softly and gentle,True
14_yr_old_girl,that souns fun,False
kinkyjeff694u,mmmmm ohh yes it does too baby,True
14_yr_old_girl,i hope all the ice melts before fri nite,False
kinkyjeff694u,yes so do i too baby,True
14_yr_old_girl,i hate bein cold,False
kinkyjeff694u,me too baby wish i was there to warm u up,True
14_yr_old_girl,lol me too,False
kinkyjeff694u,mmmm ohh yes baby,True
14_yr_old_girl,so did ya put a shirt on yet lol stil looks cold,False
kinkyjeff694u,no but i still have my heater going in my computer room though,True
14_yr_old_girl,lol lest ur stayin warm,False
kinkyjeff694u,yes baby,True
14_yr_old_girl,kewl,False
kinkyjeff694u,so whats my sexy baby wearing today,True
14_yr_old_girl,sweats its cold,False
kinkyjeff694u,sexy baby,True
14_yr_old_girl,aww ty,False
kinkyjeff694u,yvw baby,True
kinkyjeff694u,hopefully i can keep u warm sat baby,True
14_yr_old_girl,oooo thatd be kewl,False
kinkyjeff694u,mmmm ohh yes it would be to baby,True
14_yr_old_girl,ya souns fun,False
kinkyjeff694u,mmm ohh yes baby and stay with u all day too and maybe the night,True
14_yr_old_girl,relly thatd be sweet,False
kinkyjeff694u,yes it would be baby,True
14_yr_old_girl,my aunts gonna be gone til sometime mon mornin,False
kinkyjeff694u,cool baby,True
14_yr_old_girl,i cant wait lol,False
kinkyjeff694u,mmmm me either then baby,True
14_yr_old_girl,kewl,False
kinkyjeff694u,stay at ur house with u,True
14_yr_old_girl,ya thatd be kewl,False
14_yr_old_girl,hey want me to call ya sense my aunts gone rite now,False
14_yr_old_girl,aww wherd ya go,False
kinkyjeff694u,ohh yes baby i would love for u to call me,True
kinkyjeff694u,i cant wait to hear ur sexy voice baby,True
14_yr_old_girl,k let me find the phone,False
kinkyjeff694u,ok baby,True
14_yr_old_girl,ok gonna call gotta sign off,False
kinkyjeff694u,ok baby,True
14_yr_old_girl,srry was afraid aunt wuld come in,False
kinkyjeff694u,yes i understand baby,True
14_yr_old_girl,k kewl,False
kinkyjeff694u,ohh yes baby,True
14_yr_old_girl,u soun cute too lol,False
kinkyjeff694u,aww ty too baby,True
14_yr_old_girl,yw,False
14_yr_old_girl,lol,False
kinkyjeff694u,lol brb baby my dog needs out,True
14_yr_old_girl,k,False
kinkyjeff694u,im back,True
14_yr_old_girl,wow ur fast lol,False
kinkyjeff694u,yeah he just wanted out of the room,True
14_yr_old_girl,o lol ok,False
kinkyjeff694u,so do u have any steps going into ur house baby,True
14_yr_old_girl,no lol,False
kinkyjeff694u,cool baby that way i wont have a trouble getting my wheelchair in,True
14_yr_old_girl,nope u wont have no probs gettin in,False
kinkyjeff694u,cool baby,True
14_yr_old_girl,now i relly cant wait til sat lol,False
kinkyjeff694u,mmmm either can i too baby,True
14_yr_old_girl,i gotta go help my aunt wit dinnr she jus got home,False
14_yr_old_girl,i be bck latr k,False
kinkyjeff694u,ok baby,True
14_yr_old_girl,doggie must have wantd out agin lol,False
kinkyjeff694u,no baby ive been here waiting for u,True
14_yr_old_girl,aww i said hi u didnt answr thoght u were away lol,False
kinkyjeff694u,ohhh i sorry baby that must have happen when i got botted,True
14_yr_old_girl,ohh i hate when that happens,False
kinkyjeff694u,me too love,True
kinkyjeff694u,my sexy,True
14_yr_old_girl,awww relly thats kewl,False
kinkyjeff694u,ohh yes it is to baby very kwel,True
14_yr_old_girl,ya it is,False
kinkyjeff694u,ohh yes baby,True
kinkyjeff694u,would u like to be my sexy baby,True
14_yr_old_girl,ya that souns kewl,False
kinkyjeff694u,kwel baby,True
kinkyjeff694u,i heard on the new that we are supposed to get 3 to 4 more inches by this weekend baby which i dont want to happen,True
14_yr_old_girl,relly i herd it was gonna warm up lol,False
kinkyjeff694u,i hope that it does baby,True
14_yr_old_girl,me too i relly want u to be able to come sat,False
kinkyjeff694u,ohh yes so do i too baby,True
kinkyjeff694u,so we can cuddle together,True
14_yr_old_girl,ya thats goin to be fun,False
kinkyjeff694u,yes it is too baby,True
kinkyjeff694u,as i bath u too baby ad wash ur hair,True
14_yr_old_girl,kewl nevr had ne wash my hair lol,False
kinkyjeff694u,aww well very lvely ten baby,True
14_yr_old_girl,huh lol,False
kinkyjeff694u,lovely then,True
14_yr_old_girl,oh lol,False
kinkyjeff694u,mmmm ohh yes baby,True
kinkyjeff694u,then rub some baby oil all over u gently,True
14_yr_old_girl,kewl,False
kinkyjeff694u,watch some moives,True
14_yr_old_girl,ya we could do that too,False
kinkyjeff694u,i can bring a xrated one too if u like,True
14_yr_old_girl,nevr seen ne of thos,False
kinkyjeff694u,would u like to baby,True
14_yr_old_girl,if u wanna bring one wit u then ya u can lol,False
kinkyjeff694u,well i will bring one too,True
14_yr_old_girl,k,False
