User,Text,Groom
14_yr_old_girl,its gonna b so kewl seein u,False
kinkyjeff694u,ohh yes i know baby very kool,True
14_yr_old_girl,ya it is,False
kinkyjeff694u,ohh yes baby,True
kinkyjeff694u,im geting hard judt thinking about it baby,True
14_yr_old_girl,kewl im relly excitd too,False
kinkyjeff694u,mmmm very nice baby,True
14_yr_old_girl,ur relly sweet i lik u lots,False
kinkyjeff694u,ur very sweet to baby and i like u alot too,True
14_yr_old_girl,awwwww ty,False
kinkyjeff694u,mmmmm your so welcome baby,True
14_yr_old_girl,can i ask ya somethin witout u thinkin im wierd lol,False
kinkyjeff694u,yes u can baby,True
14_yr_old_girl,u evr been wit ne othr girls my age sides the one u tole me bout,False
14_yr_old_girl,i jus was wonderin if she was the only one u had to teach sides me,False
kinkyjeff694u,yes i have been too baby,True
14_yr_old_girl,srry my powr went off for a sec,False
14_yr_old_girl,i didnt getta see what u said,False
kinkyjeff694u,yes i have been baby,True
14_yr_old_girl,kewl,False
14_yr_old_girl,so i aint jus lik relly dum or nething,False
14_yr_old_girl,lol,False
kinkyjeff694u,no ur not at all baby,True
14_yr_old_girl,k,False
14_yr_old_girl,r u lik buzy now,False
14_yr_old_girl,cuz i can go if u are,False
kinkyjeff694u,no baby im not,True
14_yr_old_girl,k,False
14_yr_old_girl,i jus relly lik u an lik chattin wit u too,False
kinkyjeff694u,well so to i as well to baby,True
14_yr_old_girl,kewl,False
kinkyjeff694u,yes vry kwel baby,True
14_yr_old_girl,i think im gonna go to bed im sleepy,False
kinkyjeff694u,ok baby sweet dreams,True
14_yr_old_girl,nite see u tomm k,False
kinkyjeff694u,ok baby and nite nite,True
14_yr_old_girl,nite,False
14_yr_old_girl,hey i miss u hope u on latr,False
kinkyjeff694u,hi baby,True
14_yr_old_girl,i missd u so much,False
kinkyjeff694u,i missed u so much to baby,True
14_yr_old_girl,u ok u aint been on,False
kinkyjeff694u,yeah im ok baby and ive been on the last 3 days,True
14_yr_old_girl,geeze gues we jus missd ech othr then,False
kinkyjeff694u,yeah well its been kinda of late though when i was getting on,True
14_yr_old_girl,lol k,False
kinkyjeff694u,so what town do u live in baby i was going to look it up on mapquest to get directions,True
14_yr_old_girl,im close to lawton srry,False
14_yr_old_girl,was lettin my kitty in,False
kinkyjeff694u,cool baby were even closer then cus im in chickasha so what town by lawton,True
14_yr_old_girl,kewl that we are closr,False
kinkyjeff694u,mmmm i know a kitty i want to pet baby,True
kinkyjeff694u,ohh yes baby,True
14_yr_old_girl,oo kewl,False
kinkyjeff694u,so do u live in lawton baby,True
14_yr_old_girl,not in but relly close,False
14_yr_old_girl,i jus kinda wantd to wait to tell ya lol,False
kinkyjeff694u,ohh ok baby,True
14_yr_old_girl,wel jus that way its closr to time for u to come see me lol,False
kinkyjeff694u,i understand i was just going to have them ready so i wouldnt have to do it on the last min to come down but i can wait baby,True
14_yr_old_girl,k i wont wait til lik last min k,False
14_yr_old_girl,plz dont be mad at me,False
kinkyjeff694u,ohhh baby im not mad at u at all,True
14_yr_old_girl,k kewl,False
kinkyjeff694u,mmmm baby since were closer to we could see each other more time to time too,True
14_yr_old_girl,kewl id relly lik that,False
kinkyjeff694u,mmmm so would i too baby,True
14_yr_old_girl,thats good,False
14_yr_old_girl,at lest its gettin warmer too lol,False
kinkyjeff694u,ohh yes very true to baby,True
14_yr_old_girl,ya so what ya doin tonite neway,False
kinkyjeff694u,not much really and you baby,True
14_yr_old_girl,nm jus bein bord,False
14_yr_old_girl,lik alwasys,False
kinkyjeff694u,well u wont be bored when i come and see u baby,True
14_yr_old_girl,good i hate bein bord,False
14_yr_old_girl,lol,False
kinkyjeff694u,good baby,True
14_yr_old_girl,oh ya btw lol my aunt is leavin on the 2nd an wil be gone til lik sun nite,False
kinkyjeff694u,cool then baby,True
14_yr_old_girl,ya its gonna be so much fun i lik when shes gone,False
kinkyjeff694u,mmm ohh yes it is too baby,True
kinkyjeff694u,so did my baby wear some sexy bra and panties for me today,True
14_yr_old_girl,i got on pink panties an whit bra,False
14_yr_old_girl,wit lik lil dots on em,False
kinkyjeff694u,mmmmm so sexy baby,True
14_yr_old_girl,lol ty,False
kinkyjeff694u,mm yvw baby,True
kinkyjeff694u,i cant wait to see and feel ur sexy bra and panties on u baby,True
14_yr_old_girl,kewl,False
kinkyjeff694u,mmm ohh yes baby,True
14_yr_old_girl,ur kinda quiet,False
kinkyjeff694u,im eatting too baby,True
14_yr_old_girl,ohh srry,False
14_yr_old_girl,what ya eatin,False
kinkyjeff694u,steak rice peas and cottage cheese,True
14_yr_old_girl,yummmmmmy,False
kinkyjeff694u,mmmm ohh yes,True
kinkyjeff694u,let me finsh eatting real quick baby,True
14_yr_old_girl,k no prob,False
kinkyjeff694u,k my love,True
kinkyjeff694u,im back baby,True
14_yr_old_girl,wow ur fast lol,False
kinkyjeff694u,i was almost finished anyways,True
14_yr_old_girl,lol good u didnt chock,False
kinkyjeff694u,ohh no baby,True
kinkyjeff694u,mmmmm cant wait to take all of ur sexy and naughty pics baby,True
14_yr_old_girl,thats gonna be fun cuz i aint nevr done that,False
kinkyjeff694u,mmmm ohh yes it is to baby i show u how to pose,True
14_yr_old_girl,kewl,False
14_yr_old_girl,u not gonna show neone the pics rite,False
14_yr_old_girl,cuz i wuld be lik relly embarrsd,False
kinkyjeff694u,ohh hell no baby they are just for me,True
14_yr_old_girl,kewl,False
kinkyjeff694u,mmmm ohh yes baby,True
14_yr_old_girl,u think u can come down fri or u wanna wait til sat,False
kinkyjeff694u,yes baby i can so i can spend fri and sat with u baby,True
14_yr_old_girl,kewl then we get mor time togethr,False
kinkyjeff694u,mmmm ohh yes baby,True
14_yr_old_girl,oh kewl i so caint wait,False
kinkyjeff694u,mmmmm me either baby,True
kinkyjeff694u,brb i need to let my dog out,True
14_yr_old_girl,k,False
kinkyjeff694u,im back baby,True
14_yr_old_girl,wb luv,False
kinkyjeff694u,ty luv,True
14_yr_old_girl,yw lol,False
kinkyjeff694u,mmmmm baby i cant wait to make u a woman,True
14_yr_old_girl,me neithr,False
14_yr_old_girl,lol,False
kinkyjeff694u,kwel baby,True
kinkyjeff694u,and especially just to hold u in my arms baby,True
14_yr_old_girl,ya im gonna lik that,False
kinkyjeff694u,mmm me to baby,True
kinkyjeff694u,and kiss ur body all over,True
14_yr_old_girl,that souns relly good,False
kinkyjeff694u,mmmm ohh yes it does baby,True
14_yr_old_girl,i am jus so happy im finly gonna be able to see u,False
kinkyjeff694u,ohh me too baby,True
14_yr_old_girl,kewl,False
kinkyjeff694u,mmmm ohh yes baby,True
kinkyjeff694u,suck and nibble on ur tender breast and slide my tongue along ur hot pussy and ass,True
14_yr_old_girl,mm kewl,False
kinkyjeff694u,mmmm ohh yes baby,True
14_yr_old_girl,im so glad that shes finly gonna go lol,False
kinkyjeff694u,mmmmm ohh yes me too baby,True
14_yr_old_girl,im gonna be lik so nervous,False
kinkyjeff694u,mmmm im so gld that we found out that we live closer than what we thought too baby,True
14_yr_old_girl,oh me too its kewl,False
kinkyjeff694u,aww baby ill make u comfortable,True
14_yr_old_girl,i jus hope u lik me u kno,False
kinkyjeff694u,oh baby i do like u already,True
14_yr_old_girl,i relly lik u to,False
kinkyjeff694u,im so glad to hear that bab,True
14_yr_old_girl,wanna kno somethin wierd,False
kinkyjeff694u,sure baby,True
14_yr_old_girl,i think i kinda luv u is that bad,False
kinkyjeff694u,no its not at all baby,True
14_yr_old_girl,k didn wanna seem wierd,False
kinkyjeff694u,ur not wierd baby at all my luv,True
14_yr_old_girl,kewl,False
kinkyjeff694u,i think i love u to baby,True
14_yr_old_girl,omg thats so kewl,False
kinkyjeff694u,mmmm ohh yes baby it is,True
14_yr_old_girl,i gotta go sudy for a test,False
14_yr_old_girl,i wil be on tomm k,False
kinkyjeff694u,ok baby,True
kinkyjeff694u,did u pick out your sexy bra and panties ur goingto wear tomm for me to baby,True
14_yr_old_girl,what kind u want me to wear,False
kinkyjeff694u,tell me what kinds u have baby,True
14_yr_old_girl,i got pink blue an white ones an one black set,False
14_yr_old_girl,most of em r bikini,False
kinkyjeff694u,mmmm baby war ur sexy black ones for me are they sheer lacey,True
14_yr_old_girl,they got som lace on em ya,False
kinkyjeff694u,mmmm sexy baby,True
14_yr_old_girl,kewl i wil wear em then,False
kinkyjeff694u,mmmmm im so glad baby,True
14_yr_old_girl,k,False
14_yr_old_girl,i go sudy now,False
14_yr_old_girl,chat wit u tomm,False
kinkyjeff694u,ok baby,True
14_yr_old_girl,luv ya,False
kinkyjeff694u,luv ya to baby,True
14_yr_old_girl,by by,False
14_yr_old_girl,hey u i miss ya,False
14_yr_old_girl,geeze wher u at,False
kinkyjeff694u,hi baby i miss you too very much,True
kinkyjeff694u,hi baby are you on,True
kinkyjeff694u,r u here,True
kinkyjeff694u,baby are you here,True
kinkyjeff694u,hi baby,True
14_yr_old_girl,hi,False
kinkyjeff694u,hows my sweet sexy baby,True
14_yr_old_girl,im k,False
14_yr_old_girl,u,False
kinkyjeff694u,im doing good baby,True
14_yr_old_girl,kewl,False
14_yr_old_girl,my aunt is def goin on the 2nd,False
kinkyjeff694u,kewl then baby,True
14_yr_old_girl,i so caint wait,False
kinkyjeff694u,mmmmmm me either baby,True
14_yr_old_girl,kewl u stil comin fri rite,False
kinkyjeff694u,we are going to have so much fun with each other baby,True
kinkyjeff694u,yes i am baby,True
14_yr_old_girl,kewl lik bout 4 that way im outta school,False
kinkyjeff694u,yes baby i will here by 3 too so i can find ur house too,True
14_yr_old_girl,kewl omg im so excitd,False
kinkyjeff694u,mmm so am i too baby very excited,True
14_yr_old_girl,kewl its gonna be lotsa fun,False
14_yr_old_girl,i caint wait to see u,False
kinkyjeff694u,i cant wait to see u too baby very much so,True
14_yr_old_girl,kewl,False
kinkyjeff694u,mmmm ohh yes baby,True
kinkyjeff694u,so thrusday night dont forget to give me ur address and town so i can find you more easier baby,True
14_yr_old_girl,i wil i promis,False
kinkyjeff694u,cool baby,True
kinkyjeff694u,do u live in one of the towns before u get to lawton baby,True
14_yr_old_girl,umm not sur what u meen,False
kinkyjeff694u,u know like elgin the little towns like that,True
14_yr_old_girl,umm let me look,False
14_yr_old_girl,i dont kno elgin,False
kinkyjeff694u,ok baby,True
14_yr_old_girl,umm here i jus say where i am lol,False
14_yr_old_girl,i liv in walters,False
kinkyjeff694u,ohh ok baby,True
14_yr_old_girl,u kno where that is,False
kinkyjeff694u,i think its on the other side of lawton bby,True
14_yr_old_girl,oh is that stil ok,False
kinkyjeff694u,yes it is baby,True
14_yr_old_girl,k good cuz i wanna get to see u an do what we talkd bout,False
kinkyjeff694u,ohh we will baby,True
14_yr_old_girl,kewl i jus hope u lik me much as i lik u,False
kinkyjeff694u,yes i do baby,True
14_yr_old_girl,kewl,False
kinkyjeff694u,mmmm oh yes baby,True
kinkyjeff694u,so ur aunt dosnt have anyone checkin in on u baby,True
14_yr_old_girl,nah she says she trust me,False
kinkyjeff694u,mmmmm cool then baby,True
14_yr_old_girl,ya its gonna be awsome,False
kinkyjeff694u,mmmm ohh yes it is too baby,True
14_yr_old_girl,what kinda car u say u got i forget it lol,False
kinkyjeff694u,a 99 2 door blk cadillac eldorado,True
14_yr_old_girl,wow kewl u gotta cadi,False
kinkyjeff694u,yes i do baby,True
14_yr_old_girl,thats lik supr kewl,False
kinkyjeff694u,ty baby,True
14_yr_old_girl,yw,False
14_yr_old_girl,hey im gonna go eat k i be bck latr,False
kinkyjeff694u,ok baby just message me when ur back,True
14_yr_old_girl,k i wil,False
kinkyjeff694u,ok baby ill talk with u then,True
kinkyjeff694u,are u back baby,True
14_yr_old_girl,srry bck,False
kinkyjeff694u,wb baby,True
14_yr_old_girl,ty,False
kinkyjeff694u,yvw baby,True
14_yr_old_girl,what ya doin,False
kinkyjeff694u,not much just got finished eatting too,True
14_yr_old_girl,kewl,False
kinkyjeff694u,ohh yeah,True
kinkyjeff694u,yeah i had arbys,True
14_yr_old_girl,yummy,False
kinkyjeff694u,mmmm ohh yes baby,True
kinkyjeff694u,what did u have baby,True
14_yr_old_girl,i had yummy mashd tators an steak,False
kinkyjeff694u,mmmm yummy too baby,True
14_yr_old_girl,ya it was good,False
kinkyjeff694u,mmmm i bet too baby,True
kinkyjeff694u,so what kind of sexy bra nd panties did u wear for me today,True
14_yr_old_girl,they r blu wit whit harts on em,False
kinkyjeff694u,mmmm very sexy baby i cant wait to see and feel them on you too baby,True
14_yr_old_girl,me neithr,False
kinkyjeff694u,and slide my tongue along them while ur wearing them too baby,True
14_yr_old_girl,mmm kewl,False
kinkyjeff694u,mmm lick n taste ur sweet pussy through them before i pull them to the side and taste u without them,True
14_yr_old_girl,mm kewl,False
kinkyjeff694u,mmmm ohh yes baby,True
kinkyjeff694u,you are going to take some very sexy pics baby,True
14_yr_old_girl,thats gonna be fun,False
kinkyjeff694u,mmmm ohh yes it is baby i cant wait to have u as my sexy naughty model,True
14_yr_old_girl,me neithr,False
kinkyjeff694u,you are going to be so sexy,True
14_yr_old_girl,aww ty,False
kinkyjeff694u,aww yvw baby,True
kinkyjeff694u,so do u live in town or out in the country baby,True
14_yr_old_girl,in,False
kinkyjeff694u,cool,True
14_yr_old_girl,hey i gotta go wit my aunt for a lil bit i be bck latr,False
kinkyjeff694u,ok baby ill be here,True
14_yr_old_girl,k latr then,False
kinkyjeff694u,bye baby kisses,True
kinkyjeff694u,hi my sweet sexy girl,True
kinkyjeff694u,how are u today mylove ive missed ya,True
14_yr_old_girl,i missd u to im k,False
14_yr_old_girl,how u,False
kinkyjeff694u,im doing good just counting down the days baby,True
14_yr_old_girl,omg me too,False
kinkyjeff694u,mmmm ohh yes baby and i hope that we dont get the snow wedesday either,True
14_yr_old_girl,ya me eithr but maybe it wil miss us,False
kinkyjeff694u,yeah i hope so to i cant wait to have u in my arms,True
14_yr_old_girl,i caint wait eithr im so happy im gonna be able to see u finly,False
kinkyjeff694u,ohh so am i too baby im so excited to finaly see u as well,True
14_yr_old_girl,kewl,False
14_yr_old_girl,i askd my aunt an less we get lots of sno she is stil goin fri,False
kinkyjeff694u,cool then baby,True
14_yr_old_girl,sooo what ya been doin,False
14_yr_old_girl,wherd ya go,False
14_yr_old_girl,geeze is yahell freezin on me,False
14_yr_old_girl,im havin yim probs,False
kinkyjeff694u,yeah me to baby,True
14_yr_old_girl,dang yahell needs to stop it,False
kinkyjeff694u,yeah thats no lie,True
14_yr_old_girl,if u say sumthin an i dont answr ya then kno its yahell k,False
kinkyjeff694u,ok baby,True
kinkyjeff694u,so i already bet that u have a sexy outfit picked out for me,True
14_yr_old_girl,ya,False
kinkyjeff694u,mmmmmm what is it baby,True
14_yr_old_girl,im gonna wear a skirt an a cami,False
kinkyjeff694u,mmmmm very sexy baby and what kind of sexy panties or none at all,True
14_yr_old_girl,u said u didnt want me to ear ne,False
14_yr_old_girl,wear lol,False
kinkyjeff694u,very lovely then baby im glad u remember,True
14_yr_old_girl,ya i membr what ya said,False
kinkyjeff694u,cool my love,True
kinkyjeff694u,mmmm u r going to look so sexy,True
14_yr_old_girl,awww ty,False
kinkyjeff694u,mmmm you are so very welcome baby,True
kinkyjeff694u,i cant wait to see u bending over in front of me,True
14_yr_old_girl,we gonna hav so much fun,False
kinkyjeff694u,mmmm ohh yes we are too baby,True
14_yr_old_girl,ya i caint wait,False
kinkyjeff694u,ohh me eithr baby,True
kinkyjeff694u,mmmm might even have u flash people in ur short sexy skirt to lol,True
14_yr_old_girl,idk that mite be kinda scary,False
kinkyjeff694u,ill be with you baby like if we might have to go to the store have u bend over picking something up,True
kinkyjeff694u,no i wouldnt do that to u baby,True
14_yr_old_girl,k,False
kinkyjeff694u,plus its a small town too,True
14_yr_old_girl,ya relly small lol,False
kinkyjeff694u,so we would just have to stay at the house,True
14_yr_old_girl,ya prolly bettr if we do,False
kinkyjeff694u,yes so true baby that way we wouldnt get caught,True
14_yr_old_girl,ya lol,False
kinkyjeff694u,ill buy some beers when i get there before i come to ur house,True
14_yr_old_girl,kewl,False
kinkyjeff694u,mmmmm ohh yes baby,True
kinkyjeff694u,so what pair of sexy panties did u wear today,True
14_yr_old_girl,lil white ones,False
kinkyjeff694u,mmmmm sexy baby,True
14_yr_old_girl,lol ty,False
kinkyjeff694u,were they sheer white see thru,True
kinkyjeff694u,yvw baby,True
14_yr_old_girl,they r lil plain white wit a lil lace at the tops,False
kinkyjeff694u,mmmmm very sexy too baby,True
kinkyjeff694u,cant wait for u to be my naughty lil stripper,True
14_yr_old_girl,lol its gonna be so much fun i aint nevr done that befor,False
kinkyjeff694u,cool baby and yes it is too and u just dance to the music and slowly start to undress,True
14_yr_old_girl,kewl,False
kinkyjeff694u,mmmm ohh yes baby,True
kinkyjeff694u,then slowly come up to me and rubbing ur sexy body all over me,True
14_yr_old_girl,kewl ill try that too then,False
kinkyjeff694u,cool baby,True
14_yr_old_girl,i gotta go do my homwork an get my showr k i try to come bck on befor bed,False
kinkyjeff694u,ok my love,True
14_yr_old_girl,luv ya too,False
kinkyjeff694u,love you too,True
kinkyjeff694u,hi baby,True
14_yr_old_girl,how u,False
kinkyjeff694u,im doing good and u,True
14_yr_old_girl,im k,False
kinkyjeff694u,im glad to hear that,True
14_yr_old_girl,geeze its so cold,False
kinkyjeff694u,yeah i know baby,True
kinkyjeff694u,so how is everything looking so far,True
14_yr_old_girl,its kewl,False
14_yr_old_girl,u stil comin tomm,False
kinkyjeff694u,yes if we dont get anymore bad weather from now until then i means the roads,True
14_yr_old_girl,ya i kno hope we dont,False
kinkyjeff694u,and its supposed to be alot more colder tomm too,True
14_yr_old_girl,i kno,False
kinkyjeff694u,but ur aunt is still going thou,True
14_yr_old_girl,ya she said shes gotta go this weeknd,False
kinkyjeff694u,ok cool then baby,True
14_yr_old_girl,kewl,False
14_yr_old_girl,i gotta go help wit dinnr but i be bck soon as i eat k,False
kinkyjeff694u,ok baby cus im going to need some info so i can look everything up,True
14_yr_old_girl,k when i get bck,False
kinkyjeff694u,ok baby,True
14_yr_old_girl,bust house addy gived,False
14_yr_old_girl,u stil here,False
kinkyjeff694u,ok baby i got it,True
14_yr_old_girl,kewl,False
kinkyjeff694u,if by chance i cant get there tomm i will be sat morning by 12 but im going to try my hardest to be there tomm,True
14_yr_old_girl,k wil u lest let me kno on here tomm if u aint comin til sat,False
kinkyjeff694u,yes i will baby but im going to be watching the weather tonight and see how its going to look too,True
14_yr_old_girl,ya i kno roads aint bad here yet,False
kinkyjeff694u,yeah here either i just want to make sure that all the roads are good to travel though too,True
14_yr_old_girl,k i hope u stil gonna come cuz i stil wanna do all the stuf we talkd bout,False
14_yr_old_girl,an i caint wait to see u,False
kinkyjeff694u,ohh im going to come baby dont worry about that,True
14_yr_old_girl,kewl,False
14_yr_old_girl,k gotta go eat dinnrs done bck in a few,False
14_yr_old_girl,im gonna stay signd in lol,False
kinkyjeff694u,ok baby just message me when u get back,True
14_yr_old_girl,k,False
kinkyjeff694u,luv ya,True
14_yr_old_girl,k bck srry,False
14_yr_old_girl,did u find a map lol,False
kinkyjeff694u,hi baby,True
14_yr_old_girl,hi,False
kinkyjeff694u,i looked part of it up last night and i found that were only 68mins away from each other,True
14_yr_old_girl,kewl,False
14_yr_old_girl,thoght we was farthr,False
kinkyjeff694u,no were only 60 miles away,True
14_yr_old_girl,kewl,False
kinkyjeff694u,yeah but i hardly could see the map on my phone though,True
14_yr_old_girl,o u on ur phon,False
14_yr_old_girl,how u get a map on ur phon,False
kinkyjeff694u,i have like a map quest on my cell phone,True
14_yr_old_girl,kewl,False
kinkyjeff694u,yeah,True
14_yr_old_girl,u not talkin much whats mattr,False
kinkyjeff694u,sorry phone,True
14_yr_old_girl,k wil wait lol,False
14_yr_old_girl,i gotta reconnct i brb,False
kinkyjeff694u,ok baby,True
14_yr_old_girl,geeze u stil on phon,False
kinkyjeff694u,no baby,True
14_yr_old_girl,k u must be buzy then or u not wantin to chat,False
kinkyjeff694u,my comp froze up baby,True
kinkyjeff694u,im here now,True
14_yr_old_girl,kewl,False
14_yr_old_girl,awww ty,False
kinkyjeff694u,yvw baby,True
kinkyjeff694u,so what kind of sexy panties did u wear for me today,True
14_yr_old_girl,i gots on lil pink ones wit stripes lol,False
kinkyjeff694u,mmmmmmm very sexy and yummy baby,True
14_yr_old_girl,awww ty,False
kinkyjeff694u,mmmm my pleasure baby i cant wait to see all ur lil sexy panties and thongs,True
14_yr_old_girl,omg i went shoppin today an got some new ones 2,False
kinkyjeff694u,mmmmmm what do they look like baby,True
14_yr_old_girl,i got 3 new black ones an 2 new red ones,False
kinkyjeff694u,mmmm very sexy baby silky and sheers ones,True
14_yr_old_girl,ya they all silky wit a lil lace,False
kinkyjeff694u,mmmm so sexy baby,True
kinkyjeff694u,are they alittle sheer like see thru to baby,True
14_yr_old_girl,ya kinda,False
kinkyjeff694u,mmmmm i love those kind of panties baby,True
14_yr_old_girl,kewl was hopin ud lik em,False
kinkyjeff694u,mmmm ohh yes baby i do very much so,True
14_yr_old_girl,kewl,False
kinkyjeff694u,do u have any sexy thongs to baby,True
14_yr_old_girl,ya 3 i got today r thongs,False
kinkyjeff694u,mmmmmm sexy baby,True
kinkyjeff694u,cant wait to have u model then baby,True
14_yr_old_girl,i caint wait eithr we r gonna hav so much fun,False
kinkyjeff694u,mmmm ohh yes we are too baby,True
kinkyjeff694u,and see u in ur very short skirt and cami shirt baby,True
14_yr_old_girl,ya hope it aint gonna be 2 cold lol i wil hafta stay inside wher its warm,False
kinkyjeff694u,yes thats true baby,True
kinkyjeff694u,if it is to cold baby u can always change into them while im there,True
14_yr_old_girl,ya i can do that,False
kinkyjeff694u,yep baby that wayu wont be so cold then,True
14_yr_old_girl,thats a good idea,False
kinkyjeff694u,yes it is too baby,True
14_yr_old_girl,u stil gonna stay til sun rite,False
kinkyjeff694u,what time is ur aunt due in on sun,True
14_yr_old_girl,not til mon morn somtime,False
14_yr_old_girl,was suposd to be sun nite,False
kinkyjeff694u,cool then,True
14_yr_old_girl,kewl,False
kinkyjeff694u,yeah baby,True
kinkyjeff694u,its suppose to be alittle warmer sat too i think,True
14_yr_old_girl,so u waitin til sat then,False
kinkyjeff694u,yeah we can baby that way i can get some bills paid and fill my car up with gas and stuff but i will still try to come tomm though too,True
14_yr_old_girl,k jus let me kno tomm that way if u aint comin til sat i can find somthin to do tomm,False
kinkyjeff694u,ok baby i will do so and dont do anything without me if u know what i mean lol,True
14_yr_old_girl,nooo i wont lol,False
kinkyjeff694u,good baby,True
14_yr_old_girl,jus make sur u get here soon as u can lol so i wont be bord all weeknd lol,False
kinkyjeff694u,ohh i will be there baby,True
14_yr_old_girl,kewl,False
kinkyjeff694u,ohh yes very kwel baby,True
kinkyjeff694u,if i cant come tomm want me to call u so it wont cost u any long dtance to baby,True
14_yr_old_girl,u can jus let me kno here if u want,False
kinkyjeff694u,ok baby but i would love to call u too though,True
kinkyjeff694u,and hear ur sexy voice baby,True
14_yr_old_girl,awww i can call u agin tomm if u want me 2,False
kinkyjeff694u,mmmm that would be kwel too baby,True
14_yr_old_girl,kewl,False
14_yr_old_girl,what time u want me to call,False
kinkyjeff694u,when u get home from school and even later on that night to baby,True
14_yr_old_girl,k so u comin on sat lik what time then,False
kinkyjeff694u,i will be there by 12 baby,True
14_yr_old_girl,on sat,False
kinkyjeff694u,yes baby if im not in ur driveway fri when u get home from school,True
14_yr_old_girl,kewl,False
kinkyjeff694u,ohh yes baby,True
kinkyjeff694u,but right now that sat looks better for me baby i can get my leggs from being so jumpy from when i ran out of my med yesterday and just got them today and also make sure that im clean boewl wise where i wont have a accident and poop on myself while im there with you too,True
14_yr_old_girl,k thats kewl,False
kinkyjeff694u,i just want everything to go the way we plan baby if u know what i mean,True
14_yr_old_girl,ya me to it wil we both relly relly lik ech othr so itll be kewl,False
kinkyjeff694u,ohh yes we do baby liek each other a whole lot and yes it will be so cool,True
kinkyjeff694u,i have alot of feeling for u baby you are so very special to me,True
14_yr_old_girl,awww ty i feel the same way,False
kinkyjeff694u,yvw and im glad to hear that,True
kinkyjeff694u,mmmmm baby the way are feeling are grown it might even trun into something more to,True
14_yr_old_girl,ya thatd be so kewl,False
14_yr_old_girl,sense u arent far from me,False
kinkyjeff694u,yes thats true baby maybe even someday make u my wife as well to,True
14_yr_old_girl,omg relly thatd be lik supr kewl,False
kinkyjeff694u,mmmmm ohh yes baby it would be too very kool,True
kinkyjeff694u,have u for my sexy hot wife,True
14_yr_old_girl,omg id luv that,False
kinkyjeff694u,ohh so would i too baby very much so,True
kinkyjeff694u,mmmm do i have my sweet baby blushing now,True
14_yr_old_girl,lol ya a lil,False
kinkyjeff694u,mmmmm very lovely baby and im serious to,True
14_yr_old_girl,me to thats so kewl,False
kinkyjeff694u,marry u when u trun 18,True
14_yr_old_girl,oooo kewl,False
kinkyjeff694u,take u away from ur aunt,True
14_yr_old_girl,i caint wait to be awasys from her,False
kinkyjeff694u,kwel then baby,True
kinkyjeff694u,teach u and expoler everything u want to do sex wise as well baby,True
14_yr_old_girl,kewl,False
kinkyjeff694u,no matter what baby,True
14_yr_old_girl,kewl i caint wait,False
kinkyjeff694u,me either baby,True
kinkyjeff694u,mmm i cant wait to hold u and kiss u and caress u baby,True
14_yr_old_girl,its gonna be fun cuz i aint nevr did most stuf befor,False
