User,Text,Groom
kinkyjeff694u,mmmmm ohh yes it is to baby well u can do whatever u want with me baby,True
14_yr_old_girl,thats so kewl,False
kinkyjeff694u,ohh yes baby im very open minded and kinky lol,True
14_yr_old_girl,lol,False
kinkyjeff694u,but thats what u like about me though,True
14_yr_old_girl,ya lol,False
kinkyjeff694u,and help u to explore ur naughty side of u,True
14_yr_old_girl,ya kewl,False
kinkyjeff694u,ohh yes baby,True
kinkyjeff694u,and take ur sexy and naughty pics to baby,True
14_yr_old_girl,ya thats gonna be fun i aint nevr had pics lik that taken of me,False
kinkyjeff694u,mmmm well ur going to love it then baby and yes it will be so much fun too,True
14_yr_old_girl,ya,False
kinkyjeff694u,ohh yes baby,True
kinkyjeff694u,we put on some music and things like that,True
14_yr_old_girl,kewl i got a cd playr in my room,False
kinkyjeff694u,cool baby where u can change into ur sexy outfits and bra and panties and also posing nude to in sexy and naughty poses,True
14_yr_old_girl,kewl,False
kinkyjeff694u,mmmm ohh yes baby,True
kinkyjeff694u,do u have a dvd player too,True
14_yr_old_girl,ya but not in my room,False
kinkyjeff694u,cool ill bring a couple of my dirty moives too that we can watch,True
14_yr_old_girl,kewl aint nevr watchd ne of thos befor,False
kinkyjeff694u,ohh they are hot and exciting to watch,True
14_yr_old_girl,kewl ya bring em if u want then,False
kinkyjeff694u,ohh i am baby,True
14_yr_old_girl,kewl,False
kinkyjeff694u,mmmmm ohh yes,True
14_yr_old_girl,wherd ya go,False
kinkyjeff694u,i got booted baby,True
14_yr_old_girl,awww wb,False
kinkyjeff694u,aww ty baby,True
14_yr_old_girl,yw lol,False
kinkyjeff694u,mmmmmmmm baby ill get to see u in ur sexy nighty sat morning then,True
14_yr_old_girl,ya kewl,False
kinkyjeff694u,one of ur lil short sexy babydoll nighty,True
14_yr_old_girl,aww i aint got ne of thos,False
kinkyjeff694u,well im sure that all ur nightys are sexy though baby,True
14_yr_old_girl,i hope so,False
kinkyjeff694u,even u in ur lil tshirt would be sexy baby,True
14_yr_old_girl,kewl ty,False
kinkyjeff694u,mmmmmm yvw baby ur lil tshirt and no panties mmm sexy,True
14_yr_old_girl,lol,False
kinkyjeff694u,lol,True
14_yr_old_girl,omg i caint beleve im finlly gonna be able to be wit u,False
kinkyjeff694u,mmmm ohh me either baby,True
kinkyjeff694u,its going to be so wnderful baby,True
14_yr_old_girl,ya it is im so happy,False
kinkyjeff694u,ya so am i too baby,True
kinkyjeff694u,hmmm its snowing here,True
14_yr_old_girl,its not here yet lol,False
kinkyjeff694u,thats cool i dont think that its snowing that bad though,True
14_yr_old_girl,thats good hope it dont get bad,False
kinkyjeff694u,ohh so do i to baby but im still going to be there sat though,True
14_yr_old_girl,thats kewl cuz i relly wanna spend time wit ya,False
kinkyjeff694u,ohh yes so do i too very much so,True
kinkyjeff694u,baby im going to look outside brb,True
14_yr_old_girl,k,False
kinkyjeff694u,im back,True
14_yr_old_girl,wb luv,False
14_yr_old_girl,is it bad there yet,False
kinkyjeff694u,ty luv,True
14_yr_old_girl,yw,False
kinkyjeff694u,its not snowing that bad baby just bearly,True
14_yr_old_girl,kewl,False
kinkyjeff694u,yeah baby,True
kinkyjeff694u,so i dont think that its going to be that bad,True
14_yr_old_girl,thats good,False
kinkyjeff694u,yeah me too,True
14_yr_old_girl,sooo what ya doin,False
kinkyjeff694u,talking to my mom,True
14_yr_old_girl,k,False
kinkyjeff694u,i told her that i was commin down sat,True
14_yr_old_girl,ohh u goin to see her,False
kinkyjeff694u,no i live here with my mom baby,True
14_yr_old_girl,oh k,False
14_yr_old_girl,thats kewl,False
14_yr_old_girl,didnt kno u livd wit ur mom,False
kinkyjeff694u,yeah baby ever since ive gooten hurt she helps me out if i need her to and especially now to since my dad past away so she wouldnt be here in the house alone,True
14_yr_old_girl,thats kewl u take care of ech othr,False
kinkyjeff694u,ohh yes baby,True
14_yr_old_girl,u tole ur mom that ur commin to see me,False
kinkyjeff694u,yes but i didnt tell her how old u were though i said a was going to meet a girl,True
14_yr_old_girl,thats kewl,False
kinkyjeff694u,yep baby,True
14_yr_old_girl,ur mom not care u gonna be gone til sun somtime,False
kinkyjeff694u,no she dont baby i already told her that i would be home by sunday night,True
14_yr_old_girl,kewl,False
kinkyjeff694u,yep my luv,True
kinkyjeff694u,so what are u doing baby,True
14_yr_old_girl,nuttin thnkin bout goin to bed,False
kinkyjeff694u,mmmmm with me in there to with ya,True
14_yr_old_girl,lol ya,False
kinkyjeff694u,kewl baby,True
14_yr_old_girl,is it bad that im lik relly excitd,False
kinkyjeff694u,ohh no its not baby im just as excitd too baby,True
14_yr_old_girl,k thats good,False
kinkyjeff694u,ohh yes it is to baby,True
kinkyjeff694u,i just cant wait baby,True
14_yr_old_girl,mm me neithr,False
kinkyjeff694u,this si goingto be so good baby,True
14_yr_old_girl,ya it is i caint wait,False
kinkyjeff694u,me either baby,True
kinkyjeff694u,to have u in my arms baby and doing everything we talked about too,True
14_yr_old_girl,i kno its gonna be awsom,False
kinkyjeff694u,mmmm ohh yes baby it is,True
kinkyjeff694u,did u get ur shower and homework done baby,True
14_yr_old_girl,ya,False
kinkyjeff694u,good baby,True
kinkyjeff694u,and ill be getting everything i need together ready so i can come sat morn,True
14_yr_old_girl,kewl i be here waitin lol,False
kinkyjeff694u,mmm ohh yes i know baby i cant wait to see ur face when i pull into ur driveway,True
14_yr_old_girl,lol i jus caint wait its gonna be relly awsom,False
kinkyjeff694u,mmmm ohh yes it is to baby,True
kinkyjeff694u,and see ur hot sexy body baby,True
14_yr_old_girl,awww ty u r so sweet,False
kinkyjeff694u,and ur beautiful smile as well,True
14_yr_old_girl,ty,False
kinkyjeff694u,you are so very welcome baby,True
kinkyjeff694u,and look deeply into ur eyes as we start to kiss,True
14_yr_old_girl,ooo thats sweet too,False
kinkyjeff694u,as i have u sit on my lap as we hold each other,True
14_yr_old_girl,thats gonna be fun,False
kinkyjeff694u,then as i slowly start to caress u softly all over,True
14_yr_old_girl,im so excitd bout it i caint wait til sat gets here,False
kinkyjeff694u,ohh me either baby,True
kinkyjeff694u,and slowly slide my hands up ur sexy leggs and sliding them up higher,True
14_yr_old_girl,mm kewl,False
kinkyjeff694u,and up under ur nighty slowly,True
14_yr_old_girl,ya its gonna be so good,False
kinkyjeff694u,slowly spreading ur legs open and gently caressin you,True
kinkyjeff694u,mmmmm ohh yes it will be baby,True
14_yr_old_girl,kewl,False
kinkyjeff694u,yes it is baby so very kewl,True
14_yr_old_girl,im gonna go to bed so i wont be sleepy tomm lol,False
kinkyjeff694u,ok baby icant wait to hear ur voice tomm,True
14_yr_old_girl,k i call ya soon as i can tomm,False
kinkyjeff694u,ok baby dont have to much fun tomm so u wont be tired for sat morn eithr,True
14_yr_old_girl,im gonna go sleep early tomm so i wont be sleepy sat,False
kinkyjeff694u,kewl baby ill wispher sexy things in ur ear tomm night when ur in bed,True
14_yr_old_girl,k lol nite,False
kinkyjeff694u,nite my luv,True
14_yr_old_girl,i got outta school early cuz my aunt leavin lol so im when u on k,False
kinkyjeff694u,cool baby,True
14_yr_old_girl,hey when i called today what was ur mom sayin bout is it gonna be ok,False
kinkyjeff694u,if i could stay the night,True
14_yr_old_girl,oh k,False
14_yr_old_girl,ya u r rite lol,False
kinkyjeff694u,yes i am baby and i just tried to call u back few mins ago ans got the answering mach,True
14_yr_old_girl,ya its cuz im onlin lol,False
kinkyjeff694u,ohh ok baby lol,True
kinkyjeff694u,so what did u do today,True
14_yr_old_girl,nuttin much got outta school early an jus been home wel i walkd up to a stor,False
kinkyjeff694u,cool baby,True
kinkyjeff694u,what did my sexy baby wear today,True
14_yr_old_girl,i got jeans an a t on lol,False
kinkyjeff694u,mmmm sexy baby,True
kinkyjeff694u,what kind of sexy panties and bra baby,True
14_yr_old_girl,i gots on my red thongs,False
kinkyjeff694u,mmmmmmmmmmm very sexy and yummy baby i cant wait to see them on you,True
14_yr_old_girl,kewl me neithr,False
14_yr_old_girl,hey can u be here lik 12 12 30 tomm cuz im goin to hav brekfast wit my gf,False
kinkyjeff694u,yes baby thats what time i was planing on being there by then anyways and whos ur gf baby,True
14_yr_old_girl,my gf misty in my pics,False
kinkyjeff694u,ohh ok cool baby,True
14_yr_old_girl,kewl,False
14_yr_old_girl,her mom is takin us to eat in lawton tomm for brekfast,False
14_yr_old_girl,lol,False
kinkyjeff694u,cool then baby,True
14_yr_old_girl,k,False
kinkyjeff694u,i was planing on leaving here by 11 in the morn,True
14_yr_old_girl,k u should be here round noon then lol,False
kinkyjeff694u,yes baby,True
14_yr_old_girl,kewl,False
kinkyjeff694u,yeah i wouldnt want to be in ur driveway when u all come back from breakfast lol,True
14_yr_old_girl,nooo that wuldnt be kewl lol,False
kinkyjeff694u,yeah i know,True
14_yr_old_girl,lol,False
14_yr_old_girl,im stil excitd,False
kinkyjeff694u,ohh so am i too baby,True
kinkyjeff694u,what are you going to be wearing in the morn,True
14_yr_old_girl,hmm not sure,False
14_yr_old_girl,thinkin bout jeans an a sweatshirt cuz its suposd to be cold,False
kinkyjeff694u,mmmm nice baby and yes thats true,True
kinkyjeff694u,which panties are u going to wear,True
14_yr_old_girl,my black thongs that i got yesday,False
kinkyjeff694u,mmmmm ohh yes very sexy my luv,True
kinkyjeff694u,cant wait to see them baby im getting my camara ready too,True
14_yr_old_girl,omg its gonna be awsom,False
kinkyjeff694u,mmmm ohhh yes it is baby,True
kinkyjeff694u,im getting ready to print out the way there on mapquest baby,True
14_yr_old_girl,kewl,False
kinkyjeff694u,mmmmmmm ohh yes baby,True
14_yr_old_girl,awww,False
kinkyjeff694u,your very welcome and thats ur so speiacl to me baby,True
14_yr_old_girl,u r to me to,False
kinkyjeff694u,im so glad to hear that baby,True
kinkyjeff694u,i got the directions all printed out and ready,True
14_yr_old_girl,omg kewl,False
kinkyjeff694u,mmm oh yes and very easy to follow to stairhgt to ur house,True
14_yr_old_girl,kewl glad u got good ones cuz i aint good at directins,False
kinkyjeff694u,mmmm ohh yes it tells u step by step where to trun and look for,True
14_yr_old_girl,kewl,False
kinkyjeff694u,yeah way kewl baby,True
kinkyjeff694u,what time are you going to bed baby,True
14_yr_old_girl,in a lil bit y,False
kinkyjeff694u,i want to call u when u do,True
14_yr_old_girl,idk if the call wil com thru or not my aunt usully forwards calls to her cell,False
kinkyjeff694u,ohh ok is that why i got the answering mac when i tried to call back,True
14_yr_old_girl,prolly ya,False
kinkyjeff694u,ohh ok,True
kinkyjeff694u,well will u call me when u get into ur nighty in get in bed so we can talk for alittle bit,True
14_yr_old_girl,k,False
kinkyjeff694u,ok baby ill be in bed waiting for u my sweet darling luv,True
14_yr_old_girl,luv ya 2,False
kinkyjeff694u,i sleep in the nude baby,True
14_yr_old_girl,kewl,False
kinkyjeff694u,ohh yeah,True
kinkyjeff694u,ok baby im goin to get off here and get ready for bed so i can get up early to get ready to see you,True
14_yr_old_girl,k caint wait to see u,False
14_yr_old_girl,nite luv,False
kinkyjeff694u,nite luv please call me whenever u get off and get in bed to baby,True
14_yr_old_girl,k nite,False
kinkyjeff694u,nite luv kisses,True
14_yr_old_girl,geeze srry bout not callin last nite i feel sleep,False
14_yr_old_girl,u not chattin 2day,False
kinkyjeff694u,hi baby i just got out of the shower and i getting ready toi get dressed and come down im runn alittle bit behind,True
14_yr_old_girl,k kewl thoght u forget me,False
14_yr_old_girl,lol,False
kinkyjeff694u,no baby i would never forget you,True
14_yr_old_girl,kewl,False
kinkyjeff694u,let me get dress and i will send u a message right before i leave ok,True
14_yr_old_girl,ok hurry i wanna spend time wit ya,False
kinkyjeff694u,i am baby,True
14_yr_old_girl,k,False
kinkyjeff694u,ok baby i getting ready to load up in my car i see u when i get their,True
14_yr_old_girl,omg kewl i see ya when u get here oh my aunts white car is undr the carport but shes not here lol she jus left it here,False
kinkyjeff694u,ok baby u can give me a call by 2 to see how far i am ok,True
14_yr_old_girl,k its only bout an hr awsys rite,False
kinkyjeff694u,yes baby,True
14_yr_old_girl,k kewl see ya in a lil bit then,False
kinkyjeff694u,ok bye luv ya,True
14_yr_old_girl,luv ya 2,False
