User,Text,Groom
kinkyjeff694u,lay next to each other naked and softly touching each other,True
14_yr_old_girl,thatd be fun,False
kinkyjeff694u,mmmm ohh yes baby,True
kinkyjeff694u,and have u model for me baby too,True
14_yr_old_girl,ya that could be kewl too,False
kinkyjeff694u,mmmmm ohh yes baby in ur lil sexy outfits,True
14_yr_old_girl,i got some cute ones not sure they r sexy tho,False
kinkyjeff694u,mmmm im sure what ever u have is sexy baby,True
14_yr_old_girl,k kewl,False
kinkyjeff694u,ill bring my camra to and take pic like ur a real model,True
14_yr_old_girl,are u ne good at takin pics,False
14_yr_old_girl,lol,False
kinkyjeff694u,ohh yes i am baby,True
14_yr_old_girl,k good,False
kinkyjeff694u,i took my pics myself that i showed u,True
14_yr_old_girl,kewl,False
kinkyjeff694u,with my digital camara,True
14_yr_old_girl,ok kewl then ya,False
kinkyjeff694u,kewl baby and dont worry noone will see them but me,True
14_yr_old_girl,good thats kewl then,False
kinkyjeff694u,yes baby,True
kinkyjeff694u,as i help dress u too,True
14_yr_old_girl,lol k,False
kinkyjeff694u,would u love that too baby or me undressing u,True
14_yr_old_girl,hmm whatevr u wantd is kewl wit me,False
kinkyjeff694u,im glad to hear that then baby,True
kinkyjeff694u,and what ever u want iskwel with me too,True
14_yr_old_girl,kewl,False
kinkyjeff694u,mmmm oh yes baby,True
kinkyjeff694u,slide my tongue slowly all over ur body from head to toe,True
14_yr_old_girl,kewl,False
kinkyjeff694u,from front to back,True
14_yr_old_girl,ur tongue wuld get sore lol,False
kinkyjeff694u,ohh no baby my tongue is very gentle,True
14_yr_old_girl,kewl,False
kinkyjeff694u,im going to be very gentle with u baby,True
14_yr_old_girl,k thats kewl,False
kinkyjeff694u,thats u r very special baby,True
14_yr_old_girl,relly,False
kinkyjeff694u,ohh yes really baby,True
14_yr_old_girl,kewl,False
kinkyjeff694u,yes baby,True
kinkyjeff694u,any school tomorrow baby,True
14_yr_old_girl,ya,False
14_yr_old_girl,brb gotta potty,False
kinkyjeff694u,ok baby,True
14_yr_old_girl,bck srry,False
kinkyjeff694u,its ok baby,True
14_yr_old_girl,k,False
kinkyjeff694u,i would have wnt in there with u if i was there and watch u potty,True
14_yr_old_girl,lol k,False
kinkyjeff694u,and play with u too,True
14_yr_old_girl,kewl,False
kinkyjeff694u,yes baby rub ur pussy while u were potting,True
14_yr_old_girl,wuldnt that be kinda gross,False
kinkyjeff694u,no pee play is kinda of fun baby,True
14_yr_old_girl,oh ok,False
kinkyjeff694u,its the other thats gross,True
14_yr_old_girl,eww ya that wuld be,False
kinkyjeff694u,yes very true baby,True
kinkyjeff694u,i would even lick u after u pee to baby,True
14_yr_old_girl,wow,False
kinkyjeff694u,ohh yes baby,True
kinkyjeff694u,yes im experence in alot of hings baby,True
14_yr_old_girl,souns lik it lol,False
kinkyjeff694u,but we will do anything ur comfortable with,True
14_yr_old_girl,kewl,False
14_yr_old_girl,not sure bout the pee thing that souns kinda gross,False
kinkyjeff694u,thats fine too baby,True
14_yr_old_girl,k,False
kinkyjeff694u,yes baby,True
kinkyjeff694u,but i would still play with ur pussy and ass too baby,True
kinkyjeff694u,and ur breast,True
14_yr_old_girl,kewl,False
kinkyjeff694u,have u play with me too,True
14_yr_old_girl,ya kewl,False
kinkyjeff694u,ohhyea baby,True
kinkyjeff694u,and have u laying ontop of me as im holding u,True
14_yr_old_girl,thatd be kewl,False
kinkyjeff694u,as ur rubbin ur pussy on my cock gently as ur layingontop,True
14_yr_old_girl,kewl,False
kinkyjeff694u,then have u rasie up as i gentle start to put it in u as ur ontop,True
14_yr_old_girl,kewl,False
kinkyjeff694u,and also rub my cock against ut hot ass too genly,True
14_yr_old_girl,souns kewl,False
kinkyjeff694u,yes it does too,True
14_yr_old_girl,ya,False
kinkyjeff694u,ohhyea,True
14_yr_old_girl,i gotta go to bed my aunts yellin at me,False
kinkyjeff694u,ok baby,True
14_yr_old_girl,i chat wit ya tomm k,False
kinkyjeff694u,ok baby i cant wait,True
14_yr_old_girl,k me neithr,False
14_yr_old_girl,nite,False
kinkyjeff694u,kisses,True
kinkyjeff694u,hi my sweet sexy angel,True
14_yr_old_girl,what ya doin,False
kinkyjeff694u,not much i just got on,True
14_yr_old_girl,i been waitin,False
14_yr_old_girl,lol,False
kinkyjeff694u,aww baby ty,True
14_yr_old_girl,yw,False
14_yr_old_girl,oh my aunt aint goin this weeknd aftr all cuz of the stupid weathr,False
14_yr_old_girl,she said she goin next weeknd instead,False
kinkyjeff694u,ok cool baby then maybe all this ice and weather well be gone then,True
14_yr_old_girl,i hope so i was jus excitd that i get to see u,False
kinkyjeff694u,ohh yes and so am i too baby very excite that i get to see u too,True
14_yr_old_girl,relly r ya cuz i cant wait,False
kinkyjeff694u,ohh yes really i am baby and me either too i cant wait to have u in my arms,True
14_yr_old_girl,its gonna be so kewl,False
kinkyjeff694u,mmmmm ohh yes it is too baby,True
kinkyjeff694u,to hold u and kiss u and caress u all over baby,True
14_yr_old_girl,id lik that,False
kinkyjeff694u,ohh yes so would i too,True
kinkyjeff694u,mmm we could just naked the whole weekend together,True
kinkyjeff694u,be,True
14_yr_old_girl,mmm that souns good to,False
kinkyjeff694u,mmmmmm oh yes it does to baby,True
kinkyjeff694u,and sleep in ur room together,True
14_yr_old_girl,ya lol,False
kinkyjeff694u,and go into ur aunts room and find her toys to play with,True
14_yr_old_girl,what kinda toys,False
kinkyjeff694u,her sex toys like vibrator or dildio,True
14_yr_old_girl,oh lol thoght u meent toys lol,False
kinkyjeff694u,well those are toys baby,True
14_yr_old_girl,k lol,False
14_yr_old_girl,aint nevr playd thos kinda toys,False
kinkyjeff694u,well i will show u how to play with them to baby,True
14_yr_old_girl,that souns kewl,False
kinkyjeff694u,yes it does too baby and i know that she might even have some toys like that too,True
14_yr_old_girl,k we will look k,False
kinkyjeff694u,kwel then baby,True
kinkyjeff694u,i usually know where most women hide them at,True
14_yr_old_girl,lol how u kno that u aint a woman r ya lol,False
kinkyjeff694u,no im not baby but i kinda of know how women are though baby,True
14_yr_old_girl,lol i was jus kiddin,False
kinkyjeff694u,i know baby,True
14_yr_old_girl,i cant wait to see u,False
kinkyjeff694u,mmm me either babydoll,True
14_yr_old_girl,what ya doin,False
kinkyjeff694u,the only thing ive done that is like being like a woman baby is was letting her put her panites on me while we were playing one time,True
14_yr_old_girl,lol thats kew,False
14_yr_old_girl,kewl,False
kinkyjeff694u,and let her use her toys on me too,True
14_yr_old_girl,u lik that,False
kinkyjeff694u,it was exciting at the time in the heat of passion,True
14_yr_old_girl,thats kewl then,False
14_yr_old_girl,ur kinda quiet today,False
kinkyjeff694u,kwel ill let u put some panites on me baby,True
14_yr_old_girl,lol i dont think mine wil fit ya,False
kinkyjeff694u,well we would find a sexy pair of ur aunts then,True
14_yr_old_girl,lol k,False
kinkyjeff694u,yes ive done some wild things before baby,True
14_yr_old_girl,thats ok lol,False
kinkyjeff694u,kwel then,True
kinkyjeff694u,so did u have school today,True
14_yr_old_girl,ya it sux,False
14_yr_old_girl,lol,False
kinkyjeff694u,yeah i bet too,True
14_yr_old_girl,lol,False
kinkyjeff694u,i think the kids go back to school tomorrow here,True
14_yr_old_girl,lucky them,False
kinkyjeff694u,yeah true,True
14_yr_old_girl,i keep lookin at ur pics,False
14_yr_old_girl,i luv ur long hair,False
kinkyjeff694u,im very glad that u like them baby and thank u baby,True
14_yr_old_girl,i do lik em an yw,False
14_yr_old_girl,i didnt notice before u gotta tat,False
kinkyjeff694u,aww baby u are so very sweet,True
14_yr_old_girl,ty,False
kinkyjeff694u,yes i have a couple of them,True
14_yr_old_girl,relly thats so kewl,False
kinkyjeff694u,yeah i have one on each arm and then a drunken mistake i put on my forearm baby when i was 16 too i put a girls name on my arm,True
14_yr_old_girl,awww whats it say,False
kinkyjeff694u,angie,True
14_yr_old_girl,lol,False
14_yr_old_girl,oh wel u were jus 16,False
kinkyjeff694u,i love ur sexy pics too baby,True
14_yr_old_girl,aww ty,False
kinkyjeff694u,yes that when i got all my tats done,True
14_yr_old_girl,kewl,False
kinkyjeff694u,yvw baby,True
14_yr_old_girl,it looks lik a cross in ur pic,False
14_yr_old_girl,cant see the othr arm tho,False
kinkyjeff694u,yes thats on my left arm and i have the pic of the face of the grim repper on my right arm,True
14_yr_old_girl,oh kewl,False
14_yr_old_girl,cant wait to see that one too,False
kinkyjeff694u,and i have my left ear double pierced too,True
14_yr_old_girl,relly thats so kewl,False
14_yr_old_girl,cant tell it from ur pics,False
kinkyjeff694u,well i didnt have any earrings in my ear at the time but i will wear some when we meet,True
14_yr_old_girl,kewl,False
kinkyjeff694u,ur blonde that ur holding hands with around the tree is cute too,True
14_yr_old_girl,lol thnx,False
kinkyjeff694u,your very welcome baby have u both play with each other or exxpermented with each other,True
14_yr_old_girl,nah not relly into girls ne,False
kinkyjeff694u,ohh ok but if u were would she be one that u would play with,True
14_yr_old_girl,idk nevr thoght bout it but shes lik my best frend,False
kinkyjeff694u,thats cool then baby,True
kinkyjeff694u,but i liek u more i love ur black hair its so sexy,True
kinkyjeff694u,and dark sexy eyes,True
14_yr_old_girl,awww ty,False
kinkyjeff694u,mmmmm your so very welcome baby,True
14_yr_old_girl,u got blue eyez huh,False
14_yr_old_girl,thats what it looks lik,False
kinkyjeff694u,yes i do baby,True
14_yr_old_girl,blond an blue kewl,False
kinkyjeff694u,yep baby,True
kinkyjeff694u,so baby are u shaven or nicely trimmed,True
14_yr_old_girl,i aint got a whole lot ther,False
kinkyjeff694u,mmmm that so very sexy baby,True
14_yr_old_girl,ty,False
kinkyjeff694u,yvw baby i love that,True
14_yr_old_girl,thats kewl,False
14_yr_old_girl,u got ne more pics lol,False
kinkyjeff694u,no thats all i took for now baby,True
14_yr_old_girl,oh k lol,False
kinkyjeff694u,we will take some more when i come up there too baby,True
14_yr_old_girl,kewl,False
kinkyjeff694u,yes baby very kwel,True
kinkyjeff694u,im shaven too ill even let u shve me down there,True
14_yr_old_girl,omg i wuldnt wanna cut ya ther it wuld hurt,False
kinkyjeff694u,i would show u how baby,True
14_yr_old_girl,oh good cuz i dont wanna hurt ya lol,False
14_yr_old_girl,im gonna go eat then i wil be bck k,False
kinkyjeff694u,ok baby ill be here,True
14_yr_old_girl,k dont leav lol,False
kinkyjeff694u,im not baby,True
14_yr_old_girl,k,False
kinkyjeff694u,hi baby,True
14_yr_old_girl,im bck lol,False
kinkyjeff694u,im glad to see that and wb,True
14_yr_old_girl,aww ty,False
14_yr_old_girl,ur sweet,False
kinkyjeff694u,what did u have to eat baby,True
14_yr_old_girl,spaghetti,False
14_yr_old_girl,or howevr its spelld,False
14_yr_old_girl,srry it took me so long i hadda help clean up,False
14_yr_old_girl,wherd ya go now,False
kinkyjeff694u,im here baby i asked u what u had to eat,True
14_yr_old_girl,i said spaghetti,False
14_yr_old_girl,my dang im must not be goin thru,False
kinkyjeff694u,mmmmmm vwery yummy and yeah i didnt see what u said when i asked u that,True
14_yr_old_girl,srry,False
14_yr_old_girl,it was good tho,False
kinkyjeff694u,its ok baby and good,True
14_yr_old_girl,hav u ate,False
kinkyjeff694u,yes i had bbq ribs,True
14_yr_old_girl,mmmmm yummy,False
kinkyjeff694u,mmmm ohh yes baby,True
14_yr_old_girl,u cook,False
kinkyjeff694u,yes i do baby,True
14_yr_old_girl,yummy,False
kinkyjeff694u,mmm ohh yes baby ad i can cook good too,True
14_yr_old_girl,kewl,False
kinkyjeff694u,ill cook for u when im come there baby,True
14_yr_old_girl,aww u dont gotta do that,False
14_yr_old_girl,i can cook some too my aunt taught me,False
kinkyjeff694u,cool then we will cook something togehter then baby,True
14_yr_old_girl,thatd be lots of fun,False
kinkyjeff694u,yes it would be too baby,True
14_yr_old_girl,ya lol,False
14_yr_old_girl,so what ya doin now,False
kinkyjeff694u,talking to u baby,True
14_yr_old_girl,i kno that meent sides that lol,False
kinkyjeff694u,nothig baby,True
14_yr_old_girl,aww ur so kewl,False
kinkyjeff694u,aww ty baby,True
14_yr_old_girl,yvw,False
kinkyjeff694u,ill have u in a apron with nothing on under it like ur a sexy maid,True
14_yr_old_girl,lol that could be fun,False
14_yr_old_girl,long as i aint gotta clean,False
kinkyjeff694u,mmmm ohh yes it can be too baby and no u dont just act like it and when u bend over ill be playing with you,True
14_yr_old_girl,oh lol ok then,False
kinkyjeff694u,mmmm ohh yes baby slidfe my fingers down ur sexy ass and pussy,True
14_yr_old_girl,that souns relly kewl,False
kinkyjeff694u,mmmmm ohh yes it does baby and slide my fingers gently into ur hot ass and pussy slowly,True
14_yr_old_girl,kewl i jus dont want no babies k,False
kinkyjeff694u,well i dont cum baby so i cant get u pregnant,True
14_yr_old_girl,kewl,False
kinkyjeff694u,mmmm ohh yes baby,True
kinkyjeff694u,so i bet ur wearing some sexy lil panties baby,True
14_yr_old_girl,lol i got blue wit white stripd bikinis,False
kinkyjeff694u,mmmm very sexy baby,True
14_yr_old_girl,can i ask u somethin,False
kinkyjeff694u,yes u can baby anything,True
14_yr_old_girl,u dont care that i aint nevr went atw before,False
kinkyjeff694u,no baby i dont,True
14_yr_old_girl,k good,False
kinkyjeff694u,i want to teach u baby,True
14_yr_old_girl,i jus dont wanna mess up ya kno,False
kinkyjeff694u,aww u will be fine baby,True
14_yr_old_girl,k kewl,False
kinkyjeff694u,you are in good hands baby,True
14_yr_old_girl,good lol,False
14_yr_old_girl,thats so kewl that u wanna teach me,False
kinkyjeff694u,yes it is baby,True
14_yr_old_girl,im all excitd now,False
kinkyjeff694u,mmmmm i bet that ur nice and wet now to,True
14_yr_old_girl,lol ya a lil,False
kinkyjeff694u,mmmmm very sexy and yummy baby,True
kinkyjeff694u,cant wait to taste urhot wet pussy thru ur sexy panties baby,True
14_yr_old_girl,kewl i cant wait eithr,False
kinkyjeff694u,mmm me either baby i bet that u taste so sweet,True
14_yr_old_girl,k lol,False
kinkyjeff694u,what to try something for me now baby,True
14_yr_old_girl,what,False
kinkyjeff694u,slide ur finger along ur pussy and lick ur finger for me,True
14_yr_old_girl,i bettr not rite now my aunt is here,False
kinkyjeff694u,ohh ok baby well we will do that when i get there too,True
kinkyjeff694u,and i will lick ur fingers then and u can lick mine,True
kinkyjeff694u,and then kiss u afterwards,True
14_yr_old_girl,geeze this stupid yahell keeps bootin me off,False
kinkyjeff694u,i hate that baby,True
14_yr_old_girl,me too lol,False
kinkyjeff694u,yeah baby,True
kinkyjeff694u,ill eat some foods from off of u to baby,True
14_yr_old_girl,thatd be kewl,False
kinkyjeff694u,mmm ohh yes choclet syurp,True
14_yr_old_girl,kinda messy huh,False
14_yr_old_girl,lol,False
kinkyjeff694u,well i wouldnt put alot on u at frist,True
14_yr_old_girl,lol k,False
kinkyjeff694u,yeah baby,True
kinkyjeff694u,well we could get mesy and then i coudl bathed u then baby,True
14_yr_old_girl,ya we could do that,False
kinkyjeff694u,mmmm ohh yes as i wash u all over,True
14_yr_old_girl,mm kewl,False
kinkyjeff694u,and wash ur hair for u too,True
14_yr_old_girl,awww u r so sweet,False
kinkyjeff694u,aww ty baby,True
14_yr_old_girl,yw,False
14_yr_old_girl,i jus cant wait to see u,False
14_yr_old_girl,it bettr be nice next weeknd,False
14_yr_old_girl,lol,False
kinkyjeff694u,me either baby,True
kinkyjeff694u,yes i know,True
14_yr_old_girl,lol,False
kinkyjeff694u,yes baby i want to see u too,True
14_yr_old_girl,awww me too,False
kinkyjeff694u,mmmm yes that why it better be cleared up by then,True
14_yr_old_girl,ya it bettr,False
14_yr_old_girl,lol,False
kinkyjeff694u,yes true baby,True
14_yr_old_girl,u gonna come on fri or sat,False
kinkyjeff694u,i might come down friday afternoon,True
14_yr_old_girl,im gonna be in school fri but aftr school wil be kewl,False
kinkyjeff694u,ok baby u will have to tell me how to get there too,True
14_yr_old_girl,k i wil lol,False
kinkyjeff694u,kwel,True
14_yr_old_girl,i wanna keep chattin wit ya but i gotta get my homework done,False
kinkyjeff694u,ok baby,True
14_yr_old_girl,ill try to hurry lol,False
kinkyjeff694u,i bet that u will be wearing something sexy for me to,True
kinkyjeff694u,ok baby,True
14_yr_old_girl,ya i will when u r here,False
kinkyjeff694u,mmmmm nice baby,True
14_yr_old_girl,k wil be bck,False
kinkyjeff694u,ok baby,True
14_yr_old_girl,hiya,False
14_yr_old_girl,im me when u bck k,False
14_yr_old_girl,i miss ya hope u on latr,False
kinkyjeff694u,hi baby im here and i missed you too,True
14_yr_old_girl,u stil here,False
kinkyjeff694u,yes im here baby,True
14_yr_old_girl,k kewl,False
14_yr_old_girl,im srry i didnt get bck on last nite my aunt was bitchin at me,False
kinkyjeff694u,its ok baby i understand,True
14_yr_old_girl,kewl i missd chattin wit ya today,False
kinkyjeff694u,so did i too baby very much,True
14_yr_old_girl,awww ty,False
14_yr_old_girl,what ya been doin,False
kinkyjeff694u,ijust got finished watching wrestling,True
14_yr_old_girl,o kewl,False
14_yr_old_girl,whos ur fav one,False
kinkyjeff694u,undertaker bastia hhh abd shawn michels,True
kinkyjeff694u,and,True
14_yr_old_girl,kewl,False
14_yr_old_girl,undrtakr is kinda scary,False
kinkyjeff694u,u like wrestling to baby,True
14_yr_old_girl,ya lol,False
kinkyjeff694u,kwel,True
kinkyjeff694u,yeah ive been watching the undertker when he first started in wrestling when he wsant the undertaker but useing his real name,True
14_yr_old_girl,kewl,False
14_yr_old_girl,i used to watch it wit my dad before he died,False
kinkyjeff694u,cool baby,True
14_yr_old_girl,ya my fav was sting but i herd that he aint wrestlin no more,False
kinkyjeff694u,yes he my fav to and he wrestle on tna on spike tv on thrus nights at 8pm,True
14_yr_old_girl,oh kewl didn kno that,False
14_yr_old_girl,i aint watchd wrestlin sense my dad died,False
kinkyjeff694u,ohh wow baby i watch them all raw and smackdown and ecw and tna,True
14_yr_old_girl,kewl,False
kinkyjeff694u,raw comes on monday night on usa channel at 8pm samckdown on friday night at 7pm on the cw and ecw on tues night on scifi at 9pm,True
14_yr_old_girl,wow lol,False
kinkyjeff694u,now u knw where to watch them all again baby,True
14_yr_old_girl,ya i kinda missd watchin it,False
kinkyjeff694u,yeah its fun to watch,True
14_yr_old_girl,ya my dad took me one time when i was lik 2 to see it,False
kinkyjeff694u,yeah i go to every time it come to the city i was live on raw when it was in the city in steptember,True
14_yr_old_girl,kewl,False
kinkyjeff694u,yeah baby,True
kinkyjeff694u,baby u can be my daddys girls,True
14_yr_old_girl,awww ur so kewl,False
kinkyjeff694u,aww ty u baby,True
kinkyjeff694u,ill be ur naughty daddy,True
14_yr_old_girl,kewl lol,False
kinkyjeff694u,dad n dau playmates,True
14_yr_old_girl,k lol,False
kinkyjeff694u,mmm im being naughty baby,True
14_yr_old_girl,nah ur kewl,False
kinkyjeff694u,kewl baby,True
kinkyjeff694u,alouth i have had sex before with a mom and dau at the same time,True
14_yr_old_girl,was that kinda wierd,False
kinkyjeff694u,no it was pretty exciting she wanted to watch he with a older man teaching her,True
kinkyjeff694u,her,True
14_yr_old_girl,kewl,False
kinkyjeff694u,yeah baby like ill be teaching you too,True
14_yr_old_girl,ya i caint wait,False
kinkyjeff694u,me either baby and she was ur age too,True
14_yr_old_girl,kewl,False
14_yr_old_girl,so u kno what ur doin teachin me then lol,False
kinkyjeff694u,ohh yes i do baby,True
14_yr_old_girl,kewl,False
kinkyjeff694u,ill teach u alot awhole more than u already know baby,True
14_yr_old_girl,kewl cuz i dont kno much,False
kinkyjeff694u,what do u know baby,True
14_yr_old_girl,nm tole ya all i evr did was wit my ex bf i did a bj,False
kinkyjeff694u,well that good baby,True
14_yr_old_girl,jus dont get mad if i dont do somethin rite,False
kinkyjeff694u,ohh i wont baby,True
14_yr_old_girl,kewl,False
14_yr_old_girl,i jus dont wanna mess up,False
kinkyjeff694u,well u already know what to do to me the rest is for me to show u what he does to u too,True
14_yr_old_girl,kewl,False
kinkyjeff694u,ohh yes baby,True
kinkyjeff694u,then show u more on how to touch and please urslef to baby,True
14_yr_old_girl,k,False
kinkyjeff694u,u have played with urslef before right baby,True
14_yr_old_girl,i trid it one time but it jus felt dum,False
kinkyjeff694u,well i will show u where it will be pleasureable,True
14_yr_old_girl,k,False
kinkyjeff694u,i will have ur hand into mine as i teach u how to touch and finger urself togeter at first,True
14_yr_old_girl,kewl,False
kinkyjeff694u,ohh yeah baby and then i would watch u and then i would to u as u rub me at the same time too,True
14_yr_old_girl,souns kewl,False
kinkyjeff694u,yes it does too baby,True
kinkyjeff694u,so what kind of sexy bra and pnaties did u wear for me today,True
14_yr_old_girl,oh i gotta matchin set lol they are pink wit harts on em,False
kinkyjeff694u,mmmmm very sexy baby,True
14_yr_old_girl,aww ty,False
kinkyjeff694u,yvw baby i cant wait to see u in them too,True
14_yr_old_girl,i caint wait eithr,False
kinkyjeff694u,i sure hope that we dont get the 5 to of snow this weekend,True
14_yr_old_girl,i kno me neithr,False
14_yr_old_girl,my aunt aint sure when she gets to go on her trip sense we been gettin all this crap,False
kinkyjeff694u,yeah i bet too baby,True
kinkyjeff694u,well whenever she does we will have our special time togehrt baby,True
14_yr_old_girl,k kewl ill let ya kno as soon as i kno,False
kinkyjeff694u,yes i know that you will baby,True
14_yr_old_girl,k,False
kinkyjeff694u,were we could just play all day we with other and then cuddle for awhile just hang around nked and watch moives,True
14_yr_old_girl,that souns lik lots of fun,False
kinkyjeff694u,yes it does baby and have u model ur sexy lil outfits and nighies and ur sexy bra and panties and posing nude and sexy poses,True
14_yr_old_girl,u stil gonna bring ur cam rite,False
kinkyjeff694u,yes baby,True
14_yr_old_girl,kewl,False
14_yr_old_girl,its gonna b so much fun,False
kinkyjeff694u,mmmm ohh yes it is too baby,True
14_yr_old_girl,kewl,False
kinkyjeff694u,mmmmm ohh yes too baby,True
kinkyjeff694u,mmmm and then i have ur sexy pics and a pair of ur sexy panites for a keepsake until our next meet too baby,True
14_yr_old_girl,ya that souns good,False
kinkyjeff694u,ohh yes baby this isnt going to be our last meeting we are still going to see each other when we cam baby,True
14_yr_old_girl,kewl was hopin u didnt jus wanna see me one time,False
14_yr_old_girl,cuz ur lik relly kewl an i wanna see u whenevr we can,False
kinkyjeff694u,ohh yes so do i too baby i really like u alot too,True
14_yr_old_girl,kewl thats awesom,False
kinkyjeff694u,yes it is baby i knew when we first statred talking with each other that you were very speacil to me,True
14_yr_old_girl,awww ty ur so sweet,False
14_yr_old_girl,i relly lik u lots too,False
kinkyjeff694u,brb baby,True
14_yr_old_girl,k,False
kinkyjeff694u,aww ty baby,True
14_yr_old_girl,yw,False
kinkyjeff694u,i m back baby i had to let my dog out side,True
14_yr_old_girl,k wb lol,False
kinkyjeff694u,ty baby,True
14_yr_old_girl,yw lol,False
kinkyjeff694u,lol,True
14_yr_old_girl,so what ya doin lol,False
kinkyjeff694u,thinking about u baby,True
14_yr_old_girl,what ya thinkin,False
14_yr_old_girl,penny for ur thoghts lol,False
kinkyjeff694u,on how great it finally going to be to have u in my arms,True
14_yr_old_girl,i kno i caint wait eithr,False
kinkyjeff694u,i want u to be as naughty as u want baby,True
14_yr_old_girl,wel u gotta show me what ya meen k,False
kinkyjeff694u,ohh i will and like just stay around the house the whole naked not having to worry about having any rules that ur free to do what u want around the house,True
kinkyjeff694u,ops time,True
14_yr_old_girl,ya thats gonna b kewl,False
kinkyjeff694u,ohh yes it is too baby,True
14_yr_old_girl,u in a chat rm lol,False
kinkyjeff694u,no baby sorry i was onthe ohone,True
kinkyjeff694u,phone,True
14_yr_old_girl,oh lol,False
14_yr_old_girl,thoght u left me,False
kinkyjeff694u,ohh no baby i would never leave u without telling u baby,True
14_yr_old_girl,awww kewl,False
kinkyjeff694u,let me go and see if my dogs wants back in too baby,True
14_yr_old_girl,k,False
kinkyjeff694u,im back baby,True
14_yr_old_girl,wb,False
kinkyjeff694u,ty love,True
14_yr_old_girl,yw luv,False
14_yr_old_girl,i caint wait to see u,False
kinkyjeff694u,ohhh me either baby,True
14_yr_old_girl,relly u excitd too cuz i am,False
kinkyjeff694u,ohh yes i am baby im vry ecited,True
14_yr_old_girl,kewl,False
kinkyjeff694u,ohhyes baby,True
kinkyjeff694u,do u party baby,True
14_yr_old_girl,umm what ya meen party i been to some frends parties but jus birthday parties,False
kinkyjeff694u,ohh i ment like drink and stuff,True
14_yr_old_girl,oh i hadda beer before but i dont lik drink alot or nething,False
kinkyjeff694u,thats cool baby,True
14_yr_old_girl,do u,False
kinkyjeff694u,yes sometimes i drink and smoke baby,True
14_yr_old_girl,kewl,False
14_yr_old_girl,what ya drink lik beer or what,False
kinkyjeff694u,beer liqiour,True
14_yr_old_girl,lol,False
14_yr_old_girl,i drank a bud one time,False
kinkyjeff694u,yeah,True
14_yr_old_girl,lol,False
kinkyjeff694u,cool,True
14_yr_old_girl,it was kinda good,False
14_yr_old_girl,lol,False
kinkyjeff694u,cool baby,True
kinkyjeff694u,i smoke weed sometimes too,True
14_yr_old_girl,i aint nevr done that,False
kinkyjeff694u,ohh ok,True
14_yr_old_girl,is it good,False
kinkyjeff694u,yes it is baby,True
14_yr_old_girl,kewl,False
kinkyjeff694u,want me to bring one,True
14_yr_old_girl,i gues if u wanna,False
kinkyjeff694u,ok baby,True
kinkyjeff694u,i bring some beer too,True
14_yr_old_girl,kewl,False
kinkyjeff694u,cool baby,True
kinkyjeff694u,we will have fun baby,True
14_yr_old_girl,ya lots of fun i caint wait,False
kinkyjeff694u,ohh me either baby,True
