User,Text,Groom
shinelfmc2005,12 wondering if you hav alittle hair on yr poussy yet,True
shinelfmc2005,i shave the hair around my cock,True
sugahboogah93,i thot i tole i didnt have much of nuttin,False
shinelfmc2005,i need to get some sleep now hope to see you tomorrow,True
sugahboogah93,ok,False
shinelfmc2005,good night,True
shinelfmc2005,i will dream of you,True
sugahboogah93,nite,False
sugahboogah93,hiya,False
shinelfmc2005,hi,True
sugahboogah93,wutcha doin,False
shinelfmc2005,watching tv,True
sugahboogah93,wutcha watcin,False
shinelfmc2005,just channel surfing,True
sugahboogah93,o am i buggin u,False
shinelfmc2005,no,True
shinelfmc2005,just wishing you had some more pics,True
sugahboogah93,how wuz ur weekend,False
sugahboogah93,o sry i will afta next weekend lots of em i just dont no if my mom let me share em r not but i can ask,False
shinelfmc2005,short nothing happening,True
shinelfmc2005,wish u had a nipple pic,True
sugahboogah93,lol y,False
shinelfmc2005,i just like looking at little nipples,True
shinelfmc2005,wishing i could suck on them,True
sugahboogah93,haha i dot got much,False
shinelfmc2005,u let the boys feel them or suck on them,True
sugahboogah93,no neva have,False
shinelfmc2005,why not,True
sugahboogah93,dont got bf,False
shinelfmc2005,yr sure pretty not to hav one,True
sugahboogah93,no1 eva tole me they wannted 2 do b4,False
shinelfmc2005,u ever thought about rubbing a hard cock,True
sugahboogah93,wut do it feel like,False
shinelfmc2005,a hot dog,True
sugahboogah93,relly,False
shinelfmc2005,u ever rub yr nipples and make them hard and pokie,True
sugahboogah93,not relly,False
shinelfmc2005,when u shower do u rub down between yr leggs alittle longer,True
sugahboogah93,nah just kinda wipe em off,False
shinelfmc2005,u never slipped a finger in it,True
sugahboogah93,n wut,False
shinelfmc2005,just run yr finger in and out of it,True
sugahboogah93,wut,False
shinelfmc2005,i hav started to rub my cock while chatting ith you,True
sugahboogah93,y,False
shinelfmc2005,looking at yr pic is getting my cock hard,True
sugahboogah93,ooh do it hurt,False
shinelfmc2005,can u reach down and rub bewtteen yr legs now,True
sugahboogah93,um how come,False
shinelfmc2005,what you wearing,True
sugahboogah93,nite shirt,False
shinelfmc2005,no panties,True
sugahboogah93,o yea duh haha,False
shinelfmc2005,slip yr finger in yr panties for me and slio it in yr sweet spot,True
sugahboogah93,um u sound like him,False
shinelfmc2005,him who,True
sugahboogah93,i not relly spose talk bout it but he say same stuff 2 me,False
shinelfmc2005,does he get to put his finger in it,True
sugahboogah93,not really,False
shinelfmc2005,will you put yr finger in it and tell me how it feels,True
sugahboogah93,i dunno y,False
shinelfmc2005,if it gets you wet i will get a big hard on,True
sugahboogah93,but i not relly spose touch it,False
shinelfmc2005,you want me to get a hard on dont you,True
sugahboogah93,i guess,False
shinelfmc2005,so put yr finger in it and tell me if it gets wet,True
sugahboogah93,inot spose 2 dr saidi shouldnt try n touch it,False
shinelfmc2005,please put yr finger in it,True
shinelfmc2005,and tell me if you get wet,True
sugahboogah93,i not spose 2 tho wut if dr get mad at me,False
shinelfmc2005,you going to tell him,True
shinelfmc2005,i want,True
sugahboogah93,no but he prolly tell if i do huh,False
shinelfmc2005,no he want,True
sugahboogah93,i dunno could i call u n hear u 1st,False
shinelfmc2005,do u know what yr clit is,True
sugahboogah93,i dont think so,False
shinelfmc2005,if you put yr finger down by your slit you should feel alittle bump between yr lips down there,True
shinelfmc2005,then if you push yr finger it will slip into yr hoe,True
shinelfmc2005,hole,True
sugahboogah93,how come u not answa muh,False
shinelfmc2005,answer what,True
sugahboogah93,can i hear u voice 1st so i feel betta,False
shinelfmc2005,u want to call me,True
shinelfmc2005,when,True
sugahboogah93,yea is that ok,False
sugahboogah93,i can now but it up2 u,False
shinelfmc2005,it is late and i hate to give my phone number out,True
sugahboogah93,it me duh we talk 4 long time it not like i gonna keepit lo,False
sugahboogah93,nvm i just thot if i hear u voice it be kewl n help me not b so shy bout that stuff u talk bout but nvm,False
shinelfmc2005,maybe next time,True
shinelfmc2005,i live in texas,True
sugahboogah93,i no u tole me b4 lol,False
shinelfmc2005,how would you call me,True
sugahboogah93,id hafta use this card muh grammy sends me,False
sugahboogah93,its ok nvm k i just thot itb kewl hear u voice i thot maybe u wanna hear mine 2 but its ok itdumb idea,False
shinelfmc2005,will you be on here tomorrow,True
sugahboogah93,yea prolly,False
shinelfmc2005,could you do it then,True
sugahboogah93,yea if u wanted wut time u want me 2,False
sugahboogah93,its like 1 here wut time is it there,False
shinelfmc2005,12,True
sugahboogah93,o lucky wish it wuz 12 here,False
shinelfmc2005,how about 5 oclock there,True
sugahboogah93,ic ant that wen we eat n i gotta do dishes n stuff i can bout 10 11 ur time,False
shinelfmc2005,what about during the day,True
sugahboogah93,i can try but i sleep late n my mom bf here n he wont let me get on but i can try,False
shinelfmc2005,wish i could hear yr voice,True
sugahboogah93,relly i relly wish i could hear urs,False
sugahboogah93,u cant have calls this late r sumthin,False
sugahboogah93,oh u dont live alone huh im sry i didnt mean b rude,False
shinelfmc2005,ok you going to call right now,True
sugahboogah93,relly,False
shinelfmc2005,can you call me now i will walk outside,True
sugahboogah93,ok wut ur name,False
shinelfmc2005,281 948 1170 just want to see if yr a girl,True
sugahboogah93,wut u name r u a boy,False
shinelfmc2005,yes,True
sugahboogah93,wut ur name,False
sugahboogah93,mine jess,False
shinelfmc2005,randy,True
sugahboogah93,brb gotta sign n call,False
sugahboogah93,hi,False
shinelfmc2005,thanks for talking to me,True
sugahboogah93,i liked u voice,False
shinelfmc2005,ty,True
shinelfmc2005,i liked yrs too it soundes sexy like you,True
sugahboogah93,aww thx,False
shinelfmc2005,do u feel etter about me now,True
shinelfmc2005,better,True
sugahboogah93,yea its like i no u n stuff,False
shinelfmc2005,i feel the same way,True
sugahboogah93,aww good,False
sugahboogah93,i like u,False
shinelfmc2005,maybe we can talk again,True
shinelfmc2005,sometime,True
sugahboogah93,yea that be kewl,False
shinelfmc2005,would you run yr hand over yr nipples,True
sugahboogah93,um i told u i relly dont have any,False
shinelfmc2005,ok,True
shinelfmc2005,bet you hav something there,True
sugahboogah93,a lil bit they tryin grow i guess,False
shinelfmc2005,does yr dark part of yr nipple poke out,True
sugahboogah93,yea they a lil that do,False
shinelfmc2005,mmmmmmmmm wish i could suck on them,True
sugahboogah93,haha y,False
shinelfmc2005,just because i think you would like it,True
sugahboogah93,u do it b4 r sumthin how u no,False
shinelfmc2005,i hav on another girl she loved it,True
sugahboogah93,relly did she have bigger 1s r sumthin,False
shinelfmc2005,no she had little ones she was 13,True
sugahboogah93,o wow did she relly,False
shinelfmc2005,she let me kiss and tougne yr down bewteen her leggs too she got really wet,True
sugahboogah93,did she pee,False
shinelfmc2005,she got real wet,True
sugahboogah93,wuz it pee,False
shinelfmc2005,maybe,True
sugahboogah93,eww u like that 3,False
sugahboogah93,2,False
shinelfmc2005,yes,True
shinelfmc2005,it was ok,True
sugahboogah93,eww wut didit taste liek,False
shinelfmc2005,slippwry wet,True
shinelfmc2005,it didnt really hav a taste,True
sugahboogah93,o,False
shinelfmc2005,wish i could get you to rub it and out yr finger in it and tell me what you feel,True
shinelfmc2005,put,True
sugahboogah93,i just dont want dr 2 no wut i did tho,False
shinelfmc2005,he want know,True
sugahboogah93,u sure i gotta back 23rd,False
shinelfmc2005,if you rub it alittle and put yr finger in,True
sugahboogah93,owut happens if i do it,False
shinelfmc2005,if you get wet it would really make me hard,True
sugahboogah93,o,False
shinelfmc2005,you want to get me hard,True
shinelfmc2005,sont you,True
shinelfmc2005,dont you,True
sugahboogah93,that good thing rite,False
shinelfmc2005,right its a good thing,True
sugahboogah93,o ok i guess if it good,False
shinelfmc2005,mmmmmmmmm ty tell me what it feels like,True
sugahboogah93,can i pee 1st n get sum water,False
shinelfmc2005,sure,True
sugahboogah93,ty i brb k,False
sugahboogah93,k i sry,False
shinelfmc2005,you feel better since you pee,True
sugahboogah93,yea lots,False
shinelfmc2005,lol,True
shinelfmc2005,would hate to see you put yr finger in and pee on it,True
sugahboogah93,eww gross haha,False
shinelfmc2005,wish i could put my tougne in it think you would like that,True
sugahboogah93,i dunno how u gonna do that wen u there n tx n i n va,False
shinelfmc2005,dream about it,True
sugahboogah93,oh thats kinda hard 2 do,False
shinelfmc2005,well i am getting hard now,True
sugahboogah93,haha how come ididnt do nuttin,False
shinelfmc2005,thinking of you and lookin at yr pic,True
sugahboogah93,relly but i kinda uglytho,False
shinelfmc2005,no yr not,True
sugahboogah93,i dont like muh ears haha,False
shinelfmc2005,you hav pretty ears just right to nibble on and kiss,True
sugahboogah93,haha thx,False
shinelfmc2005,you going to tell me what it feels like to slip yr finger in it,True
sugahboogah93,o u still want me do that i 4got,False
shinelfmc2005,mmmmmmm,True
shinelfmc2005,yr hottie,True
sugahboogah93,haha thx u still got u cam,False
shinelfmc2005,yes but it isnt hooked up,True
shinelfmc2005,wish you could see me cum,True
sugahboogah93,haha i just curious y u not use it,False
sugahboogah93,wut do u yahooname mean,False
shinelfmc2005,shine is my nick and lfmc is a motorcycle club,True
sugahboogah93,ooh u got motorcucle,False
shinelfmc2005,yes,True
sugahboogah93,i like shine how u get nick that like,False
shinelfmc2005,harley,True
sugahboogah93,ooh i neva ben on 1 of those b4,False
shinelfmc2005,u changing the subject arent you,True
sugahboogah93,no sry i just trin keep from borin u sry,False
sugahboogah93,i do that lots ask my mom she be talkin bout 1 thing then i just start askin her bout diff stuff she gets mad at me 2,False
shinelfmc2005,yr not boring me i am just rubbing my cock wishing it was you,True
sugahboogah93,haha relly y r u snice 2 me 4,False
shinelfmc2005,i just like you,True
sugahboogah93,i like u 2 if i could i prolly ask u millions of s just to no so much bout u,False
sugahboogah93,i like u 2 much its kinda sad u so far way,False
shinelfmc2005,you thank it is nuts to chat to you and rub my cock and make it squirt cum,True
sugahboogah93,i dunno u said it good rite,False
shinelfmc2005,yes it is good and it feels good too,True
shinelfmc2005,wish you would tell me what yr pussy feels like,True
sugahboogah93,u neva said nuttin bout wen so,False
shinelfmc2005,do it now i am about to cum,True
sugahboogah93,just touch it,False
shinelfmc2005,yes and slip yr finger in it,True
sugahboogah93,inside,False
shinelfmc2005,and tell me if it is wet,True
shinelfmc2005,yes just alittle,True
sugahboogah93,k it stil kinda sore,False
shinelfmc2005,ok u dont hav to,True
shinelfmc2005,wish i could kiss it and make the pain go away,True
sugahboogah93,u dont want me 2,False
sugahboogah93,oh k make u mind up i confused,False
shinelfmc2005,not if it hurts,True
sugahboogah93,aww see how sweet u r,False
shinelfmc2005,mmmmmmmmmmm i am about to squirt my cum,True
sugahboogah93,im sry i hope i dont make u mad,False
shinelfmc2005,u couldnt make me mad,True
shinelfmc2005,here it cums mmmmmmmmmm,True
sugahboogah93,i hope not,False
sugahboogah93,i hope it dont hurt u,False
shinelfmc2005,mmmmmm wish it was yr hand rubbing it,True
sugahboogah93,did it hurt,False
shinelfmc2005,nooooooo,True
shinelfmc2005,it felt good,True
sugahboogah93,o haha good,False
shinelfmc2005,maybe u can watch me cum on cam sometime would you like that,True
sugahboogah93,i dunno u want me 2,False
shinelfmc2005,yes i think it would be kewl,True
shinelfmc2005,for u to see,True
sugahboogah93,o its good 2 huh,False
shinelfmc2005,yes its good to,True
shinelfmc2005,hav you seen a cock squirt cum,True
sugahboogah93,i dunno if he did it i mite of i dont wut he call it,False
shinelfmc2005,oh,True
sugahboogah93,i dunno tho sry,False
shinelfmc2005,maybe you could watch me and rub yr pussy at the same time,True
sugahboogah93,u want 2 do that,False
shinelfmc2005,yes,True
shinelfmc2005,yo cant hav a baby that way,True
sugahboogah93,wut u mean,False
shinelfmc2005,my cock want be in you,True
shinelfmc2005,when it cums,True
sugahboogah93,oh,False
sugahboogah93,do u have kids already,False
shinelfmc2005,maybe it want be sore then,True
shinelfmc2005,no,True
sugahboogah93,oh i dont mean b nosey,False
shinelfmc2005,thats ok,True
shinelfmc2005,no kids,True
sugahboogah93,u neva ben marred,False
shinelfmc2005,i was married,True
sugahboogah93,wut happen she not nice 2 u,False
shinelfmc2005,i dont know it just didnt work out and she wasnt nice either,True
sugahboogah93,im sry that mean,False
shinelfmc2005,yr nive though,True
shinelfmc2005,nice,True
sugahboogah93,thx i dont like be mean r meanppl,False
shinelfmc2005,hope i dont make you mad,True
sugahboogah93,no u dont y u say that 4 i like u randy u neva make me mad,False
shinelfmc2005,ok,True
shinelfmc2005,well it is here and i need to get up in 4 hrs to go to work,True
sugahboogah93,its 2 here haha wut u work do,False
shinelfmc2005,for the city of houston,True
sugahboogah93,wow that sound importnt,False
shinelfmc2005,i need to sleep now,True
sugahboogah93,aww im glad i got chat wit u,False
sugahboogah93,n hear u voice,False
sugahboogah93,sleep tite dont let bed bugs bite,False
shinelfmc2005,i loved hearing yr voice,True
sugahboogah93,me 2 i like u accent,False
shinelfmc2005,sweet dreams luv u,True
sugahboogah93,sweet dreams,False
shinelfmc2005,luv u,True
sugahboogah93,aww luv u 2,False
shinelfmc2005,good night,True
sugahboogah93,gnite have good monday,False
shinelfmc2005,i will dream of you tonight,True
sugahboogah93,awwwwwww me 2,False
shinelfmc2005,bye luv,True
sugahboogah93,bye luv haha,False
sugahboogah93,sry i missed ya,False
sugahboogah93,hiya guess u not on huh,False
