User,Text,Groom
sugahboogah93,hi,False
shinelfmc2005,very pretty pic,True
sugahboogah93,yea rite haha thx,False
shinelfmc2005,you hav a sexier one,True
shinelfmc2005,naybe one with yr dress on the floor,True
sugahboogah93,it on muh profile,False
shinelfmc2005,you like to watch guys jerk off on there cam,True
sugahboogah93,i dunno nevahave,False
shinelfmc2005,you ever touch a hard cock,True
sugahboogah93,i dunt think so,False
shinelfmc2005,you let any boys play with yr boobs or pussy,True
sugahboogah93,no,False
shinelfmc2005,you ever rub bewteen yr leggs,True
sugahboogah93,no,False
shinelfmc2005,yo let yr daddy give you baths,True
sugahboogah93,he use 2,False
shinelfmc2005,do u ever get to see him nakked,True
sugahboogah93,i dont think so,False
shinelfmc2005,how old are you,True
sugahboogah93,12 n u,False
shinelfmc2005,you hav nipples yet,True
sugahboogah93,omgz y u askn that 4,False
shinelfmc2005,if you do would love to suck on them,True
sugahboogah93,i dont k so u dont gotta,False
shinelfmc2005,yuo hav alittle hair around yr hole yet,True
sugahboogah93,ur kinda gross,False
shinelfmc2005,windering what you look like,True
sugahboogah93,o i got pics on profile,False
sugahboogah93,guess u left bye,False
shinelfmc2005,no i didnt sounded like you didnt want to chat,True
sugahboogah93,i do,False
shinelfmc2005,but you never finger yrself,True
sugahboogah93,no,False
shinelfmc2005,you ever hav girls sleep over,True
sugahboogah93,yea sumtimes,False
shinelfmc2005,you like to take showers with them,True
sugahboogah93,i dunno,False
shinelfmc2005,you like sleeping in the same bed with them,True
sugahboogah93,yea it fun we laff lots,False
shinelfmc2005,you ever let them touch you,True
sugahboogah93,like hugs n stuff,False
shinelfmc2005,or u touch them,True
shinelfmc2005,yes do you kiss on the lips,True
sugahboogah93,like wen tell em gnite r sumthin,False
shinelfmc2005,when yr in bed do you reachover and touch them,True
sugahboogah93,like pinch em on arm n stuff haha,False
shinelfmc2005,do yall ever tsake yr panties off in bed,True
shinelfmc2005,take,True
shinelfmc2005,or pull them down,True
sugahboogah93,eww no,False
shinelfmc2005,why not you ever think about how it mught feel to hav someone touch you between yr leggs,True
sugahboogah93,not spose talk bout that stuff,False
sugahboogah93,who told u,False
shinelfmc2005,hav you wanted someone to touch you there,True
shinelfmc2005,you hav let a girl kiss you and touch you there,True
sugahboogah93,no not girl,False
shinelfmc2005,a boy did,True
sugahboogah93,yea,False
shinelfmc2005,how old was he,True
sugahboogah93,i duno old,False
shinelfmc2005,did he want you to rub his cock,True
sugahboogah93,i aint answerin til u tell me who told u not no1 spose no,False
shinelfmc2005,i just know what you like to do,True
shinelfmc2005,did he really let you put his hard cock in yr mouth,True
sugahboogah93,how u no do u no him,False
shinelfmc2005,maybe,True
shinelfmc2005,he said he put you on yr back and put his cock between yr leggs,True
shinelfmc2005,did it hurt,True
sugahboogah93,who told u that,False
shinelfmc2005,did it hurt,True
sugahboogah93,y u askin that 4,False
shinelfmc2005,just want to make sure he isnt lying,True
sugahboogah93,i cant believe he told u tho,False
shinelfmc2005,he said you cried,True
sugahboogah93,that not nice,False
shinelfmc2005,did u,True
sugahboogah93,yea i did k,False
shinelfmc2005,he said you like to suck his cock,True
sugahboogah93,i did not,False
shinelfmc2005,did you bleed when he put it in you,True
sugahboogah93,ask him,False
shinelfmc2005,did you like it,True
sugahboogah93,y u not ask him,False
shinelfmc2005,how many times hav you been with him,True
sugahboogah93,i tole u not spose talk bout it,False
shinelfmc2005,did he squirt his cum in you or did he pull out and squirt,True
sugahboogah93,u need tell him muh mom gettin married n august,False
shinelfmc2005,yr mom is going to marry him,True
shinelfmc2005,still,True
sugahboogah93,no not him her bg,False
shinelfmc2005,oh,True
shinelfmc2005,where did he squirt his cum at,True
shinelfmc2005,in you or did he pull out and cum,True
sugahboogah93,i tole u i not spose talk bout it if u wanna no ask him,False
shinelfmc2005,i like asking you you are making me hard and i am jacking off looking at yr pic,True
shinelfmc2005,wish you where rubbing my cock,True
sugahboogah93,huh,False
shinelfmc2005,and sucking on it,True
shinelfmc2005,would you rub my cock,True
sugahboogah93,y u askn,False
shinelfmc2005,just wondering if you would since you did him,True
sugahboogah93,i didnt do that stuff 2 him muh mom said he did it 2 me,False
shinelfmc2005,would you like for me to make you do it to me,True
sugahboogah93,y,False
shinelfmc2005,because you want to play with my cock,True
sugahboogah93,i dont no u,False
shinelfmc2005,u want to see my cock on cam,True
sugahboogah93,how come u neva tole me ur asl,False
shinelfmc2005,because i am old,True
sugahboogah93,how old,False
shinelfmc2005,50,True
sugahboogah93,oh,False
shinelfmc2005,would you still rub my cock,True
sugahboogah93,u n virginia 2,False
shinelfmc2005,no tx wish i was near you,True
sugahboogah93,yea rite like ud come from there 2 here so,False
shinelfmc2005,u want to see my cock on cam,True
shinelfmc2005,yr to far away,True
shinelfmc2005,why dont you want to see my cock on cam,True
sugahboogah93,i dunno,False
shinelfmc2005,did he make you open up yr leggs so he could lick you there,True
sugahboogah93,i not spose talk bout it y cant u ask him how u no him he dont live n tx,False
shinelfmc2005,i dont know him,True
sugahboogah93,y u lie 4,False
shinelfmc2005,but i know what little girls likes,True
sugahboogah93,u dont no him,False
shinelfmc2005,no,True
sugahboogah93,y would u lie 2 me 4,False
shinelfmc2005,so u would chat with me it makes me hard,True
sugahboogah93,u like that stuff he did,False
shinelfmc2005,yes,True
sugahboogah93,y it was mean,False
shinelfmc2005,but only if the girl likes it to,True
shinelfmc2005,i wanted make you do anything you didnt want to do,True
sugahboogah93,k,False
shinelfmc2005,thats why i ask if you want to see my cock on cam,True
sugahboogah93,can i c n u,False
sugahboogah93,ur face,False
shinelfmc2005,no not my face,True
shinelfmc2005,sorry,True
sugahboogah93,how come,False
sugahboogah93,u c mh face,False
shinelfmc2005,i am old and scary,True
sugahboogah93,ur not,False
shinelfmc2005,see mt pic in trhe coner,True
shinelfmc2005,i hav a beard and look like santa,True
sugahboogah93,i dont c nethin,False
sugahboogah93,it just big sqare box not it gone,False
sugahboogah93,u not chattin now,False
shinelfmc2005,there it is,True
shinelfmc2005,i need to go to bed you want to see my cock or not,True
sugahboogah93,i c it but it hard 2 c,False
shinelfmc2005,sorry about that,True
shinelfmc2005,i need to go to bed want to see my cock,True
sugahboogah93,i dunno,False
sugahboogah93,do wutava u want,False
shinelfmc2005,i wish you wanted to see it,True
sugahboogah93,i said do wuteva u want,False
shinelfmc2005,its not what i want its what you want,True
sugahboogah93,no it not,False
shinelfmc2005,yes it is if you want to see it ask me,True
sugahboogah93,k,False
sugahboogah93,u there,False
shinelfmc2005,yes,True
shinelfmc2005,getting my cam,True
shinelfmc2005,click on my cam,True
sugahboogah93,oh kewl it slike tv,False
sugahboogah93,omg wut is that,False
shinelfmc2005,my cock,True
shinelfmc2005,would u rub it,True
sugahboogah93,it look like a kitty wit all that hair,False
shinelfmc2005,u suck it,True
sugahboogah93,huh,False
shinelfmc2005,would u like to play with it,True
sugahboogah93,how,False
shinelfmc2005,wish you had a pic of yr nipples,True
sugahboogah93,i wanna c u face,False
shinelfmc2005,maybe next time,True
sugahboogah93,i tole u i dont have those yet,False
shinelfmc2005,did you like seeing it,True
sugahboogah93,i dunno,False
shinelfmc2005,u like to finger yr pussy abd get it wet,True
shinelfmc2005,and,True
sugahboogah93,uh no,False
sugahboogah93,u stop it cuz i ask c u face,False
shinelfmc2005,next time i will squirt cum for you and show face,True
sugahboogah93,um k,False
shinelfmc2005,maybe you will rub yr pussy for me,True
shinelfmc2005,and tell me what it feels like,True
sugahboogah93,ewww y,False
shinelfmc2005,to make me harder,True
sugahboogah93,i aint doin nethin,False
sugahboogah93,u got gf r kids n stuff,False
shinelfmc2005,yo want to see sm squirt cum dont yu,True
sugahboogah93,i dont wanna touch muhself,False
shinelfmc2005,i am touching myself,True
sugahboogah93,so,False
shinelfmc2005,you might like it,True
sugahboogah93,wut u touch urself,False
shinelfmc2005,would you like it if i was touching you,True
shinelfmc2005,and kissing yr sweet pussy,True
sugahboogah93,eww duno,False
shinelfmc2005,slip my tougne in yr sweet tight pussy,True
sugahboogah93,i still mad at u 4 lyin n sayin u new him,False
shinelfmc2005,i like it when you tell me what you and him did it make me hard,True
sugahboogah93,ididnt do nethin,False
shinelfmc2005,he did kiss yr pussy didnt he,True
sugahboogah93,i aint tellin,False
shinelfmc2005,please,True
shinelfmc2005,please,True
shinelfmc2005,did he grab yr hair and make you suck his cock,True
sugahboogah93,i not gonna tell u nuttin else,False
shinelfmc2005,ok if i show you my face will you,True
sugahboogah93,y u wanna no that stuff 4,False
shinelfmc2005,just do,True
sugahboogah93,but y,False
shinelfmc2005,i would like to meet the guy and kill him for you,True
sugahboogah93,y u like no that stuff y u kill him 4,False
shinelfmc2005,he forced you didnt he,True
sugahboogah93,u do no him he told u all that stuff i new it cuz u cant make that stuff up like that,False
shinelfmc2005,i dont knoe him,True
shinelfmc2005,know,True
sugahboogah93,then how u no all that stuff,False
shinelfmc2005,but he forced you and made you suck his cock and made you open yr leggs so he put put his cock in you,True
shinelfmc2005,he raped you didnt he,True
sugahboogah93,yea i guess if that wut u call it,False
shinelfmc2005,how old was he 20 30 yrs old,True
sugahboogah93,34,False
shinelfmc2005,he needs to die doesnt he,True
sugahboogah93,i dunno,False
shinelfmc2005,how many times did he make you do it,True
sugahboogah93,i still luv him n way but dont like him no more,False
shinelfmc2005,was he kin to you,True
sugahboogah93,kin,False
sugahboogah93,oh knd,False
sugahboogah93,kind,False
shinelfmc2005,uncle,True
shinelfmc2005,dad,True
sugahboogah93,i dont wanna tell u,False
shinelfmc2005,was it yr dad,True
shinelfmc2005,tell me who it was please,True
sugahboogah93,y but i dont wanna,False
shinelfmc2005,please,True
shinelfmc2005,i need to know,True
shinelfmc2005,so i can help you,True
sugahboogah93,how u gonna help me,False
shinelfmc2005,sorry i need to go to bed need to work this morning,True
shinelfmc2005,talking about it yr mom doesnt want to talk about it,True
sugahboogah93,no she dont,False
shinelfmc2005,hope to see you again and chat some more,True
shinelfmc2005,wish you woulld tell me who it was,True
sugahboogah93,y u leavin thought u gonna help,False
shinelfmc2005,i need to sleep,True
sugahboogah93,oh,False
sugahboogah93,k ttyl,False
shinelfmc2005,see you later i hope,True
sugahboogah93,k,False
sugahboogah93,hi,False
shinelfmc2005,hi,True
sugahboogah93,hi,False
shinelfmc2005,yr up late,True
shinelfmc2005,yr up ate,True
sugahboogah93,yea,False
shinelfmc2005,late,True
shinelfmc2005,you feeling sexy tonight,True
sugahboogah93,not really,False
shinelfmc2005,why not,True
shinelfmc2005,wish you had more pics,True
sugahboogah93,i dunno i get more afta muh mom weddin i neva seen u face so u cant b mad,False
shinelfmc2005,can u see my pics now,True
sugahboogah93,i see a square,False
shinelfmc2005,u dont see the pics,True
sugahboogah93,i seen it that was u,False
shinelfmc2005,yes,True
shinelfmc2005,look kinda wild,True
sugahboogah93,u do look like santa,False
shinelfmc2005,yes i know,True
sugahboogah93,u look nice,False
shinelfmc2005,you know how to make them bigger,True
shinelfmc2005,would you sleep with a guy like thsat,True
sugahboogah93,like spend nite,False
shinelfmc2005,yes in the same bed,True
sugahboogah93,i dunno,False
shinelfmc2005,let my beard tickle yr thights as i would be kissing yr sweet pussy,True
sugahboogah93,haha,False
shinelfmc2005,would you like it if i kiss you there,True
sugahboogah93,where,False
shinelfmc2005,up between yr leggs,True
sugahboogah93,eww,False
shinelfmc2005,run my tougne in and out of it,True
shinelfmc2005,and nibble on yr nipples,True
sugahboogah93,um k wuteva,False
shinelfmc2005,u chatting with others,True
sugahboogah93,just watchin tv,False
shinelfmc2005,oh,True
shinelfmc2005,must be better than me,True
sugahboogah93,i didnt say that,False
shinelfmc2005,you think you will get more pics sometime,True
sugahboogah93,i tole u afte muh mom weddin i get more,False
shinelfmc2005,mmmmmmmmmm think you will get maybe a nipple pic for me,True
sugahboogah93,muh mom aint gonna let me put that on muh profile,False
shinelfmc2005,gwt it and send it to me,True
shinelfmc2005,get,True
sugahboogah93,huh,False
shinelfmc2005,would love to see yr nipple,True
sugahboogah93,ew wy,False
shinelfmc2005,you like seeing my cock,True
sugahboogah93,i didnt reallysee it cuz it was dark n stuff,False
shinelfmc2005,oh sorry about that next time it will be better,True
sugahboogah93,um k,False
shinelfmc2005,did you say you liked the touch of another girl,True
sugahboogah93,no,False
sugahboogah93,i didnt say that,False
shinelfmc2005,you have just been with boys,True
sugahboogah93,u mean friends n stuff,False
shinelfmc2005,yes has one ever felt yr nipples,True
sugahboogah93,no,False
shinelfmc2005,darn i would want to touch them,True
sugahboogah93,y,False
shinelfmc2005,just would like to feel them,True
shinelfmc2005,make them poke out,True
sugahboogah93,eww,False
shinelfmc2005,they dont poke out if you rub them,True
sugahboogah93,i dont touch them,False
shinelfmc2005,can you run yr fingers over them now,True
sugahboogah93,y,False
shinelfmc2005,to see if the get hard and poke out,True
sugahboogah93,o well,False
shinelfmc2005,you sound bored,True
sugahboogah93,uh yea,False
shinelfmc2005,ok guess i will let you go,True
sugahboogah93,y cuz im bored,False
shinelfmc2005,naw i need to get some sleep,True
shinelfmc2005,wish i could make you happy,True
sugahboogah93,well if u dont wanna chat wit me dont,False
shinelfmc2005,wish i could make you happy,True
sugahboogah93,how u doin that,False
shinelfmc2005,i dont know just wish i could,True
shinelfmc2005,get u in a nice sexy good mood,True
sugahboogah93,y,False
shinelfmc2005,to cheer you up,True
sugahboogah93,i not mad,False
shinelfmc2005,you just dont seem to be in a good mood,True
sugahboogah93,i am,False
shinelfmc2005,ok guess i will chat with you tomorrow,True
sugahboogah93,k,False
sugahboogah93,haha,False
shinelfmc2005,c you later,True
shinelfmc2005,good night sweet dreams,True
sugahboogah93,nite,False
shinelfmc2005,mmmmmmmmm sexy grin,True
sugahboogah93,haha,False
shinelfmc2005,you ever wrap those lips around a hard cock,True
sugahboogah93,um no,False
shinelfmc2005,you ever let a guy wrap his lips around yr nipples,True
sugahboogah93,ni,False
sugahboogah93,no,False
shinelfmc2005,u dont meet guys yet,True
shinelfmc2005,u ever rub between yr leggs,True
shinelfmc2005,i am rubbing my cock and looking at yr pic,True
sugahboogah93,y,False
shinelfmc2005,yr swxy,True
shinelfmc2005,sexy,True
sugahboogah93,i not either,False
shinelfmc2005,yes u are i would love to hold and kiss you,True
shinelfmc2005,mmm nibble on yr ears and nipples,True
sugahboogah93,eww,False
shinelfmc2005,what i would really like to do is run my tougne in and out down between yr leggs,True
sugahboogah93,y u wanna do that stuff 4,False
shinelfmc2005,i like the taste of sweet yg girls,True
sugahboogah93,o,False
shinelfmc2005,you never run yr fingers in you and masturbate to feel good,True
sugahboogah93,n,False
sugahboogah93,no,False
shinelfmc2005,why not,True
sugahboogah93,i dunno,False
shinelfmc2005,or u alone now,True
shinelfmc2005,what are u wearing,True
sugahboogah93,yea,False
sugahboogah93,i wearin gown,False
shinelfmc2005,do you hav panties on,True
sugahboogah93,yea,False
shinelfmc2005,would you pull them down,True
sugahboogah93,y,False
shinelfmc2005,so u can touch yrself do there,True
sugahboogah93,is that only thin u wanna chat bout,False
shinelfmc2005,no what do u want to chat about,True
sugahboogah93,haha wut u like do 4 fun,False
shinelfmc2005,i like to kiss sweet girls what do u do,True
sugahboogah93,nuttin relly haha,False
shinelfmc2005,i like to cam for girls and jerk off for them,True
sugahboogah93,that dont sound nice,False
shinelfmc2005,u never seen a cock,True
shinelfmc2005,on cam,True
sugahboogah93,no not on cam,False
shinelfmc2005,hav u seen a cock in real life,True
sugahboogah93,i not spose talk bout that,False
shinelfmc2005,so u hav had sex,True
sugahboogah93,i tole i not spose talk bout that,False
shinelfmc2005,did he make you suck it,True
sugahboogah93,i tole u i cant talk bout it,False
shinelfmc2005,ok well did you like it,True
sugahboogah93,i dunno it not sumthin i think bout,False
shinelfmc2005,does he still do it to you,True
sugahboogah93,no not since me n mom moved here,False
shinelfmc2005,good did he ever put it in yr pussy,True
sugahboogah93,u dont listen do u haha,False
shinelfmc2005,just wondering,True
sugahboogah93,but y,False
shinelfmc2005,so watching a guy on cam jerk off and cum you wanted want to watch,True
shinelfmc2005,wouldnt want to watch,True
sugahboogah93,i didnt say that,False
shinelfmc2005,if you did watch would you then rub yr sweet pussy with yr finger,True
sugahboogah93,i dunno that weird,False
shinelfmc2005,why would it be weired girls do it alot too,True
sugahboogah93,oh,False
shinelfmc2005,does yr pussy ever get wet and slippery,True
sugahboogah93,i dunno the meds i spose take usually make me pee alot,False
shinelfmc2005,mmmmmmmmm i had my niece pee when i was licking her it was nice,True
shinelfmc2005,she was like 12,True
sugahboogah93,gross u like pee,False
shinelfmc2005,it was different,True
sugahboogah93,oh,False
sugahboogah93,i thot u said pee,False
shinelfmc2005,i am still rubbing my cock and looking at yr pic,True
sugahboogah93,y i ugly,False
shinelfmc2005,no yr not it was girls cum it was like pee,True
shinelfmc2005,do u look at pics of yg boys and girls,True
shinelfmc2005,yr age,True
sugahboogah93,like in magz n stuff,False
shinelfmc2005,on yr putor,True
sugahboogah93,not relly,False
sugahboogah93,wut is it,False
shinelfmc2005,a boy about 10 doing a girl about 10,True
shinelfmc2005,will you reach down and rub yr pussy,True
sugahboogah93,iaint lookin at that stuff,False
shinelfmc2005,ok sorry,True
shinelfmc2005,want to watch my cock,True
sugahboogah93,y u think i wanna c boy n girl 4,False
shinelfmc2005,dont know,True
shinelfmc2005,u might be into it,True
shinelfmc2005,u want to watch my cock,True
sugahboogah93,y u think that 4,False
sugahboogah93,i dunno y i chat wit u 4,False
shinelfmc2005,i dont know either,True
shinelfmc2005,you must hav just alittle devil in you too,True
sugahboogah93,if it do it not my fault,False
shinelfmc2005,no its not yr fault,True
sugahboogah93,yea it is,False
shinelfmc2005,why would it be yr fault,True
shinelfmc2005,to watch my cock,True
sugahboogah93,cuz i am,False
shinelfmc2005,r u to rub yr pussy,True
shinelfmc2005,cuz i am what,True
sugahboogah93,ur just like him,False
shinelfmc2005,no i am not making you u do this for me because u like it and want to do it,True
sugahboogah93,then y,False
shinelfmc2005,do u like to please the men in yr life,True
sugahboogah93,my mom said it not my fault he did that,False
shinelfmc2005,i know it wasnt yr fault,True
sugahboogah93,u like wanna do that stuff 2 huh,False
shinelfmc2005,so i guess you dont want to watvh me then,True
shinelfmc2005,wsatching is different than making you do it in person,True
sugahboogah93,so u just wanna show on here n u relly dont like me 4 reals,False
shinelfmc2005,i like you for real but you live to far away for me to come see you,True
sugahboogah93,i live n herndon wher eu live,False
shinelfmc2005,tx,True
shinelfmc2005,would you like fo rme to come get you,True
shinelfmc2005,or what,True
sugahboogah93,id int say that,False
shinelfmc2005,so putor sex is all we can do for now,True
sugahboogah93,i didnt say nuttin bout sex,False
shinelfmc2005,what would you call it if you where to watch me cum and you rub yr pussy at the same time,True
sugahboogah93,i didnt say that,False
shinelfmc2005,what would you call it,True
sugahboogah93,i neva said i do that stuff,False
sugahboogah93,where n tx r u,False
shinelfmc2005,houston,True
sugahboogah93,i herd of it but neva been there,False
sugahboogah93,is it nice,False
shinelfmc2005,to big for me,True
sugahboogah93,o it sbig,False
shinelfmc2005,i like small towns,True
shinelfmc2005,wish you where into watching cam,True
sugahboogah93,can we just chat 4 min i like no u,False
shinelfmc2005,sure,True
shinelfmc2005,i wish that guy hadnt messed up yr life,True
shinelfmc2005,by making you hav sex with him,True
sugahboogah93,yea he told me cuz he loved me,False
shinelfmc2005,i dont know you well enough now to say that to you,True
shinelfmc2005,but i would lioke to be a friend for now,True
sugahboogah93,haha i didnt think u say 2 me,False
sugahboogah93,can i ask u name,False
shinelfmc2005,randy,True
shinelfmc2005,when are u going to get more pics,True
sugahboogah93,hiya randy im jess,False
shinelfmc2005,hi jess,True
sugahboogah93,i sent u all pix i had 1 on profile n on album,False
sugahboogah93,afta my mom get married i have more,False
shinelfmc2005,when will that be,True
sugahboogah93,17 agustt,False
shinelfmc2005,that soon,True
sugahboogah93,if u n tx how come u wuz n a va chat,False
sugahboogah93,yea,False
shinelfmc2005,i dont know just net surfing chat,True
sugahboogah93,haha i do that lots not no where im at,False
shinelfmc2005,would you ever send me a pic of yr nipple,True
sugahboogah93,o wow hahaha,False
sugahboogah93,wut u do wit that,False
shinelfmc2005,well i am about o go to bed and dream of you,True
sugahboogah93,u mad cuz i not c u on cam,False
shinelfmc2005,no u hav yr reason,True
shinelfmc2005,maybe later you will lighten up with me,True
sugahboogah93,wut u men lighten up,False
shinelfmc2005,get to know me better and not be so up tight about it,True
sugahboogah93,tight bout wut,False
shinelfmc2005,about watching me jerk off and cum for you on cam,True
sugahboogah93,y u wanna do that 4,False
shinelfmc2005,it isnt like i am going to come up there and rape you like he diodd,True
shinelfmc2005,did,True
shinelfmc2005,i enjoy cumming and dont mind you watching,True
shinelfmc2005,it is better than jerking ff in the dark by yrself,True
sugahboogah93,i sry ur alone,False
shinelfmc2005,ok will i hope to see you again on here,True
sugahboogah93,me 2,False
sugahboogah93,sry i made u mad,False
shinelfmc2005,i bet you could make it very easy to fall in lov with you you didnt make me mad,True
shinelfmc2005,how could i be mad at you,True
sugahboogah93,relly u thin it ez,False
shinelfmc2005,yes yr pretty and cute and seem to be very out going,True
sugahboogah93,haha thx,False
shinelfmc2005,even if you dont watch me i cant get mad at you,True
sugahboogah93,good i not like it wen ppl mad at me,False
shinelfmc2005,i want tget mad,True
sugahboogah93,thx me eiyher,False
shinelfmc2005,because u will watch me sometime i hope,True
sugahboogah93,i dunno haha,False
sugahboogah93,who nos,False
shinelfmc2005,and maybe rub yr pussy while you watch,True
shinelfmc2005,i want you to enjoy it too,True
sugahboogah93,haha,False
shinelfmc2005,you wanted do that if i ask you to,True
sugahboogah93,do wut,False
shinelfmc2005,wouldnt do that,True
shinelfmc2005,rub yr pussy,True
sugahboogah93,haha i dunno,False
shinelfmc2005,might be fun on here cyber sex lol,True
sugahboogah93,kinda weird dunno,False
shinelfmc2005,different,True
sugahboogah93,yea i guess,False
shinelfmc2005,you want hav to worry about having a baby,True
shinelfmc2005,that way,True
sugahboogah93,huh,False
shinelfmc2005,since i am not making you did it you might like it better,True
shinelfmc2005,than being made to,True
sugahboogah93,y u like that stuff 4,False
shinelfmc2005,i like the way it feels qhen i squirt cum it makes me feel good,True
sugahboogah93,oh,False
shinelfmc2005,you might like it to if yr not being made to,True
sugahboogah93,i didnt make him do nethin,False
shinelfmc2005,he made you go it didnt he,True
shinelfmc2005,do it,True
sugahboogah93,yea,False
shinelfmc2005,will i am not there to make you so if you do it on yr own you might like it,True
sugahboogah93,wut do u mean do it on my own,False
sugahboogah93,i didnt wanna do that stuff wit him y u think i wanna do it bymyself,False
shinelfmc2005,do it because i ask you to and not because i am there making you,True
sugahboogah93,no u n tx haha,False
shinelfmc2005,yes i am in tx,True
sugahboogah93,that far way huh,False
shinelfmc2005,you would do it on yr own and not because someone is standing there making you do him,True
sugahboogah93,how u no,False
shinelfmc2005,you told me he made you,True
sugahboogah93,yea so,False
sugahboogah93,brb i gotta pee,False
sugahboogah93,k back,False
sugahboogah93,y u go mmmmmmmmmm 4,False
shinelfmc2005,i did cum tonight,True
sugahboogah93,wher eu go,False
shinelfmc2005,i need to get some sleep,True
shinelfmc2005,i didnt g anywhere,True
shinelfmc2005,i shot cum,True
sugahboogah93,where u shoot it,False
shinelfmc2005,it squirted pretty good,True
sugahboogah93,just now,False
shinelfmc2005,into a napkin,True
shinelfmc2005,yes,True
sugahboogah93,how come,False
shinelfmc2005,because i was looking at yr pic and was rubbing my cock very fast,True
sugahboogah93,o,False
shinelfmc2005,maybe next time you might want to see it squirt,True
sugahboogah93,i dunno but wen u bday,False
shinelfmc2005,1 16,True
shinelfmc2005,jan 16,True
sugahboogah93,mine,False
shinelfmc2005,so yr 23 now,True
shinelfmc2005,13,True
sugahboogah93,no 12 i just turn 12,False
